Index,Publisher,URL,Date,Num_Images,Caption,Credit/Source
247,thebuffalonews,https://buffalonews.com/2019/02/06/1917-revolver-was-a-family-heirloom-then-the-county-tried-to-destroy-it/?utm_campaign=twitter-thread&utm_medium=social&utm_source=Twitter,2019-02-06,1,Old and new Erie County Halls at sunrise.   (Mark Mulville/News file photo),(Mark Mulville/News file photo)
251,thebuffalonews,https://buffalonews.com/2019/02/06/bank-of-america-facility-in-west-seneca-now-up-for-lease/?utm_term=Autofeed&utm_campaign=puma&utm_medium=social&utm_source=Twitter#Echobox=1549447746,2019-02-06,1,Bank of America will relocate an operations center to Elma from West Seneca. (Matt Glynn/Buffalo News),(Matt Glynn/Buffalo News)
252,thebuffalonews,https://buffalonews.com/2019/01/27/prospectus-the-6-stories-your-non-profit-should-tell/?utm_medium=social&utm_campaign=puma&utm_source=Twitter#Echobox=1548622747,2019-01-27,1,"Andy Goodman, co-founder and director of the Goodman Center, delivers a workshop about how storytelling techniques can help organizations get their message out at the Lexus Club at KeyBank Center, Tuesday, Jan. 15, 2019. (Derek Gee/Buffalo News)",(Derek Gee/Buffalo News)
253,thebuffalonews,https://buffalonews.com/2019/02/05/trump-speech-prompts-battle-with-cuomo-on-abortion/?utm_term=Autofeed&utm_campaign=puma&utm_medium=social&utm_source=Twitter#Echobox=1549427736,2019-02-05,1,"President Trump, with Speaker Nancy Pelosi and Vice President Mike Pence looking on, delivers the State of the Union address in the chamber of the U.S. House of Representatives at the U.S. Capitol Building on Tuesday. (Chip Somodevilla/Getty Images)",(Chip Somodevilla/Getty Images)
254,thebuffalonews,https://buffalonews.com/2019/02/05/ellicottville-man-charged-with-menacing-endangering-the-welfare-of-a-child/?utm_term=Autofeed&utm_campaign=puma&utm_medium=social&utm_source=Twitter#Echobox=1549423089,2019-02-05,0,NA,NA
255,thebuffalonews,https://buffalonews.com/2019/02/05/two-buffalo-firefighters-injured-battling-kensington-avenue-house-fire/?utm_medium=social&utm_campaign=puma&utm_source=Twitter#Echobox=1549423099,2019-02-05,1,"Buffalo firefighters on the scene at a fire on Kensington Avenue in Buffalo on Tuesday, Feb. 5, 2018. (Harold McNeil/Buffalo News)",(Harold McNeil/Buffalo News)
256,thebuffalonews,https://buffalonews.com/2019/02/05/water-main-break-forces-closure-of-section-of-colvin-boulevard/?utm_term=Autofeed&utm_campaign=puma&utm_medium=social&utm_source=Twitter#Echobox=1549422782,2019-02-05,0,NA,NA
257,thebuffalonews,https://buffalonews.com/2019/02/05/no-more-weekend-waits-for-owners-to-get-back-towed-cars-in-buffalo/?utm_medium=social&utm_campaign=puma&utm_source=Twitter#Echobox=1549409656,2019-02-05,1,"Council Member Christopher Scanlon said forcing people to go without their towed cars for the weekend is “excessively punitive.”
(News file photo)",(News file photo)
258,thebuffalonews,https://buffalonews.com/2019/02/05/jacobs-passes-on-county-exec-race-gop-may-turn-to-dixon/?utm_medium=social&utm_campaign=puma&utm_source=Twitter#Echobox=1549408312,2019-02-05,1,Lynne Dixon is contemplating a run for county executive. (Robert Kirkham/News file photo),(Robert Kirkham/News file photo)
259,thebuffalonews,https://buffalonews.com/2019/02/05/sexual-harassment-lawsuits-against-hoyt-dismissed/?utm_medium=social&utm_campaign=puma&utm_source=Twitter#Echobox=1549407538,2019-02-05,1,"Sam Hoyt resigned his position as regional president of Empire State Development on Oct. 30, 2017, right before Lisa Marie Cater’s allegations became public. (News file photo)",(News file photo)
260,thebuffalonews,https://buffalonews.com/2019/02/05/charter-is-getting-close-to-a-deal-with-new-york-over-its-spectrum-cable-business/?utm_medium=social&utm_campaign=puma&utm_source=Twitter#Echobox=1549382330,2019-02-05,1,(John Hickey/News file photo),(John Hickey/News file photo)
261,thebuffalonews,https://buffalonews.com/2019/02/05/man-in-critical-condition-following-two-vehicle-accident/?utm_term=Autofeed&utm_campaign=puma&utm_medium=social&utm_source=Twitter#Echobox=1549414748,2019-02-05,1,A car crashed on Essjay Road in Amherst Tuesday. (Photo courtesy of Kelly Payne),(Photo courtesy of Kelly Payne)
262,thebuffalonews,https://buffalonews.com/2019/02/05/woman-charged-with-appearing-in-public-under-the-influence-of-a-narcotic/?utm_term=Autofeed&utm_campaign=puma&utm_medium=social&utm_source=Twitter#Echobox=1549409934,2019-02-05,0,NA,NA
263,thebuffalonews,https://buffalonews.com/2019/02/05/west-seneca-grapples-with-flooding-of-buffalo-creek/?utm_medium=social&utm_campaign=puma&utm_source=Twitter#Echobox=1549402372,2019-02-05,2,Fire officials and NYSEG workers make sure power is off after flooding overnight on School Street in West Seneca. (John Hickey/Buffalo News),(John Hickey/Buffalo News)
263,thebuffalonews,,,2,The view Tuesday from Union Road Bridge on Buffalo Creek. (John Hickey/Buffalo News),(John Hickey/Buffalo News)
264,thebuffalonews,https://buffalonews.com/2019/02/05/welcome-back-winter-ice-storm-could-slow-travel-cause-power-outages-damage-trees/?utm_medium=social&utm_campaign=puma&utm_source=Twitter#Echobox=1549395536,2019-02-05,2,"A winter weather advisory is posted for Western New York, including metro Buffalo on Wednesday. (Derek Gee/Buffalo News)",(Derek Gee/Buffalo News)
264,thebuffalonews,,,2,The heaviest ice accretion is likely to be found to the north across Niagara County on Wednesday. (Image courtesy of the National Weather Service),(Image courtesy of the National Weather Service)
265,thebuffalonews,https://buffalonews.com/2019/02/05/buffalo-sabres-rasmus-dahlin-corsi-analytics/?utm_medium=social&utm_campaign=puma&utm_source=Twitter#Echobox=1549374858,2019-02-05,1,Buffalo has received 51.5 percent of the shots in its favor with Rasmus Dahlin on the ice. (Robert Kirkham/Buffalo News),(Robert Kirkham/Buffalo News)
266,thebuffalonews,https://buffalonews.com/2019/02/05/no-more-weekend-waits-for-owners-to-get-back-towed-cars-in-buffalo/?utm_term=Autofeed&utm_campaign=puma&utm_medium=social&utm_source=Twitter#Echobox=1549409144,2019-02-05,1,"Council Member Christopher Scanlon said forcing people to go without their towed cars for the weekend is “excessively punitive.”
(News file photo)",(News file photo)
267,thebuffalonews,https://buffalonews.com/2019/02/05/arbitration-decision-ending-lengthy-amherst-legal-fight-over-3-million/?utm_term=Autofeed&utm_campaign=puma&utm_medium=social&utm_source=Twitter#Echobox=1549399128,2019-02-05,1,"The former St. Mary of the Angels Motherhouse in what is now Amherst State Park on Mill Street. The town is close to ending a long, multimillion-dollar legal fight stemming from a 2002 accident at the site. (John Hickey/Buffalo News file photo)",(John Hickey/Buffalo News file photo)
268,thebuffalonews,https://buffalonews.com/2019/02/05/dent-doctor-cannabis-investors-turning-east-side-post-office-into-cbd-plant/?utm_medium=social&utm_campaign=puma&utm_source=Twitter#Echobox=1549390394,2019-02-05,1,Your CBD Store will sell hemp-derived products. (Mark Mulville/Buffalo News),(Mark Mulville/Buffalo News)
269,thebuffalonews,https://buffalonews.com/2019/02/05/fate-of-amherst-senior-housing-project-subject-of-special-meeting/?utm_term=Autofeed&utm_campaign=puma&utm_medium=social&utm_source=Twitter#Echobox=1549398322,2019-02-05,0,NA,NA
270,thebuffalonews,https://buffalonews.com/2019/02/05/charlotte-russe-closing-one-wny-store/?utm_term=Autofeed&utm_campaign=puma&utm_medium=social&utm_source=Twitter#Echobox=1549395448,2019-02-05,0,NA,NA
271,thebuffalonews,https://buffalonews.com/2019/02/05/albert-g-duke-91-was-buffalo-fire-commissioner-during-turbulent-times/?utm_term=Autofeed&utm_campaign=puma&utm_medium=social&utm_source=Twitter#Echobox=1549392474,2019-02-05,0,NA,NA
272,thebuffalonews,https://buffalonews.com/2019/02/04/sean-kirst-in-snow-and-soul-jeff-glor-sees-heart-of-golden-snowball/?utm_medium=social&utm_campaign=puma&utm_source=Twitter#Echobox=1549370879,2019-02-04,4,Town of Tonawanda native Jeff Glor was named anchor of “The CBS Evening News” in December 2017. (Timothy Kuratek/CBS),(Timothy Kuratek/CBS)
272,thebuffalonews,,,4,The Golden Snowball: Can Buffalo wrest it back after 17 years? (Sean Kirst/Buffalo News),(Sean Kirst/Buffalo News)
272,thebuffalonews,,,4,"Jeff Glor with his grandfather, Clarence Golibersuch, during the Blizzard of '77. (Family photo)",(Family photo)
272,thebuffalonews,,,4,"Jeff Glor and his mother, Karen, in the snow, possibly after the Blizzard of 1977. (Family photo)",(Family photo)
273,thebuffalonews,https://buffalonews.com/2019/02/05/jacobs-passes-on-county-exec-race-gop-may-turn-to-dixon/?utm_medium=social&utm_campaign=puma&utm_source=Twitter#Echobox=1549401441,2019-02-05,1,Lynne Dixon is contemplating a run for county executive. (Robert Kirkham/News file photo),(Robert Kirkham/News file photo)
274,thebuffalonews,https://buffalonews.com/2019/02/05/gurney-becker-bourne-buys-former-aaa-building-on-delaware-for-new-offices/?utm_term=Autofeed&utm_campaign=puma&utm_medium=social&utm_source=Twitter#Echobox=1549385521,2019-02-05,1,"This commercial property at 976 Delaware, formerly owned by the church next door, was sold to real estate brokerage Gurney Becker & Bourne as its new offices. (Google)",(Google)
275,thebuffalonews,https://buffalonews.com/2019/02/05/black-history-month-programs-at-central-library/?utm_term=Autofeed&utm_campaign=puma&utm_medium=social&utm_source=Twitter#Echobox=1549389233,2019-02-05,1,A Lewiston sculpture pays homage to the Underground Railroad.   (Harry Scull Jr./ Buffalo News),(Harry Scull Jr./ Buffalo News)
276,thebuffalonews,https://buffalonews.com/2019/02/05/sexual-harassment-lawsuits-against-hoyt-dismissed/,2019-02-05,1,"Sam Hoyt resigned his position as regional president of Empire State Development on Oct. 30, 2017, right before Lisa Marie Cater’s allegations became public. (News file photo)",(News file photo)
277,thebuffalonews,https://buffalonews.com/2019/02/05/league-of-women-voters-to-host-eva-doyle-lecture-on-wnys-place-in-black-history/?utm_term=Autofeed&utm_campaign=puma&utm_medium=social&utm_source=Twitter#Echobox=1549400100,2019-02-05,0,NA,NA
278,thebuffalonews,https://buffalonews.com/2019/02/05/want-to-be-a-city-intern-applications-now-available/?utm_term=Autofeed&utm_campaign=puma&utm_medium=social&utm_source=Twitter#Echobox=1549385153,2019-02-05,1,Youth from Mayor Byron W. Brown’s Summer Internship Program in 2017 outside City Hall. (Photo by Susan Schulman),(Photo by Susan Schulman)
279,thebuffalonews,https://buffalonews.com/2019/02/04/clarence-man-charged-with-trying-to-bring-shotgun-into-bar-after-fight/?utm_term=Autofeed&utm_campaign=puma&utm_medium=social&utm_source=Twitter#Echobox=1549398324,2019-02-04,0,NA,NA
280,thebuffalonews,https://buffalonews.com/2019/02/05/jacobs-passes-on-county-exec-race-gop-may-turn-to-dixon/?utm_medium=social&utm_campaign=puma&utm_source=Twitter#Echobox=1549391619,2019-02-05,1,Lynne Dixon is contemplating a run for county executive. (Robert Kirkham/News file photo),(Robert Kirkham/News file photo)
282,thebuffalonews,https://buffalonews.com/2019/02/05/26-year-old-charged-with-gun-possession-after-running-from-traffic-stop/?utm_term=Autofeed&utm_campaign=puma&utm_medium=social&utm_source=Twitter#Echobox=1549382351,2019-02-05,0,NA,NA
283,thebuffalonews,https://buffalonews.com/2019/02/04/four-hospitalized-after-chain-reaction-crash-that-snarled-traffic-on-198/?utm_term=Autofeed&utm_campaign=puma&utm_medium=social&utm_source=Twitter#Echobox=1549393498,2019-02-04,0,NA,NA
284,thebuffalonews,https://buffalonews.com/2019/02/05/wned-tv-celebrates-the-freedom-wall-with-program-airing-tonight/?utm_medium=social&utm_campaign=puma&utm_source=Twitter#Echobox=1549391482,2019-02-05,1,"Artist Edreys Wajed paints a portrait of Dr. Lydia T. Wright, in the center of portraits of Rev. J. Edward Nash Sr., left, and Frederick Douglass. (Robert Kirkham/Buffalo News)",(Robert Kirkham/Buffalo News)
285,thebuffalonews,https://buffalonews.com/2019/02/05/buffalo-sabres-nhl-jack-eichel-2/?utm_medium=social&utm_campaign=puma&utm_source=Twitter#Echobox=1549392580,2019-02-05,1,"Jack Eichel, watching from the bench during Friday’s 7-3 loss to Chicago, has two goals in his last 10 games (Harry Scull Jr./Buffalo News).",(Harry Scull Jr./Buffalo News).
286,thebuffalonews,https://buffalonews.com/2019/02/05/training-provided-to-nursing-home-workers-on-filing-violations/?utm_term=Autofeed&utm_campaign=puma&utm_medium=social&utm_source=Twitter#Echobox=1549382351,2019-02-05,0,NA,NA
287,thebuffalonews,https://buffalonews.com/2019/02/05/gunfire-leads-to-drug-weapons-charges-against-west-side-man/?utm_term=Autofeed&utm_campaign=puma&utm_medium=social&utm_source=Twitter#Echobox=1549377422,2019-02-05,0,NA,NA
288,thebuffalonews,https://buffalonews.com/2019/02/04/flooding-from-buffalo-creek-affecting-area-near-union-road-and-indian-church-road-in-west-seneca/?utm_medium=social&utm_campaign=puma&utm_source=Twitter#Echobox=1549384988,2019-02-04,1,A Rolls Royce up to its bumper in water on School Street In West Seneca with ice jam on Buffalo River in the background as record-warm temperatures produced flooding Monday. (John Hickey/Buffalo News),(John Hickey/Buffalo News)
289,thebuffalonews,https://buffalonews.com/2019/02/05/wned-tv-celebrates-the-freedom-wall-with-program-airing-tonight/?utm_term=Autofeed&utm_campaign=puma&utm_medium=social&utm_source=Twitter#Echobox=1549375202,2019-02-05,1,"Artist Edreys Wajed paints a portrait of Dr. Lydia T. Wright, in the center of portraits of Rev. J. Edward Nash Sr., left, and Frederick Douglass. (Robert Kirkham/Buffalo News)",(Robert Kirkham/Buffalo News)
290,thebuffalonews,https://buffalonews.com/2019/02/05/man-arrested-after-taking-officers-on-car-chase-across-cattaraugus-county/?utm_term=Autofeed&utm_campaign=puma&utm_medium=social&utm_source=Twitter#Echobox=1549374266,2019-02-05,0,NA,NA
291,thebuffalonews,https://buffalonews.com/2019/02/05/two-men-charged-in-driveway-repair-scam/?utm_term=Autofeed&utm_campaign=puma&utm_medium=social&utm_source=Twitter#Echobox=1549377671,2019-02-05,0,NA,NA
292,thebuffalonews,https://buffalonews.com/2019/02/04/flooding-from-buffalo-creek-affecting-area-near-union-road-and-indian-church-road-in-west-seneca/,2019-02-04,1,A Rolls Royce up to its bumper in water on School Street In West Seneca with ice jam on Buffalo River in the background as record-warm temperatures produced flooding Monday. (John Hickey/Buffalo News),(John Hickey/Buffalo News)
293,thebuffalonews,https://buffalonews.com/2019/02/05/torn-down-tuesday-the-hotel-ontario-circa-1897/?utm_term=Autofeed&utm_campaign=puma&utm_medium=social&utm_source=Twitter#Echobox=1549373337,2019-02-05,2,The Hotel Ontario was torn down in 1911 to make way for the headquarters of the General Electric Company.,NA
293,thebuffalonews,,,2,The Electric Tower in 1928.,NA
295,thebuffalonews,https://buffalonews.com/2019/02/05/charter-is-getting-close-to-a-deal-with-new-york-over-its-spectrum-cable-business/,2019-02-05,1,(John Hickey/News file photo),(John Hickey/News file photo)
298,thebuffalonews,https://buffalonews.com/2019/02/05/sources-pigeon-cooperating-with-authorities-in-bid-to-avoid-jail/?utm_medium=social&utm_campaign=puma&utm_source=Twitter#Echobox=1549371106,2019-02-05,1,Continued delays in the sentencing of political operative G. Steven Pigeon are seen as an indication that he is giving prosecutors information.  (Sharon Cantillon/News file photo),(Sharon Cantillon/News file photo)
300,thebuffalonews,https://buffalonews.com/newsletter_promo/sources-say-pigeon-cooperating-with-authorities-in-bid-to-avoid-jail/,2019-02-05,0,NA,NA
301,thebuffalonews,https://buffalonews.com/2019/02/04/ub-concussion-study-hailed-as-a-landmark-likely-to-influence-treatment-worldwide/?utm_campaign=twitter-thread&utm_medium=social&utm_source=Twitter,2019-02-04,2,"Dr. Barry Willer, a professor of psychiatry at the University at Buffalo, and co-founder of the school’s Concussion Treatment Clinic, also was co-author of a just-released study that shows teen athletes who suffer a sport-related concussion recover more effectively with a moderate, supervised exercise program than complete rest. (Derek Gee/News file photo)",(Derek Gee/News file photo)
301,thebuffalonews,,,2,"Dr. John Leddy, director of the University at Buffalo Concussion Management Clinic and a physician with UBMD Orthopaedics and Sports Medecine, works with Jason Hanania, then 14, of Orchard Park, in 2015 during a concussion study. He is lead author of a new report in JAMA Pediatrics that demonstrates the benefits of moderate exercise after a sports-related concussion. (Sharon Cantillon/News file photo)",(Sharon Cantillon/News file photo)
302,thebuffalonews,https://buffalonews.com/2019/02/05/freezing-rain-ice-potential-could-make-for-tricky-travel-wednesday/?utm_medium=social&utm_campaign=puma&utm_source=Twitter#Echobox=1549369173,2019-02-05,3,Forecasters are eyeing the potential for freezing rain and ice in Western New York on Wednesday. (T.J. Pignataro/Buffalo News file photo),(T.J. Pignataro/Buffalo News file photo)
302,thebuffalonews,,,3,Freezing rain and ice is possible early Wednesday across the lower Great Lakes. (Weather Prediction Center),(Weather Prediction Center)
302,thebuffalonews,,,3,Temperatures in the upper 40s around midnight were forecast to dip into the 30s through the morning and continue declining through today into the evening. (National Weather Service),(National Weather Service)
303,thebuffalonews,https://buffalonews.com/2019/02/05/sources-pigeon-cooperating-with-authorities-in-bid-to-avoid-jail/?utm_campaign=twitter-thread&utm_medium=social&utm_source=Twitter,2019-02-05,1,Continued delays in the sentencing of political operative G. Steven Pigeon are seen as an indication that he is giving prosecutors information.  (Sharon Cantillon/News file photo),(Sharon Cantillon/News file photo)
304,thebuffalonews,https://buffalonews.com/2019/02/04/killings-surged-in-buffalo-in-2018/?utm_campaign=twitter-thread&utm_medium=social&utm_source=Twitter,2019-02-04,1,Amir Jemes and Gayla Ross. (Photo courtesy Gayla Ross),(Photo courtesy Gayla Ross)
305,thebuffalonews,https://buffalonews.com/2019/02/05/sources-pigeon-cooperating-with-authorities-in-bid-to-avoid-jail/?utm_term=Autofeed&utm_campaign=puma&utm_medium=social&utm_source=Twitter#Echobox=1549365721,2019-02-05,1,Continued delays in the sentencing of political operative G. Steven Pigeon are seen as an indication that he is giving prosecutors information.  (Sharon Cantillon/News file photo),(Sharon Cantillon/News file photo)
307,thebuffalonews,https://buffalonews.com/2019/02/05/elma-industrial-properties-gain-new-owners/?utm_term=Autofeed&utm_campaign=puma&utm_medium=social&utm_source=Twitter#Echobox=1549362635,2019-02-05,1,These two warehouse properties on Maple Road in Elma were acquired by Buffalo investors. (Google Maps),(Google Maps)
308,thebuffalonews,https://buffalonews.com/2019/01/27/vocational-training-is-back-but-with-a-different-look/?utm_medium=social&utm_campaign=puma&utm_source=Twitter#Echobox=1548618689,2019-01-27,1,Burgard High School welding teacher James Ornello helps Janita Prim cut steel in the new welding shop. The school’s advanced manufacturing program is helping redefine vocational education. (Sharon Cantillon/News file photo),(Sharon Cantillon/News file photo)
309,thebuffalonews,https://buffalonews.com/2019/01/27/prospectus-section-6-retail-column-5-retail-trends-well-see-in-2019/?utm_medium=social&utm_campaign=puma&utm_source=Twitter#Echobox=1548622389,2019-01-27,1,Technology will continue to change the shopping habits of consumers. (Robert Kirkham/News file photo),(Robert Kirkham/News file photo)
310,thebuffalonews,https://buffalonews.com/2019/02/04/erie-county-second-highest-in-recovering-restitution-from-unemployment-insurance-fraud-cases/?utm_term=Autofeed&utm_campaign=puma&utm_medium=social&utm_source=Twitter#Echobox=1549336065,2019-02-04,0,NA,NA
311,thebuffalonews,https://buffalonews.com/2019/02/04/serious-as-a-heart-attack-cuomo-warns-of-falling-state-revenue/?utm_medium=social&utm_campaign=puma&utm_source=Twitter#Echobox=1549334946,2019-02-04,1,Gov. Andrew M. Cuomo. (News file photo),(News file photo)
312,thebuffalonews,https://buffalonews.com/2019/02/03/buffalo-public-schools-graduation-rates-2018/?utm_medium=social&utm_campaign=puma&utm_source=Twitter#Echobox=1549334892,2019-02-03,1,"Graduation at Frederick Law Olmsted High School on June 21, 2018. (Derek Gee/News file photo)",(Derek Gee/News file photo)
313,thebuffalonews,https://buffalonews.com/2019/02/03/parked-for-a-week-during-storm-mans-car-heavily-damaged/?utm_term=Autofeed&utm_campaign=puma&utm_medium=social&utm_source=Twitter#Echobox=1549333172,2019-02-03,0,NA,NA
314,thebuffalonews,https://buffalonews.com/2019/02/04/free-local-bus-service-to-be-offered-feb-16-in-jamestown-and-dunkirk-areas/?utm_term=Autofeed&utm_campaign=puma&utm_medium=social&utm_source=Twitter#Echobox=1549326215,2019-02-04,0,NA,NA
315,thebuffalonews,https://buffalonews.com/2019/02/04/richard-gubernick-well-known-visual-artist-and-retired-buffalo-state-professor/?utm_term=Autofeed&utm_campaign=puma&utm_medium=social&utm_source=Twitter#Echobox=1549332428,2019-02-04,0,NA,NA
316,thebuffalonews,https://buffalonews.com/2019/02/04/amherst-man-pleads-guilty-to-drug-and-weapons-possession-charges/?utm_term=Autofeed&utm_campaign=puma&utm_medium=social&utm_source=Twitter#Echobox=1549331199,2019-02-04,0,NA,NA
317,thebuffalonews,https://buffalonews.com/2019/02/04/killings-surged-in-buffalo-in-2018/?utm_medium=social&utm_campaign=puma&utm_source=Twitter#Echobox=1549302699,2019-02-04,1,Amir Jemes and Gayla Ross. (Photo courtesy Gayla Ross),(Photo courtesy Gayla Ross)
318,thebuffalonews,https://buffalonews.com/2019/02/04/flooding-from-buffalo-creek-affecting-area-near-union-road-and-indian-church-road-in-west-seneca/?utm_medium=social&utm_campaign=puma&utm_source=Twitter#Echobox=1549331381,2019-02-04,1,A Rolls Royce up to its bumper in water on School Street In West Seneca with ice jam on Buffalo River in the background as record-warm temperatures produced flooding Monday. (John Hickey/Buffalo News),(John Hickey/Buffalo News)
319,thebuffalonews,https://buffalonews.com/2019/02/03/mcmurray-may-have-lost-but-hes-never-stopped-running-for-congress/?utm_term=Autofeed&utm_campaign=puma&utm_medium=social&utm_source=Twitter#Echobox=1549327557,2019-02-03,1,Democrat Nathan McMurray greets voters outside the Watermark Wesleyan at McKinley polling place in Hamburg on Election Day. (Mark Mulville/Buffalo News),(Mark Mulville/Buffalo News)
320,thebuffalonews,https://buffalonews.com/2019/02/04/photo-enlargement-of-gregory-hines-forever-stamp-to-be-offered-tuesday-at-performing-arts-high-school/?utm_term=Autofeed&utm_campaign=puma&utm_medium=social&utm_source=Twitter#Echobox=1549328990,2019-02-04,0,NA,NA
321,thebuffalonews,https://buffalonews.com/2019/02/04/an-awesome-gift-buffalonians-savor-winter-warmth-while-it-lasts/?utm_medium=social&utm_campaign=puma&utm_source=Twitter#Echobox=1549329264,2019-02-04,2,"Outdoor activities are likely to pick up over the next couple of days with springlike temperatures finally returning across the Buffalo Niagara region. But, they’ll be short-lived, forecasts show. (Sharon Cantillon/Buffalo News file photo)",(Sharon Cantillon/Buffalo News file photo)
321,thebuffalonews,,,2,"Michael Evancho had to stay close to his puddle-loving son Colin, 20 months, as they took advantage of a springlike day at Delaware Park. (Sharon Cantillon/Buffalo News)",(Sharon Cantillon/Buffalo News)
322,thebuffalonews,https://buffalonews.com/2019/02/04/two-arrested-as-authorities-raid-suspected-meth-lab-in-chautauqua-county/?utm_term=Autofeed&utm_campaign=puma&utm_medium=social&utm_source=Twitter#Echobox=1549328088,2019-02-04,0,NA,NA
323,thebuffalonews,https://buffalonews.com/2019/02/04/jury-finds-buffalo-man-guilty-in-2017-killing-in-riverside/?utm_term=Autofeed&utm_campaign=puma&utm_medium=social&utm_source=Twitter#Echobox=1549327008,2019-02-04,1,Roberto Leon. (Photo courtesy of the Erie County District Attorney),(Photo courtesy of the Erie County District Attorney)
324,thebuffalonews,https://buffalonews.com/2019/02/04/assemblyman-from-livingston-county-indicted-on-bribery-charges/?utm_term=Autofeed&utm_campaign=puma&utm_medium=social&utm_source=Twitter#Echobox=1549326686,2019-02-04,0,NA,NA
325,thebuffalonews,https://buffalonews.com/2019/02/04/ub-concussion-study-hailed-as-a-landmark-likely-to-influence-treatment-worldwide/?utm_medium=social&utm_campaign=puma&utm_source=Twitter#Echobox=1549306533,2019-02-04,2,"Dr. Barry Willer, a professor of psychiatry at the University at Buffalo, and co-founder of the school’s Concussion Treatment Clinic, also was co-author of a just-released study that shows teen athletes who suffer a sport-related concussion recover more effectively with a moderate, supervised exercise program than complete rest. (Derek Gee/News file photo)",(Derek Gee/News file photo)
325,thebuffalonews,,,2,"Dr. John Leddy, director of the University at Buffalo Concussion Management Clinic and a physician with UBMD Orthopaedics and Sports Medecine, works with Jason Hanania, then 14, of Orchard Park, in 2015 during a concussion study. He is lead author of a new report in JAMA Pediatrics that demonstrates the benefits of moderate exercise after a sports-related concussion. (Sharon Cantillon/News file photo)",(Sharon Cantillon/News file photo)
326,thebuffalonews,https://buffalonews.com/2019/02/04/for-generations-of-wnyers-a-potato-chip-is-merely-a-vessel-for-bison-chip-dip/?utm_medium=social&utm_campaign=puma&utm_source=Twitter#Echobox=1549303609,2019-02-04,3,"Bison chip dip ad, 1963.",NA
326,thebuffalonews,,,3,"Ad introducing Bison French onion dip, 1958.",NA
