Index,Publisher,URL,Date,Num_Images,Caption,Credit/Source
476,thebuffalonews,https://buffalonews.com/2019/02/01/citizens-bank-survey-finds-hot-market-for-buying-selling-businesses/?utm_term=Autofeed&utm_campaign=puma&utm_medium=social&utm_source=Twitter#Echobox=1549015388,2019-02-01,2,"A Citizens Bank branch in Boston, Mass. (Photo by Bloomberg)",(Photo by Bloomberg)
476,thebuffalonews,,,2,"Ted Smith, WNY market executive for Citizens Bank. (Provided photo)",(Provided photo)
477,thebuffalonews,https://buffalonews.com/2019/02/01/a-giant-question-for-mts-ceo/?utm_term=Autofeed&utm_campaign=puma&utm_medium=social&utm_source=Twitter#Echobox=1549038794,2019-02-01,1,"René F. Jones, chairman and CEO of M&T Bank. (Derek Gee/Buffalo News)",(Derek Gee/Buffalo News)
478,thebuffalonews,https://buffalonews.com/2019/02/01/holistic-lecture-series-resumes-with-talk-on-ayurvedic-living/?utm_term=Autofeed&utm_campaign=puma&utm_medium=social&utm_source=Twitter#Echobox=1549044435,2019-02-01,0,NA,NA
479,thebuffalonews,https://buffalonews.com/2019/01/31/the-snow-plow-drivers-lament-theres-no-room-to-put-it-anymore/?utm_term=Autofeed&utm_campaign=puma&utm_medium=social&utm_source=Twitter#Echobox=1549034372,2019-01-31,2,Don Carpenter owns Monster Plowing & Lawn Care. He has a crew of four and specializes in commercial contracts and 24-hour businesses. (Sharon Cantillon/Buffalo News),(Sharon Cantillon/Buffalo News)
479,thebuffalonews,,,2,Don Carpenter plows a parking lot on Maple Road in Amherst on Jan. 30. (Sharon Cantillon/Buffalo News),(Sharon Cantillon/Buffalo News)
480,thebuffalonews,https://buffalonews.com/2019/02/01/suspended-principal-hovers-over-mckinley-controversy/?utm_medium=social&utm_campaign=puma&utm_source=Twitter#Echobox=1549037216,2019-02-01,1,"Crystal Boling-Barton has been on paid leave as McKinley High School principal since May 2017, but her name keeps coming up as the teachers union and a parent group paint opposing pictures of the school’s climate since she left. (News file photo)",(News file photo)
481,thebuffalonews,https://buffalonews.com/2019/01/31/columbus-mckinnons-earnings-top-analyst-forecasts/?utm_term=Autofeed&utm_campaign=puma&utm_medium=social&utm_source=Twitter#Echobox=1548997360,2019-01-31,0,NA,NA
482,thebuffalonews,https://buffalonews.com/2019/02/01/buffalo-nursing-home-transfers-60-residents-after-pipe-bursts/?utm_term=Autofeed&utm_campaign=puma&utm_medium=social&utm_source=Twitter#Echobox=1549037730,2019-02-01,1,"The Buffalo Fire Department responds to a burst sprinkler system that caused extensive flooding at Buffalo Center for Rehabilitation and Nursing on Friday, Feb. 1, 2019. About 60 residents of the nursing home were transferred because of the water damage. (Derek Gee/Buffalo News)",(Derek Gee/Buffalo News)
483,thebuffalonews,https://buffalonews.com/2019/02/01/ub-roswell-park-zero-in-on-a-better-treatment-for-major-cancer-side-effect/?utm_term=Autofeed&utm_campaign=puma&utm_medium=social&utm_source=Twitter#Echobox=1549036742,2019-02-01,3,"Dr. Praveen Arany, a researcher at the University at Buffalo School of Dental Medicine, and UB undergraduate student Akhila Kiran, whose face is pictured, demonstrate how a laser procedure called photobiomodulation may soon replace the current treatment of numbing mouthwash and opioid painkillers to treat oral mucositis, a common side effect of cancer treatment. (John Hickey/Buffalo News)",(John Hickey/Buffalo News)
483,thebuffalonews,,,3,"Among those leading the national effort to find a more effective way to treat ulcers and lesions in the digestive tract that often form during cancer treatment, without resorting to opioids, are, from left, Drs. Mukund Seshadri, professor and chair of oral oncology at Roswell Park Comprehensive Cancer Center; Praveen Arany, assistant professor in the University at Buffalo School of Dental Medicine; and Anurag Singh, professor of oncology and director of radiation research at Roswell Park, and professor of medicine in the UB Jacobs School of Medicine and Biomedical Sciences. Arany is president of the World Association of Laser Therapy. (John Hickey/Buffalo News)",(John Hickey/Buffalo News)
483,thebuffalonews,,,3,"Photobiomodulation (PMB) therapy likely has wider applications than easing the pain of mucositis, and helping heal the condition, but the treatment also must be refined, says Dr. Praveen Arany. (John Hickey/Buffalo News)",(John Hickey/Buffalo News)
484,thebuffalonews,https://buffalonews.com/2019/02/01/evans-bank-sets-profits-record-for-third-straight-year/?utm_term=Autofeed&utm_campaign=puma&utm_medium=social&utm_source=Twitter#Echobox=1549034369,2019-02-01,1,"David Nasca, president and CEO of Evans Bank, said the bank is building on momentum. (Buffalo News file photo)",(Buffalo News file photo)
485,thebuffalonews,https://buffalonews.com/newsletter_promo/storm-claims-lives-of-three-people/,2019-02-01,0,NA,NA
486,thebuffalonews,https://buffalonews.com/2019/01/31/man-found-dead-in-amherst-bus-shelter/?utm_medium=social&utm_campaign=puma&utm_source=Twitter#Echobox=1548973898,2019-01-31,2,A man known as Larry at the Tim Hortons in the Walker Center in 2016. He was found dead Thursday morning by Amherst Police. (Anne Neville/Buffalo News),(Anne Neville/Buffalo News)
486,thebuffalonews,,,2,A homeless man known around Williamsville as Larry was found dead this morning in this bus shelter on Main Street near the Walker Center close to the I-290 entrance. (Sharon Cantillon/Buffalo News),(Sharon Cantillon/Buffalo News)
487,thebuffalonews,https://buffalonews.com/2019/02/01/sinatra-faces-criticism-for-neglecting-hodge-avenue-properties/?utm_term=Autofeed&utm_campaign=puma&utm_medium=social&utm_source=Twitter#Echobox=1549031626,2019-02-01,1,"These properties at 137 and 143 Hodge Ave. in Buffalo, both owned by Sinatra & Company Real Estate through a limited-liability company, are the subject of Housing Court proceedings this week.",NA
488,thebuffalonews,https://buffalonews.com/2019/01/31/peoples-stokes-lawmakers-and-cuomo-are-not-close-on-pot-legalization-deal/?utm_campaign=twitter-thread&utm_medium=social&utm_source=Twitter,2019-01-31,0,NA,NA
489,thebuffalonews,https://buffalonews.com/2019/01/27/prospectus-section-6-retail-column-5-retail-trends-well-see-in-2019/?utm_medium=social&utm_campaign=puma&utm_source=Twitter#Echobox=1548622221,2019-01-27,1,Technology will continue to change the shopping habits of consumers. (Robert Kirkham/News file photo),(Robert Kirkham/News file photo)
490,thebuffalonews,https://buffalonews.com/2019/01/28/rethinking-recycling/?utm_medium=social&utm_campaign=puma&utm_source=Twitter#Echobox=1548680403,2019-01-28,3,"Peter Kyaw, operating a front-end loader, makes room for more materials coming in on the tipping floor at Buffalo Recycling Enterprise in South Buffalo. (Sharon Cantillon/Buffalo News)",(Sharon Cantillon/Buffalo News)
490,thebuffalonews,,,3,Bales of aluminum cans that have started the recycling process. (Sharon Cantillon/Buffalo News),(Sharon Cantillon/Buffalo News)
490,thebuffalonews,,,3,Cardboard is sent up the chute to the baler at Buffalo Recycling Enterprise. (Sharon Cantillon/Buffalo News),(Sharon Cantillon/Buffalo News)
491,thebuffalonews,https://buffalonews.com/2019/01/31/this-buffalo-brewery-is-measuring-snow-in-beer-cans/?utm_medium=social&utm_campaign=puma&utm_source=Twitter#Echobox=1548980156,2019-01-31,1,Community Beer Works beer stacked in the snow Thursday. (Photo courtesy of Community Beer Works/Twitter),(Photo courtesy of Community Beer Works/Twitter)
492,thebuffalonews,https://buffalonews.com/2019/01/31/on-day-two-of-the-storm-route-400-closed-buffalo-driving-ban-lifted/?utm_campaign=twitter-thread&utm_medium=social&utm_source=Twitter,2019-01-31,1,"Besty Malayny gets some exercise walking along Pine Street in Hamburg on Thursday, Jan. 31, 2019. (Harry Scull Jr./Buffalo News)",(Harry Scull Jr./Buffalo News)
493,thebuffalonews,https://buffalonews.com/2019/01/31/jane-kwiatkowski-radlich-why-i-told-larrys-story-two-decades-ago/?utm_campaign=twitter-thread&utm_medium=social&utm_source=Twitter,2019-01-31,1,A man known as Larry at the Tim Hortons in the Walker Center in 2016. He was found dead Thursday morning by Amherst Police. (Anne Neville/Buffalo News),(Anne Neville/Buffalo News)
494,thebuffalonews,https://buffalonews.com/1997/07/06/williamsville-takes-roving-homeless-man-under-its-wing/?utm_campaign=twitter-thread&utm_medium=social&utm_source=Twitter,1997-07-06,0,NA,NA
495,thebuffalonews,https://buffalonews.com/2019/01/31/man-found-dead-in-amherst-bus-shelter/?utm_campaign=twitter-thread&utm_medium=social&utm_source=Twitter,2019-01-31,2,A man known as Larry at the Tim Hortons in the Walker Center in 2016. He was found dead Thursday morning by Amherst Police. (Anne Neville/Buffalo News),(Anne Neville/Buffalo News)
495,thebuffalonews,,,2,A homeless man known around Williamsville as Larry was found dead this morning in this bus shelter on Main Street near the Walker Center close to the I-290 entrance. (Sharon Cantillon/Buffalo News),(Sharon Cantillon/Buffalo News)
497,thebuffalonews,https://buffalonews.com/2019/01/29/what-to-expect-the-next-36-hours-heavy-lake-effect-snow-high-winds-dangerous-wind-chills/,2019-01-29,1,One more cold day awaits Friday. (Sharon Cantillon/Buffalo News,(Sharon Cantillon/Buffalo News
498,thebuffalonews,https://buffalonews.com/2019/02/01/skyway-major-highways-are-open/?utm_medium=social&utm_campaign=puma&utm_source=Twitter#Echobox=1549024365,2019-02-01,1,"Through sunny skies, the biting wind whips across an open field on Colvin Boulevard in the Town of Tonawanda on Thursday.	Sharon Cantillon/Buffalo News",NA
499,thebuffalonews,https://buffalonews.com/2019/02/01/buffalo-auto-show-returns-amid-industry-transformation/?utm_term=Autofeed&utm_campaign=puma&utm_medium=social&utm_source=Twitter#Echobox=1549015596,2019-02-01,2,The 2018 Buffalo Auto Show drew crowds to the convention center. (News file photo),(News file photo)
499,thebuffalonews,,,2,Local dealers count on the auto show to kick off the sales season. (News file photo),(News file photo)
500,thebuffalonews,https://buffalonews.com/2019/02/01/skyway-major-highways-are-open/?utm_term=Autofeed&utm_campaign=puma&utm_medium=social&utm_source=Twitter#Echobox=1549022495,2019-02-01,1,"Through sunny skies, the biting wind whips across an open field on Colvin Boulevard in the Town of Tonawanda on Thursday.	Sharon Cantillon/Buffalo News",NA
502,thebuffalonews,https://buffalonews.com/2019/02/01/take-steps-to-prevent-vision-loss-from-macular-degeneration/?utm_term=Autofeed&utm_campaign=puma&utm_medium=social&utm_source=Twitter#Echobox=1549020531,2019-02-01,2,An eye specialist can diagnose and treat macular degeneration. (Derek Gee/News file photo),(Derek Gee/News file photo)
502,thebuffalonews,,,2,"Vitamins can be used to help treat most cases of macular degeneration, though those with the ""wet"" kind need injectable medication, Judith Whitehead says.",NA
503,thebuffalonews,https://buffalonews.com/2019/02/01/suspended-principal-hovers-over-mckinley-controversy/?utm_term=Autofeed&utm_campaign=puma&utm_medium=social&utm_source=Twitter#Echobox=1549019080,2019-02-01,1,"Crystal Boling-Barton has been on paid leave as McKinley High School principal since May 2017, but her name keeps coming up as the teachers union and a parent group paint opposing pictures of the school’s climate since she left. (News file photo)",(News file photo)
504,thebuffalonews,https://buffalonews.com/2019/01/27/next-generation-of-leaders-steps-up-as-opportunity-knocks-in-buffalo/?utm_medium=social&utm_campaign=puma&utm_source=Twitter#Echobox=1548603851,2019-01-27,1,A new generation of leaders is stepping up in Buffalo.  (Derek Gee/News file photo),(Derek Gee/News file photo)
505,thebuffalonews,https://buffalonews.com/2019/01/27/buffalos-east-side-the-land-of-opportunity/?utm_medium=social&utm_campaign=puma&utm_source=Twitter#Echobox=1548612373,2019-01-27,1,"Sycamore Street leads toward downtown on Buffalo’s East Side, Wednesday, Oct. 10, 2018. (Derek Gee/Buffalo News)",(Derek Gee/Buffalo News)
506,thebuffalonews,https://buffalonews.com/2019/01/27/matt-glynn-what-manufacturers-need-most-skilled-people/?utm_medium=social&utm_campaign=puma&utm_source=Twitter#Echobox=1548615952,2019-01-27,1,"Peter Coleman, executive director of the Buffalo Niagara Manufacturing Alliance, says manufacturers are clamoring for skilled workers. (News file photo)",(News file photo)
507,thebuffalonews,https://buffalonews.com/2019/01/24/mt-banks-jones-says-technology-innovation-vital-to-economic-growth/?utm_medium=social&utm_campaign=puma&utm_source=Twitter#Echobox=1548428703,2019-01-24,1,"René Jones, M&T Bank chairman and CEO, was the guest speaker at the unveiling of Prospectus, at Salvatore’s Italian Gardens in Clarence on Thursday, Jan. 24, 2019.   (John Hickey/Buffalo News)",(John Hickey/Buffalo News)
508,thebuffalonews,https://buffalonews.com/2019/01/29/what-to-expect-the-next-36-hours-heavy-lake-effect-snow-high-winds-dangerous-wind-chills/?utm_medium=social&utm_campaign=puma&utm_source=Twitter#Echobox=1548981927,2019-01-29,1,One more cold day awaits Friday. (Sharon Cantillon/Buffalo News,(Sharon Cantillon/Buffalo News
509,thebuffalonews,https://buffalonews.com/2019/01/31/citys-snow-chief-goes-out-with-storm-to-remember/?utm_medium=social&utm_campaign=puma&utm_source=Twitter#Echobox=1548988201,2019-01-31,1,"Buffalo Public Works Commissioner Steven Stepniak, center, inspects ice flows at the Stevenson Bridge on Cazenovia Creek during a 2017 flood warning. Stepniak is stepping down this week after 11 years in the job. (John Hickey/News file photo)",(John Hickey/News file photo)
510,thebuffalonews,https://buffalonews.com/2019/01/31/want-to-learn-how-to-lobby-workshop-will-show-citizens-how/?utm_term=Autofeed&utm_campaign=puma&utm_medium=social&utm_source=Twitter#Echobox=1548996998,2019-01-31,0,NA,NA
512,thebuffalonews,https://buffalonews.com/2019/01/31/niagara-county-fairgrounds-to-host-therapeutic-riding-center/?utm_term=Autofeed&utm_campaign=puma&utm_medium=social&utm_source=Twitter#Echobox=1548996612,2019-01-31,1,"Miriam Smith, former director of Equistar, with Blackie, one of their oldest horses. (File photo)",(File photo)
513,thebuffalonews,https://buffalonews.com/2019/01/31/west-seneca-ponders-future-of-the-burchfield/?utm_term=Autofeed&utm_campaign=puma&utm_medium=social&utm_source=Twitter#Echobox=1548995710,2019-01-31,1,West Seneca will seek public input on what to do with the Burchfield Nature and Art Center. (Mark Mulville/Buffalo News),(Mark Mulville/Buffalo News)
514,thebuffalonews,https://buffalonews.com/2019/01/31/robin-jon-lindgren-74-president-and-ceo-of-several-companies/?utm_term=Autofeed&utm_campaign=puma&utm_medium=social&utm_source=Twitter#Echobox=1548995522,2019-01-31,0,NA,NA
515,thebuffalonews,https://buffalonews.com/2019/01/31/neighbors-sue-to-block-lewiston-solar-project/?utm_term=Autofeed&utm_campaign=puma&utm_medium=social&utm_source=Twitter#Echobox=1548965058,2019-01-31,1,The Lewiston farm where a 5.3-megawatt solar power project was approved in September 2018. Neighbors have filed suit to try to block the project. (John Hickey/News file photo),(John Hickey/News file photo)
516,thebuffalonews,https://buffalonews.com/2019/01/31/3m-awarded-low-cost-hydropower-to-support-expansion/?utm_term=Autofeed&utm_campaign=puma&utm_medium=social&utm_source=Twitter#Echobox=1548956413,2019-01-31,1,3M in Tonawanda will receive low-cost hydropower to support an expansion. (News file photo),(News file photo)
517,thebuffalonews,https://buffalonews.com/2019/01/31/tearful-niagara-falls-woman-takes-plea-deal-in-knifing/?utm_term=Autofeed&utm_campaign=puma&utm_medium=social&utm_source=Twitter#Echobox=1548968569,2019-01-31,0,NA,NA
518,thebuffalonews,https://buffalonews.com/2019/01/31/retired-detective-to-host-book-launch-party-for-crime-novel/?utm_term=Autofeed&utm_campaign=puma&utm_medium=social&utm_source=Twitter#Echobox=1548981058,2019-01-31,0,NA,NA
519,thebuffalonews,https://buffalonews.com/2019/01/31/garbage-collection-in-niagara-falls-missed-due-to-weather-will-be-made-up-next-week/?utm_term=Autofeed&utm_campaign=puma&utm_medium=social&utm_source=Twitter#Echobox=1548965468,2019-01-31,0,NA,NA
520,thebuffalonews,https://buffalonews.com/2019/01/31/david-robinson-for-tesla-more-delays-for-solar-roof/?utm_term=Autofeed&utm_campaign=puma&utm_medium=social&utm_source=Twitter#Echobox=1548962809,2019-01-31,1,Elon Musk has never visited the Tesla factory at RiverBend. (Derek Gee/News file photo),(Derek Gee/News file photo)
521,thebuffalonews,https://buffalonews.com/2019/01/31/man-charged-with-dwi-during-orchard-parks-driving-ban/?utm_term=Autofeed&utm_campaign=puma&utm_medium=social&utm_source=Twitter#Echobox=1548980696,2019-01-31,1,Dennis Orlow. (Photo courtesy of the Orchard Park Police Department),(Photo courtesy of the Orchard Park Police Department)
522,thebuffalonews,https://buffalonews.com/2019/01/31/buffalo-snow-storm-snowfall-tallies/?utm_medium=social&utm_campaign=puma&utm_source=Twitter#Echobox=1548988983,2019-01-31,1,The Jimmy Griffin statue covered in snow Wednesday outside of Sahlen Field in Buffalo. (Mark Mulville/Buffalo News),(Mark Mulville/Buffalo News)
523,thebuffalonews,https://buffalonews.com/2019/01/31/cuomo-on-truckers-ignoring-travel-ban-this-is-a-disgrace/?utm_medium=social&utm_campaign=puma&utm_source=Twitter#Echobox=1548989097,2019-01-31,2,"Doug Herve of Hamilton, Ont. waits out the truck/bus traveling ban at Jim’s Truck Plaza in Cheektowaga Thursday, January 31, 2019.      (Mark Mulville/Buffalo News)",(Mark Mulville/Buffalo News)
523,thebuffalonews,,,2,Truck drivers wait out the truck/bus traveling ban Thursday at Jim’s Truck Plaza in Cheektowaga. (Mark Mulville/Buffalo News),(Mark Mulville/Buffalo News)
525,thebuffalonews,https://buffalonews.com/2019/01/31/buffalo-public-schools-announce-another-snow-day-for-friday/?utm_medium=social&utm_campaign=puma&utm_source=Twitter#Echobox=1548966652,2019-01-31,1,"Hamdan Elmouss, 4, plays in a pile of snow in front of his home on Prospect Avenue on Wednesday, Jan. 30, 2019.   (Derek Gee/Buffalo News)",(Derek Gee/Buffalo News)
526,thebuffalonews,https://buffalonews.com/2019/01/27/prospectus-from-north-to-south-east-to-west-here-are-big-projects-to-watch-in-2019/?utm_medium=social&utm_campaign=puma&utm_source=Twitter#Echobox=1548608137,2019-01-27,1,A rendering of the Queen City Landing project on Buffalo’s Outer Harbor.,NA
527,thebuffalonews,https://buffalonews.com/2019/01/31/on-day-two-of-the-storm-route-400-closed-buffalo-driving-ban-lifted/?utm_medium=social&utm_campaign=puma&utm_source=Twitter#Echobox=1548984998,2019-01-31,1,"Besty Malayny gets some exercise walking along Pine Street in Hamburg on Thursday, Jan. 31, 2019. (Harry Scull Jr./Buffalo News)",(Harry Scull Jr./Buffalo News)
528,thebuffalonews,https://buffalonews.com/2019/01/31/teen-charged-with-gun-possession-after-report-of-gunfire-during-blizzard/?utm_term=Autofeed&utm_campaign=puma&utm_medium=social&utm_source=Twitter#Echobox=1548942606,2019-01-31,0,NA,NA
529,thebuffalonews,https://buffalonews.com/2019/01/31/sean-kirst-from-hurricane-to-blizzard-with-hope-in-buffalo/?utm_medium=social&utm_campaign=puma&utm_source=Twitter#Echobox=1548980333,2019-01-31,3,"Yohalis Rivera, who moved to Buffalo from Puerto Rico in December because of difficulties her family had in recovering from Hurricane Maria, got her first taste of a Buffalo blizzard. (Derek Gee/Buffalo News)",(Derek Gee/Buffalo News)
529,thebuffalonews,,,3,"Yohalis Rivera and her sons after Per Niente took them shopping, in December. (Image courtesy of Joe DiLeo)",(Image courtesy of Joe DiLeo)
529,thebuffalonews,,,3,"Joe DiLeo, a member of the Per Niente club, refers to paperwork while visiting with the Rivera family. At left, twins Angel and Luis and big brother Victor play video games. (Derek Gee/Buffalo News)",(Derek Gee/Buffalo News)
531,thebuffalonews,https://buffalonews.com/2019/01/31/man-found-dead-in-amherst-bus-shelter/?utm_medium=social&utm_campaign=puma&utm_source=Twitter#Echobox=1548974146,2019-01-31,2,A man known as Larry at the Tim Hortons in the Walker Center in 2016. He was found dead Thursday morning by Amherst Police. (Anne Neville/Buffalo News),(Anne Neville/Buffalo News)
531,thebuffalonews,,,2,A homeless man known around Williamsville as Larry was found dead this morning in this bus shelter on Main Street near the Walker Center close to the I-290 entrance. (Sharon Cantillon/Buffalo News),(Sharon Cantillon/Buffalo News)
532,thebuffalonews,https://buffalonews.com/2019/01/27/prospectus-from-north-to-south-east-to-west-here-are-big-projects-to-watch-in-2019/?utm_medium=social&utm_campaign=puma&utm_source=Twitter#Echobox=1548608235,2019-01-27,1,A rendering of the Queen City Landing project on Buffalo’s Outer Harbor.,NA
533,thebuffalonews,https://buffalonews.com/2019/01/29/what-to-expect-the-next-36-hours-heavy-lake-effect-snow-high-winds-dangerous-wind-chills/?utm_medium=social&utm_campaign=puma&utm_source=Twitter#Echobox=1548981599,2019-01-29,1,One more cold day awaits Friday. (Sharon Cantillon/Buffalo News,(Sharon Cantillon/Buffalo News
534,thebuffalonews,https://buffalonews.com/2019/01/27/prospectus-section-6-craft-brewing-business-is-hopping/?utm_medium=social&utm_campaign=puma&utm_source=Twitter#Echobox=1548619259,2019-01-27,2,Hamburg Brewing Company’s beer is one of a few local breweries with a tap handle at Craft Tap House. (Sharon Cantillon/Buffalo News),(Sharon Cantillon/Buffalo News)
534,thebuffalonews,,,2,A rendering of BriteSmith brewery in Williamsville. (Rendering courtesy of David Schutte),(Rendering courtesy of David Schutte)
535,thebuffalonews,https://buffalonews.com/2019/01/31/this-buffalo-brewery-is-measuring-snow-in-beer-cans/?utm_medium=social&utm_campaign=puma&utm_source=Twitter#Echobox=1548980129,2019-01-31,1,Community Beer Works beer stacked in the snow Thursday. (Photo courtesy of Community Beer Works/Twitter),(Photo courtesy of Community Beer Works/Twitter)
536,thebuffalonews,https://buffalonews.com/2019/01/27/prospectus-new-waterfront-attractions-expected-in-2019/?utm_medium=social&utm_campaign=puma&utm_source=Twitter#Echobox=1548613444,2019-01-27,1,The Outer Harbor. (Mark Mulville/News file photo),(Mark Mulville/News file photo)
537,thebuffalonews,https://buffalonews.com/2019/01/30/western-new-york-farm-show-to-be-held-friday-and-saturday/?utm_term=Autofeed&utm_campaign=puma&utm_medium=social&utm_source=Twitter#Echobox=1548936752,2019-01-30,1,The storm has forced the Western New York Farm Show to delay its start. (John Hickey/Buffalo News),(John Hickey/Buffalo News)
538,thebuffalonews,https://buffalonews.com/2019/01/31/heart-association-encourages-all-to-wear-red-on-friday-to-launch-american-heart-month/?utm_term=Autofeed&utm_campaign=puma&utm_medium=social&utm_source=Twitter#Echobox=1548977886,2019-01-31,2,"Joan Vetter, left, nurse manager of the seventh-floor cardiovascular patient care unit at Mercy Hospital, shows Erie County Legislator Lynne Dixon a bulletin board in the unit where patients and their families can leave thank you notes on paper hearts. (Photos by Buffalo Niagara American Heart Association staff)",(Photos by Buffalo Niagara American Heart Association staff)
538,thebuffalonews,,,2,"Those taking part earlier this week in a ceremony marking February as American Hearth Month in Erie County included, from left, Marc Natalie, executive director of the Buffalo Niagara American Heart Association; Shari McDonald, vice president for patient care services and chief nursing officer at Mercy Hospital, and chairwoman of the 2019 Go Red for Women luncheon and campaign in the region; Erie County Legislator Lynne Dixon; and Eddie Bratko, chief operating officer with the regional Heart Association organization.",NA
539,thebuffalonews,https://buffalonews.com/2019/01/30/sean-kirst-in-buffalo-defining-the-meaning-of-a-blizzard/?utm_medium=social&utm_campaign=puma&utm_source=Twitter#Echobox=1548889034,2019-01-30,3,Ashley Frey shovels her driveway on Sheffield Avenue in Buffalo amid a storm that’s now officially a blizzard.      (Mark Mulville/Buffalo News),(Mark Mulville/Buffalo News)
539,thebuffalonews,,,3,"Josh Rogers walks with his shovel down South Park in Buffalo Wednesday, January 30, 2019. (Mark Mulville/Buffalo News)",(Mark Mulville/Buffalo News)
539,thebuffalonews,,,3,A good-hearted stranger pushes out the car of Peter Hutt on South Park in Buffalo Wednesday. (Mark Mulville/Buffalo News),(Mark Mulville/Buffalo News)
540,thebuffalonews,https://buffalonews.com/2019/01/31/mill-middle-school-team-advances-to-future-city-finals/?utm_term=Autofeed&utm_campaign=puma&utm_medium=social&utm_source=Twitter#Echobox=1548975922,2019-01-31,1,"The winning Mill Middle School Future Cities team is comprised of, from left, Ada Bastedo, team mentor Julie Leong, Mia Gilham, Mary Quinn, Jioia D’Andrea Mucciarelli, Maryanna Daigler, David Hatcher, and team engineer Paul Kluczynski. It also includes Alex Kania and Lauren Zwirecki, who are not pictured.",NA
541,thebuffalonews,https://buffalonews.com/2019/01/31/sean-kirst-from-hurricane-to-blizzard-with-hope-in-buffalo/?utm_term=Autofeed&utm_campaign=puma&utm_medium=social&utm_source=Twitter#Echobox=1548972865,2019-01-31,3,"Yohalis Rivera, who moved to Buffalo from Puerto Rico in December because of difficulties her family had in recovering from Hurricane Maria, got her first taste of a Buffalo blizzard. (Derek Gee/Buffalo News)",(Derek Gee/Buffalo News)
541,thebuffalonews,,,3,"Yohalis Rivera and her sons after Per Niente took them shopping, in December. (Image courtesy of Joe DiLeo)",(Image courtesy of Joe DiLeo)
