Index,Publisher,URL,Date,Num_Images,Caption,Credit/Source
1,thebuffalonews,https://buffalonews.com/2019/02/10/145-years-later-abraham-lincolns-birthday-still-marked-in-buffalo/?utm_term=Autofeed&utm_campaign=puma&utm_medium=social&utm_source=Twitter#Echobox=1549841172,2019-02-10,0,NA,NA
2,thebuffalonews,https://buffalonews.com/2019/02/10/145-years-later-abraham-lincolns-birthday-still-marked-in-buffalo/,2019-02-10,0,NA,NA
3,thebuffalonews,https://buffalonews.com/2019/02/10/broken-water-pipe-leads-to-ohara-closure-monday/?utm_term=Autofeed&utm_campaign=puma&utm_medium=social&utm_source=Twitter#Echobox=1549839141,2019-02-10,1,Cardinal O’Hara High School. (Image via Google),(Image via Google)
4,thebuffalonews,https://buffalonews.com/2019/02/09/new-york-state-legal-marijuana-pot-frequently-asked-questions/?utm_term=Autofeed&utm_campaign=puma&utm_medium=social&utm_source=Twitter#Echobox=1549817599,2019-02-09,1,"Marijuana plants fill a greenhouse at Tweed Farms in Niagara-on-the-Lake, Ont., on Dec. 21, 2017. (Derek Gee/News file photo)",(Derek Gee/News file photo)
5,thebuffalonews,https://buffalonews.com/2019/02/09/open-now-the-house-that-beer-built/?utm_term=Autofeed&utm_campaign=puma&utm_medium=social&utm_source=Twitter#Echobox=1549830576,2019-02-09,1,Volunteers with Habitat for Humanity Buffalo at an open house Saturday with Manasse Nsabiyuma and Nechode Ndayishimiye at the house they built through Habitat. (Courtesy of Habitat for Humanity Buffalo),(Courtesy of Habitat for Humanity Buffalo)
7,thebuffalonews,https://buffalonews.com/2019/02/10/discount-divaputting-a-ring-on-it-go-ahead-and-skip-the-diamond/?utm_term=Autofeed&utm_campaign=puma&utm_medium=social&utm_source=Twitter#Echobox=1549828398,2019-02-10,1,Buffalo News file photo,NA
8,thebuffalonews,https://buffalonews.com/2019/02/09/judge-ends-historic-desegregation-order-for-buffalo-firefighters/?utm_term=Autofeed&utm_campaign=puma&utm_medium=social&utm_source=Twitter#Echobox=1549819078,2019-02-09,1,"In April of last year, the fire department’s overall workforce was 24 percent African-American, 5.5 percent Hispanic and 5 percent female. That compares with a workforce that was 1 percent black and included no Hispanics or women in 1974. (Derek Gee/News file photo)",(Derek Gee/News file photo)
9,thebuffalonews,https://buffalonews.com/2019/02/09/town-of-tonawanda-bringing-back-santa-village/?utm_term=Autofeed&utm_campaign=puma&utm_medium=social&utm_source=Twitter#Echobox=1549822664,2019-02-09,1,Santa Claus (aka Mike Stroh) listens closely as a curious 4-year-old Tristen Goldring asks a question at the Walden Galleria Mall in this 2014 photo. Kids can meet Mr. Claus at the revived Santa Village in the Town of Tonawanda later this year.  (Derek Gee/Buffalo News file photo),(Derek Gee/Buffalo News file photo)
10,thebuffalonews,https://buffalonews.com/2019/02/10/trucker-faces-multiple-charges-after-traffic-stop-in-genesee-county/?utm_term=Autofeed&utm_campaign=puma&utm_medium=social&utm_source=Twitter#Echobox=1549813388,2019-02-10,0,NA,NA
11,thebuffalonews,https://buffalonews.com/2019/02/10/demolition-work-to-begin-monday-on-niagara-scenic-parkway-project/?utm_term=Autofeed&utm_campaign=puma&utm_medium=social&utm_source=Twitter#Echobox=1549812793,2019-02-10,1,A look at the Niagara Scenic Parkway looking south from Orchard Street in Niagara Falls. (Courtesy Empire State Development),(Courtesy Empire State Development)
12,thebuffalonews,https://buffalonews.com/2019/02/10/a-decade-after-flight-3407-crash-a-new-era-of-aviation-safety/?utm_term=Autofeed&utm_campaign=puma&utm_medium=social&utm_source=Twitter#Echobox=1549796558,2019-02-10,4,"Firefighters at the scene in Clarence Center after Flight 3407 crashed into a house, killing all 49 aboard and one on the ground on Feb. 12, 2009. (Harry Scull Jr./Buffalo News file photo)",(Harry Scull Jr./Buffalo News file photo)
12,thebuffalonews,,,4,"An aerial view of site where Flight 3407 crashed into a home on Long Street in Clarence at 10:17 p.m. Feb. 12, 2009, killing all 49 people aboard and a man in the home. (Derek Gee/Buffalo News file photo)",(Derek Gee/Buffalo News file photo)
12,thebuffalonews,,,4,"At a 2014 memorial service in Clarence Center, a poster with the photos of those who died in the crash of Flight 3407. (Buffalo News file photo)",(Buffalo News file photo)
12,thebuffalonews,,,4,"Family members of Flight 3407 victims – from left, Cheryl Borner, Justine Krasuski and Karen Wielinski – applaud as ""Miracle on the Hudson"" pilot ""Sully"" Sullenberger speaks during a 2015 event to push to protect the tougher pilot training rules the families fought for. (Derek Gee/Buffalo News)",(Derek Gee/Buffalo News)
14,thebuffalonews,https://buffalonews.com/2019/02/10/feds-want-ciminelli-to-forfeit-7-6-million-in-profits/?utm_term=Autofeed&utm_campaign=puma&utm_medium=social&utm_source=Twitter#Echobox=1549796559,2019-02-10,1,"Louis Ciminelli leaves Manhattan Federal Court after being sentenced to 28 months in prison on fraud and conspiracy charges on Monday, December 3, 2018. (Jefferson Siegel for The Buffalo News)",(Jefferson Siegel for The Buffalo News)
15,thebuffalonews,https://buffalonews.com/2019/02/10/erie-county-real-estate-transactions-505/?utm_term=Autofeed&utm_campaign=puma&utm_medium=social&utm_source=Twitter#Echobox=1549796949,2019-02-10,1,The inventory of homes for sale in Western New York in August 2016 was at the lowest it’s been in 16 years. during that month.  (Mark Mulville/Buffalo News),(Mark Mulville/Buffalo News)
16,thebuffalonews,https://buffalonews.com/2019/02/10/canadian-investor-jeffrey-wynn-gold-wynn-residential-sees-further-growth-in-buffalo-holdings/?utm_term=Autofeed&utm_campaign=puma&utm_medium=social&utm_source=Twitter#Echobox=1549796558,2019-02-10,1,Jeffrey Wynn stands in the lobby of Cathedral Place at 298 Main St.  Wynn and his brothers are successful Canadian businessmen investing heavily in Buffalo. (Robert Kirkham/Buffalo News),(Robert Kirkham/Buffalo News)
19,thebuffalonews,https://buffalonews.com/2019/02/09/edward-c-driscoll-90-retired-social-security-assistant-district-manager/?utm_term=Autofeed&utm_campaign=puma&utm_medium=social&utm_source=Twitter#Echobox=1549769119,2019-02-09,0,NA,NA
20,thebuffalonews,https://buffalonews.com/2019/02/09/policeman-and-mma-fighter-aims-for-niagara-county-legislature-seat/?utm_term=Autofeed&utm_campaign=puma&utm_medium=social&utm_source=Twitter#Echobox=1549769119,2019-02-09,1,"In this 2012 file photo, Erik “The Bull” Herbert, left, has his gloves tied up by Don Lilly, right, the co-owner, trainer and manager at Victory Mixed Martial Arts & Fitness. Herbert is now a North Tonawanda policeman and Niagara County Legislature candidate. (Sharon Cantillon/News file photo)",(Sharon Cantillon/News file photo)
21,thebuffalonews,https://buffalonews.com/2019/02/09/robert-h-stievater-87-architect-in-buffalo-for-55-years/?utm_term=Autofeed&utm_campaign=puma&utm_medium=social&utm_source=Twitter#Echobox=1549769482,2019-02-09,0,NA,NA
22,thebuffalonews,https://buffalonews.com/2019/02/09/bob-mccarthy-political-season-springs-up-early/?utm_term=Autofeed&utm_campaign=puma&utm_medium=social&utm_source=Twitter#Echobox=1549764219,2019-02-09,1,"Nomiki Konst, daughter of former County Legislator Kathy Konst, is running for New York City public advocate, the  office most recently occupied by new state Attorney General Tish James.  (Getty Images)",(Getty Images)
23,thebuffalonews,https://buffalonews.com/2019/02/09/home-care-aide-suspected-of-multiple-fraudulent-purchases/?utm_term=Autofeed&utm_campaign=puma&utm_medium=social&utm_source=Twitter#Echobox=1549761954,2019-02-09,0,NA,NA
24,thebuffalonews,https://buffalonews.com/2019/02/09/jamestown-man-faces-multiple-charges-after-arson-fire/?utm_term=Autofeed&utm_campaign=puma&utm_medium=social&utm_source=Twitter#Echobox=1549762831,2019-02-09,1,(Jamestown Police file photo),(Jamestown Police file photo)
25,thebuffalonews,https://buffalonews.com/2019/02/09/furnace-stolen-ductwork-damaged-at-home-under-construction-in-falls/?utm_term=Autofeed&utm_campaign=puma&utm_medium=social&utm_source=Twitter#Echobox=1549757282,2019-02-09,0,NA,NA
26,thebuffalonews,https://buffalonews.com/2019/02/09/blaze-raging-through-church-near-wellsville/?utm_term=Autofeed&utm_campaign=puma&utm_medium=social&utm_source=Twitter#Echobox=1549753682,2019-02-09,0,NA,NA
27,thebuffalonews,https://buffalonews.com/2019/02/09/man-conned-out-of-1500-in-common-computer-scam/?utm_term=Autofeed&utm_campaign=puma&utm_medium=social&utm_source=Twitter#Echobox=1549751308,2019-02-09,0,NA,NA
28,thebuffalonews,https://buffalonews.com/2019/02/09/police-recover-womans-car-reportedly-stolen-by-man-claiming-to-be-a-detective/?utm_term=Autofeed&utm_campaign=puma&utm_medium=social&utm_source=Twitter#Echobox=1549751093,2019-02-09,1,(News file photo),(News file photo)
29,thebuffalonews,https://buffalonews.com/2019/02/09/police-seeking-violent-probationer-who-cut-off-ankle-monitor/?utm_term=Autofeed&utm_campaign=puma&utm_medium=social&utm_source=Twitter#Echobox=1549757152,2019-02-09,1,Tyrell Handley (Provided by Niagara Falls Police),(Provided by Niagara Falls Police)
30,thebuffalonews,https://buffalonews.com/2019/02/08/buffalo-woman-25-pleads-guilty-to-coercing-teen-boys-to-rob-banks/?utm_medium=social&utm_campaign=puma&utm_source=Twitter#Echobox=1549737539,2019-02-08,1,Alexis Rose. (Photo from Erie County District Attorney’s Office),(Photo from Erie County District Attorney’s Office)
31,thebuffalonews,https://buffalonews.com/2019/02/09/poloncarz-launches-campaign-for-four-more-years-as-erie-county-executive/?utm_term=Autofeed&utm_campaign=puma&utm_medium=social&utm_source=Twitter#Echobox=1549750206,2019-02-09,1,Erie County Executive Mark C. Poloncarz officially kicks off his campaign for re-election to a third term with a rally last month. (John Hickey/Buffalo News),(John Hickey/Buffalo News)
32,thebuffalonews,https://buffalonews.com/2019/02/09/lockport-man-arrested-again-for-string-of-burglaries-across-wny/,2019-02-09,0,NA,NA
33,thebuffalonews,https://buffalonews.com/2019/02/09/ub-mens-basketball-central-michigan-mac/,2019-02-09,1,University at Buffalo forward Montell McRae scores against Central Michigan forward Romelo Burrell (24) in the first half Saturday at Alumni Arena. (James P. McCoy/The Buffalo News),(James P. McCoy/The Buffalo News)
34,thebuffalonews,https://buffalonews.com/2019/02/08/diane-gaidry-walker-54-local-life-coach-and-star-of-loving-annabelle/?utm_term=Autofeed&utm_campaign=puma&utm_medium=social&utm_source=Twitter#Echobox=1549750559,2019-02-08,0,NA,NA
35,thebuffalonews,https://buffalonews.com/2019/02/09/18-year-old-man-shot-3-times-in-niagara-falls/?utm_term=Autofeed&utm_campaign=puma&utm_medium=social&utm_source=Twitter#Echobox=1549746446,2019-02-09,0,NA,NA
36,thebuffalonews,https://buffalonews.com/2019/02/09/veteran-town-of-niagara-justice-runs-again/?utm_term=Autofeed&utm_campaign=puma&utm_medium=social&utm_source=Twitter#Echobox=1549745713,2019-02-09,1,NA,NA
38,thebuffalonews,https://buffalonews.com/2019/02/09/lockport-mayor-sacks-public-works-director-wont-say-why/?utm_term=Autofeed&utm_campaign=puma&utm_medium=social&utm_source=Twitter#Echobox=1549741502,2019-02-09,1,NA,NA
39,thebuffalonews,https://buffalonews.com/2019/02/09/sean-kirst-newfane-teacher-a-grammy-nominee-and-many-miracles/?utm_term=Autofeed&utm_campaign=puma&utm_medium=social&utm_source=Twitter#Echobox=1549741309,2019-02-09,4,"Eric Koch in his Red House Music Shop in Newfane: A protege, Patrick Harrington, has a shot at a Grammy. (Mark Mulville/Buffalo News)",(Mark Mulville/Buffalo News)
39,thebuffalonews,,,4,"Pat Harrington, on guitar. (Family photo)",(Family photo)
39,thebuffalonews,,,4,"Pat Harrington and his first guitar teacher, Eric Koch. (Family photo)",(Family photo)
39,thebuffalonews,,,4,"Pat Harrington's note to his teacher, Eric Koch. (Image courtesy Eric Koch)",(Image courtesy Eric Koch)
40,thebuffalonews,https://buffalonews.com/2019/02/09/18-year-old-man-shot-3-times-in-niagara-falls/,2019-02-09,0,NA,NA
41,thebuffalonews,https://buffalonews.com/2019/02/09/open-now-the-house-that-beer-built/?utm_term=Autofeed&utm_campaign=puma&utm_medium=social&utm_source=Twitter#Echobox=1549733899,2019-02-09,1,Volunteers with Habitat for Humanity Buffalo at an open house Saturday with Manasse Nsabiyuma and Nechode Ndayishimiye at the house they built through Habitat. (Courtesy of Habitat for Humanity Buffalo),(Courtesy of Habitat for Humanity Buffalo)
42,thebuffalonews,https://buffalonews.com/2019/02/09/snow-postponed-celebration-of-dr-kings-life-set-for-feb-18/?utm_term=Autofeed&utm_campaign=puma&utm_medium=social&utm_source=Twitter#Echobox=1549725447,2019-02-09,1,"Dr. Martin Luther King Jr. met with local leaders and held a news conference in 1967, while at Kleinhans Music Hall. (Robert L. Smith/The Buffalo News/Courtesy Buffalo History Museum)",(Robert L. Smith/The Buffalo News/Courtesy Buffalo History Museum)
43,thebuffalonews,https://buffalonews.com/2019/02/09/niagara-falls-food-pantry-plans-3-6-million-expansion/?utm_term=Autofeed&utm_campaign=puma&utm_medium=social&utm_source=Twitter#Echobox=1549728702,2019-02-09,1,"Sister Beth Brosmer, executive director, talks about her agency’s mission while guests eat lunch in the dining room at Heart, Love and Soul on Ontario Avenue.
(John Hickey/Buffalo News)",(John Hickey/Buffalo News)
44,thebuffalonews,https://buffalonews.com/2019/02/09/community-meeting-set-for-monday-on-new-downtown-waterfront-park/?utm_term=Autofeed&utm_campaign=puma&utm_medium=social&utm_source=Twitter#Echobox=1549720733,2019-02-09,1,The Ralph C. Wilson Foundation is donating $100 million to create a signature park at LaSalle Park on Buffalo’s waterfront and to connect a series of nature trails in the region. (Derek Gee/Buffalo News),(Derek Gee/Buffalo News)
45,thebuffalonews,https://buffalonews.com/2019/02/09/preservation-project-seeks-historical-photos-of-citys-black-community/?utm_term=Autofeed&utm_campaign=puma&utm_medium=social&utm_source=Twitter#Echobox=1549727877,2019-02-09,0,NA,NA
46,thebuffalonews,https://buffalonews.com/2019/02/08/sean-kirst-in-bandits-showdown-in-georgia-lessons-bigger-than-the-score/?utm_term=Autofeed&utm_campaign=puma&utm_medium=social&utm_source=Twitter#Echobox=1549736329,2019-02-08,3,"Lyle Thompson of the Georgia Swarm: One of the great players in the world was mocked in Philadelphia for wearing his hair in traditional fashion. (Photo courtesy Kyle Hess, National Lacrosse League)","(Photo courtesy Kyle Hess, National Lacrosse League)"
46,thebuffalonews,,,3,Deloris and Jerome Thompson Sr. are very proud of their five children for respecting Native American traditions. (Sean Kirst/Buffalo News),(Sean Kirst/Buffalo News)
46,thebuffalonews,,,3,"Silver Creek High School graduate Zed Williams, a member of the Seneca Nation, also plays for the Georgia Swarm. (Mark Mulville/Buffalo News)",(Mark Mulville/Buffalo News)
47,thebuffalonews,https://buffalonews.com/2019/02/09/free-narcan-training-session-in-tonawanda/?utm_term=Autofeed&utm_campaign=puma&utm_medium=social&utm_source=Twitter#Echobox=1549725825,2019-02-09,0,NA,NA
48,thebuffalonews,https://buffalonews.com/2019/02/08/kenmore-contractor-buys-former-tonawanda-machine-shop-property/?utm_term=Autofeed&utm_campaign=puma&utm_medium=social&utm_source=Twitter#Echobox=1549732793,2019-02-08,1,P&D Construction acquired this property at 330 East Niagara St. in Tonawanda. (Google Maps),(Google Maps)
49,thebuffalonews,https://buffalonews.com/2019/02/09/town-of-tonawanda-bringing-back-santa-village/?utm_term=Autofeed&utm_campaign=puma&utm_medium=social&utm_source=Twitter#Echobox=1549725649,2019-02-09,1,Santa Claus (aka Mike Stroh) listens closely as a curious 4-year-old Tristen Goldring asks a question at the Walden Galleria Mall in this 2014 photo. Kids can meet Mr. Claus at the revived Santa Village in the Town of Tonawanda later this year.  (Derek Gee/Buffalo News file photo),(Derek Gee/Buffalo News file photo)
50,thebuffalonews,https://buffalonews.com/2019/02/09/three-free-historical-events-to-celebrate-presidents-day-weekend/?utm_term=Autofeed&utm_campaign=puma&utm_medium=social&utm_source=Twitter#Echobox=1549720512,2019-02-09,0,NA,NA
51,thebuffalonews,https://buffalonews.com/2019/02/09/50-years-later-east-side-duos-groundbreaking-music-is-getting-its-due/?utm_term=Autofeed&utm_campaign=puma&utm_medium=social&utm_source=Twitter#Echobox=1549714963,2019-02-09,5,"Sylvester Cleary said, of the release of his music with Jesse Key nearly a half-century ago: “It is the greatest feeling of freedom, joy, and love I’ve ever felt in my life.” (Derek Gee/Buffalo News)",(Derek Gee/Buffalo News)
51,thebuffalonews,,,5,"Jesse Key, left, and Sylvester Cleary. (Photo courtesy Now-Again Records)",(Photo courtesy Now-Again Records)
51,thebuffalonews,,,5,Eothen “Egon” Alapatt. (Now-Again Records),(Now-Again Records)
51,thebuffalonews,,,5,A Key & Cleary newspaper ad from the '70s. (Photo courtesy Now-Again Records),(Photo courtesy Now-Again Records)
51,thebuffalonews,,,5,"Sylvester Cleary said, ""This music was creatively filtered through Jesse (Key) and myself, but it belongs to the world. It was destined.” (Derek Gee/Buffalo News)",(Derek Gee/Buffalo News)
52,thebuffalonews,https://buffalonews.com/2019/02/09/judge-ends-historic-desegregation-order-for-buffalo-firefighters/?utm_term=Autofeed&utm_campaign=puma&utm_medium=social&utm_source=Twitter#Echobox=1549710289,2019-02-09,1,"In April of last year, the fire department’s overall workforce was 24 percent African-American, 5.5 percent Hispanic and 5 percent female. That compares with a workforce that was 1 percent black and included no Hispanics or women in 1974. (Derek Gee/News file photo)",(Derek Gee/News file photo)
54,thebuffalonews,https://buffalonews.com/2019/02/09/a-refugee-who-couldnt-even-dream-lives-the-night-of-her-lifetime/?utm_term=Autofeed&utm_campaign=puma&utm_medium=social&utm_source=Twitter#Echobox=1549710288,2019-02-09,2,"Habiba Mohamed came to Buffalo as a refugee from Somalia, and now works in the Buffalo office of U.S. Sen. Kirsten Gillibrand. (John Hickey/Buffalo News)",(John Hickey/Buffalo News)
54,thebuffalonews,,,2,"President Trump, with Speaker Nancy Pelosi and Vice President Mike Pence looking on, delivers the State of the Union address in the chamber of the U.S. House of Representatives at the U.S. Capitol Building on Tuesday. (Chip Somodevilla/Getty Images)",(Chip Somodevilla/Getty Images)
57,thebuffalonews,https://buffalonews.com/2019/02/08/hill-takes-a-second-run-for-niagara-falls-council-seat/?utm_term=Autofeed&utm_campaign=puma&utm_medium=social&utm_source=Twitter#Echobox=1549688632,2019-02-08,1,Amber S. Hill (Contributed photo),(Contributed photo)
58,thebuffalonews,https://buffalonews.com/2019/02/08/how-cassie-sheedy-brought-chick-fil-a-to-western-new-york/?utm_medium=social&utm_campaign=puma&utm_source=Twitter#Echobox=1549629415,2019-02-08,1,"Chick-fil-A has “given me a huge opportunity by allowing me to be the steward here in Western New York and I want to do right by them,” Cassie Sheedy says. (Robert Kirkham/Buffalo News)",(Robert Kirkham/Buffalo News)
59,thebuffalonews,https://buffalonews.com/2019/02/08/gm-tonawanda-lockport-plants-supporting-shift-to-trucks-suvs/?utm_term=Autofeed&utm_campaign=puma&utm_medium=social&utm_source=Twitter#Echobox=1549653554,2019-02-08,3,GM’s two area plants will supply products for the 2020 Chevrolet Silverado HD. (provided photo),(provided photo)
59,thebuffalonews,,,3,"Ram Ramanujam, GM Tonawanda plant director. (News file photo)",(News file photo)
59,thebuffalonews,,,3,Area GM plants are supplying the radiator and V-8 engine for the 2020 Silverado. (Matt Glynn/Buffalo News),(Matt Glynn/Buffalo News)
60,thebuffalonews,https://buffalonews.com/2019/02/08/winter-wonderland-to-be-held-saturday-at-reinstein-woods/?utm_term=Autofeed&utm_campaign=puma&utm_medium=social&utm_source=Twitter#Echobox=1549649311,2019-02-08,1,Reinstein Woods Nature Preserve in Depew will host its annual Winter Wonderland on Saturday. (Sharon Cantillon/Buffalo News file photo),(Sharon Cantillon/Buffalo News file photo)
61,thebuffalonews,https://buffalonews.com/2019/02/08/lynne-dixon-contemplating-run-against-poloncarz/?utm_term=Autofeed&utm_campaign=puma&utm_medium=social&utm_source=Twitter#Echobox=1549648327,2019-02-08,1,Lynne Dixon is contemplating a run for county executive. (Robert Kirkham/News file photo),(Robert Kirkham/News file photo)
62,thebuffalonews,https://buffalonews.com/2019/02/08/lockport-group-aims-to-raise-500000-for-new-skateboard-park/?utm_term=Autofeed&utm_campaign=puma&utm_medium=social&utm_source=Twitter#Echobox=1549645154,2019-02-08,1,"Lockport’s Railyard Skatepark as it appeared covered with ice on Feb. 7, 2019. (Thomas J. Prohaska/The Buffalo News)",(Thomas J. Prohaska/The Buffalo News)
63,thebuffalonews,https://buffalonews.com/2019/02/08/barbara-l-newman-81-wife-of-noco-energy-corp-co-founder/?utm_term=Autofeed&utm_campaign=puma&utm_medium=social&utm_source=Twitter#Echobox=1549684235,2019-02-08,0,NA,NA
64,thebuffalonews,https://buffalonews.com/2019/02/08/watch-karen-wielinski-reflects-on-10th-anniversary-of-flight-3407-crash/?utm_term=Autofeed&utm_campaign=puma&utm_medium=social&utm_source=Twitter#Echobox=1549641740,2019-02-08,0,NA,NA
65,thebuffalonews,https://buffalonews.com/2019/02/08/convicted-falls-man-faces-up-to-22-years-in-prison-for-weapon-and-struggle-with-cop/?utm_term=Autofeed&utm_campaign=puma&utm_medium=social&utm_source=Twitter#Echobox=1549640936,2019-02-08,0,NA,NA
66,thebuffalonews,https://buffalonews.com/2019/02/08/welfare-fraud-investigator-runs-for-pendleton-town-board/?utm_term=Autofeed&utm_campaign=puma&utm_medium=social&utm_source=Twitter#Echobox=1549641955,2019-02-08,1,Investigator Amanda J. Irons-Rindfleisch (Contributed photo),(Contributed photo)
67,thebuffalonews,https://buffalonews.com/2019/02/08/amherst-police-officer-injured-in-crash-on-sheridan-drive/?utm_term=Autofeed&utm_campaign=puma&utm_medium=social&utm_source=Twitter#Echobox=1549659914,2019-02-08,0,NA,NA
68,thebuffalonews,https://buffalonews.com/2019/02/08/my-mother-took-her-own-life-i-want-answers-but-there-arent-any/?utm_term=Autofeed&utm_campaign=puma&utm_medium=social&utm_source=Twitter#Echobox=1549638602,2019-02-08,3,Donna Margaret Maziarz .,NA
68,thebuffalonews,,,3,Donna Margaret Maziarz,NA
68,thebuffalonews,,,3,"Samantha Christmann with her mother, Donna.",NA
69,thebuffalonews,https://buffalonews.com/2019/02/08/hes-out-authors-to-speak-at-north-tonawanda-history-museum/?utm_term=Autofeed&utm_campaign=puma&utm_medium=social&utm_source=Twitter#Echobox=1549637961,2019-02-08,0,NA,NA
70,thebuffalonews,https://buffalonews.com/2019/02/08/jury-finds-man-guilty-of-weapons-possession-in-connection-with-shooting/?utm_term=Autofeed&utm_campaign=puma&utm_medium=social&utm_source=Twitter#Echobox=1549680347,2019-02-08,0,NA,NA
71,thebuffalonews,https://buffalonews.com/2019/02/08/you-wont-find-the-state-of-the-town-of-tonawanda-in-the-town-of-tonawanda/?utm_term=Autofeed&utm_campaign=puma&utm_medium=social&utm_source=Twitter#Echobox=1549637304,2019-02-08,1,"Tonawanda Supervisor Joe Emminger gave his State of the Town address on Thursday at the Tonawanda Castle, which is in the city and not the town of Tonawanda. (Derek Gee/Buffalo News)",(Derek Gee/Buffalo News)
72,thebuffalonews,https://buffalonews.com/2019/02/08/dentist-gets-30-months-in-prison-for-filing-false-tax-return/?utm_term=Autofeed&utm_campaign=puma&utm_medium=social&utm_source=Twitter#Echobox=1549669443,2019-02-08,1,NA,NA
73,thebuffalonews,https://buffalonews.com/2019/02/08/garbage-recycling-pickup-interrupted-by-high-winds-to-resume-saturday/?utm_term=Autofeed&utm_campaign=puma&utm_medium=social&utm_source=Twitter#Echobox=1549678791,2019-02-08,0,NA,NA
74,thebuffalonews,https://buffalonews.com/2019/02/08/reward-offered-in-smith-street-butcher-knife-attack/?utm_term=Autofeed&utm_campaign=puma&utm_medium=social&utm_source=Twitter#Echobox=1549636200,2019-02-08,1,"Buffalo police are looking for Cardiair Jones, 23, in connection with an assault on Smith Street in October. (Crime Stoppers Buffalo)",(Crime Stoppers Buffalo)
76,thebuffalonews,https://buffalonews.com/2019/02/08/new-york-state-child-victims-act-frequently-asked-questions/?utm_medium=social&utm_campaign=puma&utm_source=Twitter#Echobox=1549629587,2019-02-08,1,"Lawmakers and advocates for childhood sexual abuse victims gathered at the New York State Capitol on Feb. 28, 2019, the day the State Legislature passed the Child Victims Act. (Tom Precious/Buffalo News)",(Tom Precious/Buffalo News)
77,thebuffalonews,https://buffalonews.com/2019/02/08/county-auto-bureau-looking-for-more-space-in-the-southtowns/?utm_term=Autofeed&utm_campaign=puma&utm_medium=social&utm_source=Twitter#Echobox=1549649505,2019-02-08,1,"The Erie County Auto Bureau at Erie Community College South is looking for more space, but the problem is in a state policy that penalizes localities when New Yorkers conduct transactions on the internet. (Barbara O’Brien/Buffalo News)",(Barbara O’Brien/Buffalo News)
78,thebuffalonews,https://buffalonews.com/2019/02/08/catholic-health-to-invest-135-million-in-new-health-records-system/?utm_term=Autofeed&utm_campaign=puma&utm_medium=social&utm_source=Twitter#Echobox=1549632792,2019-02-08,1,"Mark Sullivan, the CEO of Catholic Health System, says a new electronic health records system will be transformational. (Robert Kirkham/Buffalo News)",(Robert Kirkham/Buffalo News)
79,thebuffalonews,https://buffalonews.com/2019/02/08/six-meet-deadline-to-seek-appointment-as-interim-city-comptroller/?utm_term=Autofeed&utm_campaign=puma&utm_medium=social&utm_source=Twitter#Echobox=1549633222,2019-02-08,0,NA,NA
