Index,Publisher,URL,Date,Num_Images,Caption,Credit/Source
710,thebuffalonews,https://buffalonews.com/2019/01/30/victim-shot-in-face-in-jamestown-drive-by/?utm_term=Autofeed&utm_campaign=puma&utm_medium=social&utm_source=Twitter#Echobox=1548864914,2019-01-30,1,Police are looking for this car in connection with a drive-by shooting.(Jamestown Police Department),(Jamestown Police Department)
711,thebuffalonews,https://buffalonews.com/2019/01/30/miserable-ride-home-awaits-southtowns-commuters/?utm_term=Autofeed&utm_campaign=puma&utm_medium=social&utm_source=Twitter#Echobox=1548864594,2019-01-30,1,Dwight King cross-country skis down Elmwood Avenue while making a run to the store on Jan. 30. (Derek Gee/Buffalo News),(Derek Gee/Buffalo News)
712,thebuffalonews,https://buffalonews.com/2019/01/30/newfane-sex-offender-imprisoned-for-failure-to-report-address/?utm_term=Autofeed&utm_campaign=puma&utm_medium=social&utm_source=Twitter#Echobox=1548863134,2019-01-30,0,NA,NA
713,thebuffalonews,https://buffalonews.com/2019/01/30/roger-stone-no-stranger-to-wny-politics/?utm_term=Autofeed&utm_campaign=puma&utm_medium=social&utm_source=Twitter#Echobox=1548843237,2019-01-30,1,Roger Stone speaks in Buffalo in 2016. (News file photo),(News file photo)
715,thebuffalonews,https://buffalonews.com/2019/01/29/police-to-mini-tow-cars-not-impound/?utm_campaign=twitter-thread&utm_medium=social&utm_source=Twitter,2019-01-29,1,A scene from a side street in 2017. Buffalo will move cars that are obstructing crews during this week’s snow event. (Sharon Cantillon/Buffalo News),(Sharon Cantillon/Buffalo News)
716,thebuffalonews,https://buffalonews.com/2019/01/30/property-tax-deadline-extended-in-niagara-falls/?utm_campaign=twitter-thread&utm_medium=social&utm_source=Twitter,2019-01-30,0,NA,NA
717,thebuffalonews,https://buffalonews.com/2019/01/30/thieves-manipulate-niagara-falls-woman-steal-her-car/?utm_term=Autofeed&utm_campaign=puma&utm_medium=social&utm_source=Twitter#Echobox=1548858178,2019-01-30,0,NA,NA
719,thebuffalonews,https://buffalonews.com/2019/01/30/snow-moving-south-road-conditions-deteriorating/?utm_campaign=twitter-thread&utm_medium=social&utm_source=Twitter,2019-01-30,1,Snow blows over Route 20 in Hamburg Wednesday morning. (Sharon Gleason/Buffalo News),(Sharon Gleason/Buffalo News)
720,thebuffalonews,https://buffalonews.com/2019/01/30/no-injuries-or-deaths-due-to-storm-but-county-officials-urge-caution/?utm_campaign=twitter-thread&utm_medium=social&utm_source=Twitter,2019-01-30,1,"Greg Butcher, the Deputy Commissioner for Homeland Security and Preparedness (at podium) and Erie County officials provide a storm update at their 6 a.m. briefing Wednesday. (Keith McShea/Buffalo News)",(Keith McShea/Buffalo News)
721,thebuffalonews,https://buffalonews.com/2019/01/30/are-we-making-history-january-2019-a-foot-from-all-time-monthly-snow-mark-set-in-1977/?utm_term=Autofeed&utm_campaign=puma&utm_medium=social&utm_source=Twitter#Echobox=1548856720,2019-01-30,2,Buffalo in the grip of this week’s polar vortex. Hopefully the winner of Oxford Pennant’s Warmest Cold City contest will be greeted with milder weather. (Mark Mulville/Buffalo News),(Mark Mulville/Buffalo News)
721,thebuffalonews,,,2,"The snow was falling faster than the daily computer data sheets are registering it. With a record-breaking 13.6 inches Wednesday, Buffalo's monthly snowfall total for January reached 62.4 inches. That's fourth on the city's all-time list for January. (xmACIS)",(xmACIS)
722,thebuffalonews,https://buffalonews.com/2019/01/27/prospectus-northlands-plan-to-connect-workers-with-jobs/?utm_medium=social&utm_campaign=puma&utm_source=Twitter#Echobox=1548617046,2019-01-27,2,"“We want to transform this community into an advanced manufacturing and energy corridor where people can not only get training, but ultimately get the jobs,” Northland Workforce Training Center President and CEO Stephen Tucker said. (Mark Mulville/Buffalo News)",(Mark Mulville/Buffalo News)
722,thebuffalonews,,,2,"Sparks fly as student Jaelin Grey, 22, uses a grinder to smooth out his weld while practicing for a test in his stall at the Northland Workforce Training Center on Dec. 14, 2018. (Derek Gee/Buffalo News)",(Derek Gee/Buffalo News)
723,thebuffalonews,https://buffalonews.com/2019/01/30/snowfall-rates-as-much-as-3-inches-per-hour-over-metro-buffalo/?utm_medium=social&utm_campaign=puma&utm_source=Twitter#Echobox=1548856094,2019-01-30,1,"Cars travel snow-covered roads on the I-190 in Buffalo Wednesday, Jan. 30, 2019. (Mark Mulville/Buffalo News)",(Mark Mulville/Buffalo News)
725,thebuffalonews,https://buffalonews.com/2019/01/30/many-flights-in-and-out-of-buffalo-niagara-airport-canceled/?utm_medium=social&utm_campaign=puma&utm_source=Twitter#Echobox=1548851892,2019-01-30,0,NA,NA
726,thebuffalonews,https://buffalonews.com/2019/01/30/who-got-snow-and-who-hasnt-yet/?utm_campaign=twitter-thread&utm_medium=social&utm_source=Twitter,2019-01-30,1,Buffalo News reporter Matt Glynn’s newspaper was delivered to his home in Buffalo despite the snow Wednesday morning. (Matt Glynn/Buffalo News),(Matt Glynn/Buffalo News)
727,thebuffalonews,https://buffalonews.com/2019/01/30/snowfall-rates-as-much-as-3-inches-per-hour-over-metro-buffalo/?utm_campaign=twitter-thread&utm_medium=social&utm_source=Twitter,2019-01-30,1,"Cars travel snow-covered roads on the I-190 in Buffalo Wednesday, Jan. 30, 2019. (Mark Mulville/Buffalo News)",(Mark Mulville/Buffalo News)
728,thebuffalonews,https://buffalonews.com/2019/01/27/prospectus-from-north-to-south-east-to-west-here-are-big-projects-to-watch-in-2019/?utm_medium=social&utm_campaign=puma&utm_source=Twitter#Echobox=1548608014,2019-01-27,1,A rendering of the Queen City Landing project on Buffalo’s Outer Harbor.,NA
729,thebuffalonews,https://buffalonews.com/2019/01/27/prospectus-banks-devoting-more-attention-investment-to-east-side/?utm_medium=social&utm_campaign=puma&utm_source=Twitter#Echobox=1548610388,2019-01-27,1,"Trina Burruss of Northwest Bank, shown outside the new Jefferson Avenue branch. (Robert Kirkham/Buffalo News)",(Robert Kirkham/Buffalo News)
730,thebuffalonews,https://buffalonews.com/2019/01/30/many-flights-in-and-out-of-buffalo-niagara-airport-canceled/?utm_campaign=twitter-thread&utm_medium=social&utm_source=Twitter,2019-01-30,0,NA,NA
731,thebuffalonews,https://buffalonews.com/newsletter_promo/lake-effect-snow-joined-by-high-winds-frigid-temperatures/?utm_medium=social&utm_campaign=puma&utm_source=Twitter#Echobox=1548847758,2019-01-30,0,NA,NA
733,thebuffalonews,https://buffalonews.com/2019/01/29/city-mission-administrative-offices-closed-wednesday-and-thursday/?utm_campaign=twitter-thread&utm_medium=social&utm_source=Twitter,2019-01-29,0,NA,NA
734,thebuffalonews,https://buffalonews.com/2019/01/28/forget-the-bread-and-toilet-paper-heres-what-you-really-need-for-the-storm/?utm_medium=social&utm_campaign=puma&utm_source=Twitter#Echobox=1548815472,2019-01-28,1,The bread is almost always the first to go off store shelves prior to a storm. (Luke Sharrett/New York Times),(Luke Sharrett/New York Times)
735,thebuffalonews,https://buffalonews.com/2019/01/29/buffalos-code-blue-updates/?utm_campaign=twitter-thread&utm_medium=social&utm_source=Twitter,2019-01-29,0,NA,NA
736,thebuffalonews,https://buffalonews.com/2019/01/30/many-courts-closed-in-erie-and-niagara-county/?utm_campaign=twitter-thread&utm_medium=social&utm_source=Twitter,2019-01-30,1,NA,NA
737,thebuffalonews,https://buffalonews.com/2019/01/29/college-campuses-announcing-closings/?utm_campaign=twitter-thread&utm_medium=social&utm_source=Twitter,2019-01-29,1,Pedestrians navigate through slippery walkways and snow as bikes remain in place at Tusday Bike Friendly UB Amherst Campus. (John Hickey/Buffalo News),(John Hickey/Buffalo News)
738,thebuffalonews,https://buffalonews.com/2019/01/29/school-districts-already-announcing-snow-days-for-wednesday-thursday/?utm_campaign=twitter-thread&utm_medium=social&utm_source=Twitter,2019-01-29,0,NA,NA
739,thebuffalonews,https://buffalonews.com/2019/01/30/route-5-closed-due-to-winter-storm/?utm_campaign=twitter-thread&utm_medium=social&utm_source=Twitter,2019-01-30,1,"A barrier has been lowered to the entrance of the Skyway Wednesday morning in downtown Buffalo. The Skyway, along with all of Route 5 from I-190 to Ridge Road is closed because of the storm. (Maki Becker/Buffalo News)",(Maki Becker/Buffalo News)
740,thebuffalonews,https://buffalonews.com/2019/01/29/walden-galleria-loses-two-food-court-tenants/?utm_medium=social&utm_campaign=puma&utm_source=Twitter#Echobox=1548808536,2019-01-29,0,NA,NA
745,thebuffalonews,https://buffalonews.com/2019/01/28/rethinking-recycling/?utm_medium=social&utm_campaign=puma&utm_source=Twitter#Echobox=1548680203,2019-01-28,3,"Peter Kyaw, operating a front-end loader, makes room for more materials coming in on the tipping floor at Buffalo Recycling Enterprise in South Buffalo. (Sharon Cantillon/Buffalo News)",(Sharon Cantillon/Buffalo News)
745,thebuffalonews,,,3,Bales of aluminum cans that have started the recycling process. (Sharon Cantillon/Buffalo News),(Sharon Cantillon/Buffalo News)
745,thebuffalonews,,,3,Cardboard is sent up the chute to the baler at Buffalo Recycling Enterprise. (Sharon Cantillon/Buffalo News),(Sharon Cantillon/Buffalo News)
746,thebuffalonews,https://buffalonews.com/2019/01/27/prospectus-whats-next-at-the-buffalo-niagara-medical-campus/?utm_medium=social&utm_campaign=puma&utm_source=Twitter#Echobox=1548624628,2019-01-27,1,"The 120-acre Buffalo Niagara Medical Campus.
 (Derek Gee/Buffalo News )file photo)",(Derek Gee/Buffalo News )file photo)
747,thebuffalonews,https://buffalonews.com/2019/01/27/matt-glynn-what-manufacturers-need-most-skilled-people/?utm_medium=social&utm_campaign=puma&utm_source=Twitter#Echobox=1548615812,2019-01-27,1,"Peter Coleman, executive director of the Buffalo Niagara Manufacturing Alliance, says manufacturers are clamoring for skilled workers. (News file photo)",(News file photo)
748,thebuffalonews,https://buffalonews.com/2019/01/27/vocational-training-is-back-but-with-a-different-look/?utm_medium=social&utm_campaign=puma&utm_source=Twitter#Echobox=1548618557,2019-01-27,1,Burgard High School welding teacher James Ornello helps Janita Prim cut steel in the new welding shop. The school’s advanced manufacturing program is helping redefine vocational education. (Sharon Cantillon/News file photo),(Sharon Cantillon/News file photo)
749,thebuffalonews,https://buffalonews.com/2019/01/29/storm-remains-strong/?utm_medium=social&utm_campaign=puma&utm_source=Twitter#Echobox=1548812531,2019-01-29,1,Paige Tilley braces herself against the snow while walking down Main Street. Another round of heavy lake-effect snowfall is expected today along with the arrival of frigid polar air. (Derek Gee/Buffalo News),(Derek Gee/Buffalo News)
750,thebuffalonews,https://buffalonews.com/2019/01/28/forget-the-bread-and-toilet-paper-heres-what-you-really-need-for-the-storm/?utm_medium=social&utm_campaign=puma&utm_source=Twitter#Echobox=1548815454,2019-01-28,1,The bread is almost always the first to go off store shelves prior to a storm. (Luke Sharrett/New York Times),(Luke Sharrett/New York Times)
752,thebuffalonews,https://buffalonews.com/2019/01/27/prospectus-section-6-retail-column-5-retail-trends-well-see-in-2019/?utm_medium=social&utm_campaign=puma&utm_source=Twitter#Echobox=1548622110,2019-01-27,1,Technology will continue to change the shopping habits of consumers. (Robert Kirkham/News file photo),(Robert Kirkham/News file photo)
753,thebuffalonews,https://buffalonews.com/2019/01/27/next-generation-brandye-merriweather-of-buffalo-urban-development-corp/?utm_medium=social&utm_campaign=puma&utm_source=Twitter#Echobox=1548703773,2019-01-27,1,"Brandye Merriweather, vice president for downtown development at Buffalo Urban Development Corp. (Sharon Cantillon/Buffalo News)",(Sharon Cantillon/Buffalo News)
754,thebuffalonews,https://buffalonews.com/2019/01/27/prospectus-next-generation-banking-michael-anderson/?utm_medium=social&utm_campaign=puma&utm_source=Twitter#Echobox=1548705485,2019-01-27,1,"Mike Anderson, regional retail administrator for Bank on Buffalo. (Robert Kirkham/Buffalo News)",(Robert Kirkham/Buffalo News)
755,thebuffalonews,https://buffalonews.com/2019/01/27/kelly-barrett-center-for-elder-law-and-justice-health-care-advocate-next-generation-professional-services/?utm_medium=social&utm_campaign=puma&utm_source=Twitter#Echobox=1548703621,2019-01-27,1,Kelly Barrett of the Center for Elder Law and Justice. (Derek Gee/Buffalo News),(Derek Gee/Buffalo News)
756,thebuffalonews,https://buffalonews.com/2019/01/29/walter-hobson-75-doctor-of-dry-cleaning-was-advocate-for-youth/?utm_term=Autofeed&utm_campaign=puma&utm_medium=social&utm_source=Twitter#Echobox=1548796221,2019-01-29,0,NA,NA
757,thebuffalonews,https://buffalonews.com/2019/01/29/lecture-by-world-trade-center-architect-cancelled-due-to-weather/?utm_term=Autofeed&utm_campaign=puma&utm_medium=social&utm_source=Twitter#Echobox=1548820022,2019-01-29,0,NA,NA
758,thebuffalonews,https://buffalonews.com/2019/01/27/next-generation-of-leaders-steps-up-as-opportunity-knocks-in-buffalo/?utm_medium=social&utm_campaign=puma&utm_source=Twitter#Echobox=1548602963,2019-01-27,1,A new generation of leaders is stepping up in Buffalo.  (Derek Gee/News file photo),(Derek Gee/News file photo)
759,thebuffalonews,https://buffalonews.com/2019/01/27/prospectus-section-6-craft-brewing-business-is-hopping/?utm_medium=social&utm_campaign=puma&utm_source=Twitter#Echobox=1548619520,2019-01-27,2,Hamburg Brewing Company’s beer is one of a few local breweries with a tap handle at Craft Tap House. (Sharon Cantillon/Buffalo News),(Sharon Cantillon/Buffalo News)
759,thebuffalonews,,,2,A rendering of BriteSmith brewery in Williamsville. (Rendering courtesy of David Schutte),(Rendering courtesy of David Schutte)
760,thebuffalonews,https://buffalonews.com/2019/01/29/jeff-miers-soundcheck-for-working-musicians-the-new-buffalo-is-the-same-old-song-dance/?utm_term=Autofeed&utm_campaign=puma&utm_medium=social&utm_source=Twitter#Echobox=1548790815,2019-01-29,1,(Getty Images),(Getty Images)
761,thebuffalonews,https://buffalonews.com/2019/01/29/buffalo-city-hall-closed-wednesday-trash-pickups-canceled-wednesday-and-thursday/?utm_term=Autofeed&utm_campaign=puma&utm_medium=social&utm_source=Twitter#Echobox=1548805471,2019-01-29,0,NA,NA
762,thebuffalonews,https://buffalonews.com/2019/01/29/weather-accidents-close-skyway-tuesday-night-trucks-buses-banned-from-local-express-routes/?utm_medium=social&utm_campaign=puma&utm_source=Twitter#Echobox=1548819996,2019-01-29,1,Inbound traffic on Route 5. (News file photo),(News file photo)
763,thebuffalonews,https://buffalonews.com/2019/01/29/legislature-gives-final-okay-to-expanded-gun-controls/?utm_medium=social&utm_campaign=puma&utm_source=Twitter#Echobox=1548807350,2019-01-29,1,The New York Assembly chambers. (Stephanie Keith/The New York Times),(Stephanie Keith/The New York Times)
764,thebuffalonews,https://buffalonews.com/2019/01/29/buffalo-homecoming-event-hopes-to-tap-expat-talent/?utm_term=Autofeed&utm_campaign=puma&utm_medium=social&utm_source=Twitter#Echobox=1548779897,2019-01-29,1,Buffalo Homecoming hopes to stir expats’ interest in their hometown. (Harry Scull Jr./Buffalo News),(Harry Scull Jr./Buffalo News)
765,thebuffalonews,https://buffalonews.com/2019/01/29/storm-remains-strong/,2019-01-29,1,Paige Tilley braces herself against the snow while walking down Main Street. Another round of heavy lake-effect snowfall is expected today along with the arrival of frigid polar air. (Derek Gee/Buffalo News),(Derek Gee/Buffalo News)
766,thebuffalonews,https://buffalonews.com/2019/01/29/more-charges-lodged-against-alleged-falls-fraudster/?utm_term=Autofeed&utm_campaign=puma&utm_medium=social&utm_source=Twitter#Echobox=1548781842,2019-01-29,1,Victor E. Johnson (Courtesy Niagara County Sheriff's Office),(Courtesy Niagara County Sheriff's Office)
767,thebuffalonews,https://buffalonews.com/2019/01/29/city-mission-administrative-offices-closed-wednesday-and-thursday/?utm_term=Autofeed&utm_campaign=puma&utm_medium=social&utm_source=Twitter#Echobox=1548816843,2019-01-29,0,NA,NA
768,thebuffalonews,https://buffalonews.com/2019/01/29/buffalos-largest-businesses-launch-new-project-to-spur-regional-growth/?utm_term=Autofeed&utm_campaign=puma&utm_medium=social&utm_source=Twitter#Echobox=1548791971,2019-01-29,1,"By connecting some expats with local businesses and policymakers from September 11 to 13, Buffalo Homecoming organizers say they hope to encourage them to reinvest in Buffalo. (Buffalo News file photo)",(Buffalo News file photo)
769,thebuffalonews,https://buffalonews.com/2019/01/29/three-arrested-as-part-of-jamestown-meth-ring/?utm_term=Autofeed&utm_campaign=puma&utm_medium=social&utm_source=Twitter#Echobox=1548815890,2019-01-29,0,NA,NA
770,thebuffalonews,https://buffalonews.com/2019/01/29/trio-robs-niagara-falls-corner-store/?utm_term=Autofeed&utm_campaign=puma&utm_medium=social&utm_source=Twitter#Echobox=1548775227,2019-01-29,0,NA,NA
771,thebuffalonews,https://buffalonews.com/2019/01/29/what-to-expect-the-next-36-hours-heavy-lake-effect-snow-high-winds-dangerous-wind-chills/?utm_medium=social&utm_campaign=puma&utm_source=Twitter#Echobox=1548807721,2019-01-29,1,One more cold day awaits Friday. (Sharon Cantillon/Buffalo News,(Sharon Cantillon/Buffalo News
772,thebuffalonews,https://buffalonews.com/2019/01/29/storm-remains-strong/?utm_medium=social&utm_campaign=puma&utm_source=Twitter#Echobox=1548814791,2019-01-29,1,Paige Tilley braces herself against the snow while walking down Main Street. Another round of heavy lake-effect snowfall is expected today along with the arrival of frigid polar air. (Derek Gee/Buffalo News),(Derek Gee/Buffalo News)
773,thebuffalonews,https://buffalonews.com/2019/01/29/reward-offered-in-buffalos-first-homicide-of-2019/?utm_term=Autofeed&utm_campaign=puma&utm_medium=social&utm_source=Twitter#Echobox=1548784570,2019-01-29,1,"Frank Navaroli III, 27, is Buffalo’s first homicide victim of 2019. (Crime Stoppers Buffalo)",(Crime Stoppers Buffalo)
774,thebuffalonews,https://buffalonews.com/2019/01/29/college-campuses-announcing-closings/?utm_medium=social&utm_campaign=puma&utm_source=Twitter#Echobox=1548808427,2019-01-29,1,Pedestrians navigate through slippery walkways and snow as bikes remain in place at Tusday Bike Friendly UB Amherst Campus. (John Hickey/Buffalo News),(John Hickey/Buffalo News)
775,thebuffalonews,https://buffalonews.com/2019/01/29/storm-remains-strong/?utm_medium=social&utm_campaign=puma&utm_source=Twitter#Echobox=1548812500,2019-01-29,1,Paige Tilley braces herself against the snow while walking down Main Street. Another round of heavy lake-effect snowfall is expected today along with the arrival of frigid polar air. (Derek Gee/Buffalo News),(Derek Gee/Buffalo News)
776,thebuffalonews,https://buffalonews.com/2019/01/29/woman-charged-with-criminal-mischief-for-breaking-roommates-tail-light/?utm_term=Autofeed&utm_campaign=puma&utm_medium=social&utm_source=Twitter#Echobox=1548809993,2019-01-29,0,NA,NA
777,thebuffalonews,https://buffalonews.com/2019/01/29/allegany-county-man-charged-with-assault-endangering-baby/?utm_term=Autofeed&utm_campaign=puma&utm_medium=social&utm_source=Twitter#Echobox=1548775611,2019-01-29,1,Shane E. Kranock,NA
779,thebuffalonews,https://buffalonews.com/2019/01/29/walden-galleria-loses-two-food-court-tenants/?utm_medium=social&utm_campaign=puma&utm_source=Twitter#Echobox=1548808525,2019-01-29,0,NA,NA
780,thebuffalonews,https://buffalonews.com/2019/01/29/what-to-expect-the-next-36-hours-heavy-lake-effect-snow-high-winds-dangerous-wind-chills/?utm_medium=social&utm_campaign=puma&utm_source=Twitter#Echobox=1548807512,2019-01-29,1,One more cold day awaits Friday. (Sharon Cantillon/Buffalo News,(Sharon Cantillon/Buffalo News
781,thebuffalonews,https://buffalonews.com/2019/01/27/prospectus-new-waterfront-attractions-expected-in-2019/?utm_medium=social&utm_campaign=puma&utm_source=Twitter#Echobox=1548613403,2019-01-27,1,The Outer Harbor. (Mark Mulville/News file photo),(Mark Mulville/News file photo)
782,thebuffalonews,https://buffalonews.com/2019/01/27/prospectus-from-north-to-south-east-to-west-here-are-big-projects-to-watch-in-2019/?utm_medium=social&utm_campaign=puma&utm_source=Twitter#Echobox=1548609413,2019-01-27,1,A rendering of the Queen City Landing project on Buffalo’s Outer Harbor.,NA
783,thebuffalonews,https://buffalonews.com/2019/01/29/buffalos-code-blue-updates/?utm_term=Autofeed&utm_campaign=puma&utm_medium=social&utm_source=Twitter#Echobox=1548805471,2019-01-29,0,NA,NA
784,thebuffalonews,https://buffalonews.com/2019/01/29/police-to-mini-tow-cars-not-impound/?utm_term=Autofeed&utm_campaign=puma&utm_medium=social&utm_source=Twitter#Echobox=1548793378,2019-01-29,1,A scene from a side street in 2017. Buffalo will move cars that are obstructing crews during this week’s snow event. (Sharon Cantillon/Buffalo News),(Sharon Cantillon/Buffalo News)
785,thebuffalonews,https://buffalonews.com/2019/01/27/prospectus-downtown-living-column/?utm_medium=social&utm_campaign=puma&utm_source=Twitter#Echobox=1548611975,2019-01-27,1,Downtown living has become appealing to more people in recent years. (Derek Gee/Buffalo News),(Derek Gee/Buffalo News)
786,thebuffalonews,https://buffalonews.com/2019/01/29/north-tonawanda-history-museum-able-to-display-about-half-its-collection-at-new-smaller-home/?utm_term=Autofeed&utm_campaign=puma&utm_medium=social&utm_source=Twitter#Echobox=1548801518,2019-01-29,2,"Executive Director Howard W. Roeske Jr. shows off exhibits at the North Tonawanda History Museum Jan. 29, 2019. (John Hickey/Buffalo News)",(John Hickey/Buffalo News)
786,thebuffalonews,,,2,A display of Wurlitzer products at the North Tonawanda History Museum. (John Hickey/Buffalo News),(John Hickey/Buffalo News)
787,thebuffalonews,https://buffalonews.com/2019/01/29/community-foundation-announces-1-million-in-awards-to-local-changemakers/?utm_term=Autofeed&utm_campaign=puma&utm_medium=social&utm_source=Twitter#Echobox=1548759800,2019-01-29,1,"Clotilde Perez-Bode Dedecker, president and CEO of the Community Foundation for Greater Buffalo. (Robert Kirkham/News file photo)",(Robert Kirkham/News file photo)
788,thebuffalonews,https://buffalonews.com/2019/01/28/rethinking-recycling/?utm_medium=social&utm_campaign=puma&utm_source=Twitter#Echobox=1548701394,2019-01-28,3,"Peter Kyaw, operating a front-end loader, makes room for more materials coming in on the tipping floor at Buffalo Recycling Enterprise in South Buffalo. (Sharon Cantillon/Buffalo News)",(Sharon Cantillon/Buffalo News)
788,thebuffalonews,,,3,Bales of aluminum cans that have started the recycling process. (Sharon Cantillon/Buffalo News),(Sharon Cantillon/Buffalo News)
788,thebuffalonews,,,3,Cardboard is sent up the chute to the baler at Buffalo Recycling Enterprise. (Sharon Cantillon/Buffalo News),(Sharon Cantillon/Buffalo News)
789,thebuffalonews,https://buffalonews.com/2019/01/27/prospectus-the-6-stories-your-non-profit-should-tell/?utm_medium=social&utm_campaign=puma&utm_source=Twitter#Echobox=1548622729,2019-01-27,1,"Andy Goodman, co-founder and director of the Goodman Center, delivers a workshop about how storytelling techniques can help organizations get their message out at the Lexus Club at KeyBank Center, Tuesday, Jan. 15, 2019. (Derek Gee/Buffalo News)",(Derek Gee/Buffalo News)
790,thebuffalonews,https://buffalonews.com/2019/01/28/state-teachers-union-seeks-next-generation-of-educators/?utm_term=Autofeed&utm_campaign=puma&utm_medium=social&utm_source=Twitter#Echobox=1548796012,2019-01-28,2,"Teachers, students, administrators, and local politicians participate in the “Take a look at Teaching Summit” in Kenmore on Jan. 24.      (Mark Mulville/Buffalo News)",(Mark Mulville/Buffalo News)
790,thebuffalonews,,,2,Jim Mendola of the Ken-Ton schools writes down ideas from his group. (Mark Mulville/Buffalo News),(Mark Mulville/Buffalo News)
791,thebuffalonews,https://buffalonews.com/2019/01/27/health-care-is-the-biggest-employer-in-wny-here-are-six-trends-for-2019/?utm_medium=social&utm_campaign=puma&utm_source=Twitter#Echobox=1548623827,2019-01-27,2,"Dr. Paresh Dandona and his team at the Diabetes and Endocrinology Center of WNY are doing groundbreaking work using Type 2 diabetes drugs to help treat those with Type 1 diabetes, with help from a $1.5 million grant from the Juvenile Diabetes Association. (Derek Gee/Buffalo News)",(Derek Gee/Buffalo News)
791,thebuffalonews,,,2,"Kathy Clerkin, 75, who belongs to three hiking clubs, gets ready for a walk through Chestnut Ridge Park in Orchard Park. A retired nurse, Clerkin also works out six days a week at the Southtowns Family YMCA and leads an active social life. The University at Buffalo Center for Successful Aging looks to help others follow Clerkin’s lead. (Mark Mulville/News file photo)",(Mark Mulville/News file photo)
792,thebuffalonews,https://buffalonews.com/2019/01/29/legislature-gives-final-okay-to-expanded-gun-controls/,2019-01-29,1,The New York Assembly chambers. (Stephanie Keith/The New York Times),(Stephanie Keith/The New York Times)
793,thebuffalonews,https://buffalonews.com/2019/01/29/buffalo-police-officer-goes-on-trial/?utm_term=Autofeed&utm_campaign=puma&utm_medium=social&utm_source=Twitter#Echobox=1548785966,2019-01-29,2,NA,NA
793,thebuffalonews,,,2,Buffalo Police Officer Corey Krug.,NA
794,thebuffalonews,https://buffalonews.com/2019/01/29/perrys-introduces-limited-time-valentines-flavor/?utm_term=Autofeed&utm_campaign=puma&utm_medium=social&utm_source=Twitter#Echobox=1548783507,2019-01-29,1,The latest Perry’s flavor is available only during the Valentine’s season. (Contributed photo),(Contributed photo)
