Index,Publisher,URL,Date,Num_Images,Caption,Credit/Source
341,dandc,,,10,"Virginia Gov. Ralph Northam, with his wife Pam at his side, speaks at a press conference in the Executive Mansion at the Capitol in Richmond, Va., Saturday, Feb. 2, 2019. Northam is under fire for a racial photo that appeared in his college yearbook.","Steve Earley, The Virginian-Pilot via AP"
341,dandc,,,10,"Members of the media listen to a statement from Virginia Governor Ralph Northam speaks about a racist photo that appeared in his 1984 medical school yearbook, at the Executive Mansion in Richmond, Va. on Feb.2, 2019. Northam is facing pressure to resign from both Republicans and Democrats, after racist medical school yearbook pictures, showing him and another person in racist garb at a party.","Dan Currier, EPA-EFE"
341,dandc,,,10,"Virginia Governor Ralph Northam speaks with reporters at a press conference at the Governor's mansion on Feb. 2, 2019 in Richmond, Virginia. Northam denies allegations that he is pictured in a yearbook photo wearing racist attire.","Alex Edelman, Getty Images"
342,dandc,https://www.democratandchronicle.com/story/news/2019/02/03/rg-e-1-000-customers-without-power-penfield-sunday/2761424002/,"
            Published 11:10 a.m. ET Feb. 3, 2019 | Updated 12:47 p.m. ET Feb. 3, 2019",0,NA,NA
343,dandc,https://www.democratandchronicle.com/story/news/2019/02/03/rg-e-1-000-customers-without-power-penfield-sunday/2761424002/?utm_source=dlvr.it&utm_medium=twitter,"
            Published 11:10 a.m. ET Feb. 3, 2019 | Updated 12:47 p.m. ET Feb. 3, 2019",0,NA,NA
344,dandc,https://www.democratandchronicle.com/story/news/2019/02/03/your-ad-here-city-might-sell-space-benches-skyways-sidewalks/2737118002/?utm_source=dlvr.it&utm_medium=twitter,"
            Published 10:28 a.m. ET Feb. 3, 2019 | Updated 5:52 p.m. ET Feb. 3, 2019",2,CARLOS ORTIZ/@cfortiz_dandc/staff photographerThe median age for Monroe County residents was 38.9 years old in 2016. Rochester skyline (Photo: CARLOS ORTIZ / staff file photo),(Photo: CARLOS ORTIZ / staff file photo)
344,dandc,,,2,"John Nugent, producer and artistic director of the Xerox Rochester International Jazz Festival, has some fun on his way to one of the venues in this file photo. Temporary advertisements on sidewalks, also using washable paint, would be allowed under Mayor Lovely Warren's proposal during special events, large conferences and other such gatherings. (Photo: CARLOS ORTIZ/Rochester Democrat and Chronicle)",(Photo: CARLOS ORTIZ/Rochester Democrat and Chronicle)
345,dandc,https://www.democratandchronicle.com/story/news/2019/02/03/your-ad-here-city-might-sell-space-benches-skyways-sidewalks/2737118002/,"
            Published 10:28 a.m. ET Feb. 3, 2019 | Updated 5:52 p.m. ET Feb. 3, 2019",2,CARLOS ORTIZ/@cfortiz_dandc/staff photographerThe median age for Monroe County residents was 38.9 years old in 2016. Rochester skyline (Photo: CARLOS ORTIZ / staff file photo),(Photo: CARLOS ORTIZ / staff file photo)
345,dandc,,,2,"John Nugent, producer and artistic director of the Xerox Rochester International Jazz Festival, has some fun on his way to one of the venues in this file photo. Temporary advertisements on sidewalks, also using washable paint, would be allowed under Mayor Lovely Warren's proposal during special events, large conferences and other such gatherings. (Photo: CARLOS ORTIZ/Rochester Democrat and Chronicle)",(Photo: CARLOS ORTIZ/Rochester Democrat and Chronicle)
346,dandc,https://www.democratandchronicle.com/story/news/2019/02/03/six-questions-senate-majority-leader-andrea-stewart-cousins-new-york-senate-albany-abortion-guns/2761304002/,"
            Published 10:01 a.m. ET Feb. 3, 2019
        ",1,"New York State Senate Majority Leader, Andrea Stewart-Cousins, D-Yonkers, speaks with legislators and gun control advocates during a news conference introducing new legislation reforms to protect New Yorkers from gun violence at the state Capitol on Tuesday, Jan. 29, 2019, in Albany, N.Y. (Photo: Hans Pennink, AP)","(Photo: Hans Pennink, AP)"
347,dandc,https://www.democratandchronicle.com/story/news/2019/02/03/man-opens-fire-salina-dennys-three-reported-shot/2761202002/?utm_source=dlvr.it&utm_medium=twitter,"
            Published 9:32 a.m. ET Feb. 3, 2019
        ",1,Sheriffs Line Do Not Cross tape shown in 2018 file photo. (Photo: Tina MacIntyre-Yee/Rochester Democrat and Chronicle),(Photo: Tina MacIntyre-Yee/Rochester Democrat and Chronicle)
348,dandc,https://www.democratandchronicle.com/story/news/2019/02/03/man-opens-fire-salina-dennys-three-reported-shot/2761202002/,"
            Published 9:32 a.m. ET Feb. 3, 2019
        ",1,Sheriffs Line Do Not Cross tape shown in 2018 file photo. (Photo: Tina MacIntyre-Yee/Rochester Democrat and Chronicle),(Photo: Tina MacIntyre-Yee/Rochester Democrat and Chronicle)
349,dandc,https://www.democratandchronicle.com/story/news/2019/02/02/thousands-lose-power-in-greece-parma-and-hilton/2760084002/?utm_source=dlvr.it&utm_medium=twitter,"
            Published 11:22 p.m. ET Feb. 2, 2019 | Updated 10:00 a.m. ET Feb. 3, 2019",0,NA,NA
350,dandc,https://www.democratandchronicle.com/story/news/2019/02/03/super-bowl-time-tv-channel-stream-betting-halftime-show/2761188002/,"
            Published 8:58 a.m. ET Feb. 3, 2019
        ",10,Boxer Evander Holyfield takes in the action during the third quarter of Super Bowl LIII at Mercedes-Benz Stadium in Atlanta.,"Matthew Emmons, USA TODAY Sports"
350,dandc,,,10,Lead singer Adam Levine and Maroon 5 perform during the halftime show at Super Bowl LIII at Mercedes-Benz Stadium.,"Brett Davis, USA TODAY Sports"
350,dandc,,,10,Recording artist Big Boi performs with Maoon 5 during the Super Bowl LIII halftime show at Mercedes-Benz Stadium in Atlanta.,"Brett Davis, USA TODAY Sports"
350,dandc,,,10,"Recording artist Travis Scott, right, performs with Maroon 5 during the Super Bowl LIII halftime show at Mercedes-Benz Stadium.","Dale Zanine, USA TODAY Sports"
350,dandc,,,10,Legendary singer Gladys Knight performs the national anthem before Super Bowl LIII between the New England Patriots and the Los Angeles Rams at Mercedes-Benz Stadium.,"Mark J. Rebilas, USA TODAY Sports"
350,dandc,,,10,"R&B sister duo Chloe x Halle perform ""America the Beautiful"" before Super Bowl LIII at Mercedes-Benz Stadium in Atlanta.","Christopher Hanewinckel, USA TODAY Sports"
350,dandc,,,10,Actor Kevin Hart attends Super Bowl LIII between the New England Patriots and the Los Angeles Rams at Mercedes-Benz Stadium in Atlanta.,"Al Bello, Getty Images"
350,dandc,,,10,Actress Ellie Kemper on the field at Mercedes-Benz Stadium before Super Bowl LIII.,"Christopher Hanewinckel, USA TODA"
350,dandc,,,10,"Actor Jamie Foxx, right, watches the teams warm up before Super Bowl LIII between the Los Angeles Rams and the New England Patriots in Atlanta.","Mark Humphrey, AP"
350,dandc,,,10,Recording artist and actor Ludacris takes in the sights on the field before Super Bowl LIII.,"Jason Getz, USA TODAY Sports"
351,dandc,https://www.usatoday.com/story/news/nation/2019/01/30/super-bowl-liii-atlanta-sex-trafficking-victim-police-fbi-prostitution/2658224002/,"
            Published 12:00 p.m. ET Jan. 30, 2019 | Updated 1:25 p.m. ET Feb. 2, 2019",1,"Sierra Thompson (Photo: Lynsey Weatherspoon, for USA TODAY)","(Photo: Lynsey Weatherspoon, for USA TODAY)"
352,dandc,https://www.democratandchronicle.com/story/news/2019/01/31/trevyan-rowe-report-rochester-city-school-district/2731135002/?utm_source=dlvr.it&utm_medium=twitter,"
            Published 12:52 p.m. ET Jan. 31, 2019 | Updated 8:53 p.m. ET Feb. 2, 2019",1,"Carrie Houston, mother of Trevyan Rowe, is embraced by many after the vigil for her son, whose disappearance brought an outpouring of community support. (Photo: Max Schulte/Rochester Democrat and Chronicle)",(Photo: Max Schulte/Rochester Democrat and Chronicle)
353,dandc,https://www.democratandchronicle.com/story/news/2019/02/02/thousands-lose-power-in-greece-parma-and-hilton/2760084002/?utm_source=dlvr.it&utm_medium=twitter,"
            Published 11:22 p.m. ET Feb. 2, 2019 | Updated 10:00 a.m. ET Feb. 3, 2019",0,NA,NA
354,dandc,https://www.democratandchronicle.com/story/sports/high-school/2019/02/02/section-v-scores-february-2-basketball-hockey-wrestling-swimming-rochester-ny/2753832002/?utm_source=dlvr.it&utm_medium=twitter,"
            Published 11:08 p.m. ET Feb. 2, 2019 | Updated 12:15 p.m. ET Feb. 3, 2019",11,"Hilton's Rocco Camillaci, facing, beats Webster Schroeder's  Joe Berenson in the 106-pound division to win the Section V title. (Photo: JAMIE GERMANO/ROCHESTER DEMOCRAT AND CHRONICLE)",(Photo: JAMIE GERMANO/ROCHESTER DEMOCRAT AND CHRONICLE)
354,dandc,,,11,Pittsford's Nathan Cotroneo fights to stay off his back in the 132-pound Section V title match against Victor's Alex Samson.  Samson went on to win 6-0.  (Photo: JAMIE GERMANO/ROCHESTER DEMOCRAT AND CHRONICLE),(Photo: JAMIE GERMANO/ROCHESTER DEMOCRAT AND CHRONICLE)
354,dandc,,,11,Hilton's Greg Diakomihalis beat Webster Schroeder's Anthony Surace in the 113-pound weight class to win the Section V Division I title .,JAMIE GERMANO/ROCHESTER DEMOCRAT AND CHRONICLE
354,dandc,,,11,"Hilton's Rocco Camillaci, facing, beats Webster Schroeder's  Joe Berenson in the 106-pound division to win the Section V title.",JAMIE GERMANO/ROCHESTER DEMOCRAT AND CHRONICLE
354,dandc,,,11,Hilton's Gregor McNeil beat Webster Schroeder's Lucas Randisi to win the Section V title in the 99-pound division .,JAMIE GERMANO/ROCHESTER DEMOCRAT AND CHRONICLE
354,dandc,,,11,Hilton's Rocco Camillaci and Schroeder's Joe Berenson wrestle in the 106-pound Section V title match.  Camillaci went on to pin Berenson for the win.,JAMIE GERMANO/ROCHESTER DEMOCRAT AND CHRONICLE
354,dandc,,,11,Hilton's Gregor McNeil wrestles Schroeder's Lucas Randisi for the 99-pound Section V title.  McNeil pinned Randisi for the win.,JAMIE GERMANO/ROCHESTER DEMOCRAT AND CHRONICLE
354,dandc,,,11,"Hilton's Rocco Camillaci, top, and Schroeder's Joe Berenson square off in the 106-pound Section V title match.",JAMIE GERMANO/ROCHESTER DEMOCRAT AND CHRONICLE
354,dandc,,,11,Webster Schroeder's Lucas Randisi tries to escape from Hilton's Gregor McNeil in the 99-pound  Section V title match.  McNeil went on to beat Randisi  with a pin.,JAMIE GERMANO/ROCHESTER DEMOCRAT AND CHRONICLE
354,dandc,,,11,Hilton's Rocco Camillaci hangs onto the leg of Schroeder's Joe Berenson in the 106-pound title match.,JAMIE GERMANO/ROCHESTER DEMOCRAT AND CHRONICLE
355,dandc,https://www.democratandchronicle.com/story/news/2019/02/02/thousands-lose-power-in-greece-parma-and-hilton/2760084002/,"
            Published 11:22 p.m. ET Feb. 2, 2019 | Updated 10:00 a.m. ET Feb. 3, 2019",0,NA,NA
356,dandc,https://www.democratandchronicle.com/story/sports/high-school/2019/02/02/section-v-wrestling-class-aa-hilton/2725212002/,"
            Published 11:11 p.m. ET Feb. 2, 2019 | Updated 11:17 p.m. ET Feb. 2, 2019",10,Hilton's Greg Diakomihalis beat Webster Schroeder's Anthony Surace in the 113-pound weight class to win the Section V Class AA title. (Photo: JAMIE GERMANO/ROCHESTER DEMOCRAT AND CHRONICLE),(Photo: JAMIE GERMANO/ROCHESTER DEMOCRAT AND CHRONICLE)
356,dandc,,,10,Hilton's Rocco Camillaci (facing) beats Webster Schroeder's Joe Berenson in the 106-pound division to win the Section V Class AA title. (Photo: JAMIE GERMANO/ROCHESTER DEMOCRAT AND CHRONICLE),(Photo: JAMIE GERMANO/ROCHESTER DEMOCRAT AND CHRONICLE)
356,dandc,,,10,Pittsford's Nathan Cotroneo fights to stay off his back in the 132-pound Section V title match against Victor's Alex Samson.  Samson went on to win 6-0.  (Photo: JAMIE GERMANO/ROCHESTER DEMOCRAT AND CHRONICLE),(Photo: JAMIE GERMANO/ROCHESTER DEMOCRAT AND CHRONICLE)
356,dandc,,,10,Penfield's Max Kropman  beat Pittsford's Nick Sanko in the 138-pound Section V title match. Kropman went on to win with a pin.  (Photo: JAMIE GERMANO/ROCHESTER DEMOCRAT AND CHRONICLE),(Photo: JAMIE GERMANO/ROCHESTER DEMOCRAT AND CHRONICLE)
356,dandc,,,10,"Max Kropman, 138-pound wrestler at Penfield (Photo: JAMES JOHNSON/ROCHESTER DEMOCRAT AND CHRONICLE)",(Photo: JAMES JOHNSON/ROCHESTER DEMOCRAT AND CHRONICLE)
356,dandc,,,10,"Joseph Theede, 170-pound wrestler and football player at Victor (Photo: JAMES JOHNSON/ROCHESTER DEMOCRAT AND CHRONICLE)",(Photo: JAMES JOHNSON/ROCHESTER DEMOCRAT AND CHRONICLE)
356,dandc,,,10,Rush-Henrietta's Mijid Refaai tries to stay off his back in the 120-pound title match against teammate Jayden Scott.  (Photo: JAMIE GERMANO/ROCHESTER DEMOCRAT AND CHRONICLE),(Photo: JAMIE GERMANO/ROCHESTER DEMOCRAT AND CHRONICLE)
356,dandc,,,10,Sam DePrez (Photo: PROVIDED PHOTO),(Photo: PROVIDED PHOTO)
356,dandc,,,10,Hilton's Greg Diakomihalis beat Webster Schroeder's Anthony Surace in the 113-pound weight class to win the Section V Division I title .,JAMIE GERMANO/ROCHESTER DEMOCRAT AND CHRONICLE
356,dandc,,,10,"Hilton's Rocco Camillaci, facing, beats Webster Schroeder's  Joe Berenson in the 106-pound division to win the Section V title.",JAMIE GERMANO/ROCHESTER DEMOCRAT AND CHRONICLE
357,dandc,https://www.democratandchronicle.com/story/sports/high-school/2019/02/02/section-v-scores-february-2-basketball-hockey-wrestling-swimming-rochester-ny/2753832002/,"
            Published 11:08 p.m. ET Feb. 2, 2019 | Updated 12:15 p.m. ET Feb. 3, 2019",11,"Hilton's Rocco Camillaci, facing, beats Webster Schroeder's  Joe Berenson in the 106-pound division to win the Section V title. (Photo: JAMIE GERMANO/ROCHESTER DEMOCRAT AND CHRONICLE)",(Photo: JAMIE GERMANO/ROCHESTER DEMOCRAT AND CHRONICLE)
357,dandc,,,11,Pittsford's Nathan Cotroneo fights to stay off his back in the 132-pound Section V title match against Victor's Alex Samson.  Samson went on to win 6-0.  (Photo: JAMIE GERMANO/ROCHESTER DEMOCRAT AND CHRONICLE),(Photo: JAMIE GERMANO/ROCHESTER DEMOCRAT AND CHRONICLE)
357,dandc,,,11,Hilton's Greg Diakomihalis beat Webster Schroeder's Anthony Surace in the 113-pound weight class to win the Section V Division I title .,JAMIE GERMANO/ROCHESTER DEMOCRAT AND CHRONICLE
357,dandc,,,11,"Hilton's Rocco Camillaci, facing, beats Webster Schroeder's  Joe Berenson in the 106-pound division to win the Section V title.",JAMIE GERMANO/ROCHESTER DEMOCRAT AND CHRONICLE
357,dandc,,,11,Hilton's Gregor McNeil beat Webster Schroeder's Lucas Randisi to win the Section V title in the 99-pound division .,JAMIE GERMANO/ROCHESTER DEMOCRAT AND CHRONICLE
357,dandc,,,11,Hilton's Rocco Camillaci and Schroeder's Joe Berenson wrestle in the 106-pound Section V title match.  Camillaci went on to pin Berenson for the win.,JAMIE GERMANO/ROCHESTER DEMOCRAT AND CHRONICLE
357,dandc,,,11,Hilton's Gregor McNeil wrestles Schroeder's Lucas Randisi for the 99-pound Section V title.  McNeil pinned Randisi for the win.,JAMIE GERMANO/ROCHESTER DEMOCRAT AND CHRONICLE
357,dandc,,,11,"Hilton's Rocco Camillaci, top, and Schroeder's Joe Berenson square off in the 106-pound Section V title match.",JAMIE GERMANO/ROCHESTER DEMOCRAT AND CHRONICLE
357,dandc,,,11,Webster Schroeder's Lucas Randisi tries to escape from Hilton's Gregor McNeil in the 99-pound  Section V title match.  McNeil went on to beat Randisi  with a pin.,JAMIE GERMANO/ROCHESTER DEMOCRAT AND CHRONICLE
357,dandc,,,11,Hilton's Rocco Camillaci hangs onto the leg of Schroeder's Joe Berenson in the 106-pound title match.,JAMIE GERMANO/ROCHESTER DEMOCRAT AND CHRONICLE
359,dandc,https://www.democratandchronicle.com/story/news/2019/02/02/suburban-police-blotter-keyboard-sales-hits-sour-note-guitar-store/2739674002/?utm_source=dlvr.it&utm_medium=twitter,"
            Published 4:55 p.m. ET Feb. 2, 2019 | Updated 5:29 p.m. ET Feb. 2, 2019",1,Stock photo of handcuffs (Photo: File photo),(Photo: File photo)
360,dandc,https://www.democratandchronicle.com/story/news/2019/02/02/suburban-police-blotter-keyboard-sales-hits-sour-note-guitar-store/2739674002/,"
            Published 4:55 p.m. ET Feb. 2, 2019 | Updated 5:29 p.m. ET Feb. 2, 2019",1,Stock photo of handcuffs (Photo: File photo),(Photo: File photo)
361,dandc,https://www.usatoday.com/story/weather/2019/02/02/groundhog-day-live-punxsutawney/2744360002/,"
            Published 6:44 a.m. ET Feb. 2, 2019 | Updated 10:01 a.m. ET Feb. 2, 2019",1,"Punxsutawney Phil, the weather prognosticating groundhog, is held by the gloved hands of handler Ron Ploucha during the 129th celebration of Groundhog Day on Gobbler's Knob in Punxsutawney, Pa., Feb. 2, 2015. (Photo: Gene J. Puskar, AP)","(Photo: Gene J. Puskar, AP)"
363,dandc,https://www.democratandchronicle.com/story/sports/football/nfl/bills/2019/02/02/ken-dorsey-qbs-coach-buffalo-bills-josh-allen/2754673002/?utm_source=dlvr.it&utm_medium=twitter,"
            Published 1:26 p.m. ET Feb. 2, 2019 | Updated 4:26 p.m. ET Feb. 2, 2019",10,"Former Carolina Panthers quarterback coach Ken Dorsey will now have that position with the Bills. (Photo: Mike McCarn, AP)","(Photo: Mike McCarn, AP)"
363,dandc,,,10,Bills quarterback Josh Allen celebrates his 30-yard touchdown run against the Dolphins.,JAMIE GERMANO/ROCHESTER DEMOCRAT AND CHRONICLE
363,dandc,,,10,Bills first-round draft picks Josh Allen and Tremaine Edmunds with owners Terry and Kim Pegula inside New Era Field on April 27.,"JAMIE GERMANO, @jgermano1/Staff Photographer"
363,dandc,,,10,"Former Bills quarterback and Hall of Famer Jim Kelly visits with Buffalo's top draft pick, Josh Allen after rookie camp on May 11.  Kelly is coming back from another cancer surgery.",JAMIE GERMANO/ROCHESTER DEMOCRAT AND CHRONICLE
363,dandc,,,10,"Bills rookie quarterback Josh Allen has some fun with fans as he signs autographs after the first night of training camp on July 27, 2018.",JAMIE GERMANO/ROCHESTER DEMOCRAT
363,dandc,,,10,Bills rookie quarterback Josh Allen balances a football on his fingertip between offensive reps during training camp.,JAMIE GERMANO/ROCHESTER DEMOCRAT
363,dandc,,,10,Bills rookie quarterback Josh Allen makes an off balance throw as he is pressured by Efe Obada in a 28-23 loss to Carolina in the preseason opener.,JAMIE GERMANO/ROCHESTER DEMOCRAT
363,dandc,,,10,"Bills rookie quarterback Josh Allen heads out onto the field before his first NFL start - a preseason game against the Cincinnati Bengals on Aug. 26, 2018.",JAMIE GERMANO/DEMOCRAT AND CHRON
363,dandc,,,10,Bills rookie quarterback Josh Allen is pressured by Bengals Carlos Dunlap and hits his head on the turf.  He was removed from the Aug. 26 preseason game a play later and checked for a concussion.,JAMIE GERMANO/DEMOCRAT AND CHRON
363,dandc,,,10,Bills quarterback Josh Allen is sacked by Chargers Uchenna Nwosu in his first regular-season start on Sept. 16.,JAMIE GERMANO/ROCHESTER DEMOCRAT
364,dandc,https://www.democratandchronicle.com/story/sports/football/nfl/bills/2019/02/02/ken-dorsey-qbs-coach-buffalo-bills-josh-allen/2754673002/,"
            Published 1:26 p.m. ET Feb. 2, 2019 | Updated 4:26 p.m. ET Feb. 2, 2019",10,"Former Carolina Panthers quarterback coach Ken Dorsey will now have that position with the Bills. (Photo: Mike McCarn, AP)","(Photo: Mike McCarn, AP)"
364,dandc,,,10,Bills quarterback Josh Allen celebrates his 30-yard touchdown run against the Dolphins.,JAMIE GERMANO/ROCHESTER DEMOCRAT AND CHRONICLE
364,dandc,,,10,Bills first-round draft picks Josh Allen and Tremaine Edmunds with owners Terry and Kim Pegula inside New Era Field on April 27.,"JAMIE GERMANO, @jgermano1/Staff Photographer"
364,dandc,,,10,"Former Bills quarterback and Hall of Famer Jim Kelly visits with Buffalo's top draft pick, Josh Allen after rookie camp on May 11.  Kelly is coming back from another cancer surgery.",JAMIE GERMANO/ROCHESTER DEMOCRAT AND CHRONICLE
364,dandc,,,10,"Bills rookie quarterback Josh Allen has some fun with fans as he signs autographs after the first night of training camp on July 27, 2018.",JAMIE GERMANO/ROCHESTER DEMOCRAT
364,dandc,,,10,Bills rookie quarterback Josh Allen balances a football on his fingertip between offensive reps during training camp.,JAMIE GERMANO/ROCHESTER DEMOCRAT
364,dandc,,,10,Bills rookie quarterback Josh Allen makes an off balance throw as he is pressured by Efe Obada in a 28-23 loss to Carolina in the preseason opener.,JAMIE GERMANO/ROCHESTER DEMOCRAT
364,dandc,,,10,"Bills rookie quarterback Josh Allen heads out onto the field before his first NFL start - a preseason game against the Cincinnati Bengals on Aug. 26, 2018.",JAMIE GERMANO/DEMOCRAT AND CHRON
364,dandc,,,10,Bills rookie quarterback Josh Allen is pressured by Bengals Carlos Dunlap and hits his head on the turf.  He was removed from the Aug. 26 preseason game a play later and checked for a concussion.,JAMIE GERMANO/DEMOCRAT AND CHRON
364,dandc,,,10,Bills quarterback Josh Allen is sacked by Chargers Uchenna Nwosu in his first regular-season start on Sept. 16.,JAMIE GERMANO/ROCHESTER DEMOCRAT
365,dandc,https://www.democratandchronicle.com/story/lifestyle/rocflavors/2019/02/01/gordon-ramsay-rochester-hot-sauce-karma-hot-ones-los-calientes-youtube/2734793002/,"
            Published 11:50 a.m. ET Feb. 1, 2019 | Updated 1:01 p.m. ET Feb. 1, 2019",4,"Gordon Ramsay bites a chicken wing on an episode of ""Hot Ones,"" a talk show on YouTube. (Photo: Provided by First We Feast)",(Photo: Provided by First We Feast)
365,dandc,,,4,Hot Ones Los Calientes hot sauce is made by Karma Sauce in Rochester. (Photo: Provided by Karma Sauce),(Photo: Provided by Karma Sauce)
365,dandc,,,4,"Gordon Ramsay squirts a wing with lemon and lime juice in an attempt to combat the heat on an episode of ""Hot Ones,"" hosted by Sean Evans. (Photo: Provided by First We Feast)",(Photo: Provided by First We Feast)
365,dandc,,,4,"Gene Olczak has a line of hot sauce, Karma, he makes from his home-grown tomatoes and peppers.  He also makes different types of salsas. (Photo: TINA MACINTYRE-YEE/ @tyee23/staff photographer)",(Photo: TINA MACINTYRE-YEE/ @tyee23/staff photographer)
367,dandc,https://www.democratandchronicle.com/story/news/2019/02/01/where-millennial-homebuyers-buying-monroe-county/2549642002/?utm_source=dlvr.it&utm_medium=twitter,"
            Published 5:21 p.m. ET Feb. 1, 2019 | Updated 8:34 p.m. ET Feb. 7, 2019",5,The Village of Fairport home of Mark and Lynne Van Thof.  (Photo: JAMIE GERMANO/ROCHESTER DEMOCRAT AND CHRONICLE),(Photo: JAMIE GERMANO/ROCHESTER DEMOCRAT AND CHRONICLE)
367,dandc,,,5,The dining area in the Fairport home of Mark and Lynne Van Thof. (Photo: JAMIE GERMANO/ROCHESTER DEMOCRAT AND CHRONICLE),(Photo: JAMIE GERMANO/ROCHESTER DEMOCRAT AND CHRONICLE)
367,dandc,,,5,Millennial home buyers appreciate walkable neighborhoods (Photo: JAMIE GERMANO/ROCHESTER DEMOCRAT AND CHRONICLE),(Photo: JAMIE GERMANO/ROCHESTER DEMOCRAT AND CHRONICLE)
367,dandc,,,5,Millennial home buyers appreciate walkable neighborhoods and access to a business district like Main Street in Fairport.  (Photo: JAMIE GERMANO/ROCHESTER DEMOCRAT AND CHRONICLE),(Photo: JAMIE GERMANO/ROCHESTER DEMOCRAT AND CHRONICLE)
367,dandc,,,5,Millennial home buyers Mark and Lynne Van Thof with their son Henry in their Fairport home.   (Photo: JAMIE GERMANO/ROCHESTER DEMOCRAT AND CHRONICLE),(Photo: JAMIE GERMANO/ROCHESTER DEMOCRAT AND CHRONICLE)
368,dandc,https://www.democratandchronicle.com/story/news/2019/02/01/where-millennial-homebuyers-buying-monroe-county/2549642002/,"
            Published 5:21 p.m. ET Feb. 1, 2019 | Updated 8:34 p.m. ET Feb. 7, 2019",5,The Village of Fairport home of Mark and Lynne Van Thof.  (Photo: JAMIE GERMANO/ROCHESTER DEMOCRAT AND CHRONICLE),(Photo: JAMIE GERMANO/ROCHESTER DEMOCRAT AND CHRONICLE)
368,dandc,,,5,The dining area in the Fairport home of Mark and Lynne Van Thof. (Photo: JAMIE GERMANO/ROCHESTER DEMOCRAT AND CHRONICLE),(Photo: JAMIE GERMANO/ROCHESTER DEMOCRAT AND CHRONICLE)
368,dandc,,,5,Millennial home buyers appreciate walkable neighborhoods (Photo: JAMIE GERMANO/ROCHESTER DEMOCRAT AND CHRONICLE),(Photo: JAMIE GERMANO/ROCHESTER DEMOCRAT AND CHRONICLE)
368,dandc,,,5,Millennial home buyers appreciate walkable neighborhoods and access to a business district like Main Street in Fairport.  (Photo: JAMIE GERMANO/ROCHESTER DEMOCRAT AND CHRONICLE),(Photo: JAMIE GERMANO/ROCHESTER DEMOCRAT AND CHRONICLE)
368,dandc,,,5,Millennial home buyers Mark and Lynne Van Thof with their son Henry in their Fairport home.   (Photo: JAMIE GERMANO/ROCHESTER DEMOCRAT AND CHRONICLE),(Photo: JAMIE GERMANO/ROCHESTER DEMOCRAT AND CHRONICLE)
369,dandc,https://www.democratandchronicle.com/story/weather/2019/02/02/groundhog-day-live-punxsutawney/2744360002/,"
            Published 6:44 a.m. ET Feb. 2, 2019 | Updated 10:01 a.m. ET Feb. 2, 2019",1,"Punxsutawney Phil, the weather prognosticating groundhog, is held by the gloved hands of handler Ron Ploucha during the 129th celebration of Groundhog Day on Gobbler's Knob in Punxsutawney, Pa., Feb. 2, 2015. (Photo: Gene J. Puskar, AP)","(Photo: Gene J. Puskar, AP)"
370,dandc,https://www.democratandchronicle.com/story/news/politics/2019/02/01/ralph-northam-5-things-know-virginia-governor/2749488002/?fbclid=IwAR0fcMpymYJYUe5Y0rv10vLnFlWVuLR7qejpX7DhjB5kKL-Ik4vUD01UqXs,"
            Published 10:08 p.m. ET Feb. 1, 2019 | Updated 10:45 a.m. ET Feb. 2, 2019",10,Gov. Ralph Northam's 1984 medical school yearbook shows a photo of a man dressed in blackface and a second person in a KKK robe (Photo: Eastern Virginia Medical School),(Photo: Eastern Virginia Medical School)
370,dandc,,,10,"Virginia Gov. Ralph Northam speaks during a news conference in the Crystal City neighborhood in Arlington, Va., Tuesday, Nov. 13, 2018. Amazon, which has grown too big for its Seattle hometown, said it will split its much-anticipated second headquarters between New York and northern Virginia. (Photo: Susan Walsh, AP)","(Photo: Susan Walsh, AP)"
