Index,Publisher,URL,Date,Num_Images,Caption,Credit/Source
1,dandc,https://www.democratandchronicle.com/story/news/2019/02/10/shamrocks-irish-pub-henrietta-park-point-brawl-fight-rit-stabbing-firefighters-hospital/2830703002/,"
            Published 6:13 p.m. ET Feb. 10, 2019 | Updated 4:01 p.m. ET Feb. 11, 2019",1,Schramrocks Irish Pub at Park Point at RIT in Henrietta. (Photo: Provided by Andrew Gustavson),(Photo: Provided by Andrew Gustavson)
2,dandc,https://www.democratandchronicle.com/story/news/2019/02/10/nicholas-kalpin-killed-snowmobile-crash-adirondacks-lewis-county-hamlin-man/2831352002/,"
            Published 4:33 p.m. ET Feb. 10, 2019 | Updated 12:19 p.m. ET Feb. 17, 2019",1,A snowmobile sits on a snow-covered trail. (Photo: Thinkstock),(Photo: Thinkstock)
3,dandc,https://www.democratandchronicle.com/story/sports/high-school/2019/02/10/section-v-hockey-playoffs-mcquaid-webster-thomas-nab-top-seeds-rochester-ny/2815852002/,"
            Published 4:24 p.m. ET Feb. 10, 2019 | Updated 5:11 p.m. ET Feb. 11, 2019",12,"McQuaid's Zack Allen, second from left, celebrates his goal with teammates during the first period of a regular-season game played at the Rochester Ice Center, Wednesday, Feb. 6, 2019. McQuaid beat Fairport 5-4 in overtime. (Photo: ADRIAN KRAUS)",(Photo: ADRIAN KRAUS)
3,dandc,,,12,"Fairport's Caleb Kaiser, left, shields the puck from McQuaid's Zack Allen during the third period of a regular season game played at the Rochester Ice Center, Wednesday, Feb. 6, 2019.  Kaiser scored the winning goal in Fairport's win over Penfield on Saturday. (Photo: ADRIAN KRAUS)",(Photo: ADRIAN KRAUS)
3,dandc,,,12,"Webster Thomas' Tommy Ammon (19) puts the puck past Churchville-Chili goalie Ethan Breton for the Titans' third goal during a regular season game played at the Scottsville Ice Arena, Tuesday, Jan. 22, 2019. Webster Thomas beat Chuchville-Chili 4-1. (Photo: ADRIAN KRAUS)",(Photo: ADRIAN KRAUS)
3,dandc,,,12,"Fairport's Nick Krug, and Penfield's  Jack Schlifke hug after the Red Raiders and Patriots played to a 2-2 tie in December. Schlifke and Krug are both players to keep an eye on during the Section V Class A Tournament. (Photo: Max Schulte / Rochester Democrat and Chronicle)",(Photo: Max Schulte / Rochester Democrat and Chronicle)
3,dandc,,,12,"Spencerport's AJ Giannavola, left, puts the game-winner past Gates Chili goalie Charles Healey during a regular season game played at Genesee Valley Ice Arena, Tuesday, Dec. 11, 2018. (Photo: ADRIAN KRAUS)",(Photo: ADRIAN KRAUS)
3,dandc,,,12,"Webster Thomas' Spencer Nuccitelli, center, celebrates his first goal with Cullen Hennessy, left, and Zack Wolfe during a regular season game against Chuchville-Chili played at the Scottsville Ice Arena, Tuesday, Jan. 22, 2019. Webster Thomas beat Chuchville-Chili 4-1.",ADRIAN KRAUS
3,dandc,,,12,"Webster Thomas goalie Cody Rougeux, right, pokes the puck away as Matthew Stuewe shields  Churchville-Chili's Dylan Clark off the play during a regular season game played at the Scottsville Ice Arena, Tuesday, Jan. 22, 2019. Webster Thomas beat Chuchville-Chili 4-1.",ADRIAN KRAUS
3,dandc,,,12,"Churchville-Chili's Max Williams, right, is tripped up by Webster Thomas' Teagan Spang during a regular season game played at the Scottsville Ice Arena, Tuesday, Jan. 22, 2019. Webster Thomas beat Chuchville-Chili 4-1.",ADRIAN KRAUS
3,dandc,,,12,"Webster Thomas' Tommy Ammon, right, checks Churchville-Chili's Colin Hess during a regular season game played at the Scottsville Ice Arena, Tuesday, Jan. 22, 2019. Webster Thomas beat Chuchville-Chili 4-1.",ADRIAN KRAUS
3,dandc,,,12,"Webster Thomas' Tommy Ammon (19) puts the puck past Churchville-Chili goalie Ethan Breton for the Titans' third goal during a regular season game played at the Scottsville Ice Arena, Tuesday, Jan. 22, 2019. Webster Thomas beat Chuchville-Chili 4-1.",ADRIAN KRAUS
5,dandc,https://www.democratandchronicle.com/story/news/2019/02/10/cheryl-dinolfo-launches-job-training-program-it-monroe/2830154002/,"
            Published 3:30 p.m. ET Feb. 10, 2019 | Updated 9:37 p.m. ET Feb. 10, 2019",1,Monroe County Executive Cheryl Dinolfo releases the county budget and has a big announcement at the Monroe County Office Building. (Photo: CARLOS ORTIZ/ROCHESTER DEMOCRAT AND CHRONICLE),(Photo: CARLOS ORTIZ/ROCHESTER DEMOCRAT AND CHRONICLE)
8,dandc,https://www.democratandchronicle.com/story/news/2019/02/10/therapy-dog-spencerport-palmyra-macedon-gates-chili/2699133002/,"
            Published 2:15 p.m. ET Feb. 10, 2019 | Updated 10:40 p.m. ET Feb. 11, 2019",10,"Breanna Tamburello, a 17-year-old senior, visits with Ruby, a 4-year-old black Labrador retriever who is the new therapy dog at Spencerport High School. (Photo: SHAWN DOWD/ROCHESTER DEMOCRAT AND CHRONICLE)",(Photo: SHAWN DOWD/ROCHESTER DEMOCRAT AND CHRONICLE)
8,dandc,,,10,"Dominic Mayo, a kindergartner at Neil Armstrong School in Gates, lies on the floor to hug Kelsey, the school's therapy dog, before school starts on the morning of Feb. 4, 2019. (Photo: Georgie Silvarole/Rochester Democrat and Chronicle)",(Photo: Georgie Silvarole/Rochester Democrat and Chronicle)
8,dandc,,,10,"Students stop to pet and visit with Ruby, a 4-year-old black Labrador retriever who is the new therapy dog at Spencerport High School., in the busy hallways between periods Tuesday, Jan. 29, 2019. (Photo: SHAWN DOWD/ROCHESTER DEMOCRAT AND CHRONICLE)",(Photo: SHAWN DOWD/ROCHESTER DEMOCRAT AND CHRONICLE)
8,dandc,,,10,"Dominic Payne, a ninth-grader at Monroe 2 BOCES at Spencerport High, visits with Ruby, a 4-year-old black Labrador retriever who is the new therapy dog at Spencerport High School, as she walks the hallways Tuesday, Jan. 29, 2019. (Photo: SHAWN DOWD/ROCHESTER DEMOCRAT AND CHRONICLE)",(Photo: SHAWN DOWD/ROCHESTER DEMOCRAT AND CHRONICLE)
8,dandc,,,10,"Dominic Payne, a ninth-grader at Monroe 2 BOCES at Spencerport High, visits with Ruby, a 4-year-old black Labrador retriever who is the new therapy dog at Spencerport High School, as she walks the hallways Tuesday, Jan. 29, 2019.",SHAWN DOWD/ROCHESTER DEMOCRAT AND CHRONICLE
8,dandc,,,10,"Sophia Cruz, a first-grader at Neil Armstrong School in Gates, greets Kelsey on her way into school on Monday, Feb. 4, 2019. Kelsey, a Newfoundland, serves as the school's certified therapy dog and works with school social worker Chris Magee.",Georgie Silvarole/Rochester Democrat and Chronicle
8,dandc,,,10,"Breanna Tamburello, 17, a senior, visits with Ruby, a 4-year-old black Lab who is the new therapy dog at Spencerport High School, on Tuesday, Jan. 29, 2019.",SHAWN DOWD/ROCHESTER DEMOCRAT AND CHRONICLE
8,dandc,,,10,"Katie, one of three certified therapy dogs owned by Jill Davis, a vocal music teacher at Palmyra-Macedon High School, comforts a student at school.",Provided
8,dandc,,,10,"Katie, one of three certified therapy dogs owned by Jill Davis, a vocal music teacher at Palmyra-Macedon High School, comforts a student at school.",Provided
8,dandc,,,10,"Dominic Mayo, a kindergartner at Neil Armstrong School in Gates, lies on the floor to hug Kelsey, the school's therapy dog, before school starts on the morning of Feb. 4, 2019.",Georgie Silvarole/Rochester Democrat and Chronicle
11,dandc,https://www.democratandchronicle.com/story/news/2019/02/10/greenlight-expands-webster-irondequoit-coverage-doubles-staff/2801077002/,"
            Published 12:38 p.m. ET Feb. 10, 2019 | Updated 5:56 p.m. ET Feb. 10, 2019",2,Updated maps show where Greenlight Networks is available and/or under construction as of February 2019. (Photo: Provided),(Photo: Provided)
11,dandc,,,2,Updated maps show where Greenlight Networks is available and/or under construction as of February 2019. (Photo: Provided),(Photo: Provided)
12,dandc,https://www.democratandchronicle.com/story/news/2019/02/10/polar-plunge-rochester-2019-special-olympics-fundraiser/2830182002/,"
            Published 12:17 p.m. ET Feb. 10, 2019 | Updated 4:44 p.m. ET Feb. 10, 2019",10,"Joel McFarland, of Penfield, goes airborne as he jumps into Lake Ontario. McFarland was part of 2,000 people who took part int the annual Polar Plunge which raised more than $250,000 for Special Olympics of New York.",JAMIE GERMANO/ROCHESTER DEMOCRAT AND CHRONICLE
12,dandc,,,10,"More than 2,000 people took part in the annual Polar Plunge at Charlotte Beach.  This year's plunge raised more that $250,000 for Special Olympics of New York.",JAMIE GERMANO/ROCHESTER DEMOCRAT AND CHRONICLE
12,dandc,,,10,Plungers exit the frigid waters of Lake Ontario after taking part in the Polar Plunge.,JAMIE GERMANO/ROCHESTER DEMOCRAT AND CHRONICLE
12,dandc,,,10,Rochester Police Deputy Chief LaRon Singletary carries the torch at the start of the annual Polar Plunge at Charlotte Beach.,JAMIE GERMANO/ROCHESTER DEMOCRAT AND CHRONICLE
12,dandc,,,10,Marcia Catallo (left) and Provie Morris make their way out of the frigid waters of Lake Ontario as part of the annual Polar Plunge.,JAMIE GERMANO/ROCHESTER DEMOCRAT AND CHRONICLE
12,dandc,,,10,"Some of the 2,000 people who took the plunge into Lake Ontario as part of the annual Polar Plunge.  The event raised more than $250,000 for Special Olympics of New York.",JAMIE GERMANO/ROCHESTER DEMOCRAT AND CHRONICLE
12,dandc,,,10,"Some of the 2,000 people who took the plunge into Lake Ontario as part of the annual Polar Plunge.  The event raised more than $250,000 for Special Olympics of New York.",JAMIE GERMANO/ROCHESTER DEMOCRAT AND CHRONICLE
12,dandc,,,10,"Some of the 2,000 people who took the plunge into Lake Ontario as part of the annual Polar Plunge.  The event raised more than $250,000 for Special Olympics of New York.",JAMIE GERMANO/ROCHESTER DEMOCRAT AND CHRONICLE
12,dandc,,,10,"Some of the 2,000 people who took the plunge into Lake Ontario as part of the annual Polar Plunge.  The event raised more than $250,000 for Special Olympics of New York.",JAMIE GERMANO/ROCHESTER DEMOCRAT AND CHRONICLE
12,dandc,,,10,"Some of the 2,000 people who took the plunge into Lake Ontario as part of the annual Polar Plunge.  The event raised more than $250,000 for Special Olympics of New York.",JAMIE GERMANO/ROCHESTER DEMOCRAT AND CHRONICLE
13,dandc,https://www.democratandchronicle.com/story/news/2019/02/10/valerie-reyes-feared-death-body-found-suitcase/2830111002/,"
            Published 11:36 a.m. ET Feb. 10, 2019
        ",10,"Valerie Reyes' mother, Norma Sanchez of New Rochelle, hugs a visitor at her New Rochelle home Feb. 7, 2019. Reyes dead body was found in Greenwich, Conn. Feb, 5. (Photo: Peter Carr/The Journal News)",(Photo: Peter Carr/The Journal News)
13,dandc,,,10,"Vigil for Valerie Reyes at Glen Island Park in New Rochelle Feb. 7, 2019. Reyes body was found in Greenwich, Conn. Feb, 5. (Photo: Peter Carr/The Journal News)",(Photo: Peter Carr/The Journal News)
13,dandc,,,10,"Mourners arrive at Lloyd Macy & Sons Beauchamp Chapel in New Rochelle Feb.. 12, 2019 to attend a wake for New Rochelle resident Valerie Reyes, whose body was found in a suitcase in Greenwich, Ct. last week.",Seth Harrison/The Journal News
13,dandc,,,10,"Mourners arrive at Lloyd Macy & Sons Beauchamp Chapel in New Rochelle Feb.. 12, 2019 to attend a wake for New Rochelle resident Valerie Reyes, whose body was found in a suitcase in Greenwich, Ct. last week.",Seth Harrison/The Journal News
13,dandc,,,10,"Mourners arrive at Lloyd Macy & Sons Beauchamp Chapel in New Rochelle Feb.. 12, 2019 to attend a wake for New Rochelle resident Valerie Reyes, whose body was found in a suitcase in Greenwich, Ct. last week.",Seth Harrison/The Journal News
13,dandc,,,10,"Mourners arrive at Lloyd Macy & Sons Beauchamp Chapel in New Rochelle Feb.. 12, 2019 to attend a wake for New Rochelle resident Valerie Reyes, whose body was found in a suitcase in Greenwich, Ct. last week.",Seth Harrison/The Journal News
13,dandc,,,10,"Norma Sanchez of New Rochelle, center left, at a vigil for her daughter, Valerie Reyes at Glen Island Park in New Rochelle Feb. 7, 2019. Reyes body was found in Greenwich, Conn. Feb, 5.",Peter Carr/The Journal News
13,dandc,,,10,"Candlelight vigil for Valerie Reyes at Glen Island Park in New Rochelle Feb. 7, 2019. Reyes body was found in Greenwich, Conn. Feb, 5.",Peter Carr/The Journal News
13,dandc,,,10,"Candlelight vigil for Valerie Reyes at Glen Island Park in New Rochelle Feb. 7, 2019. Reyes body was found in Greenwich, Conn. Feb, 5.",Peter Carr/The Journal News
13,dandc,,,10,"Candlelight vigil for Valerie Reyes at Glen Island Park in New Rochelle Feb. 7, 2019. Reyes body was found in Greenwich, Conn. Feb, 5.",Peter Carr/The Journal News
14,dandc,https://www.democratandchronicle.com/story/lifestyle/rocflavors/2019/02/10/rochester-wine-festival-offers-apology-refunds-2019-event/2829928002/,"
            Published 10:32 a.m. ET Feb. 10, 2019 | Updated 5:55 p.m. ET Feb. 10, 2019",1,Some patrons are complaining of long lines and little wine at Friday's Rochester Wine Festival. (Photo: Provided photo),(Photo: Provided photo)
15,dandc,https://www.usatoday.com/story/news/nation/2019/02/09/jeff-bezos-blackmail-ami-national-enquirer-parent-go-under/2811938002/,"
            Published 6:00 a.m. ET Feb. 9, 2019 | Updated 12:21 p.m. ET Feb. 9, 2019",10,"A copy of the National Enquirer is seen at a newspaper vendor's shop on Third Avenue in midtown New York City Friday alongside other titles by AMI, the tabloid publisher at the heart of growing scandals involving President Donald Trump and Amazon founder Jeff Bezos. (Photo: TIMOTHY A. CLARY, AFP/Getty Images)","(Photo: TIMOTHY A. CLARY, AFP/Getty Images)"
15,dandc,,,10,"The front page of the Jan. 28, 2019, edition of the National Enquirer featuring a story about Amazon founder and CEO Jeff Bezos' divorce. (Photo: AP)",(Photo: AP)
15,dandc,,,10,Amazon founder and chief executive Jeff Bezos.,"2012 photo by Joe Klamar, AFP/Getty Images"
15,dandc,,,10,"Amazon.com founder and CEO Jeff Bezos holds a copy of ""Fluid Concepts and Creative Analogies"" by Douglas Hofstadter -- the first book sold online by Amazon.com -- as he poses for photos at the company's headquarters in Seattle on June 17, 2005.  Amazon launched at the dawn of the Web as an online bookseller on July 16, 1995.","Ted S. Warren, AP"
15,dandc,,,10,"Jeff Bezos and MacKenzie Bezos attend the 2018 Vanity Fair Oscar Party  on March 4, 2018 in Beverly Hills, Calif.","Dia Dipasupil, Getty Images"
15,dandc,,,10,"Jeff Bezos and his wife MacKenzie Bezos approached the National Cathedral in Washington for a memorial service for John McCain on Sept. 1, 2018.","Jasper Colt, USA TODAY"
15,dandc,,,10,"(L-R) Washington Post reporter and former Tehran bureau chief Jason Rezaian, U.S. Secretary of State John Kerry, Amazon founder and Washington Post owner Jeff Bezos and his wife MacKenzie Bezos participate in the opening ceremony of the newspaper's new location Jan. 28, 2016 in Washington, DC. Kerry and Bezos worked to help free Rezaian after he spent 18 months in an Iranian prison after he was jailed and tried in secret for espionage.","Chip Somodevilla, Getty Images"
15,dandc,,,10,"Jeff Bezos (R) speaks with Leonard Garfield, Executive Director of the Museum of History and Industry (MOHAI), during a launch event for the Bezos Center for Innovation at MOHAI on October 11, 2013 in Seattle, Washington. Supported by Jeff and MacKenzie Bezos, the center aims to highlight the history and future of innovation in the Puget Sound region.","David Ryder, Getty Images"
15,dandc,,,10,"Jeff Bezos, founder and CEO of Amazon, demonstrates a cordless power drill and reciprocating saw as he wears a Western-style hard hat at a New York news conference on Nov. 9, 1999.  Amazon added home improvement goods, computer software and a wider array of video games to its Web site in a move by the Internet merchant to build itself into an online superstore.","Richard Drew, AP"
15,dandc,,,10,"Jeff Bezos, founder and CEO of Amazon.com, Inc., appears on the cover of the December 1999, issue of Time magazine as the magazine's ""Person of the Year"" for 1999. ""There were two great themes of the year, online shopping and dot-com mania, and the minute we thought of Bezos it was obvious that he embodied both"" the magazine wrote.",Courtesy of TIME Magazine via newsmakers
16,dandc,https://www.democratandchronicle.com/story/sports/college/2019/02/09/buffalo-bills-ranked-23-defeat-central-michigan-jeremy-harris-cj-massinburg-injured-shoulder/2828035002/,"
            Published 11:52 p.m. ET Feb. 9, 2019 | Updated 11:52 p.m. ET Feb. 9, 2019",1,"Buffalo's Nick Perkins, top, dunks against Central Michigan during the second half of an NCAA college basketball game in Buffalo, N.Y., Saturday, Feb. 9, 2019. (AP Photo/Heather Ainsworth) (Photo: Heather Ainsworth, AP)","(Photo: Heather Ainsworth, AP)"
17,dandc,https://www.democratandchronicle.com/story/sports/high-school/2019/02/09/section-v-scores-saturday-feb-9-basketball-hockey-more-rochester-ny/2823647002/,"
            Published 11:34 p.m. ET Feb. 9, 2019 | Updated 4:46 p.m. ET Feb. 10, 2019",11,"Hilton's Gregor McNeil, right, goes for the pin on Casper Stewart, Attica/Batavia, in their Division 1 99 pound match at the 52nd Annual State Wrestling Qualifier at the College at Brockport Saturday, Feb. 9, 2019.",SHAWN DOWD/ROCHESTER DEMOCRAT AN
17,dandc,,,11,"Spencerport's Mason Wersinger, celebrates his win over Nick Sanko, Pittsford, in their Division 1, 138 pound match at the 52nd Annual State Wrestling Qualifier at the College at Brockport Saturday, Feb. 9, 2019.",SHAWN DOWD/ROCHESTER DEMOCRAT AN
17,dandc,,,11,"Hilton's Gregor McNeil, right, takes down Casper Stewart, Attica/Batavia, in their Division 1 99 pound match at the 52nd Annual State Wrestling Qualifier at the College at Brockport Saturday, Feb. 9, 2019.",SHAWN DOWD/ROCHESTER DEMOCRAT AN
17,dandc,,,11,"Pal-Mac's Jace Schafer, top right, ties up Braidon Woodward, Canisteo-Greenwood, in their Division 2, 99 pound match at the 52nd Annual State Wrestling Qualifier at the College at Brockport Saturday, Feb. 9, 2019.",SHAWN DOWD/ROCHESTER DEMOCRAT AN
17,dandc,,,11,"Pal-Mac's Jace Schafer, takes the win over Braidon Woodward, Canisteo-Greenwood, in their Division 2, 99 pound match at the 52nd Annual State Wrestling Qualifier at the College at Brockport Saturday, Feb. 9, 2019.",SHAWN DOWD/ROCHESTER DEMOCRAT AN
17,dandc,,,11,"Hilton's Rocco Camillaci, bottom left, shoots in on Joe Berenson, Webster Schroeder, in their Division 1, 106 pound match at the 52nd Annual State Wrestling Qualifier at the College at Brockport Saturday, Feb. 9, 2019.",SHAWN DOWD/ROCHESTER DEMOCRAT AN
17,dandc,,,11,"Hilton's Rocco Camillaci, top, pins Joe Berenson, Webster Schroeder, in their Division 1, 106 pound match at the 52nd Annual State Wrestling Qualifier at the College at Brockport Saturday, Feb. 9, 2019.",SHAWN DOWD/ROCHESTER DEMOCRAT AN
17,dandc,,,11,"Warsaw's Muskan Monger, left, lifts Nicholas Noto, Honeoye Falls-Lima, off his feet in their Division 2, 106 pound match at the 52nd Annual State Wrestling Qualifier at the College at Brockport Saturday, Feb. 9, 2019.",SHAWN DOWD/ROCHESTER DEMOCRAT AN
17,dandc,,,11,"Warsaw's Muskan Monger celebrates his win over Nicholas Noto, Honeoye Falls-Lima, in their Division 2, 106 pound match at the 52nd Annual State Wrestling Qualifier at the College at Brockport Saturday, Feb. 9, 2019.",SHAWN DOWD/ROCHESTER DEMOCRAT AN
17,dandc,,,11,"Hilton's Greg Diakomihalis, top right, takes down Brandon Callaghan, Greece, in their Division 1, 113 pound match at the 52nd Annual State Wrestling Qualifier at the College at Brockport Saturday, Feb. 9, 2019.",SHAWN DOWD/ROCHESTER DEMOCRAT AN
18,dandc,https://www.democratandchronicle.com/story/sports/high-school/2019/02/09/section-v-wrestling-supersectionals-greg-diakomihalis-sam-deprez-mason-wersinger/2792711002/,"
            Published 10:16 p.m. ET Feb. 9, 2019 | Updated 6:01 p.m. ET Feb. 21, 2019",10,"Hilton's Greg Diakomihalis, top right, takes down Brandon Callaghan, Greece, in their Division 1, 113 pound match at the 52nd Annual State Wrestling Qualifier at the College at Brockport Saturday, Feb. 9, 2019.  (Photo: SHAWN DOWD/ROCHESTER DEMOCRAT AN)",(Photo: SHAWN DOWD/ROCHESTER DEMOCRAT AN)
18,dandc,,,10,Warsaw senior Sam Wolf (Photo: JAMES JOHNSON/ROCHESTER DEMOCRAT AND CHRONICLE),(Photo: JAMES JOHNSON/ROCHESTER DEMOCRAT AND CHRONICLE)
18,dandc,,,10,"Honeoye Falls-Lima's Anthony Noto, top left, spins behind and takes down Bryson Terwilliger, Canisteo-Greenwood, in their Division 2, 113 pound match at the 52nd Annual State Wrestling Qualifier at the College at Brockport Saturday, Feb. 9, 2019.  (Photo: SHAWN DOWD/ROCHESTER DEMOCRAT AN)",(Photo: SHAWN DOWD/ROCHESTER DEMOCRAT AN)
18,dandc,,,10,"Spencerport's Mason Wersinger, celebrates his win over Nick Sanko, Pittsford, in their Division 1, 138 pound match at the 52nd Annual State Wrestling Qualifier at the College at Brockport Saturday, Feb. 9, 2019.  (Photo: SHAWN DOWD/ROCHESTER DEMOCRAT AN)",(Photo: SHAWN DOWD/ROCHESTER DEMOCRAT AN)
18,dandc,,,10,"Honeoye Falls-Lima's Anthony Noto, gets the victory over Bryson Terwilliger, Canisteo-Greenwood, in their Division 2, 113 pound match at the 52nd Annual State Wrestling Qualifier at the College at Brockport Saturday, Feb. 9, 2019.  (Photo: SHAWN DOWD/ROCHESTER DEMOCRAT AN)",(Photo: SHAWN DOWD/ROCHESTER DEMOCRAT AN)
18,dandc,,,10,"Colton Crane, Gates Chili's 285-pound wrestler (Photo: JAMES JOHNSON/ROCHESTER DEMOCRAT AND CHRONICLE)",(Photo: JAMES JOHNSON/ROCHESTER DEMOCRAT AND CHRONICLE)
18,dandc,,,10,"Hilton's Gregor McNeil, right, goes for the pin on Casper Stewart, Attica/Batavia, in their Division 1 99 pound match at the 52nd Annual State Wrestling Qualifier at the College at Brockport Saturday, Feb. 9, 2019.",SHAWN DOWD/ROCHESTER DEMOCRAT AN
18,dandc,,,10,"Spencerport's Mason Wersinger, celebrates his win over Nick Sanko, Pittsford, in their Division 1, 138 pound match at the 52nd Annual State Wrestling Qualifier at the College at Brockport Saturday, Feb. 9, 2019.",SHAWN DOWD/ROCHESTER DEMOCRAT AN
18,dandc,,,10,"Hilton's Gregor McNeil, right, takes down Casper Stewart, Attica/Batavia, in their Division 1 99 pound match at the 52nd Annual State Wrestling Qualifier at the College at Brockport Saturday, Feb. 9, 2019.",SHAWN DOWD/ROCHESTER DEMOCRAT AN
18,dandc,,,10,"Pal-Mac's Jace Schafer, top right, ties up Braidon Woodward, Canisteo-Greenwood, in their Division 2, 99 pound match at the 52nd Annual State Wrestling Qualifier at the College at Brockport Saturday, Feb. 9, 2019.",SHAWN DOWD/ROCHESTER DEMOCRAT AN
20,dandc,https://www.democratandchronicle.com/story/sports/college/2019/02/09/buddy-boeheim-jim-coach-son-syracuse-orange-boston-college-win-67-56/2827870002/,"
            Published 9:48 p.m. ET Feb. 9, 2019
        ",3,"Syracuse's Oshae Brissett, left, and Buddy Boeheim, right, talk during a timeout during the second half of an NCAA college basketball game against Boston College in Syracuse, N.Y., Saturday, Feb. 9, 2019. Syracuse won 67-56. (Photo: Nick Lisi, AP)","(Photo: Nick Lisi, AP)"
20,dandc,,,3,"Syracuse's Tyus Battle celebrates after scoring a basket during the second half of an NCAA college basketball game against Boston College in Syracuse, N.Y., Saturday, Feb. 9, 2019. Syracuse won 67-56. (Photo: Nick Lisi, AP)","(Photo: Nick Lisi, AP)"
20,dandc,,,3,"Syracuse head coach Jim Boeheim yells to his players during the second half of an NCAA college basketball game against Boston College in Syracuse, N.Y., Saturday, Feb. 9, 2019. Syracuse won 67-56. (Photo: Nick Lisi, AP)","(Photo: Nick Lisi, AP)"
22,dandc,https://www.democratandchronicle.com/story/news/2019/02/09/monroe-county-ny-crime-rochester-suburban-blotter-police-chili-greece-henrietta-irondequoit/2796508002/,"
            Published 6:47 p.m. ET Feb. 9, 2019 | Updated 7:27 p.m. ET Feb. 9, 2019",0,NA,NA
23,dandc,https://www.democratandchronicle.com/story/news/2019/02/09/shooting-rochester-ny-crime-homicide-beechwood-neighborhood-webster-avenue-shafer-street/2825115002/,"
            Published 5:28 p.m. ET Feb. 9, 2019 | Updated 8:45 p.m. ET Feb. 10, 2019",3,"The Rochester Police Department K-9 unit on the scene of a homicide at Webster Avenue and Shafer Street on Feb. 9, 2019. (Photo: Will Cleveland/Rochester Democrat and Chronicle)",(Photo: Will Cleveland/Rochester Democrat and Chronicle)
23,dandc,,,3,"The Rochester Police Department's mobile command unit on scene following a homicide on Webster Avenue on Feb. 9, 2019. (Photo: Will Cleveland/Democrat and Chronicle)",(Photo: Will Cleveland/Democrat and Chronicle)
23,dandc,,,3,"One person is dead after a shooting on Webster Avenue and Shafer Street on Feb. 9, 2019. (Photo: Will Cleveland/Rochester Democrat and Chronicle)",(Photo: Will Cleveland/Rochester Democrat and Chronicle)
24,dandc,https://www.democratandchronicle.com/story/news/2019/02/09/adam-bello-holds-official-kickoff-county-executives-race/2823407002/,"
            Published 3:15 p.m. ET Feb. 9, 2019 | Updated 7:23 p.m. ET Feb. 9, 2019",2,Monroe County Clerk Adam Bello. (Photo: Provided),(Photo: Provided)
24,dandc,,,2,Monroe County Executive Cheryl Dinolfo releases the county budget and has a big announcement at the Monroe County Office Building. (Photo: CARLOS ORTIZ/ROCHESTER DEMOCRAT AND CHRONICLE),(Photo: CARLOS ORTIZ/ROCHESTER DEMOCRAT AND CHRONICLE)
27,dandc,https://www.democratandchronicle.com/story/news/2019/02/09/rochester-wine-festival-refunds-demanded-convention-center/2822229002/,"
            Published 10:34 a.m. ET Feb. 9, 2019 | Updated 10:40 a.m. ET Feb. 10, 2019",1,Some patrons are complaining of long lines and little wine at Friday's Rochester Wine Festival. (Photo: Provided photo),(Photo: Provided photo)
