1094745470998503425,14307764,351,114944,365,725,78609,2008-04-05 01:46:58,1,1,2019-02-10 23:50:34,Paramedics' truck and Chevy collide near New Castle https://t.co/DaBZh2vfbC https://t.co/jzCGVq6Gml
1094730762518093824,14307764,351,114944,365,725,78609,2008-04-05 01:46:58,0,2,2019-02-10 22:52:07,Raw Video: Man airlifted after stabbing in Wilmington https://t.co/XRMDumQdZp https://t.co/xRgtd8Chn8
1094730755832332288,14307764,351,114944,365,725,78609,2008-04-05 01:46:58,0,1,2019-02-10 22:52:05,Philadelphia 76ers vs. Los Angeles Lakers https://t.co/0QcJSwX9q7 https://t.co/kl78aOPNfp
1094723204612943872,14307764,351,114944,365,725,78609,2008-04-05 01:46:58,1,0,2019-02-10 22:22:05,Raw Video: Only minor injuries suffered in rollover wreck in Wilmington https://t.co/R8ZQwRTFF2 https://t.co/nWFNKpg2VF
1094723197331591168,14307764,351,114944,365,725,78609,2008-04-05 01:46:58,0,0,2019-02-10 22:22:03,Police: 23-year-old in critical but stable condition after stabbing in Wilmington https://t.co/7eG2T3vaqN https://t.co/5z3xwhesBN
1094715647982882816,14307764,351,114944,365,725,78609,2008-04-05 01:46:58,6,12,2019-02-10 21:52:03,Over 200 166th Airlift Wing members welcomed home https://t.co/gbWxeJCEcx https://t.co/D3XCeSB1f8
1094700799962169344,14307764,351,114944,365,725,78609,2008-04-05 01:46:58,2,1,2019-02-10 20:53:03,Charges pending against driver after several injured in Wilmington rollover crash https://t.co/H1NRwUMs5p https://t.co/kGlUij712I
1094663048684437504,14307764,351,114944,365,725,78609,2008-04-05 01:46:58,0,1,2019-02-10 18:23:03,Family of four sent to the hospital after a camper fire near Ellendale https://t.co/eSsH2J0jm3 https://t.co/iKmGknTUl3
1094655503198650369,14307764,351,114944,365,725,78609,2008-04-05 01:46:58,3,6,2019-02-10 17:53:04,Winter weather advisory could mean a slippery Monday morning commute for Delaware https://t.co/ymQwtZ1M1u https://t.co/myh3E8djGW
1094632859908751360,14307764,351,114944,365,725,78609,2008-04-05 01:46:58,1,10,2019-02-10 16:23:05,"Dr. Oz mourns death of his father, whose career brought the family to Delaware in the 60s https://t.co/7sFHeJUQ8V https://t.co/kUp9qP2KIw"
1094588563134459904,14307764,351,114944,365,725,78609,2008-04-05 01:46:58,0,3,2019-02-10 13:27:04,"Could Amazon's Bezos wreck AMI, owner of National Enquirer, with blackmail charges? https://t.co/NGboAJF7Yw https://t.co/tBvqi6xQeY"
1094566155233054725,14307764,351,114944,365,725,78609,2008-04-05 01:46:58,0,0,2019-02-10 11:58:02,Milford cruises to DII title https://t.co/lV8AFLbxdE
1094558614998532096,14307764,351,114944,365,725,78609,2008-04-05 01:46:58,1,0,2019-02-10 11:28:04,Smyrna holds on for DIAA Division I dual meet team title https://t.co/qUs8k3hSsf
1094558611211079680,14307764,351,114944,365,725,78609,2008-04-05 01:46:58,0,1,2019-02-10 11:28:03,Roundabout planned to ease sluggish traffic north of Middletown https://t.co/i0zXjWfFuD https://t.co/UxapH7q6E3
1094461845866332161,14307764,351,114944,365,725,78609,2008-04-05 01:46:58,0,2,2019-02-10 05:03:32,Several injured in Wilmington rollover crash https://t.co/oeClxoYpyz https://t.co/dx0HKm735K
1094454425316290560,14307764,351,114944,365,725,78609,2008-04-05 01:46:58,0,4,2019-02-10 04:34:03,"This time, halftime lead doesn't end up haunting University of Delaware https://t.co/Oh4YGykJIl https://t.co/EvxzoBxN1s"
1094446887371866112,14307764,351,114944,365,725,78609,2008-04-05 01:46:58,0,3,2019-02-10 04:04:06,"This time, Delaware builds off halftime lead https://t.co/8wpnuFAj4J https://t.co/iOKm1Je6OA"
1094446879721619457,14307764,351,114944,365,725,78609,2008-04-05 01:46:58,0,3,2019-02-10 04:04:04,Delaware survives UNCW rally https://t.co/IQBJuFzpEn https://t.co/rUSxgsPTq6
1094402334623379456,14307764,351,114944,365,725,78609,2008-04-05 01:46:58,0,2,2019-02-10 01:07:04,Smyrna wins fifth Division I Dual Team wrestling title https://t.co/ghUte0hNOB https://t.co/udfANMlRPr
1094402330940760064,14307764,351,114944,365,725,78609,2008-04-05 01:46:58,0,0,2019-02-10 01:07:03,Stumpy’s Hatchet House in Middletown holds 'Social Throwdown' https://t.co/F29velxYCI https://t.co/rwXniwQ6kA
1094396782149279744,14307764,351,114944,365,725,78609,2008-04-05 01:46:58,0,1,2019-02-10 00:45:00,"This dual swung back and forth all the way, with the lead changing nine times. https://t.co/bap6j7GLLo #delhs"
1094394659483209734,14307764,351,114944,365,725,78609,2008-04-05 01:46:58,0,3,2019-02-10 00:36:34,Smyrna holds off Caesar Rodney for DIAA Division I team wrestling title https://t.co/YFPq4Fdn9Y https://t.co/ifHXdStWOs
1094387109081694210,14307764,351,114944,365,725,78609,2008-04-05 01:46:58,1,3,2019-02-10 00:06:34,Milford adds to — but also closes — DIAA Division II wrestling dynasty https://t.co/V1IcyCWjVh https://t.co/B1A4XBgl5v
1094385847875575808,14307764,351,114944,365,725,78609,2008-04-05 01:46:58,2,5,2019-02-10 00:01:33,The Bucs' sixth straight Division II wrestling title comes before their move up to Division I. https://t.co/EqDAhpiwUz #delhs
1094379435753582592,14307764,351,114944,365,725,78609,2008-04-05 01:46:58,1,4,2019-02-09 23:36:04,Milford wins sixth straight Division II wrestling title https://t.co/hlgNccuTBN https://t.co/h8zjSURNU1
1094327085139542016,14307764,351,114944,365,725,78609,2008-04-05 01:46:58,0,3,2019-02-09 20:08:03,Spartans end nine years of frustration against Sals https://t.co/zRIMDCptgI https://t.co/iLAwvdxOmf
1094297146465996801,14307764,351,114944,365,725,78609,2008-04-05 01:46:58,0,4,2019-02-09 18:09:05,'This is the fight of our lives': Elizabeth Warren officially announces 2020 bid https://t.co/5T4N12Zduu https://t.co/zILIthLGrp
1094297140296175618,14307764,351,114944,365,725,78609,2008-04-05 01:46:58,0,0,2019-02-09 18:09:03,State police: stolen car used to hit trooper Friday https://t.co/CNfJKOHn4e https://t.co/4azuaW0XBB
1094289492414935040,14307764,351,114944,365,725,78609,2008-04-05 01:46:58,0,0,2019-02-09 17:38:40,"52-year-old man shot in Wilmington Friday night, police say https://t.co/VyNbvWc74J https://t.co/DCtPPnD6px"
1094289483455856640,14307764,351,114944,365,725,78609,2008-04-05 01:46:58,0,2,2019-02-09 17:38:38,More states adopting gun-seizure laws after Parkland tragedy https://t.co/He4lmIcoLp https://t.co/ECFnm4Tzkr
1094289476442976256,14307764,351,114944,365,725,78609,2008-04-05 01:46:58,0,0,2019-02-09 17:38:36,Bridgeton woman charged with killing her 2-year-old son https://t.co/ZhhVD4gRJv https://t.co/vr2pyqjO55
1094289469576900608,14307764,351,114944,365,725,78609,2008-04-05 01:46:58,1,2,2019-02-09 17:38:35,"AAF: New pro football league, the Alliance of American Football, kicks off Saturday https://t.co/eWUEBjCCeS https://t.co/8YJ43m7CWU"
1094259771954233345,14307764,351,114944,365,725,78609,2008-04-05 01:46:58,2,14,2019-02-09 15:40:34,'Keep fighting the bad guys': Girl battling cancer with no cure made honorary police officer https://t.co/hGYIXmccwN https://t.co/EdAiz8WHvL
1094252353828544512,14307764,351,114944,365,725,78609,2008-04-05 01:46:58,1,1,2019-02-09 15:11:06,"Virginia black caucus, Dem lawmakers call for Justin Fairfax to step down after new sexual assault accusation… https://t.co/5ddf7j6kYQ"
1094252345590833153,14307764,351,114944,365,725,78609,2008-04-05 01:46:58,0,1,2019-02-09 15:11:04,"After fleeing violence at home, migrants wait patiently at Texas border to enter U.S. https://t.co/aJzJwGQmU2 https://t.co/PWzBwBZ1ne"
1094204264694669313,14307764,351,114944,365,725,78609,2008-04-05 01:46:58,0,7,2019-02-09 12:00:00,"R.I.P., Bubba. 😢 https://t.co/GcMAU9PnKG"
1094148412411277319,14307764,351,114944,365,725,78609,2008-04-05 01:46:58,9,40,2019-02-09 08:18:04,"St. Mark's breaks 9-year losing streak to Sals, Unlocke the Light inaugurates tourney https://t.co/ka0JJR1U0T https://t.co/ifwr2LdDOf"
1094148407327739906,14307764,351,114944,365,725,78609,2008-04-05 01:46:58,0,0,2019-02-09 08:18:03,Ursuline girls prevail in SL24 Memorial Classic https://t.co/ksmsaB4XYx https://t.co/ZEULsLFC4p
1094141111679893506,14307764,351,114944,365,725,78609,2008-04-05 01:46:58,4,10,2019-02-09 07:49:03,St. Mark's basketball ends nine-year losing streak against Salesianum https://t.co/9yZQqXVtT4 https://t.co/WYduHQVCJ9
1094096313380028416,14307764,351,114944,365,725,78609,2008-04-05 01:46:58,3,10,2019-02-09 04:51:03,Spartans beat Sals for first time since 2010 https://t.co/YTJLKBdZng https://t.co/BMafeo5A7f
1094081094222196736,14307764,351,114944,365,725,78609,2008-04-05 01:46:58,2,20,2019-02-09 03:50:34,"Spartans rush court, party like it's 2010 https://t.co/b6GP02fBg6 https://t.co/jSiGSil9x3"
1094081087184105474,14307764,351,114944,365,725,78609,2008-04-05 01:46:58,0,0,2019-02-09 03:50:32,Dover man accused of raping a sleeping teen pleads no contest https://t.co/O3AdXj1zLc https://t.co/p2R1cp4z3h
1094073421397282816,14307764,351,114944,365,725,78609,2008-04-05 01:46:58,1,3,2019-02-09 03:20:05,Clydesdale horse that Delaware City firefighters rescued twice dies from injuries https://t.co/17LUbQ6hZC https://t.co/UIVhkeeN18
1094068391269330944,14307764,351,114944,365,725,78609,2008-04-05 01:46:58,1,2,2019-02-09 03:00:05,"A 10-year-old boy and a 39-year-old woman escaped this fire by jumping from a second-floor bedroom, authorities sai… https://t.co/nNvKEiSFFX"
1094053282484576256,14307764,351,114944,365,725,78609,2008-04-05 01:46:58,1,1,2019-02-09 02:00:03,Ken Fontal was a championship runner at @wilmu as well as at Newark High School. https://t.co/hECCchZXxV
1094051268132188160,14307764,351,114944,365,725,78609,2008-04-05 01:46:58,2,0,2019-02-09 01:52:03,70-year-old man killed in Milton fire identified https://t.co/pLX4QYjHZ1 https://t.co/vu6H9pZUr7
1094043718603071489,14307764,351,114944,365,725,78609,2008-04-05 01:46:58,0,0,2019-02-09 01:22:03,"Man struck, killed while jogging in Newark was former Wilmington University runner https://t.co/tGxmy3r38g https://t.co/AabyDjlKJy"
1094036420346339329,14307764,351,114944,365,725,78609,2008-04-05 01:46:58,1,1,2019-02-09 00:53:03,Patrolling Wilmington police officers see man fire gun into air in West Center City https://t.co/airhABR1Pf https://t.co/CLluDT5Skn
1094021322798129152,14307764,351,114944,365,725,78609,2008-04-05 01:46:58,4,4,2019-02-08 23:53:03,"Man pointed gun at tenants, drank beer during entire 4-hour standoff with police, according to court documents… https://t.co/G9cBcrzHGY"
1094016242812375041,14307764,351,114944,365,725,78609,2008-04-05 01:46:58,1,0,2019-02-08 23:32:52,"This landlord was ""extremely intoxicated,"" according to court documents. https://t.co/f3qAsDbyxh"
1093991511069323265,14307764,351,114944,365,725,78609,2008-04-05 01:46:58,1,2,2019-02-08 21:54:36,"Double drug busts net $150,000 seized in Bear and Dover https://t.co/GJmGZtG6XA https://t.co/DKwSlULUgv"
1093991502240313344,14307764,351,114944,365,725,78609,2008-04-05 01:46:58,0,0,2019-02-08 21:54:34,Wilmington City Council to hold interviews for vacant seat https://t.co/cPgBv6dww1 https://t.co/BVD5oud3Ie
1093984077026226177,14307764,351,114944,365,725,78609,2008-04-05 01:46:58,0,1,2019-02-08 21:25:03,17-year-old boy accidentally shoots himself in Wilmington's Riverside neighborhood https://t.co/oXKk8QS00r https://t.co/feEWTb8klK
1093976152241143813,14307764,351,114944,365,725,78609,2008-04-05 01:46:58,1,1,2019-02-08 20:53:34,Milford poised to become Delaware's next boom town https://t.co/WZi94AR3fo https://t.co/N0fvXwTIWk
1093968604687523842,14307764,351,114944,365,725,78609,2008-04-05 01:46:58,0,0,2019-02-08 20:23:34,"Hospital, wellness center highlight growth in Milford https://t.co/RoJMZEHujM https://t.co/5aFjSwYJHP"
1093961462622482432,14307764,351,114944,365,725,78609,2008-04-05 01:46:58,0,0,2019-02-08 19:55:12,Delaware Today owner sues maker of commemorative plaques https://t.co/BCT7sBmep3
1093961459220963328,14307764,351,114944,365,725,78609,2008-04-05 01:46:58,0,0,2019-02-08 19:55:11,"Resident, 2 firefighters hurt in Milford home fire https://t.co/Nd0edJ9mJ2 https://t.co/l4ApeYLcDY"
1093961451776049152,14307764,351,114944,365,725,78609,2008-04-05 01:46:58,0,0,2019-02-08 19:55:09,Appoquinimink jumper Phoenix wins Delaware Online Athlete of the Week vote https://t.co/pZ9LtFt23B https://t.co/O6LTwQZeJl
1093961443123257344,14307764,351,114944,365,725,78609,2008-04-05 01:46:58,0,0,2019-02-08 19:55:07,'FBI' star Zeeko Zaki has lots of ties to Delaware https://t.co/kwGzU8AZPa https://t.co/bnsYj4Hhuk
1093961434113794048,14307764,351,114944,365,725,78609,2008-04-05 01:46:58,0,0,2019-02-08 19:55:05,Need a unique Valentine's gift? Try the naming rights to an Assateague Island foal https://t.co/PDGXilxI6p https://t.co/indprMo8IB
1093953640195252224,14307764,351,114944,365,725,78609,2008-04-05 01:46:58,2,1,2019-02-08 19:24:07,Newport police chief scheduled to plea in case involving crash coverup accusation https://t.co/4kvCsWGb3y https://t.co/cVQ5Z3ZYei
1093946239337426945,14307764,351,114944,365,725,78609,2008-04-05 01:46:58,0,0,2019-02-08 18:54:42,"Two charged for crack, marijuana in Dover https://t.co/hc5cwciNjQ https://t.co/kIUpaXNp9l"
1093946232559435776,14307764,351,114944,365,725,78609,2008-04-05 01:46:58,0,0,2019-02-08 18:54:41,Wilmington police arrest man wanted in three states https://t.co/dUVGUJQNvc https://t.co/sGoZTfqYqu
1093946225567485952,14307764,351,114944,365,725,78609,2008-04-05 01:46:58,1,2,2019-02-08 18:54:39,"Glasgow, William Penn basketball game closed to public after fight that brought police https://t.co/Po50sfBY7p https://t.co/IEikxdOM7y"
1093946214452621312,14307764,351,114944,365,725,78609,2008-04-05 01:46:58,2,9,2019-02-08 18:54:36,"Punkin Chunkin lawsuit dismissed, organizers hope to host Delaware event https://t.co/4IwOKW0wND https://t.co/lvq3z4mQOK"
1093946205187432448,14307764,351,114944,365,725,78609,2008-04-05 01:46:58,0,0,2019-02-08 18:54:34,Charged Vaughn inmate 'ashamed' by testimony claiming he cited KKK in attack on Floyd https://t.co/8Rr5AnkHjJ https://t.co/V3S71PCbok
1093930977410244608,14307764,351,114944,365,725,78609,2008-04-05 01:46:58,0,0,2019-02-08 17:54:03,"National Enquirer owner responds to Bezos post, says it 'acted lawfully' in its reporting https://t.co/vuhwOfviUl https://t.co/vSy5jTOGaN"
1093915638089670656,14307764,351,114944,365,725,78609,2008-04-05 01:46:58,1,1,2019-02-08 16:53:06,Where's my paycheck? Wells Fargo customers say direct deposits not showing up after outage https://t.co/pamb40ACVY https://t.co/Iqr0wYRNYU
1093900783886622720,14307764,351,114944,365,725,78609,2008-04-05 01:46:58,0,5,2019-02-08 15:54:05,"Eagles could franchise tag Nick Foles to keep him from Giants, Washington. Should they? https://t.co/aqRYykee2C https://t.co/zeddKACUnU"
1093900779654569984,14307764,351,114944,365,725,78609,2008-04-05 01:46:58,1,0,2019-02-08 15:54:04,Five injured in crash in New Castle County Thursday https://t.co/hQ9eh5JtlF
1093892988802031616,14307764,351,114944,365,725,78609,2008-04-05 01:46:58,0,0,2019-02-08 15:23:06,Your Delaware Weather Forecast for February 8 https://t.co/BKpWrSJt1F https://t.co/qNhVFw6Hwr
1093892982325923840,14307764,351,114944,365,725,78609,2008-04-05 01:46:58,0,0,2019-02-08 15:23:05,Delaware weather forecast: Frosty weekend to follow Friday night cold front https://t.co/2XMDP5Bops https://t.co/S7cUYiWqKJ
1093885708547194886,14307764,351,114944,365,725,78609,2008-04-05 01:46:58,0,0,2019-02-08 14:54:10,Watch live: Acting Attorney General Matthew Whitaker testifies before Congress on Russia probe… https://t.co/Y3jCokoi78
1093885693875474432,14307764,351,114944,365,725,78609,2008-04-05 01:46:58,0,0,2019-02-08 14:54:07,Say 'I love you' by taking your sweetheart to a romantic Delaware-area spot https://t.co/vIEldbQj0m https://t.co/CbyVuVMeo9
1093885681590460417,14307764,351,114944,365,725,78609,2008-04-05 01:46:58,0,0,2019-02-08 14:54:04,Valentine's Day on steroids https://t.co/pmfbWHUljx https://t.co/rxJahJev6y
1093870585996660736,14307764,351,114944,365,725,78609,2008-04-05 01:46:58,1,1,2019-02-08 13:54:05,"Fiesty, feminist Joan of Arc takes center stage at Delaware Theatre Company https://t.co/eG109pz5NL https://t.co/1z0yUOfgoF"
1093863048840769537,14307764,351,114944,365,725,78609,2008-04-05 01:46:58,1,2,2019-02-08 13:24:08,Crash in New Castle County badly injures 5 people https://t.co/eGFzmLBqfV https://t.co/oqCzS4zBNy
1093848312090845185,14307764,351,114944,365,725,78609,2008-04-05 01:46:58,0,3,2019-02-08 12:25:34,Delaware saw lowest number of new HIV infections in two decades in 2018 https://t.co/CJuZ64Bgil https://t.co/5ygs3Nc7U7
1093848304176099328,14307764,351,114944,365,725,78609,2008-04-05 01:46:58,1,2,2019-02-08 12:25:33,Jeff Bezos accuses National Enquirer parent of 'extortion and blackmail' attempt https://t.co/1lUxB0tLFb https://t.co/fLuBK4OPyf
1093841878657703937,14307764,351,114944,365,725,78609,2008-04-05 01:46:58,0,1,2019-02-08 12:00:01,"Having 47 years of experience in correction operations, he said inmates should be separated immediately after a ""cr… https://t.co/KbpPPblE5Y"
1093840756840685568,14307764,351,114944,365,725,78609,2008-04-05 01:46:58,0,0,2019-02-08 11:55:33,"Veterans Affairs care improving in Delaware, but veterans still face long waits https://t.co/zTLYBmskBp https://t.co/JoXPVbUf6y"
1093826777015877632,14307764,351,114944,365,725,78609,2008-04-05 01:46:58,0,1,2019-02-08 11:00:00,This marks University of Delaware's third straight loss. https://t.co/hm8tL88uv9
1093818234682265600,14307764,351,114944,365,725,78609,2008-04-05 01:46:58,0,0,2019-02-08 10:26:03,"Whitaker's testimony, winter weather, a Kristoff St. John tribute: 5 things you need to know Friday… https://t.co/ZimOiwzrLX"
1093757845508476931,14307764,351,114944,365,725,78609,2008-04-05 01:46:58,0,0,2019-02-08 06:26:06,UD: 'We're continuing to learn' https://t.co/N4FuqLv5ib https://t.co/eVh93iggtp
1093757836587196417,14307764,351,114944,365,725,78609,2008-04-05 01:46:58,0,3,2019-02-08 06:26:03,This cat was found 'frozen and unresponsive' in snow. An animal hospital saved her life https://t.co/d1l9KRciID https://t.co/JJuwHf3ZGA
1093736180393410563,14307764,351,114944,365,725,78609,2008-04-05 01:46:58,0,1,2019-02-08 05:00:00,"Gucci issued a statement on Twitter apologizing for ""offense"" caused by the sweater. https://t.co/12fPN4YtWB"
1093735566712000515,14307764,351,114944,365,725,78609,2008-04-05 01:46:58,3,1,2019-02-08 04:57:34,Glasgow High cancels classes Friday following fights https://t.co/OglIAMgpYd https://t.co/8ck3zyaQOY
1093728019305222144,14307764,351,114944,365,725,78609,2008-04-05 01:46:58,2,0,2019-02-08 04:27:34,"Fined for 'bizarre behavior' including unwanted face licking, Florida official resigns https://t.co/1OmfQoIm81 https://t.co/TetmRIGt9C"
1093723876427735045,14307764,351,114944,365,725,78609,2008-04-05 01:46:58,2,0,2019-02-08 04:11:07,"RT @kevintresolini: Defending #caahoops champ ⁦@CofCBasketball⁩ shows pedigree, toughness by rallying to beat ⁦@DelawareMBB⁩ https://t.co/F…"
1093720590320422912,14307764,351,114944,365,725,78609,2008-04-05 01:46:58,0,0,2019-02-08 03:58:03,"Defending champs show pedigree, toughness by rallying to beat Delaware https://t.co/LnYLAyirag https://t.co/5ua34cpuXp"
1093713291342340096,14307764,351,114944,365,725,78609,2008-04-05 01:46:58,1,0,2019-02-08 03:29:03,Hens can't match Charleston https://t.co/v85BZoBohu https://t.co/yFRDWkKT4Q
1093702707649671169,14307764,351,114944,365,725,78609,2008-04-05 01:46:58,0,1,2019-02-08 02:47:00,The Louisiana law's similarity to one the justices thwarted in Texas less than three years ago apparently sealed it… https://t.co/nqe9j9PJys
1093699642657775617,14307764,351,114944,365,725,78609,2008-04-05 01:46:58,2,3,2019-02-08 02:34:49,"Dingell served nearly 60 years in the House, making him the longest-serving member in Congress' history. He stepped… https://t.co/5y5Ux4jmnV"
1093684014219702272,14307764,351,114944,365,725,78609,2008-04-05 01:46:58,0,2,2019-02-08 01:32:43,"From today: Sen. @ChrisCoons,@realDonaldTrump and @SenatorLankford bow for prayer during the National Prayer Breakf… https://t.co/kwQHZczY7f"
1093677541884346369,14307764,351,114944,365,725,78609,2008-04-05 01:46:58,0,2,2019-02-08 01:07:00,Apple users should go their device settings and install the released software update. The company said they ran a t… https://t.co/vetf7OchUw
1093668243837984768,14307764,351,114944,365,725,78609,2008-04-05 01:46:58,3,3,2019-02-08 00:30:03,"""They said they had more of my text messages and photos that they would publish if we didn’t stop our investigation… https://t.co/A2UVy3qqD0"
1093660697026793473,14307764,351,114944,365,725,78609,2008-04-05 01:46:58,9,20,2019-02-08 00:00:04,Delaware native @TheRealSap’s most recent production credit has landed him on @NipseyHussle's Grammy-nominated albu… https://t.co/TTGHTB2t0v
1093654027903000577,14307764,351,114944,365,725,78609,2008-04-05 01:46:58,2,1,2019-02-07 23:33:34,Prisons expert criticizes Vaughn riot investigation https://t.co/m4ye5PkxQ8 https://t.co/WmiqgoC8zc
1093639071358803968,14307764,351,114944,365,725,78609,2008-04-05 01:46:58,1,2,2019-02-07 22:34:08,"When DelState first hired a white coach, racial tensions flared, but then it became a non-issue… https://t.co/SUxvKCkoQK"
1093639060441116672,14307764,351,114944,365,725,78609,2008-04-05 01:46:58,0,0,2019-02-07 22:34:05,"Sixers trading Markelle Fultz, Phillies adding J.T. Realmuto sends same winning message https://t.co/bnTs5ANVWI https://t.co/AnlAVIVMHO"
1093639052543193088,14307764,351,114944,365,725,78609,2008-04-05 01:46:58,1,1,2019-02-07 22:34:03,Tennessee bills would allow adoption agencies to deny LGBT couples on religious grounds https://t.co/0sGfpTDdSb https://t.co/IpcDdk8m4i
1093631758078070784,14307764,351,114944,365,725,78609,2008-04-05 01:46:58,0,0,2019-02-07 22:05:04,Raw Video: Scenes outside Glasgow High School following fights https://t.co/q2hu4Zk28N https://t.co/BjN0kFp3O3
1093630487078338565,14307764,351,114944,365,725,78609,2008-04-05 01:46:58,1,0,2019-02-07 22:00:01,"What would have been a routine meeting, turned into a skirmish between top officials in Wilmington. https://t.co/CuroGMuVfx"
1093624203977216000,14307764,351,114944,365,725,78609,2008-04-05 01:46:58,0,0,2019-02-07 21:35:03,Teen charged in armed robbery of Dover letgo sellers https://t.co/5fxcpxTfjZ https://t.co/TYBSiSy6w3
1093620415640059909,14307764,351,114944,365,725,78609,2008-04-05 01:46:58,0,3,2019-02-07 21:20:00,"“Frank Robinson’s résumé in our game is without parallel, a trailblazer in every sense, whose impact spanned genera… https://t.co/2P8bbMCx1T"
1093616913836474369,14307764,351,114944,365,725,78609,2008-04-05 01:46:58,0,1,2019-02-07 21:06:05,"New Joan of Arc play at Delaware Theatre focuses on the woman herself, not men around her https://t.co/mqExut2dzX https://t.co/pOcya4MwbH"
1093609482108555264,14307764,351,114944,365,725,78609,2008-04-05 01:46:58,10,20,2019-02-07 20:36:33,Sap talks losing Mac Miller and working on Nipsey Hussle's Grammy-nominated album https://t.co/f4ErGSDNUF https://t.co/pKRLaHTKeF
1093606120684429312,14307764,351,114944,365,725,78609,2008-04-05 01:46:58,2,1,2019-02-07 20:23:12,Breaking: @MarkelleF will get a fresh start after being traded by the @sixers. https://t.co/xzymtCDqRX
1093602131125391360,14307764,351,114944,365,725,78609,2008-04-05 01:46:58,1,5,2019-02-07 20:07:20,It's been confirmed: The @Phillies have acquired J.T. Realmuto. #Phillies https://t.co/ourEpIa03w
1093594272471822336,14307764,351,114944,365,725,78609,2008-04-05 01:46:58,1,1,2019-02-07 19:36:07,Wilmington neighborhood meeting devolves into fight over transparency website https://t.co/AWJzgEAKZJ https://t.co/toK0acMasm
1093594262464212992,14307764,351,114944,365,725,78609,2008-04-05 01:46:58,1,1,2019-02-07 19:36:04,Federal appeals court rules that Delaware's judicial balance mandate is unconstitutional https://t.co/CxwLBdgN9X https://t.co/Y0W6AsfltP
1093593991663243264,14307764,351,114944,365,725,78609,2008-04-05 01:46:58,1,0,2019-02-07 19:35:00,Police identify the 24-year-old victim. https://t.co/f9OdFZWP9q
1093586967483174912,14307764,351,114944,365,725,78609,2008-04-05 01:46:58,1,2,2019-02-07 19:07:05,"More than $130,000 seized in Bear drug bust https://t.co/Zj9ZHfB2fM https://t.co/V6qjqzVTnX"
1093586960872923136,14307764,351,114944,365,725,78609,2008-04-05 01:46:58,2,4,2019-02-07 19:07:03,Raw Video: Large fight at Glasgow High School https://t.co/Lk2gwkNJXO https://t.co/Cd53Rpc6wH
1093586106594009089,14307764,351,114944,365,725,78609,2008-04-05 01:46:58,4,5,2019-02-07 19:03:40,Update: Students have been dismissed early after fights broke out involving at least 20 people. https://t.co/A7RI6ifG9m
1093580715005014016,14307764,351,114944,365,725,78609,2008-04-05 01:46:58,0,0,2019-02-07 18:42:14,@planetcocoa https://t.co/A7RI6ifG9m
1093579160520290304,14307764,351,114944,365,725,78609,2008-04-05 01:46:58,1,2,2019-02-07 18:36:04,"Brides to be: Ollie's is selling 30,000 wedding dresses at a deep discount https://t.co/Vk3YXal00V https://t.co/KF02jgZc6p"
1093571902499483648,14307764,351,114944,365,725,78609,2008-04-05 01:46:58,2,3,2019-02-07 18:07:13,"WDEL and partner stations sold for $18.5 million, layoffs possible https://t.co/42df4u9AKG https://t.co/DA59yqOS0X"
1093571886779326464,14307764,351,114944,365,725,78609,2008-04-05 01:46:58,4,2,2019-02-07 18:07:10,"Police, state troopers respond to Glasgow High School https://t.co/eEWNKo7ZCL https://t.co/L7aX8Bw0l1"
1093571865677713408,14307764,351,114944,365,725,78609,2008-04-05 01:46:58,1,0,2019-02-07 18:07:05,Pennsylvania man accused of feeding child crystal methamphetamine https://t.co/ax13YozkW6 https://t.co/u2UEpnixo3
1093570093517287424,14307764,351,114944,365,725,78609,2008-04-05 01:46:58,2,1,2019-02-07 18:00:02,"""It was pretty terrifying to hear a human being scream and be unable to help."" https://t.co/62FdBTJzIn"
1093569373611216897,14307764,351,114944,365,725,78609,2008-04-05 01:46:58,0,1,2019-02-07 17:57:10,@planetcocoa We're working to confirm details
