1094745336185319425,15163577,10420,142232,1362,1340,137017,2008-06-18 23:06:08,0,5,2019-02-10 23:50:02,Corn could become Nebraska's official vegetable (maybe you thought it already was) https://t.co/YTvKKVvCX9 https://t.co/weuClKGC4d
1094740300155764737,15163577,10420,142232,1362,1340,137017,2008-06-18 23:06:08,2,7,2019-02-10 23:30:01,"'I never had the desire to smoke marijuana,' @GovRicketts says. 'I never thought it was the cool thing to do'… https://t.co/R4ErnoXWt8"
1094735621090881536,15163577,10420,142232,1362,1340,137017,2008-06-18 23:06:08,11,0,2019-02-10 23:11:25,"RT @OWHbigred: When Travis Fisher followed Scott Frost to NU, he could tell #Huskers DBs lacked confidence. They also lacked camaraderie.…"
1094727964120502273,15163577,10420,142232,1362,1340,137017,2008-06-18 23:06:08,2,5,2019-02-10 22:41:00,How did OPS' pension fall into a $771 million deficit? How did fund leaders get swindled out of $16 million? What i… https://t.co/T09fl54BjK
1094727132666888193,15163577,10420,142232,1362,1340,137017,2008-06-18 23:06:08,0,0,2019-02-10 22:37:42,A 71-year-old Nebraska man dies from injuries he received Sunday in a three-vehicle crash on Interstate 80 near Mil… https://t.co/QwzvR9FATR
1094721427624939521,15163577,10420,142232,1362,1340,137017,2008-06-18 23:06:08,0,3,2019-02-10 22:15:01,From @cgonzalez_owh: Two downtown staples will soon reach a little higher with plans to extend roofs.… https://t.co/tXH9nkrztE
1094707584244830208,15163577,10420,142232,1362,1340,137017,2008-06-18 23:06:08,0,1,2019-02-10 21:20:01,A new ABC sitcom set in Nebraska about two city slickers; Joe Ricketts' political clout in light of his racist emai… https://t.co/DiV7FDeAjb
1094702607589957632,15163577,10420,142232,1362,1340,137017,2008-06-18 23:06:08,1,5,2019-02-10 21:00:14,"In Sidney, former Cabela’s employees have opened online stores, competing with their old employer. The startups so… https://t.co/4tpadsoIDh"
1094695006651203584,15163577,10420,142232,1362,1340,137017,2008-06-18 23:06:08,0,8,2019-02-10 20:30:02,ICYMI: Omaha native and comedian Amber Ruffin will set her NBC sitcom in the town of Benson. https://t.co/iu2ioWEyE0 https://t.co/r96e7CJx7j
1094691227713327104,15163577,10420,142232,1362,1340,137017,2008-06-18 23:06:08,0,0,2019-02-10 20:15:01,From today's Ask Amy: My friend keeps criticizing my Facebook posts and brings them up to others later.… https://t.co/qB4UA34wF3
1094687591457280001,15163577,10420,142232,1362,1340,137017,2008-06-18 23:06:08,0,3,2019-02-10 20:00:34,A project on 20th and Dodge Streets heralds a healthier downtown office market  — and vacant space is filling up.… https://t.co/fiZZIU7non
1094683685209718786,15163577,10420,142232,1362,1340,137017,2008-06-18 23:06:08,4,24,2019-02-10 19:45:03,ICYMI: A new ABC sitcom is set in Nebraska. It's about a couple of city slickers who decide to live the Good Life.… https://t.co/ZsYs67jma4
1094679957157105666,15163577,10420,142232,1362,1340,137017,2008-06-18 23:06:08,1,1,2019-02-10 19:30:14,"Will Joe Ricketts' racist emails affect his political clout? Don’t be too sure. “The bottom line is, money is the m… https://t.co/8iIzhXyccJ"
1094677716811608065,15163577,10420,142232,1362,1340,137017,2008-06-18 23:06:08,6,0,2019-02-10 19:21:20,"RT @OWHmavs: From @BooneOWH: Rebranding helps UNO operate on a whole new level: ""We had a community and a university that didn’t understand…"
1094672459645812736,15163577,10420,142232,1362,1340,137017,2008-06-18 23:06:08,0,4,2019-02-10 19:00:27,"""We're just having fun"": Snow sculptors brave the cold this weekend to chip, scrape and pack creations.… https://t.co/DnMytoW7jA"
1094668589200744451,15163577,10420,142232,1362,1340,137017,2008-06-18 23:06:08,2,3,2019-02-10 18:45:04,Here are 11 easy steps to going green and having fun in the process. https://t.co/RMUy9VeXOm https://t.co/mRtMNl1cIN
1094664877703118856,15163577,10420,142232,1362,1340,137017,2008-06-18 23:06:08,0,3,2019-02-10 18:30:19,"Before Elton John's Omaha concert this week, we offer a retrospective of a colorful career as the true Rocket Man c… https://t.co/hULY49Jn2M"
1094662029359513600,15163577,10420,142232,1362,1340,137017,2008-06-18 23:06:08,2,0,2019-02-10 18:19:00,"In 2015, a family of swindlers got its hands on some of the OPS pension fund's money. Instead of supporting OPS ret… https://t.co/n0mhVdyrSR"
1094658257136820224,15163577,10420,142232,1362,1340,137017,2008-06-18 23:06:08,1,0,2019-02-10 18:04:00,"RT @HuskerHistory: After 10 days of off-the-field distractions in New Orleans involving the police and the press, the #Huskers unloaded aga…"
1094653492994678785,15163577,10420,142232,1362,1340,137017,2008-06-18 23:06:08,0,1,2019-02-10 17:45:05,A man is critically wounded early Sunday in a shooting outside a north Lincoln restaurant. https://t.co/6rOKkpddch https://t.co/my0avtqb1F
1094649768482082816,15163577,10420,142232,1362,1340,137017,2008-06-18 23:06:08,3,0,2019-02-10 17:30:17,A 39-year-old Omaha man told police he was struck by gunfire from a passing car early Sunday near 55th and Spauldin… https://t.co/P8fV2dddEE
1094640957323124736,15163577,10420,142232,1362,1340,137017,2008-06-18 23:06:08,1,0,2019-02-10 16:55:16,"RT @OWHopinion: The Legislature should be wary of stripping Nebraska’s elected town and city officials of their authority on this issue, ou…"
1094630060588449792,15163577,10420,142232,1362,1340,137017,2008-06-18 23:06:08,1,0,2019-02-10 16:11:58,"RT @OWHCrime: A  fatal crash near Milford, Nebraska, closed eastbound lanes of Interstate 80 from about 8 a.m. until 10 a.m. The Nebraska S…"
1094629732195405824,15163577,10420,142232,1362,1340,137017,2008-06-18 23:06:08,3,0,2019-02-10 16:10:40,RT @OWHbigred: The work the #Huskers have already done on the 2020 class — including QB commit @logan_smothers — should pay off most inside…
1094623287454453760,15163577,10420,142232,1362,1340,137017,2008-06-18 23:06:08,1,4,2019-02-10 15:45:03,"Sunday's snowfall is expected to total about 3 inches in the Omaha area by the time the storm is done, but more win… https://t.co/PVTcs4TOeL"
1094615734607589377,15163577,10420,142232,1362,1340,137017,2008-06-18 23:06:08,0,0,2019-02-10 15:15:02,"Abortion, death penalty, religion: Late-night rulings show new alliances at Supreme Court https://t.co/tQl6qIObI7"
1094612005321875457,15163577,10420,142232,1362,1340,137017,2008-06-18 23:06:08,4,7,2019-02-10 15:00:13,"Gov. Pete Ricketts says he’s never smoked marijuana, and he sees danger in legalizing its use as medicine.

“There’… https://t.co/lEnPA44CUj"
1094604445957218304,15163577,10420,142232,1362,1340,137017,2008-06-18 23:06:08,0,9,2019-02-10 14:30:11,A group of fourth-graders might soon make history for their role in naming the first new Nebraska state symbol in m… https://t.co/4e7Pfb5d4R
1094601128073981952,15163577,10420,142232,1362,1340,137017,2008-06-18 23:06:08,1,0,2019-02-10 14:17:00,"In 2015, a family of financial swindlers got its hands on some of the OPS pension fund's money. 

Instead of suppor… https://t.co/Fd0s4hdFs2"
1094596878262509568,15163577,10420,142232,1362,1340,137017,2008-06-18 23:06:08,0,0,2019-02-10 14:00:07,"Because of a quirk in federal law, more than 80 acres of the base lies outside the jurisdiction of the federal secu… https://t.co/Ym60uRitzA"
1094589344965423106,15163577,10420,142232,1362,1340,137017,2008-06-18 23:06:08,0,1,2019-02-10 13:30:10,"In recent years, the video game industry looked like it had found the antidote to the boom-bust cycles that had lon… https://t.co/pVUhigi8fp"
1094581769016393728,15163577,10420,142232,1362,1340,137017,2008-06-18 23:06:08,0,1,2019-02-10 13:00:04,"https://t.co/l14i2Knipz: Obituaries published Feb. 10, 2019 https://t.co/Lw05pP7Zmi"
1094574220426792961,15163577,10420,142232,1362,1340,137017,2008-06-18 23:06:08,0,0,2019-02-10 12:30:05,Up to $250 in coupons in today's paper. Find the nearest single copy sales location: https://t.co/V88pb5VBrq https://t.co/ma3OfA74sd
1094566705781719041,15163577,10420,142232,1362,1340,137017,2008-06-18 23:06:08,1,13,2019-02-10 12:00:13,"If you live in the Midwest, winter is by far the worst season of them all.

When temperatures drop, roads freeze an… https://t.co/bLaOEh4RBG"
1094468517628387328,15163577,10420,142232,1362,1340,137017,2008-06-18 23:06:08,1,5,2019-02-10 05:30:03,The 100 best TV shows to watch on Netflix right now https://t.co/NPMMsy99Gm
1094460985669312513,15163577,10420,142232,1362,1340,137017,2008-06-18 23:06:08,0,1,2019-02-10 05:00:07,"Cheers! New book, 'Nebraska Craft Beer,' explores our breweries, past and present https://t.co/oUAEqATrjt https://t.co/xioiZh7kXs"
1094457916655108099,15163577,10420,142232,1362,1340,137017,2008-06-18 23:06:08,0,0,2019-02-10 04:47:56,A small dog was injured Saturday when its leash apparently got caught in a car door and was dragged by the car an e… https://t.co/Rgy93UANZq
1094453447720607745,15163577,10420,142232,1362,1340,137017,2008-06-18 23:06:08,0,0,2019-02-10 04:30:10,"It could be said that flamboyance — living large — is an art form in the pop music biz. And if that’s the case, Elt… https://t.co/etOVZzsGW2"
1094449629842808832,15163577,10420,142232,1362,1340,137017,2008-06-18 23:06:08,0,2,2019-02-10 04:15:00,"Swindled out of $16 million? How the OPS pension fund fell victim to a 'first-rate con man'

SUBSCRIBER PLUS: https://t.co/oy8nGE7P9c"
1094445868239994881,15163577,10420,142232,1362,1340,137017,2008-06-18 23:06:08,0,0,2019-02-10 04:00:03,Lawmakers hear tearful testimony from woman who could lose home over unpaid taxes https://t.co/ww5YKDgHZR
1094438342341595136,15163577,10420,142232,1362,1340,137017,2008-06-18 23:06:08,0,6,2019-02-10 03:30:09,First look at Omaha native @itsgabrielleu and @JessicaAlba in their new cop show #LAsFinest https://t.co/odkOa6oSiB
1094436185655656448,15163577,10420,142232,1362,1340,137017,2008-06-18 23:06:08,2,52,2019-02-10 03:21:34,"Gov. Pete Ricketts says he’s never smoked marijuana despite having college friends who did, and he sees danger in l… https://t.co/W0bHiYHTAU"
1094430815642095616,15163577,10420,142232,1362,1340,137017,2008-06-18 23:06:08,0,5,2019-02-10 03:00:14,"The first snow Nebraska Snow Sculpting Competition has begun in Elkhorn, with both amateur and professional sculpto… https://t.co/QzB6vrtOU1"
1094424162045698048,15163577,10420,142232,1362,1340,137017,2008-06-18 23:06:08,1,0,2019-02-10 02:33:48,"RT @OWHopinion: Nebraska seniors deserve major tax relief, a Public Pulse writer says. 

In other letters: 

-- Heightened flood risk along…"
1094423219765997568,15163577,10420,142232,1362,1340,137017,2008-06-18 23:06:08,1,5,2019-02-10 02:30:03,Will Joe Ricketts' racist emails affect his political clout? Don’t be too sure https://t.co/T89lzlyr6y
1094415689425842181,15163577,10420,142232,1362,1340,137017,2008-06-18 23:06:08,0,1,2019-02-10 02:00:08,Bellevue middle school teacher arrested on possession of child pornography charges https://t.co/X2Soyqw4v8
1094408118652624896,15163577,10420,142232,1362,1340,137017,2008-06-18 23:06:08,0,2,2019-02-10 01:30:03,2019 Oscar-nominated films reviewed by Micah Mertes https://t.co/KTY6ntz2mi https://t.co/d6pSNOqrRx
1094400581572136961,15163577,10420,142232,1362,1340,137017,2008-06-18 23:06:08,4,7,2019-02-10 01:00:06,You can get an early look at Part 4 of @HenryCordes' investigation into the $771 million OPS pension shortfall late… https://t.co/xuAbrV7lLg
1094396785127276545,15163577,10420,142232,1362,1340,137017,2008-06-18 23:06:08,1,8,2019-02-10 00:45:01,ICYMI: Omaha-native comedian @AmberMRuffin will set her NBC sitcom in the town of Benson https://t.co/iu2ioWEyE0
1094393007187595265,15163577,10420,142232,1362,1340,137017,2008-06-18 23:06:08,0,8,2019-02-10 00:30:00,"Should Omaha raise taxes to help OPS recover from pension shortfall?

Vote and discuss: https://t.co/4VdE969K4c"
1094389242611093504,15163577,10420,142232,1362,1340,137017,2008-06-18 23:06:08,0,5,2019-02-10 00:15:02,"OPS wants bus tracking app for parents, fines for late-arriving buses in new busing contract 

SUBSCRIBER PLUS: https://t.co/3r5L08AjvI"
1094385460938530816,15163577,10420,142232,1362,1340,137017,2008-06-18 23:06:08,0,2,2019-02-10 00:00:01,"Classrooms will be 'feeling the pain' of OPS pension woes for years to come. Taxpayers may, too. 

SUBSCRIBER PLUS: https://t.co/5ygtb1XhU6"
1094381684647231489,15163577,10420,142232,1362,1340,137017,2008-06-18 23:06:08,1,3,2019-02-09 23:45:00,Nebraska man grateful for helicopter rescue after stroke on California beach https://t.co/vtxuSe8LpD
1094377949451694086,15163577,10420,142232,1362,1340,137017,2008-06-18 23:06:08,1,6,2019-02-09 23:30:10,"Editorial: Elizabeth Davis Pittman, Nebraska's first black judge, left an admirable legacy https://t.co/YZYqsJcWyD"
1094377907118575616,15163577,10420,142232,1362,1340,137017,2008-06-18 23:06:08,0,0,2019-02-09 23:30:00,"Ask Amy: A friend mistreated me and apologized, but I don't know how to move past it https://t.co/dz2vg7jqAb"
1094370473121669120,15163577,10420,142232,1362,1340,137017,2008-06-18 23:06:08,1,2,2019-02-09 23:00:27,"OPS pension troubles rooted in cozy ties to investment firm, including pricey dinners. 

SUBSCRIBER PLUS: https://t.co/I3AtnGZgcu"
1094366594501890048,15163577,10420,142232,1362,1340,137017,2008-06-18 23:06:08,0,2,2019-02-09 22:45:03,Two downtown staples will soon reach a little higher as plans to extend rooves near https://t.co/QGB5ngOwYl https://t.co/x6QOTUt7Z6
1094362811231293440,15163577,10420,142232,1362,1340,137017,2008-06-18 23:06:08,0,3,2019-02-09 22:30:01,ICYMI: New @ABC sitcom #BlessThisMess will be set in Nebraska and feature a couple of city slickers who decide to l… https://t.co/Dh2lbtnCFB
1094360568520232960,15163577,10420,142232,1362,1340,137017,2008-06-18 23:06:08,18,0,2019-02-09 22:21:06,"RT @OWHbigred: The #Huskers' spring football game has sold out for the second straight season.

NU’s athletic department announced Saturday…"
1094359042275848195,15163577,10420,142232,1362,1340,137017,2008-06-18 23:06:08,0,0,2019-02-09 22:15:02,"Got sinus troubles? Wondering what you can you do at home for relief? A local doc explains 

SUBSCRIBER PLUS: https://t.co/p793DODAK3"
1094355301690761217,15163577,10420,142232,1362,1340,137017,2008-06-18 23:06:08,2,1,2019-02-09 22:00:10,"OPS's $771 million pension shortfall a product of 'mind-boggling' mistakes, World-Herald investigation shows. https://t.co/3OErroLgIe"
1094351492121849856,15163577,10420,142232,1362,1340,137017,2008-06-18 23:06:08,1,1,2019-02-09 21:45:02,Enjoy the Saturday sun because snow could follow Sunday with even more on Monday https://t.co/HJdu7uSSRN
1094347714958114817,15163577,10420,142232,1362,1340,137017,2008-06-18 23:06:08,1,2,2019-02-09 21:30:01,"Should win, will win ... and everything else you need to know about Sunday's Grammys

SUBSCRIBER PLUS:… https://t.co/8W9froJGy4"
1094343945793036290,15163577,10420,142232,1362,1340,137017,2008-06-18 23:06:08,3,0,2019-02-09 21:15:03,"RT @OWHmoney: Project on 20th and Dodge heralds healthier downtown office market. Vacant space is filling up 

SUBSCRIBER PLUS: https://t.c…"
1094340173167513600,15163577,10420,142232,1362,1340,137017,2008-06-18 23:06:08,0,1,2019-02-09 21:00:03,"His apartments have bugs, rodents and mold. Council questions if Paladino should get help to build more

SUBSCRIBER… https://t.co/KxdKc4jqk6"
1094336686060982273,15163577,10420,142232,1362,1340,137017,2008-06-18 23:06:08,3,12,2019-02-09 20:46:12,New 30-story skyscraper planned for downtown Omaha would be one of city's tallest buildings https://t.co/wGTZ83MtA8 https://t.co/Bwj5OPrsri
1094317557501358083,15163577,10420,142232,1362,1340,137017,2008-06-18 23:06:08,0,1,2019-02-09 19:30:11,Judge delays release of convicted Omaha killer Jack E. Harris; case headed to State Supreme Court https://t.co/m2ahHtRlvF
1094313741485830146,15163577,10420,142232,1362,1340,137017,2008-06-18 23:06:08,2,23,2019-02-09 19:15:01,Creighton soccer team surprises Iowa teen who can no longer play after cancer diagnosis https://t.co/v92rKS2Krs
1094310118202712064,15163577,10420,142232,1362,1340,137017,2008-06-18 23:06:08,2,7,2019-02-09 19:00:38,"Evocative '30 Americans' exhibit at @joslynartmuseum casts light on issues of race, identification 

SUBSCRIBER PLU… https://t.co/L88o2ijJNU"
1094306191784710144,15163577,10420,142232,1362,1340,137017,2008-06-18 23:06:08,6,0,2019-02-09 18:45:02,"RT @OWHbigred: A deeply personal column from @tomshatelOWH on Matt Slauson, stuttering and how the former #Huskers lineman changed Tom's li…"
1094302418974724096,15163577,10420,142232,1362,1340,137017,2008-06-18 23:06:08,1,1,2019-02-09 18:30:02,Cat fight leaves one brother battered and the other under arrest but the cats unharmed https://t.co/Vco32fGbcH
1094299665204424705,15163577,10420,142232,1362,1340,137017,2008-06-18 23:06:08,1,0,2019-02-09 18:19:05,RT @NEPrepZone: Heartland Hoops Classic roundup: No. 2 Riverside beats No. 8 Loomis 72-59 in tourney opener https://t.co/o951FSmVQj https:/…
1094287380583014400,15163577,10420,142232,1362,1340,137017,2008-06-18 23:06:08,1,2,2019-02-09 17:30:17,Seven current and former nurses at St. Elizabeth Regional Medical Center in Lincoln have named Catholic Health Init… https://t.co/oRuG5sz37M
1094283537723936769,15163577,10420,142232,1362,1340,137017,2008-06-18 23:06:08,0,2,2019-02-09 17:15:00,"Rash of shootings in past week leads to police, community groups vowing to combat violence https://t.co/BQZdJvfpdX"
1094277782773923842,15163577,10420,142232,1362,1340,137017,2008-06-18 23:06:08,59,0,2019-02-09 16:52:08,RT @OWHpictures: Exclusive video of @OmahaPolice pursuit that ends in @OWHnews garage —&gt; https://t.co/6Dgg2F9OFm https://t.co/FlptGIKv3m
1094277745180323840,15163577,10420,142232,1362,1340,137017,2008-06-18 23:06:08,0,0,2019-02-09 16:51:59,Video: Surveillance shows Friday night police pursuit ending in World-Herald parking garage https://t.co/zbyoVMeuCC https://t.co/EZ9EepBLd1
1094272251736875008,15163577,10420,142232,1362,1340,137017,2008-06-18 23:06:08,7,23,2019-02-09 16:30:10,"A 90-year-old man escaped his burning house completely nude on one of the coldest nights of the year, then went bac… https://t.co/TJ7u7ZwbsO"
1094267904693059585,15163577,10420,142232,1362,1340,137017,2008-06-18 23:06:08,1,1,2019-02-09 16:12:53,"OPS principal arrested, accused of failing to report teacher's suspected sexual abuse https://t.co/uxFsZwFTLG"
1094253352303644673,15163577,10420,142232,1362,1340,137017,2008-06-18 23:06:08,1,13,2019-02-09 15:15:04,"Buffalo Bills defensive tackle Harrison Phillips, a Millard West alum, stopped by his old school Friday to show off… https://t.co/GvGvwIEXm2"
1094242089418797057,15163577,10420,142232,1362,1340,137017,2008-06-18 23:06:08,1,3,2019-02-09 14:30:18,Pursuit ends when car crashes into parking garage gate next to World-Herald building https://t.co/zbyoVMeuCC
1094234468011913217,15163577,10420,142232,1362,1340,137017,2008-06-18 23:06:08,3,12,2019-02-09 14:00:01,Fern Watanabe was committed to the success of young women in business so she started a scholarship at South High Sc… https://t.co/aYXzVMoFmH
1094226966985756672,15163577,10420,142232,1362,1340,137017,2008-06-18 23:06:08,2,0,2019-02-09 13:30:13,Sanders risks getting crowded out in 2020 field of progressives https://t.co/vvXJqIe5bC
1094219402596233216,15163577,10420,142232,1362,1340,137017,2008-06-18 23:06:08,0,0,2019-02-09 13:00:09,"https://t.co/l14i2Knipz: Obituaries published Feb. 9, 2019 https://t.co/xgVDtjxdN3"
1094211846347915276,15163577,10420,142232,1362,1340,137017,2008-06-18 23:06:08,0,4,2019-02-09 12:30:08,Photos: The AP's best images from the past week https://t.co/50n52uOR54
1094204379278774272,15163577,10420,142232,1362,1340,137017,2008-06-18 23:06:08,2,3,2019-02-09 12:00:28,"Mearl DePeel lost his hearing aid and his 60-year-old dentures in the fire, along with just about everything else,… https://t.co/zrOrnyg3k3"
1094106117637095424,15163577,10420,142232,1362,1340,137017,2008-06-18 23:06:08,1,3,2019-02-09 05:30:00,A Lincoln police report indicates one brother became enraged with another and said he intended to move out. Then th… https://t.co/tANsj5Zq6p
1094095050164838400,15163577,10420,142232,1362,1340,137017,2008-06-18 23:06:08,8,0,2019-02-09 04:46:01,RT @reecereports: A high-speed chase just ended at the @OWHnews newsroom when the driver crashed through the gate to our parking garage. Su…
1094091018423726085,15163577,10420,142232,1362,1340,137017,2008-06-18 23:06:08,0,1,2019-02-09 04:30:00,"If you jump out of your seat watching “The Prodigy” this weekend (or the ""Child's Play"" reboot this summer), you mi… https://t.co/S57kuJ3qXO"
1094083480386965504,15163577,10420,142232,1362,1340,137017,2008-06-18 23:06:08,2,2,2019-02-09 04:00:03,State Sen. Kate Bolz says her measure would give low-income families a boost toward self-sufficiency. The Nebraska… https://t.co/vHMYU467u4
1094075946708156416,15163577,10420,142232,1362,1340,137017,2008-06-18 23:06:08,0,1,2019-02-09 03:30:07,An Oklahoma City man who cyberstalked a woman based at Offutt Air Force Base whom he had dated years earlier has be… https://t.co/W0DrqxaQTK
1094068370427777024,15163577,10420,142232,1362,1340,137017,2008-06-18 23:06:08,1,0,2019-02-09 03:00:00,"RT @MichaelBCompany: Got to turn @micahmertes into a mini fig for his review of #TheLEGOMovie2 which I hear is “pure madness, mostly in a g…"
1094060843313045504,15163577,10420,142232,1362,1340,137017,2008-06-18 23:06:08,1,14,2019-02-09 02:30:06,Legislative Bill 463 would increase notification to delinquent taxpayers so they clearly understand that they owe b… https://t.co/Bl5CalFd2r
1094053286645239808,15163577,10420,142232,1362,1340,137017,2008-06-18 23:06:08,0,2,2019-02-09 02:00:04,Farewell tours: Those who've already said goodbye and those we expect to say it next. https://t.co/GrMFMHt8c6
1094045754098896896,15163577,10420,142232,1362,1340,137017,2008-06-18 23:06:08,3,5,2019-02-09 01:30:08,"The next part to @HenryCordes' investigation into the OPS pension shortfall will be published Sunday.

You still ha… https://t.co/fIEM7JN6vM"
1094038217756721154,15163577,10420,142232,1362,1340,137017,2008-06-18 23:06:08,0,0,2019-02-09 01:00:12,"In three days, from Sunday to Tuesday, five shootings ended with six victims, two of whom have died. In the entire… https://t.co/sv3w3PX3Z5"
1094034397311979521,15163577,10420,142232,1362,1340,137017,2008-06-18 23:06:08,1,1,2019-02-09 00:45:01,"Check out the newest @OWHgo Show as @owhmusicguy and @ZLong_OWH talk about the latest food, booze and music news ha… https://t.co/4nqzoRQ17D"
1094030622765604864,15163577,10420,142232,1362,1340,137017,2008-06-18 23:06:08,0,0,2019-02-09 00:30:01,'Flesh and blood robots for Amazon': They raid clearance aisles and resell it all online for profit https://t.co/tRxGh9OxeF
1094026844695871490,15163577,10420,142232,1362,1340,137017,2008-06-18 23:06:08,0,0,2019-02-09 00:15:00,Experience January through pictures captured by OWH photo staff. https://t.co/PUvPXE1PyD
1094023114453848064,15163577,10420,142232,1362,1340,137017,2008-06-18 23:06:08,1,1,2019-02-09 00:00:11,"Wondering what you can expect from Sunday's Grammy Awards?

Let @owhmusicguy be your guide.

SUBSCRIBER PLUS: https://t.co/K52lj2wcPf"
1094019295758217216,15163577,10420,142232,1362,1340,137017,2008-06-18 23:06:08,4,5,2019-02-08 23:45:00,TransCanada Corp. believes its Keystone pipeline is likely the source of an oil leak near St. Louis that Missouri o… https://t.co/JakJPQPP2E
1094015556544536577,15163577,10420,142232,1362,1340,137017,2008-06-18 23:06:08,0,1,2019-02-08 23:30:09,Treadmills and tricks: Physical and mental training keeps #dogs happy in the #winter - https://t.co/0ZOuUq06gc https://t.co/p1kwx6Xun3
1094011751706882053,15163577,10420,142232,1362,1340,137017,2008-06-18 23:06:08,2,10,2019-02-08 23:15:02,Creighton soccer team (@creightonmsoc) surprises Iowa teen who can no longer play after cancer diagnosis. https://t.co/v92rKS2Krs
1094008056185307137,15163577,10420,142232,1362,1340,137017,2008-06-18 23:06:08,0,1,2019-02-08 23:00:20,Lawmakers advance amendment to remove exception to prohibition of slavery.  https://t.co/2pqBbdDCbB
1094000422946254848,15163577,10420,142232,1362,1340,137017,2008-06-18 23:06:08,1,0,2019-02-08 22:30:01,"Cat fight leaves one brother battered, the other under arrest. The cats were unharmed. https://t.co/CrseCbctSP"
1094000422736617473,15163577,10420,142232,1362,1340,137017,2008-06-18 23:06:08,16,0,2019-02-08 22:30:00,"RT @NEBHSRecruits: This state produced more than a dozen Division I football players in the 2019 recruiting class

Can the 2020 class match…"
1093996649809088512,15163577,10420,142232,1362,1340,137017,2008-06-18 23:06:08,0,1,2019-02-08 22:15:01,Ask Amy: I feel guilty for not speaking up when I hear strangers say offensive things. https://t.co/95ZG34K988
1093993083090415618,15163577,10420,142232,1362,1340,137017,2008-06-18 23:06:08,1,1,2019-02-08 22:00:51,"OPS principal arrested, accused of failing to report teacher's suspected sexual abuse. https://t.co/uxFsZwFTLG"
1093992996197072898,15163577,10420,142232,1362,1340,137017,2008-06-18 23:06:08,0,0,2019-02-08 22:00:30,"If you jump out of your seat watching “The Prodigy” this weekend, you might have Tom Elkins to thank for that.

The… https://t.co/T9KdSci04r"
1093989097125879808,15163577,10420,142232,1362,1340,137017,2008-06-18 23:06:08,26,107,2019-02-08 21:45:00,A state senator who is pushing for legalization of medical marijuana has challenged the governor and Nebraska Attor… https://t.co/EA5PhHCoaS
1093987165380448256,15163577,10420,142232,1362,1340,137017,2008-06-18 23:06:08,4,5,2019-02-08 21:37:20,"A 90-year-old man escaped his burning house completely nude on one of the coldest nights of the year, then he went… https://t.co/nCYCltHAJL"
