1091921676286246913,15937533,3058,101098,3196,818,97084,2008-08-21 21:58:24,0,3,2019-02-03 04:49:49,Bob Baffert gets a split during rainy day at Santa Anita https://t.co/1oGh0yUCra
1091911983106908166,15937533,3058,101098,3196,818,97084,2008-08-21 21:58:24,8,0,2019-02-03 04:11:18,"RT @CallMeEPJ: Rancho Christian 29, Sierra Canyon 25 at halftime.

The perimeter shooting of Luke Turner and Dominick Harris have helped th…"
1091911923220783104,15937533,3058,101098,3196,818,97084,2008-08-21 21:58:24,0,0,2019-02-03 04:11:03,Ducks return from 9-day break and give up 9 goals in loss to Jets https://t.co/bV1yNXDUd5
1091911352225054720,15937533,3058,101098,3196,818,97084,2008-08-21 21:58:24,0,0,2019-02-03 04:08:47,Late Warriors run overwhelms LeBron-less Lakers on the road https://t.co/KXwWN9vKDP
1091910228289949696,15937533,3058,101098,3196,818,97084,2008-08-21 21:58:24,0,0,2019-02-03 04:04:19,"LeBron James deals with soreness, sits out for Lakers-Warriors https://t.co/HXFxrmIIUE"
1091909579498315777,15937533,3058,101098,3196,818,97084,2008-08-21 21:58:24,9,19,2019-02-03 04:01:45,Elsinore High School wins 2019 Riverside County Academic Decathlon crown https://t.co/wuwSph2V9m
1091906800641810433,15937533,3058,101098,3196,818,97084,2008-08-21 21:58:24,0,0,2019-02-03 03:50:42,Opinion: Good for ‘SNL.’ Bad for America https://t.co/ifbqOYMFQe
1091888597920350208,15937533,3058,101098,3196,818,97084,2008-08-21 21:58:24,0,1,2019-02-03 02:38:22,Remains found of Lucerne Valley woman missing almost 4 years https://t.co/6ac2swl9dF
1091882880521908224,15937533,3058,101098,3196,818,97084,2008-08-21 21:58:24,0,0,2019-02-03 02:15:39,"Whicker: Despite its wounded image, is football beginning to heal itself? https://t.co/eM5UvltVzq"
1091879419076112389,15937533,3058,101098,3196,818,97084,2008-08-21 21:58:24,0,0,2019-02-03 02:01:54,"Clippers rally from 25 down, beat Pistons https://t.co/OTBBcWySeN"
1091870701064278016,15937533,3058,101098,3196,818,97084,2008-08-21 21:58:24,0,1,2019-02-03 01:27:15,"Tony Gonzalez, formerly of Huntington Beach, voted into Pro Football Hall of Fame https://t.co/XenHBnYS7M"
1091867096168976385,15937533,3058,101098,3196,818,97084,2008-08-21 21:58:24,0,1,2019-02-03 01:12:56,Fate of operations at Splash Kingdom in hands of Redlands city leaders https://t.co/H0opP8r1ME
1091852706220781568,15937533,3058,101098,3196,818,97084,2008-08-21 21:58:24,0,0,2019-02-03 00:15:45,Corey Perry jumps back into Ducks lineup after 51-game absence https://t.co/QXdzXvzCoS
1091848698601054208,15937533,3058,101098,3196,818,97084,2008-08-21 21:58:24,1,1,2019-02-02 23:59:49,"Aaron Donald wins NFL Defensive Player of the Year award again, leads Rams into Super Bowl https://t.co/TRfC9CUXMV"
1091847561521041408,15937533,3058,101098,3196,818,97084,2008-08-21 21:58:24,1,3,2019-02-02 23:55:18,2 arrested after suspected home invasion robbery and carjacking in Ontario https://t.co/ofbg95heGF
1091841067740262403,15937533,3058,101098,3196,818,97084,2008-08-21 21:58:24,0,0,2019-02-02 23:29:30,UCLA stumbles at Washington thanks to 23 turnovers https://t.co/yDq6HwmWsA
1091839910972137472,15937533,3058,101098,3196,818,97084,2008-08-21 21:58:24,0,0,2019-02-02 23:24:54,Wife of O.C. man detained in Vietnam invited by Rep. Katie Porter to State of the Union address https://t.co/ZQmoK8NLMa
1091839877606367232,15937533,3058,101098,3196,818,97084,2008-08-21 21:58:24,9,0,2019-02-02 23:24:46,RT @CALFIRERRU: #HOLYFLOODWATCH Update - Lakeside A added to list of zones under Mandatory Evacuation Warning. All previous mandatory evacu…
1091838500620521472,15937533,3058,101098,3196,818,97084,2008-08-21 21:58:24,23,0,2019-02-02 23:19:18,RT @RivCoReady: #HOLYFLOODWATCH Update - Lakeside A added to list of zones under Mandatory Evacuation Warning. All previous mandatory evacu…
1091830947748601856,15937533,3058,101098,3196,818,97084,2008-08-21 21:58:24,14,0,2019-02-02 22:49:17,"RT @cityofcorona: SCE downed power line on Railroad, power outages in the area. Power restored to the Crossings &amp; Dos Lagos areas. SCE crew…"
1091821313457602561,15937533,3058,101098,3196,818,97084,2008-08-21 21:58:24,0,0,2019-02-02 22:11:00,Kartje: Patriots’ usual Super Bowl strategy no match for McVay and multifaceted Rams https://t.co/RWmBM8AZ1C
1091817676744347649,15937533,3058,101098,3196,818,97084,2008-08-21 21:58:24,0,0,2019-02-02 21:56:33,Opinion: Party of the people? Or the oligarchs? https://t.co/mrveNWqiV0
1091816492419579904,15937533,3058,101098,3196,818,97084,2008-08-21 21:58:24,4,0,2019-02-02 21:51:51,RT @KimGuim: Just got the emergency alert for the #Hemet area. Flash flood warnings through 4:30 p.m. #IEweather #LArain
1091812608032808960,15937533,3058,101098,3196,818,97084,2008-08-21 21:58:24,0,0,2019-02-02 21:36:25,11 Inland girls soccer teams seeded for CIF Southern Section playoffs https://t.co/Y5Zpd1mMO9
1091806657267388418,15937533,3058,101098,3196,818,97084,2008-08-21 21:58:24,6,0,2019-02-02 21:12:46,RT @RivCoTrans: Temescal Cyn Rd is CLOSED between Trilogy Pkwy and Glen Ivy Rd at 1:45pm.  #HolyFlood #RivCoNow
1091805553494503425,15937533,3058,101098,3196,818,97084,2008-08-21 21:58:24,0,1,2019-02-02 21:08:23,Super Bowl predictions from SCNG’s team in Atlanta https://t.co/dlgLkpKUwB
1091804507615313920,15937533,3058,101098,3196,818,97084,2008-08-21 21:58:24,20,0,2019-02-02 21:04:14,"RT @NWSSanDiego: A Flood Advisory has been issued for San Bernardino Co, western Riverside Co, and Orange County until 3:30 PM (areas highl…"
1091803842025418752,15937533,3058,101098,3196,818,97084,2008-08-21 21:58:24,9,0,2019-02-02 21:01:35,RT @CALFIRERRU: #HOLYFLOODWATCH Update - Horsethief B added to list of zones under Voluntary Evacuation Warning. All previous mandatory eva…
1091800230679457793,15937533,3058,101098,3196,818,97084,2008-08-21 21:58:24,0,3,2019-02-02 20:47:14,Four Inland boys soccer teams earn No. 1 seeds for CIF Southern Section playoffs https://t.co/fU0aTUqd9q
1091791496678965248,15937533,3058,101098,3196,818,97084,2008-08-21 21:58:24,1,1,2019-02-02 20:12:31,Here’s how much TV ratings for the Super Bowl and NFL soared https://t.co/349RRuqijp
1091790349096243200,15937533,3058,101098,3196,818,97084,2008-08-21 21:58:24,12,0,2019-02-02 20:07:58,"RT @MtBaldyFire: Very heavy rain occuring now, over 1"" an hour rate.  Use extreme caution if traveling on Mt Baldy Road."
1091790302459973632,15937533,3058,101098,3196,818,97084,2008-08-21 21:58:24,0,2,2019-02-02 20:07:47,Five Inland girls water polo teams seeded for CIF Southern Section playoffs https://t.co/6r37hkKpRC
1091787662854283264,15937533,3058,101098,3196,818,97084,2008-08-21 21:58:24,10,0,2019-02-02 19:57:17,RT @Brian_Rokos: CHP reporting that the cab of a big rig was hanging over the edge of the connector from the westbound 10 Freeway to the so…
1091782744324169729,15937533,3058,101098,3196,818,97084,2008-08-21 21:58:24,0,0,2019-02-02 19:37:45,Four Inland teams selected for CIF Southern Section Open Division boys basketball playoffs https://t.co/Kf0H6S2vkd
1091780334407028736,15937533,3058,101098,3196,818,97084,2008-08-21 21:58:24,0,0,2019-02-02 19:28:10,Will jet sweep be the play the Rams use to win the Super Bowl? https://t.co/4BysX88dM8
1091772250964062209,15937533,3058,101098,3196,818,97084,2008-08-21 21:58:24,0,1,2019-02-02 18:56:03,Riverside County Fair 2019: These are the performers playing the National Date Festival https://t.co/7svVEmu4XD
1091757731726401536,15937533,3058,101098,3196,818,97084,2008-08-21 21:58:24,0,0,2019-02-02 17:58:21,Planning to drink excessively at a Super Bowl party? Law enforcement will be hunting for you https://t.co/ZbmcP3g3au
1091751377284542464,15937533,3058,101098,3196,818,97084,2008-08-21 21:58:24,1,0,2019-02-02 17:33:06,Update: Man who sued Riverside hospital over wife’s death now accused of ripping it off https://t.co/YyRUdfRChg
1091750818712309760,15937533,3058,101098,3196,818,97084,2008-08-21 21:58:24,0,0,2019-02-02 17:30:53,"Santa Anita racing consensus picks for Saturday, Feb. 2 https://t.co/g3er8d3ImF"
1091749019515273216,15937533,3058,101098,3196,818,97084,2008-08-21 21:58:24,1,0,2019-02-02 17:23:44,Lake Elsinore woman sues Metrolink over husband’s death in Dana Point https://t.co/O0NOvu4AhX
1091744344586010624,15937533,3058,101098,3196,818,97084,2008-08-21 21:58:24,0,0,2019-02-02 17:05:10,Heisler: Lakers set to go every which way as Anthony Davis makes it official https://t.co/CEe6eqEuZl
1091741556191576069,15937533,3058,101098,3196,818,97084,2008-08-21 21:58:24,4,0,2019-02-02 16:54:05,"RT @rivcafire: Flash Flood Watch in effect from February 2, 07:00 AM PST until February 3, 12:00 AM PST. Be careful and take your time if y…"
1091741520007491584,15937533,3058,101098,3196,818,97084,2008-08-21 21:58:24,0,0,2019-02-02 16:53:56,"Hello, tax season! 6 tips to help you find a CPA https://t.co/pypwPh4U3X"
1091741368672645120,15937533,3058,101098,3196,818,97084,2008-08-21 21:58:24,72,0,2019-02-02 16:53:20,"RT @CAL_FIRE: #HolyFloodWatch - Mandatory Evacuation Orders have been issued for some areas of the Holy Fire burn scar. 
Visit https://t.co…"
1091727548222967808,15937533,3058,101098,3196,818,97084,2008-08-21 21:58:24,0,0,2019-02-02 15:58:25,"Getting a home picture-perfect takes muscle, smarts https://t.co/FYKmVLPdfF"
1091722163718144001,15937533,3058,101098,3196,818,97084,2008-08-21 21:58:24,1,1,2019-02-02 15:37:01,Rain prompts mandatory evacuations in Holy fire burn area; Disneyland closing early https://t.co/QXq4slZdHd
1091720950972891138,15937533,3058,101098,3196,818,97084,2008-08-21 21:58:24,0,0,2019-02-02 15:32:12,"High school football in California is taking a hit, even as Rams, Patriots produce stars from the Golden State https://t.co/QwuMDQxLcv"
1091715476315611136,15937533,3058,101098,3196,818,97084,2008-08-21 21:58:24,0,0,2019-02-02 15:10:27,Opinion: We need a bold vision for juvenile justice. Gov. Newsom’s plan falls short https://t.co/on0oTE1G35
1091634430941237249,15937533,3058,101098,3196,818,97084,2008-08-21 21:58:24,0,0,2019-02-02 09:48:24,Crafton Hills College welcomes its 9th president in 45-year history https://t.co/8zrmIQul4a
1091630342983860225,15937533,3058,101098,3196,818,97084,2008-08-21 21:58:24,0,0,2019-02-02 09:32:09,‘Surprise’ lawsuit threatened over discrimination complaint by former Redlands city manager https://t.co/c64Ix7cB0U
1091628081712910336,15937533,3058,101098,3196,818,97084,2008-08-21 21:58:24,1,2,2019-02-02 09:23:10,"Redlands East Valley High student arrested with firearm, ammunition at school, authorities say https://t.co/0swpTku8ct"
1091584921586618369,15937533,3058,101098,3196,818,97084,2008-08-21 21:58:24,0,0,2019-02-02 06:31:40,Mom sought in Indio pepper-spray abduction is arrested in Long Beach https://t.co/iOgXg2OMRa
1091584366608822272,15937533,3058,101098,3196,818,97084,2008-08-21 21:58:24,0,1,2019-02-02 06:29:28,Riverside carjacker still sought after vehicle is found https://t.co/XJ8jscEHQi
1091548622624382981,15937533,3058,101098,3196,818,97084,2008-08-21 21:58:24,1,1,2019-02-02 04:07:26,Man who sued Riverside hospital over wife’s death now accused of ripping it off https://t.co/osmGGtlNrx
1091543803654217729,15937533,3058,101098,3196,818,97084,2008-08-21 21:58:24,1,3,2019-02-02 03:48:17,About 100 Inland girls make history by joining Boy Scouts https://t.co/csnJo2Gq32
1091536973674831872,15937533,3058,101098,3196,818,97084,2008-08-21 21:58:24,0,0,2019-02-02 03:21:08,"Man struck, killed while attempting to cross freeway in Bloomington is identified https://t.co/1AoPulG9A9"
1091533391479144448,15937533,3058,101098,3196,818,97084,2008-08-21 21:58:24,1,1,2019-02-02 03:06:54,Report alleges Dodgers minor-leaguers of role in assault of woman at spring training in 2015 https://t.co/L1ZgNZ3NHa
1091525790238416902,15937533,3058,101098,3196,818,97084,2008-08-21 21:58:24,0,0,2019-02-02 02:36:42,USC men’s basketball looks to end road woes at Washington State https://t.co/3CHAqLWk4R
1091525419000578048,15937533,3058,101098,3196,818,97084,2008-08-21 21:58:24,0,0,2019-02-02 02:35:14,Opinion: Willie Brown sees protégés rise to the top https://t.co/drN3S23GcG
1091518779870334976,15937533,3058,101098,3196,818,97084,2008-08-21 21:58:24,0,1,2019-02-02 02:08:51,"Alexander: Should Lakers go all in for Anthony Davis? Absolutely, but … https://t.co/OlcVEexZCn"
1091518185453555712,15937533,3058,101098,3196,818,97084,2008-08-21 21:58:24,0,0,2019-02-02 02:06:29,Rams lineman Austin Blythe kept tight grip on starting job this season https://t.co/9sT8PDdFXB
1091517039229980672,15937533,3058,101098,3196,818,97084,2008-08-21 21:58:24,2,2,2019-02-02 02:01:56,"Mincing no words, forecasters say rain will pummel Southern California on Saturday https://t.co/DhNJ9W32CV"
1091507589098209280,15937533,3058,101098,3196,818,97084,2008-08-21 21:58:24,0,0,2019-02-02 01:24:23,Etiwanda girls basketball team chosen for Open Division playoffs; King gets passed over https://t.co/sgjBozAMaT
1091506986829664256,15937533,3058,101098,3196,818,97084,2008-08-21 21:58:24,0,1,2019-02-02 01:21:59,See ‘Life Meets Life! The Collision of Art and Biology’ exhibit at Mt. San Jacinto College https://t.co/qxuM2sAjcb
1091504627915411459,15937533,3058,101098,3196,818,97084,2008-08-21 21:58:24,0,0,2019-02-02 01:12:37,Rams Q&amp;A with Rich Hammond: Which unexpected player will step up in Super Bowl LIII? https://t.co/WqlXKqXkHj
1091504148707766272,15937533,3058,101098,3196,818,97084,2008-08-21 21:58:24,19,0,2019-02-02 01:10:42,RT @CALFIRERRU: Voluntary Evacuation warnings have been issued for some areas of the Holy Fire burn scar. Visist https://t.co/MmYQ2NXu6z to…
1091503535097872384,15937533,3058,101098,3196,818,97084,2008-08-21 21:58:24,0,0,2019-02-02 01:08:16,Foxconn again shifts Wisconsin plan after Trump intervenes https://t.co/QmwvhyyKee
1091497664829632513,15937533,3058,101098,3196,818,97084,2008-08-21 21:58:24,0,0,2019-02-02 00:44:56,How to have your home included in the Temecula Valley Woman’s Club’s Holiday Home Tour https://t.co/hFonbs1wPL
1091495910994071552,15937533,3058,101098,3196,818,97084,2008-08-21 21:58:24,0,0,2019-02-02 00:37:58,Whicker: James Develin is a Patriot who batters like a ram https://t.co/oLxjPLrU0J
1091492393000595456,15937533,3058,101098,3196,818,97084,2008-08-21 21:58:24,0,0,2019-02-02 00:24:00,UC Riverside men’s basketball stumbles against Cal Poly https://t.co/e96iq7HEee
1091491810730541057,15937533,3058,101098,3196,818,97084,2008-08-21 21:58:24,0,0,2019-02-02 00:21:41,Clippers are at a size disadvantage without Danilo Gallinari in the lineup https://t.co/SAQOcSBiuN
1091490441776766978,15937533,3058,101098,3196,818,97084,2008-08-21 21:58:24,1,1,2019-02-02 00:16:14,Opinion: It’s time to dump the role of elected sheriff https://t.co/DiFFJy0Qq0
1091483762674843650,15937533,3058,101098,3196,818,97084,2008-08-21 21:58:24,0,0,2019-02-01 23:49:42,UCLA men’s basketball gets major test at first-place Washington https://t.co/9hsv4meE8B
1091481076386725888,15937533,3058,101098,3196,818,97084,2008-08-21 21:58:24,0,0,2019-02-01 23:39:02,Los Angeles vs. New England: Who’s got a more ‘super’ economy? https://t.co/W2Ve4NcvEP
1091474366322364418,15937533,3058,101098,3196,818,97084,2008-08-21 21:58:24,0,1,2019-02-01 23:12:22,How Rams coach Sean McVay and QB Jared Goff formed winning bond from first meeting https://t.co/CXfJWOUYRL
1091473268240994304,15937533,3058,101098,3196,818,97084,2008-08-21 21:58:24,0,0,2019-02-01 23:08:00,"Sparks match offer sheet for Odyssey Sims, re-sign Karlie Samuelson https://t.co/d8X8gRXWHJ"
1091471870652755969,15937533,3058,101098,3196,818,97084,2008-08-21 21:58:24,0,0,2019-02-01 23:02:27,Cal State San Bernardino center reaches out to disabled Inland youths https://t.co/T68K0ZWsbm
1091469123283025921,15937533,3058,101098,3196,818,97084,2008-08-21 21:58:24,0,0,2019-02-01 22:51:32,"Analysis: Kings, in last place, know change is inevitable https://t.co/MrJk8ZXmvf"
1091469054978768897,15937533,3058,101098,3196,818,97084,2008-08-21 21:58:24,1,1,2019-02-01 22:51:15,"Cockroaches, no hot water: Restaurant closures in Riverside County, Jan. 24-31 https://t.co/8EnpwvJbPM"
1091468103626690560,15937533,3058,101098,3196,818,97084,2008-08-21 21:58:24,0,2,2019-02-01 22:47:29,"Another blue wave in 2020? Maybe, but it might skip California https://t.co/yxBcw3ICmR"
1091456590618734593,15937533,3058,101098,3196,818,97084,2008-08-21 21:58:24,1,3,2019-02-01 22:01:44,Changes to sexual harassment laws could open California employers to increased liability https://t.co/kmvz4WD7Z0
1091450464842014720,15937533,3058,101098,3196,818,97084,2008-08-21 21:58:24,0,0,2019-02-01 21:37:23,Inside the Rams podcast: Super Bowl LIII Edition from Atlanta https://t.co/HrykpJzthm
1091449054897287168,15937533,3058,101098,3196,818,97084,2008-08-21 21:58:24,0,1,2019-02-01 21:31:47,Big Brothers Big Sisters salutes two Riverside volunteers https://t.co/U5sU2sf0IO
1091447830261174273,15937533,3058,101098,3196,818,97084,2008-08-21 21:58:24,0,0,2019-02-01 21:26:55,"Overflowing wastewater, no hot water: Restaurant closures in San Bernardino County, Jan. 24-31 https://t.co/j8s8GGWlJV"
1091444874895941633,15937533,3058,101098,3196,818,97084,2008-08-21 21:58:24,0,0,2019-02-01 21:15:10,"Billions pile up in nuclear waste burial fund, but no permanent storage solution on the horizon https://t.co/SNEc8qwCCF"
1091437569051639809,15937533,3058,101098,3196,818,97084,2008-08-21 21:58:24,0,1,2019-02-01 20:46:09,Norte Vista boys soccer team wins sixth consecutive River Valley League championship https://t.co/y99KSdnkzj
1091433430448046080,15937533,3058,101098,3196,818,97084,2008-08-21 21:58:24,1,0,2019-02-01 20:29:42,Rams vs. New England Patriots in the Super Bowl: Who has the edge? https://t.co/XtdqYuQDvW
1091428907662929920,15937533,3058,101098,3196,818,97084,2008-08-21 21:58:24,1,2,2019-02-01 20:11:44,Former Riverside Community Hospital employee accused of embezzling nearly $3 million in medical supplies including… https://t.co/iaRNic9iwV
1091427780217032706,15937533,3058,101098,3196,818,97084,2008-08-21 21:58:24,15,0,2019-02-01 20:07:15,"RT @Rich_Hammond: OK, here we go...feel free to hit me with your questions. https://t.co/NKjzMLJLZ2"
1091424679485677569,15937533,3058,101098,3196,818,97084,2008-08-21 21:58:24,0,0,2019-02-01 19:54:55,LeBron James overcomes doubt in triumphant return for Lakers https://t.co/fjlpMhy6ap
1091422317031419904,15937533,3058,101098,3196,818,97084,2008-08-21 21:58:24,0,1,2019-02-01 19:45:32,Chargers’ Philip Rivers fights back tears in heartfelt speech to San Diego https://t.co/OjtGPpv2zq
1091420638613508096,15937533,3058,101098,3196,818,97084,2008-08-21 21:58:24,0,1,2019-02-01 19:38:52,Father-and-son boxing team help each other win in and out of the ring https://t.co/oVroSiNW3T
1091420337114415104,15937533,3058,101098,3196,818,97084,2008-08-21 21:58:24,0,1,2019-02-01 19:37:40,Zac Brown Band will headline two nights at FivePoint Amphitheater in Irvine https://t.co/LaGklLI6uQ
1091420312724561922,15937533,3058,101098,3196,818,97084,2008-08-21 21:58:24,0,2,2019-02-01 19:37:34,Rancho Cucamonga’s Hamilton Family Brewery takes on Boston brewery in battle of the Super Bowl beer cans https://t.co/1LRPwCyzsp
1091418871498723331,15937533,3058,101098,3196,818,97084,2008-08-21 21:58:24,0,0,2019-02-01 19:31:51,"Santa Anita racing consensus picks for Friday, Feb. 1 https://t.co/CV1oWpVTmK"
1091414696182321154,15937533,3058,101098,3196,818,97084,2008-08-21 21:58:24,0,0,2019-02-01 19:15:15,Alexander: Remembering the L.A. Rams’ unlikely first Super Bowl https://t.co/qHaA7WsMDi
1091413239072804867,15937533,3058,101098,3196,818,97084,2008-08-21 21:58:24,0,0,2019-02-01 19:09:28,"People are braving long lines right now at Disneyland — for a popcorn bucket, not a ride https://t.co/cOtz1DF8KQ"
1091407998604492801,15937533,3058,101098,3196,818,97084,2008-08-21 21:58:24,2,1,2019-02-01 18:48:38,Disneyland’s Space Mountain reopens after state investigation into man who climbed out of moving ride https://t.co/SrXWHfLE1b
1091404737990279169,15937533,3058,101098,3196,818,97084,2008-08-21 21:58:24,0,0,2019-02-01 18:35:41,Opinion: Will San Onofre spur a Yucca Mountain revival? https://t.co/Cv3bellvHW
1091398870591070209,15937533,3058,101098,3196,818,97084,2008-08-21 21:58:24,0,0,2019-02-01 18:12:22,Bishop Amat’s Marcos Polanco voted Southern California Boys Athlete of the Week https://t.co/IhSNvlTJ6x
1091398869223649280,15937533,3058,101098,3196,818,97084,2008-08-21 21:58:24,0,0,2019-02-01 18:12:22,Lakeside’s Jazlen Green voted Southern California Girls Athlete of the Week https://t.co/Pe8L99HWjb
1091388890471194624,15937533,3058,101098,3196,818,97084,2008-08-21 21:58:24,0,2,2019-02-01 17:32:43,Opinion: Gavin Newsom is right to order a DMV overhaul https://t.co/WQozHSnv6W
1091380964033478656,15937533,3058,101098,3196,818,97084,2008-08-21 21:58:24,0,0,2019-02-01 17:01:13,"10 strangest Super Bowl halftime moments: From Janet Jackson’s wardrobe malfunction and Left Shark to, well, you’ll… https://t.co/4VZo1uCHIF"
1091380961227563009,15937533,3058,101098,3196,818,97084,2008-08-21 21:58:24,0,0,2019-02-01 17:01:12,"Andy Gill of Gang of Four talks Trump, punk, politics and ‘Entertainment!’ at 40 https://t.co/q6Pe2hSfuP"
1091377961822052352,15937533,3058,101098,3196,818,97084,2008-08-21 21:58:24,1,6,2019-02-01 16:49:17,Not crazy about the Super Bowl? Southern California museums offer free admission this weekend https://t.co/FWMbG1aXjG
1091374125405343745,15937533,3058,101098,3196,818,97084,2008-08-21 21:58:24,0,0,2019-02-01 16:34:02,Think your rent is high? Inland retailers saw 13 percent hike in 2018 https://t.co/cWnUkUlmz5
1091366394099318785,15937533,3058,101098,3196,818,97084,2008-08-21 21:58:24,0,0,2019-02-01 16:03:19,Dante Fowler taking advantage of fresh start with Rams to get back on track https://t.co/dQ5JswfdQi
1091366394070003712,15937533,3058,101098,3196,818,97084,2008-08-21 21:58:24,0,0,2019-02-01 16:03:19,Analysis: Why the Ducks might not make any major moves the rest of the season https://t.co/l8cyiv5hvh
1091366298926362625,15937533,3058,101098,3196,818,97084,2008-08-21 21:58:24,0,0,2019-02-01 16:02:56,5 museum shows to see honoring Black History Month https://t.co/VhPSHalwqw
1091359286154928128,15937533,3058,101098,3196,818,97084,2008-08-21 21:58:24,0,0,2019-02-01 15:35:04,8 One Love Cali Reggae Fest must-see artists you might not know https://t.co/gPFjuxiXv3
1091344067324203008,15937533,3058,101098,3196,818,97084,2008-08-21 21:58:24,0,0,2019-02-01 14:34:36,How to use the Sip and Savor pass at Disney Lunar New Year https://t.co/3htGdrlA5I
1091327823007096833,15937533,3058,101098,3196,818,97084,2008-08-21 21:58:24,0,0,2019-02-01 13:30:03,New Jersey Democratic Sen. Cory Booker launches 2020 presidential bid https://t.co/q33cCBLocA
1091321254626377729,15937533,3058,101098,3196,818,97084,2008-08-21 21:58:24,2,1,2019-02-01 13:03:57,"Southern California has two of the top 5 on Yelp’s Top 100 Most Romantic Restaurants for 2019, a nationally ranked… https://t.co/9dja0VPwpw"
1091313704598163457,15937533,3058,101098,3196,818,97084,2008-08-21 21:58:24,1,1,2019-02-01 12:33:57,"Opinion: Community colleges offer value, quality education: Letters https://t.co/mq4QWsAFr9"
1091272195148525568,15937533,3058,101098,3196,818,97084,2008-08-21 21:58:24,1,0,2019-02-01 09:49:00,LAFC coach Bob Bradley sees ‘a lot of positives’ in exhibition victory over Japan’s Vissel Kobe https://t.co/Knkse9OAPA
1091264463314042880,15937533,3058,101098,3196,818,97084,2008-08-21 21:58:24,1,0,2019-02-01 09:18:17,Clippers argue OT defensive foul call on Boban Marjonovic added insult to injury https://t.co/ev7Z7p7VZE
1091236683390038016,15937533,3058,101098,3196,818,97084,2008-08-21 21:58:24,0,0,2019-02-01 07:27:54,Senior Living: How to choose cooking oils that are heart healthy https://t.co/AiLtYCTouG
1091230803667943424,15937533,3058,101098,3196,818,97084,2008-08-21 21:58:24,0,0,2019-02-01 07:04:32,Amazon has another ‘Prime’ holiday: Profit tops $3 billion https://t.co/e8oC4sg1dS
1091225651913330690,15937533,3058,101098,3196,818,97084,2008-08-21 21:58:24,0,0,2019-02-01 06:44:04,Super Bowl LIII: Live Q&amp;A with LA Rams beat reporter Rich Hammond https://t.co/A8L99oytPW
1091225651296776192,15937533,3058,101098,3196,818,97084,2008-08-21 21:58:24,0,0,2019-02-01 06:44:03,LeBron James one assist shy of a triple-double as Lakers edge Clippers in his return https://t.co/cA0MPBSRBd
1091225068380798976,15937533,3058,101098,3196,818,97084,2008-08-21 21:58:24,0,1,2019-02-01 06:41:44,Former UCR player Aaron Long earns U.S. Soccer team captaincy https://t.co/1VNgu25dX2
1091221354660155392,15937533,3058,101098,3196,818,97084,2008-08-21 21:58:24,0,3,2019-02-01 06:26:59,"Federal agents charge 19 for birth tourism in So Cal, say practice poses national threat https://t.co/n6WOb6Girh"
1091215788499820547,15937533,3058,101098,3196,818,97084,2008-08-21 21:58:24,4,0,2019-02-01 06:04:52,"Mom pepper-sprayed caseworker to abduct daughter, Indio police say https://t.co/J6gOMKQw8M"
1091212843213619202,15937533,3058,101098,3196,818,97084,2008-08-21 21:58:24,4,0,2019-02-01 05:53:10,Man arrested after attempted robbery at Riverside bank https://t.co/8KJcJnsRev
1091208228313141253,15937533,3058,101098,3196,818,97084,2008-08-21 21:58:24,0,0,2019-02-01 05:34:49,Centennial wraps up Big VIII boys basketball title with win over Roosevelt https://t.co/dFENQYUmBt
1091206437882212352,15937533,3058,101098,3196,818,97084,2008-08-21 21:58:24,0,0,2019-02-01 05:27:43,"IE Varsity scoreboard: Thursday, January 31 https://t.co/lCEFV9dCgd"
1091204112312664064,15937533,3058,101098,3196,818,97084,2008-08-21 21:58:24,2,0,2019-02-01 05:18:28,All Lake Elsinore Unified schools will be open Friday after 2 closed https://t.co/yT5r2ZC8NO
1091199524729745413,15937533,3058,101098,3196,818,97084,2008-08-21 21:58:24,0,0,2019-02-01 05:00:14,"Los Altos’ Jarod Lucas scores 52, becomes CIF-SS all-time scoring leader https://t.co/Q3q0unxvqH"
