1094742571262214144,15752446,1555,69415,757,1586,233291,2008-08-06 17:28:34,0,0,2019-02-10 23:39:02,Just Ask Us: How old do my children have to be before they can legally stay home alone? https://t.co/fHMGqp1xdV https://t.co/jRNgVM5tqV
1094740310662377472,15752446,1555,69415,757,1586,233291,2008-08-06 17:28:34,0,0,2019-02-10 23:30:04,Cynthia Tucker: We seem to need a blackface history month https://t.co/XNmbYn0ujs | opinion https://t.co/1YhUMnP0WE
1094733012644720641,15752446,1555,69415,757,1586,233291,2008-08-06 17:28:34,0,0,2019-02-10 23:01:04,"Fight at home in Windsor leads to Saturday night stabbing, Sheriff's Office says https://t.co/i34ES6E75U https://t.co/euZ7iBR6k0"
1094718410015961088,15752446,1555,69415,757,1586,233291,2008-08-06 17:28:34,0,1,2019-02-10 22:03:02,"SOS: Phone back, satellite equipment gone, and no trip to roof for 73-year-old https://t.co/8w1djlti5q https://t.co/jbuC5mxqTf"
1094710230687002625,15752446,1555,69415,757,1586,233291,2008-08-06 17:28:34,0,0,2019-02-10 21:30:32,Madison sends out trucks to plow and salt roads as snow falls across area https://t.co/9tFinXIjNR https://t.co/5o1y1ViOAi
1094704069506039809,15752446,1555,69415,757,1586,233291,2008-08-06 17:28:34,0,0,2019-02-10 21:06:03,The 25 cities with the most single parents https://t.co/0Ry2IOtBSZ https://t.co/3StmCq5nrw
1094702686073610240,15752446,1555,69415,757,1586,233291,2008-08-06 17:28:34,0,0,2019-02-10 21:00:33,"Man dies in Green Lake County house fire Sunday morning, sheriff's office says https://t.co/iycAdFHNSQ https://t.co/xhK1hnFuMk"
1094687741915279360,15752446,1555,69415,757,1586,233291,2008-08-06 17:28:34,0,0,2019-02-10 20:01:10,"Winter Storm Watch for Sauk, Columbia, Dodge, Iowa, Dane, Jefferson, Lafayette, Green and Rock County in WI until 1… https://t.co/baIfyK4tE0"
1094677142074417152,15752446,1555,69415,757,1586,233291,2008-08-06 17:28:34,0,0,2019-02-10 19:19:03,"Hands on Wisconsin: For President Trump, it was the right to reform the criminal justice system.… https://t.co/Dm0OaxhjQZ"
1094673621107134465,15752446,1555,69415,757,1586,233291,2008-08-06 17:28:34,0,1,2019-02-10 19:05:03,17 fictional characters with stars on the Hollywood Walk of Fame https://t.co/flBfGElRFY https://t.co/9pq2qp3fqa
1094672863024410625,15752446,1555,69415,757,1586,233291,2008-08-06 17:28:34,0,1,2019-02-10 19:02:03,Roll Call: Key votes from the Wisconsin congressional delegation this week https://t.co/bC5vsUHt4C https://t.co/DQA6x6ePex
1094657509762031616,15752446,1555,69415,757,1586,233291,2008-08-06 17:28:34,1,1,2019-02-10 18:01:02,"At 80, famed composer John Harbison celebrates with more music https://t.co/nMvxdotW0j https://t.co/Km4zcbtgg7"
1094620018241728512,15752446,1555,69415,757,1586,233291,2008-08-06 17:28:34,0,0,2019-02-10 15:32:04,"WIAA team wrestling: Top-ranked Stoughton, Janesville Craig and Waunakee qualify for Division 1 sectionals… https://t.co/z78r8NNNdm"
1094615987750498305,15752446,1555,69415,757,1586,233291,2008-08-06 17:28:34,0,1,2019-02-10 15:16:03,From Henry VIII to Harry and Meghan: How the royals' rules on divorce have evolved https://t.co/QSvrLTMADl https://t.co/RnvLlXweCH
1094613473571434496,15752446,1555,69415,757,1586,233291,2008-08-06 17:28:34,0,1,2019-02-10 15:06:03,Winning caption has numb cerebral cortex https://t.co/lOd0v50iHJ | opinion https://t.co/g13n7Jko5b
1094597743903879168,15752446,1555,69415,757,1586,233291,2008-08-06 17:28:34,2,3,2019-02-10 14:03:33,Wisconsin is finally serious about fixing its roads https://t.co/HItUykUHjg | opinion https://t.co/NaJqTAXnbi
1094597241812090881,15752446,1555,69415,757,1586,233291,2008-08-06 17:28:34,0,2,2019-02-10 14:01:33,Garden calendar: For the week of Feb. 10 https://t.co/AhbgU6FCU9 https://t.co/G9Cva7zNA6
1094574338571853824,15752446,1555,69415,757,1586,233291,2008-08-06 17:28:34,0,0,2019-02-10 12:30:33,Southern Wisconsin neighbors: Obituaries published today https://t.co/9rOa5UfcuT https://t.co/ofnpAwXMj8
1094570691297304576,15752446,1555,69415,757,1586,233291,2008-08-06 17:28:34,0,1,2019-02-10 12:16:03,"After 2 years out of baseball, former top draft pick Brett Lawrie says he's rejoined Brewers https://t.co/KQKMDC2SbE https://t.co/7FC5rCaYd1"
1094569177552117763,15752446,1555,69415,757,1586,233291,2008-08-06 17:28:34,1,0,2019-02-10 12:10:02,BREAKING: Personal political views return to Supreme Court debate https://t.co/d1ccnOVscg https://t.co/nFcL4UahyR
1094566664627081216,15752446,1555,69415,757,1586,233291,2008-08-06 17:28:34,0,0,2019-02-10 12:00:03,"Today In History, Feb. 10: Mike Tyson https://t.co/3gIDqSIsWz https://t.co/oI2oqFD2AG"
1094562888310636544,15752446,1555,69415,757,1586,233291,2008-08-06 17:28:34,0,0,2019-02-10 11:45:03,"Today's Birthdays, Feb. 10: Greg Norman https://t.co/hmDpB7riiN https://t.co/oUZK1xAAUi"
1094562507224576005,15752446,1555,69415,757,1586,233291,2008-08-06 17:28:34,0,0,2019-02-10 11:43:32,Freshman Jasmine Hale learning the ropes with UW women's basketball team https://t.co/C7ci684lwq https://t.co/B0hUWifKZA
1094560251745988610,15752446,1555,69415,757,1586,233291,2008-08-06 17:28:34,0,0,2019-02-10 11:34:34,Tom Oates: Brewers have questions to answer when spring training opens https://t.co/djVRIVxKod https://t.co/ktiT0WFXSy
1094559115534159873,15752446,1555,69415,757,1586,233291,2008-08-06 17:28:34,0,0,2019-02-10 11:30:03,Birthday Highlight: Laura Dern https://t.co/Es7G3rpUSx https://t.co/h9UppvfSUB
1094555848351739905,15752446,1555,69415,757,1586,233291,2008-08-06 17:28:34,0,0,2019-02-10 11:17:04,Whimsical jewelry and 'magic' color at Prairie du Sac gallery https://t.co/3ijHEZuGhs https://t.co/yhM7ScneE8
1094555843503116290,15752446,1555,69415,757,1586,233291,2008-08-06 17:28:34,1,0,2019-02-10 11:17:03,"Madison-based Nordic acquires Canadian firm, Healthtech Consultants https://t.co/zMETVNSAGR https://t.co/sh0mALxe6X"
1094552190994210816,15752446,1555,69415,757,1586,233291,2008-08-06 17:28:34,0,0,2019-02-10 11:02:32,DeForest company that provides dental exams for troops expanding https://t.co/lln6qj3IOg https://t.co/GHSpAnQxuN
1094537345645178882,15752446,1555,69415,757,1586,233291,2008-08-06 17:28:34,0,4,2019-02-10 10:03:33,"NBA All-Star coaches Mike Budenholzer, Michael Malone have come a long way in a year https://t.co/XmkPMJKhBN https://t.co/AqBg7f2ZC0"
1094521868550168577,15752446,1555,69415,757,1586,233291,2008-08-06 17:28:34,0,0,2019-02-10 09:02:03,"Review: Daniel Radcliffe aside, 'Miracle Workers' looks familiar https://t.co/Ox7DmRJqER https://t.co/dwxQ0ntjF7"
1094465246041796608,15752446,1555,69415,757,1586,233291,2008-08-06 17:28:34,0,1,2019-02-10 05:17:03,Wisconsin Badgers swept in men's hockey series by Ohio State https://t.co/lvK0hrn79r https://t.co/qZLAcvylQU
1094460084531343361,15752446,1555,69415,757,1586,233291,2008-08-06 17:28:34,0,0,2019-02-10 04:56:32,"Minues Giannis Antetokounmpo, Bucks fall to Magic https://t.co/chkM0mr52d https://t.co/52uJ8W9pum"
1094446999296831488,15752446,1555,69415,757,1586,233291,2008-08-06 17:28:34,3,3,2019-02-10 04:04:33,Photos: UW Hockey retires Mark Johnson's jersey before game against OSU https://t.co/oT4mL4FGGq https://t.co/Q5E4dD37wA
1094446886755291136,15752446,1555,69415,757,1586,233291,2008-08-06 17:28:34,0,0,2019-02-10 04:04:06,"Nate Frucht, Madison Edgewood stand atop WIAA Division 1 Baraboo boys swimming sectional https://t.co/FSQK1Q42ex https://t.co/LZabiCR7uY"
1094434413205573632,15752446,1555,69415,757,1586,233291,2008-08-06 17:28:34,0,2,2019-02-10 03:14:32,Prep roundup: Madison West edges Middleton by half a point in boys swimming sectional https://t.co/hk1mVcTbVt https://t.co/6LIgyJIQ55
1094408621775962112,15752446,1555,69415,757,1586,233291,2008-08-06 17:28:34,0,0,2019-02-10 01:32:03,Esther Cepeda: The labor of illegal immigrants is the motor of America https://t.co/lfaq2Dqbr4 | opinion https://t.co/l1CZVRzuQU
1094387734024581125,15752446,1555,69415,757,1586,233291,2008-08-06 17:28:34,0,0,2019-02-10 00:09:03,"'Rosewell, New Mexico' drinks in the town's atmosphere https://t.co/eYXNhDrXFQ https://t.co/qb2bjqPLLe"
1094382072582393856,15752446,1555,69415,757,1586,233291,2008-08-06 17:28:34,0,1,2019-02-09 23:46:33,Freshman Nicole LaMantia scores first collegiate goal to trigger Wisconsin Badgers women's hockey team to rout of M… https://t.co/9cXSrpMyGZ
1094379934175219713,15752446,1555,69415,757,1586,233291,2008-08-06 17:28:34,2,1,2019-02-09 23:38:03,Fans take to Twitter to weigh in on Badgers' loss to Wolverines https://t.co/uSqyS0pV86 https://t.co/LR2NbI0EDQ
1094377166110769152,15752446,1555,69415,757,1586,233291,2008-08-06 17:28:34,0,1,2019-02-09 23:27:03,Government should leave the telegraph alone -- State Journal editorial from 150 years ago https://t.co/kd85la4jeH |… https://t.co/cO3UUnXxLN
1094371382039740416,15752446,1555,69415,757,1586,233291,2008-08-06 17:28:34,2,1,2019-02-09 23:04:04,Wisconsin Badgers' guard Brad Davison in spotlight again after costly foul in loss at Michigan… https://t.co/WAKRKShFeP
1094363070757888002,15752446,1555,69415,757,1586,233291,2008-08-06 17:28:34,0,0,2019-02-09 22:31:03,EAGLE school 5th grader takes first place in All-City Spelling Bee https://t.co/PQTkBtsj2b https://t.co/rkpzQuwZ6L
1094361435793121280,15752446,1555,69415,757,1586,233291,2008-08-06 17:28:34,0,0,2019-02-09 22:24:33,Ben Bromley: How to talk like a cheesehead https://t.co/hUMsGbZNf9 | opinion https://t.co/DUsrDHIjM7
1094358040810143750,15752446,1555,69415,757,1586,233291,2008-08-06 17:28:34,0,2,2019-02-09 22:11:03,11 actresses who are also British dames https://t.co/dVKQIZEMs8 https://t.co/GxjTXiFeZL
1094332874793218048,15752446,1555,69415,757,1586,233291,2008-08-06 17:28:34,1,1,2019-02-09 20:31:03,"Photos: No. 7 Michigan Wolverines 61, No. 19 Wisconsin Badgers 52 https://t.co/Gj4i0nhld4 https://t.co/dTRg99gcLc"
1094331410989473792,15752446,1555,69415,757,1586,233291,2008-08-06 17:28:34,0,0,2019-02-09 20:25:14,Flood Warning for Rock County in WI. https://t.co/Ro5TV7R7kb #wiwx
1094317270103277568,15752446,1555,69415,757,1586,233291,2008-08-06 17:28:34,0,1,2019-02-09 19:29:03,BREAKING: Wisconsin Badgers come up short in 61-52 loss to Michigan Wolverines https://t.co/wcxpOknPSi https://t.co/VAbcazlo8E
1094296635281092609,15752446,1555,69415,757,1586,233291,2008-08-06 17:28:34,2,3,2019-02-09 18:07:03,"BREAKING: Wisconsin utilities and environmental groups unite behind solar, but regulators question value… https://t.co/tcjSq4TRtQ"
1094282793087954945,15752446,1555,69415,757,1586,233291,2008-08-06 17:28:34,0,1,2019-02-09 17:12:03,"Rep. Daniel Riemer: Middle-class tax cut must be responsible, roll back giveaway to millionaires… https://t.co/r4tAPMycz5"
1094266812747808768,15752446,1555,69415,757,1586,233291,2008-08-06 17:28:34,1,2,2019-02-09 16:08:33,"Rep. Jim Steineke: GOP surplus should reduce, not shift, state's tax burden https://t.co/X2xgTwH6b7 | opinion https://t.co/xulorhXTCj"
1094266183488917509,15752446,1555,69415,757,1586,233291,2008-08-06 17:28:34,3,4,2019-02-09 16:06:03,How to buy a private island https://t.co/mkNjzBOwz6 https://t.co/eozhNrSjnv
1094246550216134657,15752446,1555,69415,757,1586,233291,2008-08-06 17:28:34,1,2,2019-02-09 14:48:02,Week in review: Top photos of the week from AP https://t.co/m5T176qGmP https://t.co/738n3Vsds2
1094239009268686850,15752446,1555,69415,757,1586,233291,2008-08-06 17:28:34,0,0,2019-02-09 14:18:04,"Candidate Q&amp;A: Madison School Board, Seat 4 https://t.co/T3ZxATSI0K https://t.co/3AvMoyK3jm"
1094235358609301504,15752446,1555,69415,757,1586,233291,2008-08-06 17:28:34,1,2,2019-02-09 14:03:34,"'It is like Tinder, but with dogs.' A look at some of this week's weirdest news https://t.co/52giZOH92E https://t.co/5z5xgNAOvs"
1094235353664212992,15752446,1555,69415,757,1586,233291,2008-08-06 17:28:34,0,0,2019-02-09 14:03:32,Candidate Q&amp;A: Madison City Council District 13 https://t.co/oenZEx60y6 https://t.co/w5auesceUS
1094224163286347776,15752446,1555,69415,757,1586,233291,2008-08-06 17:28:34,0,1,2019-02-09 13:19:04,DVD review: Tiffany Haddish can't save 'Nobody's Fool' https://t.co/WNupKPjEu6 https://t.co/C11HPlrPRz
1094220632215105536,15752446,1555,69415,757,1586,233291,2008-08-06 17:28:34,4,3,2019-02-09 13:05:03,Growth of private school voucher program impacts public school funds https://t.co/ZkgOvB9pSi https://t.co/ZIN27QhRd6
1094213350328754176,15752446,1555,69415,757,1586,233291,2008-08-06 17:28:34,0,0,2019-02-09 12:36:06,Southern Wisconsin neighbors: Obituaries published today https://t.co/0O4uebqBQh https://t.co/CkxaDIs1Mu
1094209558606532609,15752446,1555,69415,757,1586,233291,2008-08-06 17:28:34,3,8,2019-02-09 12:21:02,Our Best Pics of the Week: Lady Liberty and Deep Freezes https://t.co/zHxzWhCaj1 https://t.co/sMxGUVyNuG
1094205532926177281,15752446,1555,69415,757,1586,233291,2008-08-06 17:28:34,1,1,2019-02-09 12:05:03,Don’t Forget — 10 Valentine’s Day Gifts For That Special Someone https://t.co/5XBudxXEBW https://t.co/AiDo47DOLx
1094201633431478272,15752446,1555,69415,757,1586,233291,2008-08-06 17:28:34,1,2,2019-02-09 11:49:33,"Today In History, Feb. 9: ""Ed Sullivan Show"" https://t.co/e8dZxOGxZu https://t.co/0PY1J2v6z7"
1094198484763201536,15752446,1555,69415,757,1586,233291,2008-08-06 17:28:34,0,2,2019-02-09 11:37:02,Know Your Madisonian: Instant hot cocoa drinkers have Charles Sanna to thank https://t.co/yt03qX8miw https://t.co/ktx9qWF8E5
1094197858620690434,15752446,1555,69415,757,1586,233291,2008-08-06 17:28:34,0,0,2019-02-09 11:34:33,"Today's Birthdays, Feb. 9: Mia Farrow https://t.co/M9sz70wqQE https://t.co/HTDnu3JPrg"
1094193707484495872,15752446,1555,69415,757,1586,233291,2008-08-06 17:28:34,1,2,2019-02-09 11:18:03,Milwaukee Bucks trade for Nikola Mirotic all about playoffs https://t.co/rsO8gFD0y2 https://t.co/tWxIi3Q4ML
1094174582154551297,15752446,1555,69415,757,1586,233291,2008-08-06 17:28:34,1,7,2019-02-09 10:02:03,High hopes as Milwaukee Brewers begin spring training https://t.co/YQtQEN0x9B https://t.co/uXXXbXRd4n
1094160107947012096,15752446,1555,69415,757,1586,233291,2008-08-06 17:28:34,1,0,2019-02-09 09:04:32,"Madison area prep results from Friday, February 8, 2019 https://t.co/a6YGEuFZDv https://t.co/rJ9B48yRPA"
1094112044792442880,15752446,1555,69415,757,1586,233291,2008-08-06 17:28:34,0,1,2019-02-09 05:53:33,Nevaehia Boston's late putback in overtime sends Madison East girls basketball team past Sun Prairie… https://t.co/OCi7ZqdtTi
1094110915287343104,15752446,1555,69415,757,1586,233291,2008-08-06 17:28:34,0,0,2019-02-09 05:49:04,Badgers men's hockey team falls into last place after OT loss to Ohio State https://t.co/7EEgD8yKwP https://t.co/JZdlkixpBQ
1094110910153613312,15752446,1555,69415,757,1586,233291,2008-08-06 17:28:34,2,2,2019-02-09 05:49:03,Giannis Antetokounmpo's double-double leads Bucks past Mavericks for sixth straight win https://t.co/6CwfQd6XxS https://t.co/8jAZZzcU0j
1094081843475886080,15752446,1555,69415,757,1586,233291,2008-08-06 17:28:34,0,3,2019-02-09 03:53:33,"Photos: Madison East 62, Sun Prairie 61 https://t.co/vHAMV2ZSqi https://t.co/Jg7JvXJAvN"
1094028619125379072,15752446,1555,69415,757,1586,233291,2008-08-06 17:28:34,3,7,2019-02-09 00:22:03,Public lands board repeals ban on staff climate change advocacy https://t.co/JWoOTag7Rm https://t.co/Wz9FYZSoxp
1094023967260606464,15752446,1555,69415,757,1586,233291,2008-08-06 17:28:34,0,1,2019-02-09 00:03:34,"Police: 2 caught with drugs, $8,000-plus during traffic stop in Black River Falls https://t.co/kiERmUZMZ0 https://t.co/pd0ijmtHgG"
1094023023764463616,15752446,1555,69415,757,1586,233291,2008-08-06 17:28:34,0,0,2019-02-08 23:59:49,Flood Warning for Green County in WI. https://t.co/Ro5TV7R7kb #wiwx
1094016540200980481,15752446,1555,69415,757,1586,233291,2008-08-06 17:28:34,1,5,2019-02-08 23:34:03,"Bees can do basic math, scientists say https://t.co/DDdkDecYDY https://t.co/xtrsuYSvJT"
1094014776668123141,15752446,1555,69415,757,1586,233291,2008-08-06 17:28:34,0,0,2019-02-08 23:27:03,Seattle Times: A thoughtful approach to school safety https://t.co/XLSVLebBGA | opinion https://t.co/1wajMQjTj5
1094009239213752320,15752446,1555,69424,757,1586,233291,2008-08-06 17:28:34,0,0,2019-02-08 23:05:02,Reedsburg business one of few places accepting old electronics https://t.co/9RCDNEmhoZ https://t.co/VGpoGlJAAs
1094002071185936384,15752446,1555,69424,757,1586,233291,2008-08-06 17:28:34,0,0,2019-02-08 22:36:34,Prep notes: Monona Grove names Amanda Klassman as softball coach; Beaver Dam's Cade Ferron among area athletes maki… https://t.co/xBM5DYswn1
1094001437934153728,15752446,1555,69424,757,1586,233291,2008-08-06 17:28:34,0,0,2019-02-08 22:34:03,"Racine Horlick student, 18, accused of sexual assault of girl, 15, in school stairwell https://t.co/Bv6OF7VvGc https://t.co/YMLZjGiH4y"
1093993890351333377,15752446,1555,69424,757,1586,233291,2008-08-06 17:28:34,0,1,2019-02-08 22:04:03,"What's in the Green New Deal? The Democrats' resolution, explained https://t.co/0kjGcCe38M https://t.co/kJ4Mcyxe1N"
1093988356839460865,15752446,1555,69424,757,1586,233291,2008-08-06 17:28:34,3,4,2019-02-08 21:42:04,"Study: transition to renewable energy could create 162,000 jobs in Wisconsin https://t.co/oEPz9WKZ2O https://t.co/IyxXzlusiM"
1093983442943893504,15752446,1555,69424,757,1586,233291,2008-08-06 17:28:34,0,0,2019-02-08 21:22:32,Kathleen Parker: Yearbook politics shouldn't sink Ralph Northam https://t.co/BWZkOHqTy8 | opinion https://t.co/EzVW2a4a8p
1093978542486937601,15752446,1555,69424,757,1586,233291,2008-08-06 17:28:34,0,0,2019-02-08 21:03:04,Here are 14 things to know about the 2019 Grammy Awards https://t.co/bI7N8zk6R4 https://t.co/UknEQEtH1H
1093970744092971010,15752446,1555,69424,757,1586,233291,2008-08-06 17:28:34,0,0,2019-02-08 20:32:05,ETC co-founder and CEO Fred Foster dies https://t.co/outb4gsjvp https://t.co/oTiBMuxmgh
1093964957639569408,15752446,1555,69424,757,1586,233291,2008-08-06 17:28:34,0,0,2019-02-08 20:09:05,"Wisconsin's Dean Oliver, Michigan's Luke Yaklich together again Saturday in Ann Arbor https://t.co/XtoK0cmQWE https://t.co/2vud4wEd2e"
1093964950052061184,15752446,1555,69424,757,1586,233291,2008-08-06 17:28:34,0,0,2019-02-08 20:09:03,Mills Hall recording in the running for Grammy Award https://t.co/BamifU1WtM https://t.co/PjjCFnuNKO
1093959977729835008,15752446,1555,69424,757,1586,233291,2008-08-06 17:28:34,0,0,2019-02-08 19:49:18,"Woman gets 13 months in jail for fatal gun incident, other crimes https://t.co/CWpPYktgfH https://t.co/hBe2nalz24"
1093954886440341504,15752446,1555,69424,757,1586,233291,2008-08-06 17:28:34,0,0,2019-02-08 19:29:04,"Sweet talking thief sought in southern Wisconsin, Green County Sheriff said https://t.co/TOf8rLNmFW https://t.co/qGbmug9OTz"
1093951368946044929,15752446,1555,69424,757,1586,233291,2008-08-06 17:28:34,0,0,2019-02-08 19:15:05,The 25 cities investing the most in new housing https://t.co/sZSMH5YELW https://t.co/BBUWzABVkO
1093950982520594432,15752446,1555,69424,757,1586,233291,2008-08-06 17:28:34,0,0,2019-02-08 19:13:33,Top 10 legislator per diem payouts for 2018 https://t.co/MPNkmRSAdE https://t.co/fu8xpbYcZR
1093947584270364672,15752446,1555,69424,757,1586,233291,2008-08-06 17:28:34,0,3,2019-02-08 19:00:03,Zoo will name cockroach after your ex and feed it to meerkat for Valentine's Day https://t.co/CdrDCPH5jD https://t.co/wCUJ4Iij67
1093944566267297792,15752446,1555,69424,757,1586,233291,2008-08-06 17:28:34,1,0,2019-02-08 18:48:03,Prep football: WIAA and state coaches release an updated version of their conference realignment plan… https://t.co/CfOsNyORsq
1093940039141052417,15752446,1555,69424,757,1586,233291,2008-08-06 17:28:34,1,1,2019-02-08 18:30:04,"State champion Waterford wrestler Hayden Halter, family file lawsuit against WIAA over disqualification… https://t.co/99uuUki5qg"
1093938276094754817,15752446,1555,69424,757,1586,233291,2008-08-06 17:28:34,0,1,2019-02-08 18:23:04,"Water main break closes Sun Prairie school, 2nd time this week https://t.co/y4Kork18pc https://t.co/MdYIHiyqmn"
1093936014463102978,15752446,1555,69424,757,1586,233291,2008-08-06 17:28:34,0,0,2019-02-08 18:14:04,Memories important but relationships mean more to former Wisconsin Badgers assistant Grant Standbrook… https://t.co/0NxTk8AAxT
1093936009262166016,15752446,1555,69424,757,1586,233291,2008-08-06 17:28:34,0,0,2019-02-08 18:14:03,Boiling water challenge sends people to hospital https://t.co/ORTlMeroMM https://t.co/eKTxoI76Sh
1093932359437639680,15752446,1555,69415,757,1586,233291,2008-08-06 17:28:34,0,0,2019-02-08 17:59:33,"Photos: Remembering Albert Finney, 1936-2019 https://t.co/20jPeYM2Mh https://t.co/98WTISXQ4l"
1093929843731791873,15752446,1555,69415,757,1586,233291,2008-08-06 17:28:34,0,0,2019-02-08 17:49:33,Who makes what at the University of Wisconsin? Search employee salaries here https://t.co/Gwq5FJBAhw https://t.co/TnwrdeD0Qo
1093928710720245760,15752446,1555,69415,757,1586,233291,2008-08-06 17:28:34,0,0,2019-02-08 17:45:03,"MOVIE REVIEWS: 'Lego Movie 2,' 'What Men Want' &amp; 'Cold Pursuit' https://t.co/SksMXy1gfT https://t.co/uwm3rTp4tA"
1093923934221684736,15752446,1555,69415,757,1586,233291,2008-08-06 17:28:34,3,2,2019-02-08 17:26:04,"Boy, 9, called 911 because of early bedtime, then wrote apology to Madison police https://t.co/jWHqUqOlEq https://t.co/mRg8IjISRe"
1093921032837070849,15752446,1555,69415,757,1586,233291,2008-08-06 17:28:34,0,0,2019-02-08 17:14:32,Photos: Here's what 10 feet of snow looks like https://t.co/MlrRbK84OT https://t.co/626UqVvaSs
1093920407885774848,15752446,1555,69415,757,1586,233291,2008-08-06 17:28:34,0,0,2019-02-08 17:12:03,"The stalemate of the union is strong, in Nate Beeler's latest political cartoon https://t.co/FjJtPUZPfJ | opinion https://t.co/myAhVLMMiC"
1093916377742622721,15752446,1555,69415,757,1586,233291,2008-08-06 17:28:34,0,0,2019-02-08 16:56:03,"BREAKING: Police chief: Car thefts way up in Madison, most had keys in car https://t.co/kb2ivFvNZ0 https://t.co/4SfZYhjN4w"
1093905431842287617,15752446,1555,69415,757,1586,233291,2008-08-06 17:28:34,0,1,2019-02-08 16:12:33,"Car thefts way up in Madison, most had keys in car, police chief said https://t.co/JCcop3TWBJ https://t.co/Ndn9zrHMvN"
1093904057540853760,15752446,1555,69415,757,1586,233291,2008-08-06 17:28:34,3,5,2019-02-08 16:07:05,Dane County Humane Society opens thrift store https://t.co/rlYTA6quoq https://t.co/DDXldL3bpH
1093904048279891969,15752446,1555,69415,757,1586,233291,2008-08-06 17:28:34,0,1,2019-02-08 16:07:03,Get ready as No. 19 Wisconsin Badgers prepare to take on No. 7 Michigan Wolverines https://t.co/VzJ6Boy39K https://t.co/ibWpa0IjFk
1093898262782795777,15752446,1555,69415,757,1586,233291,2008-08-06 17:28:34,0,0,2019-02-08 15:44:04,Today’s top pics: Leaping for win at Speedskating Worlds and more https://t.co/7ipkXMt29S https://t.co/kYoOcMbbxp
1093894484037791744,15752446,1555,69415,757,1586,233291,2008-08-06 17:28:34,1,1,2019-02-08 15:29:03,Report: Brewers sign veteran right-hander Josh Tomlin https://t.co/bsj70Xq9ca https://t.co/v5kI5cZhE3
1093890220901031936,15752446,1555,69415,757,1586,233291,2008-08-06 17:28:34,1,1,2019-02-08 15:12:06,Here's where you can find the pizza capitals of America https://t.co/8BohfWwg02 https://t.co/obCxg5m06u
1093888950228275200,15752446,1555,69415,757,1586,233291,2008-08-06 17:28:34,0,1,2019-02-08 15:07:03,Top 10 signs it's winter in Wisconsin https://t.co/yPHyQPhrFY https://t.co/XHiXrnycKL
1093886434094723074,15752446,1555,69415,757,1586,233291,2008-08-06 17:28:34,2,1,2019-02-08 14:57:03,"UW-Madison launches review of fraternities, sororities https://t.co/wG8rR5psuq https://t.co/A48BSyXlOH"
1093882906005581825,15752446,1555,69415,757,1586,233291,2008-08-06 17:28:34,0,0,2019-02-08 14:43:02,Police: Two arrested in string of Madison armed robberies https://t.co/XF0UqruPmY https://t.co/k7BHBsLwmx
1093882660047310850,15752446,1555,69415,757,1586,233291,2008-08-06 17:28:34,0,1,2019-02-08 14:42:04,Videos: LeBron James' triple-double leads Lakers upset of Celtics: Breaking down the latest in sports… https://t.co/5gRfFEw6wK
1093874857253588992,15752446,1555,69415,757,1586,233291,2008-08-06 17:28:34,0,1,2019-02-08 14:11:03,"Chipping out of the ice as bitterly cold temps cover Wisconsin, snow coming Sunday https://t.co/mIWQpBLdqT https://t.co/HtluTlOVbA"
1093874852904165378,15752446,1555,69415,757,1586,233291,2008-08-06 17:28:34,0,1,2019-02-08 14:11:02,Make your own sweets this Valentine’s Day https://t.co/WicxpGBgvd https://t.co/CSCQ2FFMJp
1093873098435133440,15752446,1555,69415,757,1586,233291,2008-08-06 17:28:34,0,0,2019-02-08 14:04:04,New York Times: Venezuela's crisis spreads beyond its borders https://t.co/NfrbOtyixc | opinion https://t.co/YovwjjzMZb
1093866927422824448,15752446,1555,69415,757,1586,233291,2008-08-06 17:28:34,0,0,2019-02-08 13:39:33,"Acting AG set for highly anticipated Congressional testimony, and 9 more things to know for Friday… https://t.co/xCP7SsgPjm"
1093863155892072448,15752446,1555,69415,757,1586,233291,2008-08-06 17:28:34,0,1,2019-02-08 13:24:34,"BREAKING: 10 killed, 3 injured as fire tears through Brazilian soccer team complex https://t.co/Y1ECgVmuXI https://t.co/3BUuBL30eD"
1093863152029061120,15752446,1555,69415,757,1586,233291,2008-08-06 17:28:34,0,0,2019-02-08 13:24:33,"10 killed, 3 injured as fire tears through Brazilian soccer team complex https://t.co/Y1ECgVmuXI https://t.co/HGD1S3s1jK"
1093851705274322944,15752446,1555,69415,757,1586,233291,2008-08-06 17:28:34,0,0,2019-02-08 12:39:03,Southern Wisconsin neighbors: Obituaries published today https://t.co/gkglqAVKRi https://t.co/eo8HP6oWKV
1093844278642597888,15752446,1555,69415,757,1586,233291,2008-08-06 17:28:34,0,1,2019-02-08 12:09:33,Spectrum Brands' stock drops nearly 18 percent after financial results miss expectations https://t.co/HJSekGbLqw https://t.co/0hY1MMAY0N
1093842019116507137,15752446,1555,69415,757,1586,233291,2008-08-06 17:28:34,0,0,2019-02-08 12:00:34,State GOP legislative leaders push for tolling to fund roads https://t.co/TqKOiQIJa5 https://t.co/VPnGOt3Cf3
