Index,ID,User_ID,Friends_Count,Followers_Count,Favourites_Count,Listed_Count,Status_Count,Created_at,Retweet_Count,Favourite_Count,Created_at,Text
567,1091399280290455552,13115682,594,377137,1507,3276,214306,2008-02-05 22:04:38,1,8,2019-02-01 18:14:00,An arctic blast in Wisconsin causes boiling water to instantly freeze into snow cloud. https://t.co/4f62PtnSTv
568,1091395764612407297,13115682,594,377137,1507,3276,214306,2008-02-05 22:04:38,1,2,2019-02-01 18:00:02,How many of these do you remember? https://t.co/LsYKY3yDFh
569,1091388256833470466,13115682,594,377137,1507,3276,214306,2008-02-05 22:04:38,6,4,2019-02-01 17:30:12,Colorado River plan now in question as top federal water official tells Arizona and California: 'Close isn't done' https://t.co/ioKYFYEO3k
570,1091388208623931392,13115682,594,377137,1507,3276,214306,2008-02-05 22:04:38,2,3,2019-02-01 17:30:00,"""I'm thankful that we can get together like this and show that we appreciate her. She's family."" https://t.co/xHZwvClTR3"
571,1091382922672631808,13115682,594,377137,1507,3276,214306,2008-02-05 22:04:38,2,4,2019-02-01 17:09:00,"Group protests Tempe police shooting, fills Tempe City Council meeting. https://t.co/dBaC1O4pYW https://t.co/LhgBuiwvCE"
572,1091380661439606784,13115682,594,377137,1507,3276,214306,2008-02-05 22:04:38,11,20,2019-02-01 17:00:01,"From columnist @ejmontini: ""Dolphins don't belong in the desert."" https://t.co/sgriiR2g55"
573,1091373109985361920,13115682,594,377137,1507,3276,214306,2008-02-05 22:04:38,6,5,2019-02-01 16:30:00,Here's a breakdown of how water supplies are expected to shift in Arizona. https://t.co/0nupiclOQX
574,1091366825311510528,13115682,594,377137,1507,3276,214306,2008-02-05 22:04:38,2,7,2019-02-01 16:05:02,"Here's a few things you should know today:
- Arizona lawmakers approved a plan to stop reservoirs from dipping to c… https://t.co/GPghR4zzxd"
575,1091349128737480705,13115682,594,377137,1507,3276,214306,2008-02-05 22:04:38,3,17,2019-02-01 14:54:43,Lyft drivers hold memorial procession to honor driver who was fatally stabbed in Tempe. https://t.co/m2hw0EQx7V https://t.co/XcEq6g7vcN
576,1091343417022599168,13115682,594,377137,1507,3276,214306,2008-02-05 22:04:38,0,0,2019-02-01 14:32:01,Serious collision involving a pedestrian in Phoenix causes road closure https://t.co/qhBepfZ8Ia
577,1091335384372518912,13115682,594,377137,1507,3276,214306,2008-02-05 22:04:38,0,3,2019-02-01 14:00:06,From our editorial board: The Drought Contingency Plan won't solve any of our water problems. But it provides the t… https://t.co/OYGNoJ097m
578,1091320263160094720,13115682,594,377137,1507,3276,214306,2008-02-05 22:04:38,2,14,2019-02-01 13:00:01,"The use of lynching and noose symbolism has increased, possibly by people emboldened by the election of President T… https://t.co/1pzSPTiGRo"
579,1091305172612116480,13115682,594,377137,1507,3276,214306,2008-02-05 22:04:38,5,10,2019-02-01 12:00:03,"Kai's death marks the fourth death since the facility opened in 2016, and comes just a month after an 11-year-old d… https://t.co/cYaHdRbCEp"
580,1091274964441927680,13115682,594,377137,1507,3276,214306,2008-02-05 22:04:38,2,1,2019-02-01 10:00:01,“It seems that both of these parties simply cannot resist the opportunity to take a 'shot' at the other.” https://t.co/hsj5LKnrdC
581,1091259863777333248,13115682,594,377137,1507,3276,214306,2008-02-05 22:04:38,2,3,2019-02-01 09:00:00,We have a state amphibian? lol no way https://t.co/zFgOAEeIKj
582,1091244762798149632,13115682,594,377137,1507,3276,214306,2008-02-05 22:04:38,9,13,2019-02-01 08:00:00,"""Just keep him talking. Stay positive with him. Don't go negative.""

Those chilling words are heard at the beginnin… https://t.co/Kx643j4jOu"
583,1091229664616558592,13115682,594,377137,1507,3276,214306,2008-02-05 22:04:38,1,0,2019-02-01 07:00:00,"""This case is going to end badly for gun violence prevention advocates."" https://t.co/C9P9aCiGhj"
584,1091223030762631173,13115682,594,377137,1507,3276,214306,2008-02-05 22:04:38,30,50,2019-02-01 06:33:39,"Kai, a 22-year-old dolphin, died Thursday morning after his condition began deteriorating and he had difficulty swi… https://t.co/5yajeruhcp"
585,1091222115381067776,13115682,594,377137,1507,3276,214306,2008-02-05 22:04:38,5,3,2019-02-01 06:30:00,Revolver Records has marked all items down to 50 percent off as the store prepares to close its doors on Feb. 1  af… https://t.co/nSaD1cKfGY
586,1091218086382850049,13115682,594,377137,1507,3276,214306,2008-02-05 22:04:38,1,0,2019-02-01 06:14:00,Super Bowl clash: Atlanta hip-hop vs. halftime show. https://t.co/v3OpC2AOGR
587,1091214566619377665,13115682,594,377137,1507,3276,214306,2008-02-05 22:04:38,2,11,2019-02-01 06:00:01,"Today, we get our Colorado River water through the Central Arizona Project. The project required years of dealmakin… https://t.co/cMK8fiFfti"
588,1091207018931724288,13115682,594,377137,1507,3276,214306,2008-02-05 22:04:38,1,7,2019-02-01 05:30:01,"The mansion, located on five acres, comes with seven bedrooms, 12 bathrooms, a professional recording studio, a mus… https://t.co/aaE8NjSp8m"
589,1091205251611254784,13115682,594,377137,1507,3276,214306,2008-02-05 22:04:38,3,2,2019-02-01 05:23:00,"""Harry Potter"" to ""Dr. Pimple Popper,"" there are plenty of things to watch if you aren't into the Super Bowl. https://t.co/bU1cj9K86x"
590,1091199466860892161,13115682,594,377137,1507,3276,214306,2008-02-05 22:04:38,3,9,2019-02-01 05:00:01,He just wanted to play Fortnite. Then he ended up discovering an iPhone security glitch that has captured the atten… https://t.co/IImoBXsCmI
591,1091197209775874048,13115682,594,377137,1507,3276,214306,2008-02-05 22:04:38,11,10,2019-02-01 04:51:02,JUST IN: https://t.co/KRAogSFsG9
592,1091195940495605760,13115682,594,377137,1507,3276,214306,2008-02-05 22:04:38,66,178,2019-02-01 04:46:00,Serena Williams stars in Bumble's 2019 Super Bowl ad. https://t.co/S9kFkwWhpG
593,1091191914811088896,13115682,594,377137,1507,3276,214306,2008-02-05 22:04:38,2,1,2019-02-01 04:30:00,"Lots of ""yikes"" moments in here https://t.co/5ztEzN4Kss"
594,1091186881021149185,13115682,594,377137,1507,3276,214306,2008-02-05 22:04:38,4,10,2019-02-01 04:10:00,"The National Memorial for Peace and Justice opened in April of 2018, becoming the nation's first memorial dedicated… https://t.co/xeUGT85DBP"
595,1091184365718196224,13115682,594,377137,1507,3276,214306,2008-02-05 22:04:38,0,0,2019-02-01 04:00:00,Some symbols are better than others. https://t.co/zFgOAEeIKj
596,1091176818659549184,13115682,594,377137,1507,3276,214306,2008-02-05 22:04:38,2,10,2019-02-01 03:30:01,"From columnist @KarinaBland: Why can't parents master the school drop off? Ideally, we'd double-clutch into second… https://t.co/rVQmG0saMo"
597,1091175807777628160,13115682,594,377137,1507,3276,214306,2008-02-05 22:04:38,2,11,2019-02-01 03:26:00,Christina Applegate deals with unruly backseat passengers on her drive back from the grocery store in M&amp;M'S 2019 Su… https://t.co/64141trt0n
598,1091169269537230848,13115682,594,377137,1507,3276,214306,2008-02-05 22:04:38,0,0,2019-02-01 03:00:01,Construction is expected to begin by August. https://t.co/6N38O9nYX6
599,1091169069473165312,13115682,594,377137,1507,3276,214306,2008-02-05 22:04:38,6,6,2019-02-01 02:59:13,"Demonstrators filled the council chambers to demand justice for 14-year-old Antonio Arce, who was shot and killed b… https://t.co/aCG9GVPqK7"
600,1091165238181937154,13115682,594,377137,1507,3276,214306,2008-02-05 22:04:38,1,4,2019-02-01 02:44:00,"Amazon is adding it's Alexa technology to a lot of things, but in it's new Super Bowl ad we see that some products… https://t.co/0WdXRJDqyw"
601,1091161717420244992,13115682,594,377137,1507,3276,214306,2008-02-05 22:04:38,1,6,2019-02-01 02:30:00,Nathan Sutherland has officially been charged with sexual assault and vulnerable-adult abuse. https://t.co/vxsTEBGHmL
602,1091150078218244096,13115682,594,377137,1507,3276,214306,2008-02-05 22:04:38,0,0,2019-02-01 01:43:45,JUST IN: https://t.co/UMCXVvZpq9
603,1091146618567647232,13115682,594,377137,1507,3276,214306,2008-02-05 22:04:38,4,29,2019-02-01 01:30:01,Sens. Kyrsten Sinema and Martha McSally voted to advance legislation calling on the president to leave troops in Sy… https://t.co/7rdaQXVwmm
604,1091142841542365184,13115682,594,377137,1507,3276,214306,2008-02-05 22:04:38,5,4,2019-02-01 01:15:00,"Arizona's use of Colorado River water is set to decrease 18 percent under the state's drought plan, which divvies u… https://t.co/kC7d4G4NG5"
605,1091142030409981952,13115682,594,377137,1507,3276,214306,2008-02-05 22:04:38,12,16,2019-02-01 01:11:47,Arizona Legislature passes historic Colorado River drought plan hours before deadline. https://t.co/LyF4qTnmNJ https://t.co/UVhr3LTZN5
606,1091139090911760385,13115682,594,377137,1507,3276,214306,2008-02-05 22:04:38,6,12,2019-02-01 01:00:06,Opinion: No border wall is going to keep the thugs from trying to smuggle drugs across the border as long as there… https://t.co/ggyncGZ8D9
607,1091135292763979776,13115682,594,377137,1507,3276,214306,2008-02-05 22:04:38,9,12,2019-02-01 00:45:00,"Apple pays up to $200,000 to people who discover serious breaches, but so far Grant Thompson hasn't received a rewa… https://t.co/VyemWHVm1m"
608,1091133025960644608,13115682,594,377137,1507,3276,214306,2008-02-05 22:04:38,2,9,2019-02-01 00:36:00,"This Pringles Super Bowl ad claims their flavors can be stacked into 318,000 different combos. Working to confirm.… https://t.co/Vrl0Ov3sFk"
609,1091124337237782528,13115682,594,377137,1507,3276,214306,2008-02-05 22:04:38,6,14,2019-02-01 00:01:28,Arizona Legislature passes historic Colorado River drought plan https://t.co/LyF4qTEYcj
610,1091123985117573120,13115682,594,377137,1507,3276,214306,2008-02-05 22:04:38,5,8,2019-02-01 00:00:04,From contributor Darcy Olsen: Many of the children sold as sex slaves were in the care of social services when they… https://t.co/jsTQUuKxI0
611,1091116417355796481,13115682,594,377137,1507,3276,214306,2008-02-05 22:04:38,2,5,2019-01-31 23:30:00,Secure the bag https://t.co/oz1xKfPerU
612,1091108869642899456,13115682,594,377137,1507,3276,214306,2008-02-05 22:04:38,4,7,2019-01-31 23:00:01,A new plant-based restaurant will open on Seventh Street in March in Phoenix. https://t.co/HLCiWD6BMN
613,1091101317404258309,13115682,594,377137,1507,3276,214306,2008-02-05 22:04:38,1,4,2019-01-31 22:30:00,"From media critic @goodyk: If the city of Phoenix had responded to his job application, Mike Arnold might not be wo… https://t.co/4mC7RNVP86"
614,1091093768235900929,13115682,594,377137,1507,3276,214306,2008-02-05 22:04:38,5,7,2019-01-31 22:00:00,It's the largest fentanyl seizure ever recorded at any port of entry in the United States. https://t.co/hq7ntRW6FR
615,1091091250911105027,13115682,594,377137,1507,3276,214306,2008-02-05 22:04:38,3,3,2019-01-31 21:50:00,Raise your beer if you’re one of the 17.2 million calling in sick after the Super Bowl. https://t.co/pqtwxccNDx
616,1091086219184885761,13115682,594,377137,1507,3276,214306,2008-02-05 22:04:38,1,1,2019-01-31 21:30:00,Low natural-gas prices and strong interstate business are allowing APS to drop customer bills by $3 a month startin… https://t.co/ctx4NvFlJX
617,1091086218501140482,13115682,594,377137,1507,3276,214306,2008-02-05 22:04:38,1,1,2019-01-31 21:30:00,"With hours before federal deadline, Arizona lawmakers vote on Colorado River drought plan. https://t.co/7I0vVvPP6o https://t.co/zQ7YXyhILJ"
618,1091079450303709184,13115682,594,377137,1507,3276,214306,2008-02-05 22:04:38,2,7,2019-01-31 21:03:06,State officials are deciding what Arizona's worst-case drought plan looks like. A decision may not be made until mi… https://t.co/3Hf9BQ7HPI
619,1091078676928700416,13115682,594,377137,1507,3276,214306,2008-02-05 22:04:38,0,3,2019-01-31 21:00:02,"A petition to declare Tucson a sanctuary city is being circulated for signatures, but it could conflict with Arizon… https://t.co/r5bDXf4GGY"
620,1091068601442988032,13115682,594,377137,1507,3276,214306,2008-02-05 22:04:38,1,3,2019-01-31 20:20:00,One of the most notorious corners in Mesa should look different by March 2021. https://t.co/6N38O9nYX6
621,1091062310196690944,13115682,594,377137,1507,3276,214306,2008-02-05 22:04:38,5,16,2019-01-31 19:55:00,APS announces $80M rate reduction because of low gas prices -- $3 per month for customers https://t.co/1cvXNHq8Zl
622,1091059794323087362,13115682,594,377137,1507,3276,214306,2008-02-05 22:04:38,2,1,2019-01-31 19:45:00,Debate is set to begin at 1:15 p.m. in the state House and 1:30 p.m. in the Senate. https://t.co/YQnEwWi9vf
623,1091053688372822016,13115682,594,377137,1507,3276,214306,2008-02-05 22:04:38,2,5,2019-01-31 19:20:44,UPDATE: Nathan Sutherland has been formally indicted on charges of sexual assault and vulnerable-adult abuse. https://t.co/vxsTEBGHmL
624,1091043943817535488,13115682,594,377137,1507,3276,214306,2008-02-05 22:04:38,0,2,2019-01-31 18:42:01,"Former Starbucks CEO Howard Schultz on border security.
https://t.co/TRVFZyGkS6 https://t.co/vhtzvxjsjL"
625,1091043435493187588,13115682,594,377137,1507,3276,214306,2008-02-05 22:04:38,0,2,2019-01-31 18:40:00,Ditch the visor and pack an umbrella for @WMPhoenixOpen https://t.co/j0E9dwVkS4
626,1091038402085113856,13115682,594,377137,1507,3276,214306,2008-02-05 22:04:38,0,5,2019-01-31 18:20:00,"Honestly, who needs to watch The Patriots v. The Rams when you can see Emma Stone and Rachel Weisz compete in… https://t.co/vhlhMonFJh"
627,1091036361753276417,13115682,594,377137,1507,3276,214306,2008-02-05 22:04:38,3,5,2019-01-31 18:11:53,254-pound fentanyl seizure sets record at Nogales border crossing https://t.co/N5tpIEODql
628,1091033371973685249,13115682,594,377137,1507,3276,214306,2008-02-05 22:04:38,1,2,2019-01-31 18:00:00,Brussels sprouts and Bowie can be found at this vinyl-inspired vegan spot. https://t.co/HLCiWD6BMN
629,1091031610202312704,13115682,594,377137,1507,3276,214306,2008-02-05 22:04:38,5,10,2019-01-31 17:53:00,"Phil Mickelson returns to #PhoenixOpen 2019.
https://t.co/tBOZvg7Kuj https://t.co/wQmuRbX8QR"
630,1091028335864541184,13115682,594,377137,1507,3276,214306,2008-02-05 22:04:38,2,3,2019-01-31 17:40:00,"Fearless and sincere, Hulu's @PEN15show feels like a ""silly outsider crashing the cool kids’ party,"" writes critic… https://t.co/UEA2B0Vatn"
631,1091023303110742018,13115682,594,377137,1507,3276,214306,2008-02-05 22:04:38,3,3,2019-01-31 17:20:00,He says it all in 8 seconds. #AZCardinals Patrick Peterson officially rescinds his trade request from last season a… https://t.co/4V4lJl4Y6B
632,1091023302372528128,13115682,594,377137,1507,3276,214306,2008-02-05 22:04:38,0,1,2019-01-31 17:20:00,Pop quiz: What are Arizona's state colors? https://t.co/HLCiWD6BMN
633,1091013001329733637,13115682,594,377137,1507,3276,214306,2008-02-05 22:04:38,1,2,2019-01-31 16:39:04,"$75K for airfare, $41K for copies: Judge rips $10M taxpayer-money fee requests in Turf Paradise lawsuit https://t.co/9Z7r8dn56Y"
634,1091010651567411203,13115682,594,377137,1507,3276,214306,2008-02-05 22:04:38,0,1,2019-01-31 16:29:43,Good morning Arizona! Here's what you need to know to start your day: https://t.co/dnHNJtr9NK https://t.co/7VbgnFTLS5
635,1091006441119539200,13115682,594,377137,1507,3276,214306,2008-02-05 22:04:38,2,5,2019-01-31 16:13:00,Underrated fave: Trefoils. https://t.co/cl1wwBhUtJ
636,1090999664084770816,13115682,594,377137,1507,3276,214306,2008-02-05 22:04:38,2,3,2019-01-31 15:46:04,Pursuit suspect arrested after crash on University Drive near Tempe https://t.co/khl8z0aToy
637,1090992457918136320,13115682,594,377137,1507,3276,214306,2008-02-05 22:04:38,1,2,2019-01-31 15:17:26,Rain expected to hit the Valley tonight and into weekend during Phoenix Open https://t.co/3hwqjayMHC
638,1090988072743907328,13115682,594,377137,1507,3276,214306,2008-02-05 22:04:38,1,2,2019-01-31 15:00:00,"ICYMI: Howard Schultz, former Starbucks CEO, discussed his possible independent presidential run during a visit to… https://t.co/LLVpRdoVOd"
639,1090986582432047105,13115682,594,377137,1507,3276,214306,2008-02-05 22:04:38,2,5,2019-01-31 14:54:05,"Lucky to be in Arizona! The polar vortex, explained. https://t.co/MBHQzLTvoG"
640,1090972974327517184,13115682,594,377137,1507,3276,214306,2008-02-05 22:04:38,1,6,2019-01-31 14:00:01,Ever wonder what Roosevelt Row was like before it was developed? Or why there are so many wrong-way crashes in Phoe… https://t.co/tn2Ltub6vw
641,1090966680531021826,13115682,594,377137,1507,3276,214306,2008-02-05 22:04:38,11,50,2019-01-31 13:35:00,Marine dad’s surprise knocks his toddler off her feet. https://t.co/QOWg1G669J
642,1090912575066460161,13115682,594,377137,1507,3276,214306,2008-02-05 22:04:38,1,3,2019-01-31 10:00:00,Remember Kevin's Famous Chili from The Office? Well it isn't in this list because he spilled it but there are still… https://t.co/fpvdv92VvD
643,1090897473911095296,13115682,594,377137,1507,3276,214306,2008-02-05 22:04:38,6,4,2019-01-31 09:00:00,"The incident is the first of its kind in Arizona in 2019, according to the Anti-Defamation League Arizona Regional… https://t.co/2vhpdeJUkP"
644,1090882374781620224,13115682,594,377137,1507,3276,214306,2008-02-05 22:04:38,4,10,2019-01-31 08:00:00,The Phoenix Suns have a very big point guard question. Is trading for Lonzo Ball the answer? https://t.co/9Q7IuhO7xr
645,1090867275966619648,13115682,594,377137,1507,3276,214306,2008-02-05 22:04:38,2,9,2019-01-31 07:00:00,"He was allegedly found with a fanny pack carrying cocaine, crack cocaine, meth and other narcotics. https://t.co/aNkSUf6E7G"
646,1090862745040359424,13115682,594,377137,1507,3276,214306,2008-02-05 22:04:38,9,32,2019-01-31 06:42:00,Super Soaker shoots snow bombs in freezing conditions. https://t.co/nVLj7j6H5T
647,1090859725934202881,13115682,594,377137,1507,3276,214306,2008-02-05 22:04:38,5,7,2019-01-31 06:30:00,"From our editorial board: ""If Arizona signs the drought contingency plan on Jan. 31, no one can call us a holdout.… https://t.co/nRdT0cVBgP"
648,1090852176606441472,13115682,594,377137,1507,3276,214306,2008-02-05 22:04:38,0,7,2019-01-31 06:00:00,"“I think President Trump is unqualified to be the president,"" Schultz told a woman in the audience. ""No one in Amer… https://t.co/I6htBg33Gq"
649,1090844635331731457,13115682,594,377137,1507,3276,214306,2008-02-05 22:04:38,2,3,2019-01-31 05:30:02,"As state Republican lawmakers push legislation to offset possible tax increases, education advocates want the extra… https://t.co/o5XjczFgn6"
650,1090841857309822976,13115682,594,377137,1507,3276,214306,2008-02-05 22:04:38,5,7,2019-01-31 05:19:00,"The polar vortex, explained. https://t.co/LVnyphAVhj"
651,1090837078160625664,13115682,594,377137,1507,3276,214306,2008-02-05 22:04:38,1,5,2019-01-31 05:00:00,"Opinion: AZ GOP has always been highly conservative, so Kelli Ward is no aberration. And she brings skills that cou… https://t.co/FpQa4t27r1"
652,1090829526802882560,13115682,594,377137,1507,3276,214306,2008-02-05 22:04:38,0,8,2019-01-31 04:30:00,"For when you want to get away, but also not totally ~away~ https://t.co/ww53bNHBY3"
653,1090829022777421824,13115682,594,377137,1507,3276,214306,2008-02-05 22:04:38,0,1,2019-01-31 04:28:00,"Amazon is adding it's Alexa technology to a lot of things, but in it's new Super Bowl ad we see that some products… https://t.co/rVBtIsm2Th"
654,1090821978754351104,13115682,594,377137,1507,3276,214306,2008-02-05 22:04:38,11,15,2019-01-31 04:00:00,"The agency will heighten efforts to inform people of the severity of this issue and work with other organizations,… https://t.co/NpcOuyhoU7"
655,1090819605902315520,13115682,594,377137,1507,3276,214306,2008-02-05 22:04:38,3,3,2019-01-31 03:50:35,"The group included 130 juveniles, with 11 of them unaccompanied by a legal guardian, the agency said. https://t.co/yXA6aW45Xu"
656,1090814427501379584,13115682,594,377137,1507,3276,214306,2008-02-05 22:04:38,0,1,2019-01-31 03:30:00,"""We can hopefully have an effect on people making that disastrous decision."" https://t.co/Bh2XlC6nNN"
657,1090806878010003459,13115682,594,377137,1507,3276,214306,2008-02-05 22:04:38,2,3,2019-01-31 03:00:00,"An Indiana-based company will oversee operations at Hacienda HealthCare, where an incapacitated patient was raped a… https://t.co/tVNkdhd5ty"
658,1090806826042454016,13115682,594,377137,1507,3276,214306,2008-02-05 22:04:38,0,21,2019-01-31 02:59:48,@freep Thank you and we’ll see you in July https://t.co/Vccd6GQkf3
659,1090803605404348417,13115682,594,377137,1507,3276,214306,2008-02-05 22:04:38,3,13,2019-01-31 02:47:00,Time-lapse video shows overnight snowfall in Michigan. https://t.co/1iqdIU4ZwX
660,1090803103778123776,13115682,594,377137,1507,3276,214306,2008-02-05 22:04:38,2,5,2019-01-31 02:45:00,"Arizona lawmakers appear on track to pass a Colorado River drought plan, with less than 30 hours to go before a cri… https://t.co/wKEJeH15JZ"
661,1090799331605659648,13115682,594,377137,1507,3276,214306,2008-02-05 22:04:38,1,20,2019-01-31 02:30:01,"Hoping to neutralize the language, Grijalva, D-Ariz., proposed removing the religious aspect of the House Natural R… https://t.co/R40oLqQFmr"
662,1090791781732679681,13115682,594,377137,1507,3276,214306,2008-02-05 22:04:38,1,0,2019-01-31 02:00:01,"""It made people realize that it could happen anywhere."" https://t.co/P65JFIMZE5"
663,1090787266069442560,13115682,594,377137,1507,3276,214306,2008-02-05 22:04:38,0,0,2019-01-31 01:42:04,"The fire was burning a commercial structure in the 2200 block of East Main Street, just east of Gilbert Road. https://t.co/6mRemtJLo5"
664,1090784231830274048,13115682,594,377137,1507,3276,214306,2008-02-05 22:04:38,0,5,2019-01-31 01:30:01,Cold weather? Can't relate. https://t.co/OZH7OSFx8W
665,1090780461901717504,13115682,594,377137,1507,3276,214306,2008-02-05 22:04:38,1,0,2019-01-31 01:15:02,Former Rep. Don Shooter alleges he was denied due process because the process for his removal didn't go through the… https://t.co/4JadvrrGaB
666,1090776683131686913,13115682,594,377137,1507,3276,214306,2008-02-05 22:04:38,4,0,2019-01-31 01:00:01,Extreme cold in upper Midwest cities has canceled or delayed few flights into and out of Phoenix. https://t.co/QpTsVX62Fp
667,1090776416797380608,13115682,594,377137,1507,3276,214306,2008-02-05 22:04:38,1,1,2019-01-31 00:58:58,Arctic blast sends travelers to Phoenix for warmer weather. https://t.co/4GMEx9a9t9 https://t.co/uTjSsGGeeF
668,1090769131119538176,13115682,594,377137,1507,3276,214306,2008-02-05 22:04:38,11,28,2019-01-31 00:30:01,.@WritingMoore was there for Amy Bockerstette's par at the 16th hole of the #PhoenixOpen on Tuesday. Go behind the… https://t.co/7k0QLzjdwr
669,1090761582282489857,13115682,594,377137,1507,3276,214306,2008-02-05 22:04:38,1,0,2019-01-31 00:00:01,You’ve been watching the Super Bowl all wrong. https://t.co/TjFM1A83XE
670,1090757812966305799,13115682,594,377137,1507,3276,214306,2008-02-05 22:04:38,2,4,2019-01-30 23:45:02,Not the nugs! https://t.co/zgSItf9FvX
671,1090754031205666816,13115682,594,377137,1507,3276,214306,2008-02-05 22:04:38,1,1,2019-01-30 23:30:00,A dog was euthanized Tuesday after biting a Maricopa County animal shelter supervisor who required surgery for her… https://t.co/48UODi3jSC
672,1090752767088574465,13115682,594,377137,1507,3276,214306,2008-02-05 22:04:38,4,8,2019-01-30 23:24:59,"""I'm here to stay, baby."" #AZCardinals cornerback Patrick Peterson apologizes for trade demand after teeing off on… https://t.co/QeCiNAglg9"
673,1090746486923673601,13115682,594,377137,1507,3276,214306,2008-02-05 22:04:38,5,6,2019-01-30 23:00:02,The Phoenix metro area is facing a disastrous combination of issues surrounding housing. How will Phoenix's next ma… https://t.co/K62fshNR0t
674,1090741527465394182,13115682,594,377137,1507,3276,214306,2008-02-05 22:04:38,4,2,2019-01-30 22:40:19,Police were in a standoff with an armed man who barricaded himself inside his car outside a Safeway grocery store i… https://t.co/NRwtMaldYB
675,1090738930843037697,13115682,594,377137,1507,3276,214306,2008-02-05 22:04:38,2,1,2019-01-30 22:30:00,"Arizona is one of six states with retail distribution centers where the recalled nuggets were shipped, according to… https://t.co/N379PNGzeU"
676,1090735657755000833,13115682,594,377137,1507,3276,214306,2008-02-05 22:04:38,4,9,2019-01-30 22:17:00,"Amid questions, Tempe police show media more video footage in shooting of 14-year-old https://t.co/Gt9Jh4x79B https://t.co/ffnOKeOoh0"
677,1090731391531274241,13115682,594,377137,1507,3276,214306,2008-02-05 22:04:38,3,3,2019-01-30 22:00:03,"""I'm not a lawyer. I'm a cop. I didn't know what a preliminary injunction was."" https://t.co/yF3wH57QaY"
678,1090726428503654401,13115682,594,377137,1507,3276,214306,2008-02-05 22:04:38,1,3,2019-01-30 21:40:19,https://t.co/clnVtjPWsh
679,1090723836167929870,13115682,594,377137,1507,3276,214306,2008-02-05 22:04:38,1,6,2019-01-30 21:30:01,"Liberal group ""Protect Our Care Arizona"" demanded that Congress keep fighting for the Affordable Care Act amid ongo… https://t.co/cgbnRyhWhI"
680,1090717606271729678,13115682,594,377137,1507,3276,214306,2008-02-05 22:04:38,3,2,2019-01-30 21:05:16,"Amid questions, Tempe police show media additional video taken during the fatal police shooting of 14-year-old boy https://t.co/Gt9Jh4x79B"
681,1090716284961112083,13115682,594,377137,1507,3276,214306,2008-02-05 22:04:38,1,0,2019-01-30 21:00:01,Don't be that person who serves average snacks at the Super Bowl party. https://t.co/rjxm794P2d
682,1090712504907382785,13115682,594,377137,1507,3276,214306,2008-02-05 22:04:38,1,1,2019-01-30 20:45:00,azcentral sports' @kentsomers and @kfitz134 are at the Phoenix Open talking about Jon Rahm and D-Backs manager Tore… https://t.co/tkLDnYQXFj
