Index,ID,User_ID,Friends_Count,Followers_Count,Favourites_Count,Listed_Count,Status_Count,Created_at,Retweet_Count,Favourite_Count,Created_at,Text
968,1090284469695606786,14304462,5587,264909,11094,2732,176014,2008-04-04 17:14:50,2,12,2019-01-29 16:24:08,Food Network says quintessential Cuban Sandwich is found at Tampa's Columbia Restaurant https://t.co/bEPew3zxJS
969,1090284468399570944,14304462,5587,264909,11094,2732,176014,2008-04-04 17:14:50,0,0,2019-01-29 16:24:08,Not everyone is buying into the Bruce Arians hype https://t.co/gNi4cK72nu
970,1090284465828421632,14304462,5587,264909,11094,2732,176014,2008-04-04 17:14:50,0,0,2019-01-29 16:24:07,"Suspect in Seminole Heights killings complains of health problems in jail, asks judge for help https://t.co/ylDbqg9Qfx"
971,1090284463756472321,14304462,5587,264909,11094,2732,176014,2008-04-04 17:14:50,0,2,2019-01-29 16:24:07,These estates are the most expensive in Pasco County's 'affordable' luxury home market https://t.co/NQqNfhUBSW
972,1090281945529933824,14304462,5587,264909,11094,2732,176014,2008-04-04 17:14:50,0,0,2019-01-29 16:14:06,Pasco transgender student rights debate prompts talk on parental permission for clubs https://t.co/ogEhF7gEaw
973,1090281944397492224,14304462,5587,264909,11094,2732,176014,2008-04-04 17:14:50,0,0,2019-01-29 16:14:06,Top things to do in Tampa Bay for Wednesday Jan. 30 https://t.co/sND6g6fCS2
974,1090278410331541505,14304462,5587,264909,11094,2732,176014,2008-04-04 17:14:50,0,1,2019-01-29 16:00:04,Renovations that have closed much of the park since November will revamp the backstage area and brighten the underw… https://t.co/O5yMeoJnQx
975,1090277920726081536,14304462,5587,264909,11094,2732,176014,2008-04-04 17:14:50,1,2,2019-01-29 15:58:07,"Remembering 'Chainsaw' Al Dunlap, ruthless corporate cost cutter and big-time FSU donor https://t.co/YNFQchSw26"
976,1090260914903822336,14304462,5587,264909,11094,2732,176014,2008-04-04 17:14:50,0,1,2019-01-29 14:50:32,Pasco schools hope fun videos might help attract teachers https://t.co/iwURtTVlMH
977,1090258403312599042,14304462,5587,264909,11094,2732,176014,2008-04-04 17:14:50,0,2,2019-01-29 14:40:34,No charges filed in deaths of 3 North Florida children found in freezer https://t.co/6ldxTOuS5A
978,1090251866166837248,14304462,5587,264909,11094,2732,176014,2008-04-04 17:14:50,2,3,2019-01-29 14:14:35,Apple to fix FaceTime bug that allows eavesdropping https://t.co/pD46lb9NCv
979,1090251861926375425,14304462,5587,264909,11094,2732,176014,2008-04-04 17:14:50,462,1000,2019-01-29 14:14:34,This Super Bowl is living a lie https://t.co/m32OAaW1CA
980,1090249239370711043,14304462,5587,264909,11094,2732,176014,2008-04-04 17:14:50,0,0,2019-01-29 14:04:09,Who deserves the most credit for the Patriots' dynasty: Tom Brady or Bill Belichick? https://t.co/rXNAKRzPbb
981,1090248198180999169,14304462,5587,264909,11094,2732,176014,2008-04-04 17:14:50,1,1,2019-01-29 14:00:00,ICYMI: There was a lot to remember about that Super Bowl in Tampa 10 years ago. But the crotch-first slide into the… https://t.co/iTmo9sagV8
982,1090244697317007362,14304462,5587,264909,11094,2732,176014,2008-04-04 17:14:50,2,14,2019-01-29 13:46:06,Florida State Fair releases lineup of gut-busting foods coming to midway this year https://t.co/0TTTpv1aLb
983,1090236871412760577,14304462,5587,264909,11094,2732,176014,2008-04-04 17:14:50,1,7,2019-01-29 13:15:00,Our food critic's list of Tampa Bay's top restaurants -- always one of our most popular stories of the year -- drop… https://t.co/HYmu4hpoBV
984,1090226581539155968,14304462,5587,264909,11094,2732,176014,2008-04-04 17:14:50,1,0,2019-01-29 12:34:07,Forecast: Cold start to a mild Tuesday in Tampa Bay ahead of reinforcing cold front https://t.co/57ecZNJaZP
985,1090226580058591232,14304462,5587,264909,11094,2732,176014,2008-04-04 17:14:50,0,2,2019-01-29 12:34:06,Sports Day Tampa Bay podcast: Is Tom Brady the greatest QB of all time? https://t.co/eLqTqVAYYl
986,1090225547504951298,14304462,5587,264909,11094,2732,176014,2008-04-04 17:14:50,4,2,2019-01-29 12:30:00,ICYMI: Tampa Bay’s oldest farmers’ market and community supported agriculture business is shutting down after 26 ye… https://t.co/xmwEwYfiQ5
987,1090222804681641985,14304462,5587,264909,11094,2732,176014,2008-04-04 17:14:50,1,1,2019-01-29 12:19:06,Homicide detectives investigating after man found shot in van in Brandon https://t.co/NbclPoDXxs
988,1090219284054237184,14304462,5587,264909,11094,2732,176014,2008-04-04 17:14:50,0,2,2019-01-29 12:05:07,"Florida education news: Climate change, student clubs, top teachers and more https://t.co/GUxpIY9TUq"
989,1090217998093303811,14304462,5587,264909,11094,2732,176014,2008-04-04 17:14:50,4,15,2019-01-29 12:00:00,"She thanked family and friends, then turned to a student standing next to her and said: ""Girl, you're the reason th… https://t.co/aor1zhfEBh"
990,1090210453723193345,14304462,5587,264909,11094,2732,176014,2008-04-04 17:14:50,16,10,2019-01-29 11:30:01,"The bill’s sponsor, Sen. Dennis Baxley, R-Ocala, said that schools need to teach “different worldviews” on issues l… https://t.co/OXt5uaDjtJ"
991,1090209717693992960,14304462,5587,264909,11094,2732,176014,2008-04-04 17:14:50,0,2,2019-01-29 11:27:06,'Polar vortex' will bring record-breaking cold to Midwest after snowstorm https://t.co/Ry4janstCm
992,1090202899534278656,14304462,5587,264909,11094,2732,176014,2008-04-04 17:14:50,7,17,2019-01-29 11:00:00,Sen. Jeff Brandes filed a bill to redefine the term “medical use” to include smoking. It would also delete a provis… https://t.co/Qn89NoBn6l
993,1090192361315946496,14304462,5587,264909,11094,2732,176014,2008-04-04 17:14:50,1,2,2019-01-29 10:18:08,"Argosy University, in federal receivership, faces demand from accrediting agency https://t.co/O2gsCoa2pe"
994,1090192357822087169,14304462,5587,264909,11094,2732,176014,2008-04-04 17:14:50,1,2,2019-01-29 10:18:07,Could you be a big-dollar donor? Many hospitals check patient records to find out. https://t.co/ICJVToniku
995,1090192353900486657,14304462,5587,264909,11094,2732,176014,2008-04-04 17:14:50,0,3,2019-01-29 10:18:06,The Daystarter: Scientific facts are anything but that in the Florida Legislature; it's the 10th anniversary of Bru… https://t.co/XgATapaDN6
996,1090192352126283777,14304462,5587,264909,11094,2732,176014,2008-04-04 17:14:50,1,1,2019-01-29 10:18:06,"With 4.3 million Facebook followers, iHorror expands from reviewing to streaming films https://t.co/72HriDzHSB"
997,1090142500323553281,14304462,5587,264909,11094,2732,176014,2008-04-04 17:14:50,2,1,2019-01-29 07:00:00,"ICYMI: Knack allows college students on more than 50 campuses to tutor or mentor fellow students in more than 8,000… https://t.co/nVyzTQSN6w"
998,1090127426183749633,14304462,5587,264909,11094,2732,176014,2008-04-04 17:14:50,2,2,2019-01-29 06:00:06,"Florida still leads the world in shark bites. Climate change may be connected to the drop.
https://t.co/TqrslO0cDc"
999,1090112302597181441,14304462,5587,264909,11094,2732,176014,2008-04-04 17:14:50,1,3,2019-01-29 05:00:00,"ICYMI: Tattoos may have once been taboo to show off at work. Not any longer.  In fact, the tattoos employees at thi… https://t.co/ZJ6u052MZ3"
1000,1090098849538920448,14304462,5587,264909,11094,2732,176014,2008-04-04 17:14:50,0,0,2019-01-29 04:06:33,"Sports on the air for Tuesday, Jan. 29 https://t.co/SkyY4WWR9J"
1001,1090097211910823936,14304462,5587,264909,11094,2732,176014,2008-04-04 17:14:50,0,3,2019-01-29 04:00:03,ICYMI: Bills have been filed to create more “pathways” to a high school diploma. The proposals will be debated in t… https://t.co/3v3q8lCEZH
1002,1090085267749330944,14304462,5587,264909,11094,2732,176014,2008-04-04 17:14:50,1,6,2019-01-29 03:12:35,From the food editor: A new slate of top restaurants is headed your way https://t.co/9W49sT8VMZ
1003,1090082110805864448,14304462,5587,264909,11094,2732,176014,2008-04-04 17:14:50,0,9,2019-01-29 03:00:02,There was a lot to remember about that Super Bowl in Tampa 10 years ago. But the crotch-first slide into the camera… https://t.co/3PafKN2ebE
1004,1090078593441386497,14304462,5587,264909,11094,2732,176014,2008-04-04 17:14:50,0,2,2019-01-29 02:46:04,"High school scoreboard for Monday, Jan. 28 https://t.co/dNPBbSZiM1"
1005,1090076207486390277,14304462,5587,264909,11094,2732,176014,2008-04-04 17:14:50,0,8,2019-01-29 02:36:35,Pinellas' teacher of the year: Plumb Elementary's Nicole Kenngott https://t.co/9syZvNjnQv
1006,1090076203883483137,14304462,5587,264909,11094,2732,176014,2008-04-04 17:14:50,4,6,2019-01-29 02:36:34,"The day the Challenger exploded, ending the space age of innocence https://t.co/9OkwReRQQx"
1007,1090067002625019904,14304462,5587,264909,11094,2732,176014,2008-04-04 17:14:50,1,2,2019-01-29 02:00:00,"Kayla was among the last orcas at SeaWorld's Orlando park.
https://t.co/7RkDfmZHz9"
1008,1090051905051611136,14304462,5587,264909,11094,2732,176014,2008-04-04 17:14:50,0,2,2019-01-29 01:00:01,"Tampa Bay’s oldest farmers’ market and community supported agriculture business is shutting down after 26 years. 
https://t.co/iCOw42vEvP"
1009,1090049152967270401,14304462,5587,264909,11094,2732,176014,2008-04-04 17:14:50,1,3,2019-01-29 00:49:04,Deputies investigating death at Indigo Point Apartments in Brandon https://t.co/kOmGtSk0Jb
1010,1090037574242988032,14304462,5587,264909,11094,2732,176014,2008-04-04 17:14:50,0,1,2019-01-29 00:03:04,HomeTeam Hot Shot winners: Sager Cavalier and Carly Price https://t.co/XQNsVebANF
1011,1090036803686543360,14304462,5587,264909,11094,2732,176014,2008-04-04 17:14:50,6,3,2019-01-29 00:00:00,"ICYMI: Most of the homes in Panama City still have tarps on them right now,.
Yet somehow, at least nationally, Hurr… https://t.co/xVJQlKEvj8"
1012,1090006609844154370,14304462,5587,264909,11094,2732,176014,2008-04-04 17:14:50,0,3,2019-01-28 22:00:01,"What does a surge in tourism mean for Florida? How about nearly $90 million in taxes paid to the state by Airbnb.
https://t.co/K4KfB0VD3W"
1013,1090000836539736064,14304462,5587,264909,11094,2732,176014,2008-04-04 17:14:50,2,5,2019-01-28 21:37:05,"It's been a while, so here's a reminder: The Lightning is good https://t.co/Mw9jWTHuHs"
1014,1089998334784241665,14304462,5587,264909,11094,2732,176014,2008-04-04 17:14:50,1,3,2019-01-28 21:27:08,"Extended breather was nice, now back to work for Lightning https://t.co/53D54dOypQ"
1015,1089998332796125184,14304462,5587,264909,11094,2732,176014,2008-04-04 17:14:50,1,0,2019-01-28 21:27:08,Top things to do in Tampa Bay for Tuesday Jan. 29 https://t.co/nOkCyAUzWS
1016,1089987514163593217,14304462,5587,264909,11094,2732,176014,2008-04-04 17:14:50,0,1,2019-01-28 20:44:09,Pasco Letters to the Editor https://t.co/Nrikb7LzIe
1017,1089987512976588800,14304462,5587,264909,11094,2732,176014,2008-04-04 17:14:50,0,1,2019-01-28 20:44:08,USF's Alexis Yetna honored by AAC ... again https://t.co/osuLpJ2IMM
1018,1089984990283059201,14304462,5587,264909,11094,2732,176014,2008-04-04 17:14:50,2,3,2019-01-28 20:34:07,"After 26 years, Sweetwater Organic Community Farm in Tampa calls it quits https://t.co/kieOz7sLTi"
1019,1089984986151673860,14304462,5587,264909,11094,2732,176014,2008-04-04 17:14:50,4,4,2019-01-28 20:34:06,"As Tampa Bay tourism grows, Airbnb's tax payments to Florida nearly double year over year https://t.co/uFE8V4ZLeL"
1020,1089983956328554502,14304462,5587,264909,11094,2732,176014,2008-04-04 17:14:50,3,8,2019-01-28 20:30:00,"It has been 33 years today, since the nation witnessed the Challenger explosion. Do you remember it?
https://t.co/7nyawZtMSQ"
1021,1089977444340121600,14304462,5587,264909,11094,2732,176014,2008-04-04 17:14:50,0,0,2019-01-28 20:04:08,HomeTeam 15: Girls basketball rankings for Tampa Bay https://t.co/sNM8WFtJbh
1022,1089977441160851456,14304462,5587,264909,11094,2732,176014,2008-04-04 17:14:50,1,5,2019-01-28 20:04:07,"Remembering Bruce Springsteen's Super Bowl halftime crotch thrust in Tampa, 10 years later https://t.co/aMXJEDq4yL"
1023,1089977438321299456,14304462,5587,264909,11094,2732,176014,2008-04-04 17:14:50,1,2,2019-01-28 20:04:06,Veteran INF/OF Emilio Bonifacio among Rays' latest minor-league signees https://t.co/DO6Amofs87
1024,1089970383300612096,14304462,5587,264909,11094,2732,176014,2008-04-04 17:14:50,6,9,2019-01-28 19:36:04,"Number of shark bites dropped last year, both in Florida and worldwide https://t.co/1n2PBV6gTh"
1025,1089961306495561729,14304462,5587,264909,11094,2732,176014,2008-04-04 17:14:50,1,9,2019-01-28 19:00:00,"Knack allows college students on more than 50 campuses to tutor or mentor fellow students in more than 8,000 course… https://t.co/APJhbAStMa"
1026,1089957045309067264,14304462,5587,264909,11094,2732,176014,2008-04-04 17:14:50,0,1,2019-01-28 18:43:04,"Parental consent for clubs deserves consideration, Pasco board member says https://t.co/fD6qR6KQ7U"
1027,1089953399791968257,14304462,5587,264909,11094,2732,176014,2008-04-04 17:14:50,0,0,2019-01-28 18:28:35,"Longtime MLB umpire Jim McKean remembered by family, friends, former colleagues https://t.co/b3WNriGr09"
1028,1089950759234330624,14304462,5587,264909,11094,2732,176014,2008-04-04 17:14:50,0,3,2019-01-28 18:18:05,Deputies still searching for suspect in fatal shooting of man near Plant City https://t.co/VGSq1FTMis
1029,1089950756357033984,14304462,5587,264909,11094,2732,176014,2008-04-04 17:14:50,3,3,2019-01-28 18:18:05,"Kayla, a 30-year-old orca, dies at SeaWorld's Orlando park https://t.co/ae7mpHMCEK"
1030,1089946992740978688,14304462,5587,264909,11094,2732,176014,2008-04-04 17:14:50,1,3,2019-01-28 18:03:07,'One size doesn't fit all.' Should Florida widen the path to high school graduation? https://t.co/AtPt0DgWR8
1031,1089946990912229378,14304462,5587,264909,11094,2732,176014,2008-04-04 17:14:50,0,0,2019-01-28 18:03:07,The great sports debate that Tom Brady settled https://t.co/UAFxSX2zws
1032,1089946206531477506,14304462,5587,264909,11094,2732,176014,2008-04-04 17:14:50,1,1,2019-01-28 18:00:00,"A developer wants to replace a small, boutique hotel with an 80-foot-tall, 60-room hotel. Residents are angry -- on… https://t.co/s6cZ7FBDcR"
1033,1089939558865793025,14304462,5587,264909,11094,2732,176014,2008-04-04 17:14:50,2,1,2019-01-28 17:33:35,Thread 👇 https://t.co/VA4Ee4PVxI
1034,1089933149633572864,14304462,5587,264909,11094,2732,176014,2008-04-04 17:14:50,0,0,2019-01-28 17:08:07,"News at noon: Spring Hill woman killed after walking into path of SUV on U.S. 19, troopers say; Tampa startup Knack… https://t.co/snl7seW3gJ"
1035,1089931107531919360,14304462,5587,264909,11094,2732,176014,2008-04-04 17:14:50,2,6,2019-01-28 17:00:00,"Tattoos may have once been taboo to show off at work. Not any longer.  In fact, the tattoos employees at this St. P… https://t.co/qtbjTgkv7g"
1036,1089930379820097536,14304462,5587,264909,11094,2732,176014,2008-04-04 17:14:50,0,1,2019-01-28 16:57:07,Examining the UF-USF pipeline https://t.co/8CBqx8I4DK
1037,1089930377915854848,14304462,5587,264909,11094,2732,176014,2008-04-04 17:14:50,0,0,2019-01-28 16:57:06,Will BP money get tapped to pay for Hurricane Michael? https://t.co/DidM3yZMNg
1038,1089924341351907328,14304462,5587,264909,11094,2732,176014,2008-04-04 17:14:50,1,3,2019-01-28 16:33:07,Pasco schools begin preparing raises for support employees https://t.co/YHXvI36aE4
1039,1089924339502178305,14304462,5587,264909,11094,2732,176014,2008-04-04 17:14:50,0,2,2019-01-28 16:33:07,Super Bowl quarterback rankings: The best and worst performances of all-time https://t.co/B7OsVFMw4r
1040,1089923557340131331,14304462,5587,264909,11094,2732,176014,2008-04-04 17:14:50,1,2,2019-01-28 16:30:00,"Police said alcohol played a role in the crash but did not elaborate further.
https://t.co/p2tzGu3nfE"
1041,1089916010835181568,14304462,5587,264909,11094,2732,176014,2008-04-04 17:14:50,1,5,2019-01-28 16:00:01,Bills have been filed to create more “pathways” to a high school diploma. The proposals will be debated in the upco… https://t.co/Zn14xzYqTx
1042,1089907222442696704,14304462,5587,264909,11094,2732,176014,2008-04-04 17:14:50,0,0,2019-01-28 15:25:05,"Spring Hill woman killed after walking into path of SUV on U.S. 19, troopers say https://t.co/kqCVBDHo4J"
1043,1089903455441829889,14304462,5587,264909,11094,2732,176014,2008-04-04 17:14:50,1,1,2019-01-28 15:10:07,Florida House seats may remain open until June https://t.co/9GPrjTY8oq
1044,1089900919523893249,14304462,5587,264909,11094,2732,176014,2008-04-04 17:14:50,3,5,2019-01-28 15:00:03,"ICYMI: While driving has become safer thanks to air bags and other safety features, walking has become more dangero… https://t.co/AG3XB82XdW"
1045,1089896523729498112,14304462,5587,264909,11094,2732,176014,2008-04-04 17:14:50,0,3,2019-01-28 14:42:35,Make-your-own wine shop in Spring Hill coaches customers through the process https://t.co/67SBWkUHju
1046,1089894001426063360,14304462,5587,264909,11094,2732,176014,2008-04-04 17:14:50,0,2,2019-01-28 14:32:33,Democrats uneasy about potential Howard Schultz bid https://t.co/DWv0tWWFsx
1047,1089894000104853505,14304462,5587,264909,11094,2732,176014,2008-04-04 17:14:50,0,1,2019-01-28 14:32:33,Tampa tutoring startup Knack partners with eductional testing service on job skills project https://t.co/rg61EpcTDu
1048,1089893998364221440,14304462,5587,264909,11094,2732,176014,2008-04-04 17:14:50,0,0,2019-01-28 14:32:33,"Three hurt, including two Pasco firefighters, in blaze at home Trinity https://t.co/MvppDuw3We"
1049,1089893358061961216,14304462,5587,264909,11094,2732,176014,2008-04-04 17:14:50,0,1,2019-01-28 14:30:00,The police chief said the vast majority of people were well-behaved -- though there were two guys arrested on crimi… https://t.co/jeCReEXnCk
1050,1089891622353948673,14304462,5587,264909,11094,2732,176014,2008-04-04 17:14:50,0,1,2019-01-28 14:23:06,"Mike Evans' new Pro Bowl history: No catches, one interception https://t.co/7SSex6Kti7"
1051,1089885809807945733,14304462,5587,264909,11094,2732,176014,2008-04-04 17:14:50,11,4,2019-01-28 14:00:00,"Most of the homes in Panama City still have tarps on them right now,.
Yet somehow, at least nationally, Hurricane M… https://t.co/qIm7F31MLs"
1052,1089875270578843649,14304462,5587,264909,11094,2732,176014,2008-04-04 17:14:50,1,2,2019-01-28 13:18:08,"Heavy snow to push across Upper Midwest, bitter cold follows https://t.co/xsRoD236zz"
1053,1089871744171532288,14304462,5587,264909,11094,2732,176014,2008-04-04 17:14:50,2,6,2019-01-28 13:04:07,"Sports Day Tampa Bay podcast: Tom Brady's mic drop, Pro Bowl shenanigans, more https://t.co/fWzb05yi9j"
1054,1089870709269164034,14304462,5587,264909,11094,2732,176014,2008-04-04 17:14:50,8,18,2019-01-28 13:00:00,"ICYMI: ""This wasn't some teenager with a brain not fully baked or a frat boy trying to be funny. This was a grown-u… https://t.co/8bOc4nFEUZ"
1055,1089863161421942785,14304462,5587,264909,11094,2732,176014,2008-04-04 17:14:50,3,5,2019-01-28 12:30:01,"The Driftwood Inn was destroyed by Hurricane Michael, leaving this Mexico Beach family facing an impossible choice. https://t.co/JrULXjcaoy"
1056,1089857902733488128,14304462,5587,264909,11094,2732,176014,2008-04-04 17:14:50,1,3,2019-01-28 12:09:07,Bucs' Evans scores an interception as AFC get a sloppy Pro Bowl win in Orlando https://t.co/NO4Z2sW6Qg
1057,1089855385849090049,14304462,5587,264909,11094,2732,176014,2008-04-04 17:14:50,0,2,2019-01-28 11:59:07,Brokaw says he feels terrible commentary offended Hispanics https://t.co/2LJtO6Lsav
1058,1089855382288101376,14304462,5587,264909,11094,2732,176014,2008-04-04 17:14:50,0,2,2019-01-28 11:59:06,"Florida education news: Graduation requirements, textbooks, school grades and more https://t.co/mCCVUynvGl"
1059,1089855379083653120,14304462,5587,264909,11094,2732,176014,2008-04-04 17:14:50,4,2,2019-01-28 11:59:05,Hurricane Michael recovery has a big problem: People aren't donating https://t.co/vtDdXHit9f
1060,1089849349532614656,14304462,5587,264909,11094,2732,176014,2008-04-04 17:14:50,45,80,2019-01-28 11:35:08,"PolitiFact Florida: Sen. Rick Scott said he always supported Dreamers, but that's not correct https://t.co/daEHUTRmvw"
1061,1089845829718794241,14304462,5587,264909,11094,2732,176014,2008-04-04 17:14:50,0,1,2019-01-28 11:21:08,"Forecast: Clouds and rain are gone, but brisk conditions remain over Tampa Bay https://t.co/o2HUfNdcqL"
1062,1089845828489949186,14304462,5587,264909,11094,2732,176014,2008-04-04 17:14:50,0,0,2019-01-28 11:21:08,Regional credit union enters Hernando market https://t.co/ou6O5glvZg
1063,1089840514495643649,14304462,5587,264909,11094,2732,176014,2008-04-04 17:14:50,2,2,2019-01-28 11:00:01,"The 800,000 federal workers who were affected will receive back pay, but contractors don't have the same guarantee.
https://t.co/4t4LeO4Oc9"
1064,1089835753863958528,14304462,5587,264909,11094,2732,176014,2008-04-04 17:14:50,1,2,2019-01-28 10:41:06,A new senator's responsibility on drilling https://t.co/dJPynYot7D
1065,1089832236277362688,14304462,5587,264909,11094,2732,176014,2008-04-04 17:14:50,0,0,2019-01-28 10:27:07,"Just for laughs, National Comedy Hall of Fame plans move to Pasco https://t.co/YKvJ61wtwf"
1066,1089832234662555648,14304462,5587,264909,11094,2732,176014,2008-04-04 17:14:50,0,1,2019-01-28 10:27:07,Tattoos in the workplace? These 11 coworkers got tats to match in St. Petersburg https://t.co/gVrQKl3qS5
1067,1089828454382489600,14304462,5587,264909,11094,2732,176014,2008-04-04 17:14:50,1,5,2019-01-28 10:12:06,Hooper: The search for sensible solutions to gun violence must be relentless https://t.co/luWsJvkKpq
1068,1089828449017946112,14304462,5587,264909,11094,2732,176014,2008-04-04 17:14:50,0,1,2019-01-28 10:12:04,The Daystarter: Hurricane Michael donations lag behind other recent storms; PolitiFact Florida evaluates Rick Scott… https://t.co/ppbmf9Jvyy
1069,1089825411817713664,14304462,5587,264909,11094,2732,176014,2008-04-04 17:14:50,1,6,2019-01-28 10:00:00,"ICYMI: “He’s destroyed my business; he’s destroyed me,” Hamburger Mary’s owner Kurt King said. “A lot of our employ… https://t.co/n2Txha6RNo"
1070,1089809334492585984,14304462,5587,264909,11094,2732,176014,2008-04-04 17:14:50,0,0,2019-01-28 08:56:07,Another commercial seafood expansion in Hernando Beach has been proposed https://t.co/p3xfMuG2ta
1071,1089780111845539840,14304462,5587,264909,11094,2732,176014,2008-04-04 17:14:50,0,2,2019-01-28 07:00:00,"The comedian was hanging out with veterans during the 2019 parade.
https://t.co/XCONfJeT6k"
1072,1089765012682559489,14304462,5587,264909,11094,2732,176014,2008-04-04 17:14:50,4,2,2019-01-28 06:00:00,"ICYMI: Affordable housing was already scarce before the storm. Now, families are enduring cold January temperatures… https://t.co/DbihwNbswe"
1073,1089742362144845824,14304462,5587,264909,11094,2732,176014,2008-04-04 17:14:50,0,3,2019-01-28 04:30:00,ICYMI: Two arrests involved men standing atop and damaging a police vehicle. Two others were for battery on a law e… https://t.co/n4OFf16xl4
1074,1089734813710540801,14304462,5587,264909,11094,2732,176014,2008-04-04 17:14:50,3,7,2019-01-28 04:00:00,"""Building vertically also allays sprawl, an affliction that plagues parts of the Tampa Bay area. More families movi… https://t.co/mtCH5GNR08"
1075,1089724390160224257,14304462,5587,264909,11094,2732,176014,2008-04-04 17:14:50,0,3,2019-01-28 03:18:35,Former USF QB Brett Kean headed to Charlotte https://t.co/G48mkm5fLv
1076,1089724386410606592,14304462,5587,264909,11094,2732,176014,2008-04-04 17:14:50,1,3,2019-01-28 03:18:34,Police: St. Petersburg taxi passenger killed in multi-car collision https://t.co/L9aVMQwLWZ
1077,1089719714643955713,14304462,5587,264909,11094,2732,176014,2008-04-04 17:14:50,1,1,2019-01-28 03:00:00,"Though similar plans in Pasco County have drawn heated debate and a lawsuit, it remains to be seen how Hernando Cou… https://t.co/8eG6rNwrM9"
1078,1089704616860807168,14304462,5587,264909,11094,2732,176014,2008-04-04 17:14:50,6,6,2019-01-28 02:00:01,Limiting how long a rape victim has to report the crime creates a barrier to coming forward. But no limitation make… https://t.co/vKOeLswxsL
1079,1089697592382910464,14304462,5587,264909,11094,2732,176014,2008-04-04 17:14:50,0,2,2019-01-28 01:32:06,Highway Patrol: One dead in Citrus County crash https://t.co/JGZ0iJSQDa
1080,1089691041219764224,14304462,5587,264909,11094,2732,176014,2008-04-04 17:14:50,0,1,2019-01-28 01:06:04,"Sports on TV/radio for Monday, Jan. 28 https://t.co/RuNr8GKQDe"
1081,1089689515659284480,14304462,5587,264909,11094,2732,176014,2008-04-04 17:14:50,5,23,2019-01-28 01:00:00,ICYMI: If you thought for a moment that one of the guys tossing beads to the crowd at the Gasparilla parade of pira… https://t.co/djGK4niLpG
1082,1089674415439314944,14304462,5587,264909,11094,2732,176014,2008-04-04 17:14:50,0,3,2019-01-28 00:00:00,Maybe Florida should hire a trademark attorney to stop all those folks mocking us for our goofy behavior. https://t.co/mPjTElimyw
1083,1094746601392824320,14304462,5587,264916,11094,2731,176014,2008-04-04 17:14:50,1,3,2019-02-10 23:55:03,Lightning more than holding its own in physical games https://t.co/V5JpCAx4NX
1084,1094733512958070784,14304462,5587,264916,11094,2731,176014,2008-04-04 17:14:50,0,3,2019-02-10 23:03:03,Hillsborough deputies: Motorcyclist dies when struck by van https://t.co/2ILxSwttpg
1085,1094732759371780097,14304462,5587,264916,11094,2731,176014,2008-04-04 17:14:50,1,4,2019-02-10 23:00:03,ICYMI: “Some of the people we put here did not act in the best interest of the children we were caring for or this… https://t.co/iLSofgyM2g
1086,1094730241002459136,14304462,5587,264916,11094,2731,176014,2008-04-04 17:14:50,1,2,2019-02-10 22:50:03,Classical opera meets modern in Opera Tampa's world premiere of 'Lady Swanwhite' https://t.co/U1Gq01aRrJ
