Index,ID,User_ID,Friends_Count,Followers_Count,Favourites_Count,Listed_Count,Status_Count,Created_at,Retweet_Count,Favourite_Count,Created_at,Text
663,1092255746153160706,4170491,56286,1039696,542,5038,239509,2007-04-11 12:50:15,4,16,2019-02-04 02:57:17,ALERT: @Shaq spotted in downtown Atlanta 😂. LIVE #SuperBowl updates here: https://t.co/jeua0p6ZQx https://t.co/mMZGaR3ezg
664,1092254799427497985,4170491,56286,1039696,542,5038,239509,2007-04-11 12:50:15,0,5,2019-02-04 02:53:31,"More photos: Maroon 5, Big Boi, Travis Scott perform at Super Bowl 53 halftime show
https://t.co/g1E4WJptue https://t.co/JBHZmvsmN5"
665,1092252913748066305,4170491,56286,1039696,542,5038,239509,2007-04-11 12:50:15,0,7,2019-02-04 02:46:02,Super Bowl 53: Maroon 5 and guests bland and tattooed for halftime show https://t.co/LLVIOhcgBx
666,1092249434757496833,4170491,56286,1039696,542,5038,239509,2007-04-11 12:50:15,5,19,2019-02-04 02:32:12,"An Atlanta police spokeswoman said there have been ""no significant incidents"" to report. LIVE updates:… https://t.co/fvejx7EciW"
667,1092248634576510976,4170491,56286,1039696,542,5038,239509,2007-04-11 12:50:15,0,1,2019-02-04 02:29:02,"Photos: Maroon 5, Big Boi, Travis Scott perform at Super Bowl 53 halftime show https://t.co/gEd8qvUdb8"
668,1092248476962967552,4170491,56286,1039696,542,5038,239509,2007-04-11 12:50:15,1,26,2019-02-04 02:28:24,Well said! https://t.co/rysYQPcJZu
669,1092247368957939717,4170491,56286,1039696,542,5038,239509,2007-04-11 12:50:15,2,11,2019-02-04 02:24:00,"'Pyro, lighted orbs and a tribute to Spongebob Squarepants': Maroon 5 and guests bland and tattooed for halftime sh… https://t.co/x1GtyBMvuP"
670,1092244996911259648,4170491,56286,1039696,542,5038,239509,2007-04-11 12:50:15,6,21,2019-02-04 02:14:34,‘That’s it for Big Boi?’ Twitter reacts to ‘disappointing’ #SuperBowlLIII halftime show. LIVE SOCIAL UPDATES:… https://t.co/CrnZPPM8hB
671,1092244356080259074,4170491,56286,1039696,542,5038,239509,2007-04-11 12:50:15,1,17,2019-02-04 02:12:02,Los Angeles Rams defensive coordinator Wade Phillips made quite an entrance at Mercedes-Benz Stadium Sunday for Sup… https://t.co/sAPRHFofhg
672,1092240200850460672,4170491,56286,1039696,542,5038,239509,2007-04-11 12:50:15,12,7,2019-02-04 01:55:31,"ICYMI:  21 Savage, whose real name is Sha Yaa Bin Abraham-Joseph, was taken into custody in a “targeted operation”… https://t.co/NRo9RnyQe5"
673,1092240080448749568,4170491,56286,1039696,542,5038,239509,2007-04-11 12:50:15,2,11,2019-02-04 01:55:02,"Many fans responded with awe after hearing that 21 Savage, a long-time ambassador for Atlanta, is not in fact a nat… https://t.co/SF9vqsOahK"
674,1092236053648416769,4170491,56286,1039696,542,5038,239509,2007-04-11 12:50:15,0,1,2019-02-04 01:39:02,A quarter-by-quarter breakdown of Super Bowl 53 in Atlanta: https://t.co/CAWDniuB8a
675,1092233598269341696,4170491,56286,1039696,542,5038,239509,2007-04-11 12:50:15,1,5,2019-02-04 01:29:17,How will this year's  #SuperBowl halftime show stack up? The most- and least-loved Super Bowl halftime shows:… https://t.co/iEXOz5RXx6
676,1092231952164446209,4170491,56286,1039696,542,5038,239509,2007-04-11 12:50:15,6,61,2019-02-04 01:22:44,What did you think about the #SuperBowl halftime performance? What was your favorite part? https://t.co/oyCM6CY7OA https://t.co/FPXIHPFVdz
677,1092231382267514880,4170491,56286,1039696,542,5038,239509,2007-04-11 12:50:15,2,3,2019-02-04 01:20:28,"Which artists do Gronk, Gurley and Goff listen to get ready for a big game? #SuperBowl53  https://t.co/Vo2uTw59GV https://t.co/l2NnRbFJPx"
678,1092231343365410823,4170491,56286,1039696,542,5038,239509,2007-04-11 12:50:15,4,58,2019-02-04 01:20:19,How are we feeling so far about the #SuperBowl halftime show? https://t.co/OUGltka026
679,1092229906564558848,4170491,56286,1039696,542,5038,239509,2007-04-11 12:50:15,1,7,2019-02-04 01:14:37,LIVE UPDATES: #BestAdEver? People are stoked for the ‘Twilight Zone’ promo feat. Jordan Peele… https://t.co/wu7NSqYm0v
680,1092228745304391681,4170491,56286,1039696,542,5038,239509,2007-04-11 12:50:15,3,5,2019-02-04 01:10:00,UPDATE: The long notes put her over. Or did they? https://t.co/UGPK1rpxMj
681,1092228483940601857,4170491,56286,1039696,542,5038,239509,2007-04-11 12:50:15,3,22,2019-02-04 01:08:57,"#SuperBowlLIII Gladys Knight, Chloe x Halle flawless in game performances.
https://t.co/rOJjveDj4e https://t.co/rqFHp3dbU7"
682,1092228107426246661,4170491,56286,1039696,542,5038,239509,2007-04-11 12:50:15,1,4,2019-02-04 01:07:28,"It’s halftime for #SuperBowl53! You know what that means: food, drinks and soon @maroon5 https://t.co/ENpaf70vFl"
683,1092227495099854848,4170491,56286,1039696,542,5038,239509,2007-04-11 12:50:15,2,0,2019-02-04 01:05:02,"MARTA union approves new contract, but bus driver sickout continues https://t.co/FF4GKAIUoN https://t.co/tJPmDGuNVK"
684,1092224978123141120,4170491,56286,1039696,542,5038,239509,2007-04-11 12:50:15,2,19,2019-02-04 00:55:02,PHOTOS: Gladys Knight sings the national anthem for #SuperBowl53 https://t.co/Mt8y6h7BKo https://t.co/4mFk2TaFqk
685,1092223874119450624,4170491,56286,1039696,542,5038,239509,2007-04-11 12:50:15,1,2,2019-02-04 00:50:38,"Photos: Patriots, Rams collide in #SuperBowlLIII in Atlanta: https://t.co/GltrdLYhZe https://t.co/bHJ3Wlfeh5"
686,1092222463105208320,4170491,56286,1039696,542,5038,239509,2007-04-11 12:50:15,1,6,2019-02-04 00:45:02,".@Maroon5, @BigBoi and @trvisXX  will perform shortly. Who are you most excited to see? https://t.co/Ehs6Q7hAE7 https://t.co/0lG37iVZf6"
687,1092221204558172161,4170491,56286,1039696,542,5038,239509,2007-04-11 12:50:15,4,19,2019-02-04 00:40:02,"Atlanta rappers @2Chainz, @LilJon, @Ludacris cash in with #SuperBowl ads https://t.co/jflaHfFxgc https://t.co/3ej2yTs1rA"
688,1092219522285740033,4170491,56286,1039696,542,5038,239509,2007-04-11 12:50:15,7,17,2019-02-04 00:33:21,New Orleans holds a massive bitterness parade over missed Super Bowl. https://t.co/qg7AqWvnsU https://t.co/Y5sF70zzHt
689,1092218716274733056,4170491,56286,1039696,542,5038,239509,2007-04-11 12:50:15,6,7,2019-02-04 00:30:09,NFL’s first male cheerleaders make #SuperBowl debut in Atlanta https://t.co/V9kGHSmNjf https://t.co/vSOAjpwEeF
690,1092218704090288129,4170491,56286,1039696,542,5038,239509,2007-04-11 12:50:15,0,1,2019-02-04 00:30:06,Who's No. 1 in football? https://t.co/Dv8t0M4pfE
691,1092216832528912384,4170491,56286,1039696,542,5038,239509,2007-04-11 12:50:15,3,8,2019-02-04 00:22:39,"Social media reacts with shock, humor after reports of 21 Savage’s British roots, ICE arrest in Atlanta.… https://t.co/vEymH2rdhJ"
692,1092215357379624960,4170491,56286,1039696,542,5038,239509,2007-04-11 12:50:15,22,165,2019-02-04 00:16:48,"Didn't she look stunning? Did Atlanta's very own legend Gladys Knight nail that national anthem? #SuperBowlLIII 
LI… https://t.co/WasTw1eHUn"
693,1092214416228188160,4170491,56286,1039696,542,5038,239509,2007-04-11 12:50:15,2,11,2019-02-04 00:13:03,"Moments before the coin toss, the NFL ran video across the Halo Board of Martin Luther King Jr., along with excepts… https://t.co/EpSE3vJqMu"
694,1092213289432555521,4170491,56286,1039696,542,5038,239509,2007-04-11 12:50:15,2,6,2019-02-04 00:08:35,Check out the most memorable Super Bowl Halftime shows. What was your fave? How will #SuperBowlLIII halftime show s… https://t.co/YQAxPEQ0uU
695,1092211999952588800,4170491,56286,1039696,542,5038,239509,2007-04-11 12:50:15,2,7,2019-02-04 00:03:27,PHOTOS:The #SuperBowl vibe inside @MBStadium is bananas. Here's what we're seeing: https://t.co/0Kb3vxsoze https://t.co/YMYXi4Nu5W
696,1092211888853843968,4170491,56286,1039696,542,5038,239509,2007-04-11 12:50:15,22,59,2019-02-04 00:03:01,Tom Brady fist-bumps Super Bowl ref and the Internet claims game is fixed. https://t.co/E0tLm3Cnw0 https://t.co/kIEcitPl43
697,1092211262635823105,4170491,56286,1039696,542,5038,239509,2007-04-11 12:50:15,2,6,2019-02-04 00:00:31,There’s no shortage of creativity at #SuperBowl53 when it comes to showing team pride!! LIVE UPDATES:… https://t.co/NyuJDWK1Bg
698,1092208354565545984,4170491,56286,1039696,542,5038,239509,2007-04-11 12:50:15,1,4,2019-02-03 23:48:58,".@JetBlue is the official airline of the New England @Patriots, so ...  🤷 https://t.co/Veysxx1ZEc"
699,1092205193637363712,4170491,56286,1039696,542,5038,239509,2007-04-11 12:50:15,2,12,2019-02-03 23:36:25,The long notes put her over. 🎵🎵 https://t.co/K6lebU4E0a
700,1092204523928645632,4170491,56286,1039696,542,5038,239509,2007-04-11 12:50:15,55,1201,2019-02-03 23:33:45,So what did we think about Gladys Knight's performance? Did we like her rendition of the National Anthem?… https://t.co/GkZLQOU8uz
701,1092201067314581506,4170491,56286,1039696,542,5038,239509,2007-04-11 12:50:15,11,13,2019-02-03 23:20:01,"The “Boycott Bowl,” was billed as an outdoor street party with live musical performances and a specialty beer calle… https://t.co/XSlWTNKXbk"
702,1092201061182554113,4170491,56286,1039696,542,5038,239509,2007-04-11 12:50:15,9,32,2019-02-03 23:19:59,Civil rights leaders John Lewis and Andrew Young await the coin toss. Don't miss a thing!: LIVE updates here:… https://t.co/pRrc3xDuy9
703,1092199750026383365,4170491,56286,1039696,542,5038,239509,2007-04-11 12:50:15,1,1,2019-02-03 23:14:47,"LATEST: With kickoff approaching, there are at least 8 Super Bowl tickets available https://t.co/8CGT0CW4f7 https://t.co/IRKYJcZVf1"
704,1092199379044319232,4170491,56286,1039696,542,5038,239509,2007-04-11 12:50:15,2,8,2019-02-03 23:13:18,We're also hanging out with @batonbob at Park Tavern for a #SuperBowl watch party. Catch us over on Instagram (AJCN… https://t.co/riMIzj6TMr
705,1092198553072664577,4170491,56286,1039696,542,5038,239509,2007-04-11 12:50:15,1,2,2019-02-03 23:10:01,Steve Harvey is totally over Tom Brady playing in #SuperBowl https://t.co/23UUyl0thh https://t.co/kXoYk8eG1Y
706,1092198062280318976,4170491,56286,1039696,542,5038,239509,2007-04-11 12:50:15,6,18,2019-02-03 23:08:04,The roof at @MBStadium is opening up...which means it must be time for #SuperBowl53!! Follow along on our Instagram… https://t.co/uItnslbkbh
707,1092197246504968192,4170491,56286,1039696,542,5038,239509,2007-04-11 12:50:15,4,8,2019-02-03 23:04:50,The roof is slooowly opening as we speak. https://t.co/ZgdLrYbd7l
708,1092196951221825536,4170491,56286,1039696,542,5038,239509,2007-04-11 12:50:15,0,5,2019-02-03 23:03:39,#SuperBowl53: The scene in downtown Atlanta https://t.co/QZKOdjiCBl https://t.co/mNkm7uMjIO
709,1092196380481863681,4170491,56286,1039696,542,5038,239509,2007-04-11 12:50:15,1,3,2019-02-03 23:01:23,"Closer to game time, security checkpoint lines to get inside #MercedesBenzStadium are long. Don't you dare miss our… https://t.co/rIYLhVfP9D"
710,1092194779872534528,4170491,56286,1039696,542,5038,239509,2007-04-11 12:50:15,0,2,2019-02-03 22:55:02,PHOTOS: The #SuperBowl scene inside @MBStadium. You can FEEL the energy! https://t.co/0Kb3vxsoze https://t.co/YiQonk8eOa
711,1092193455181361155,4170491,56286,1039696,542,5038,239509,2007-04-11 12:50:15,2,8,2019-02-03 22:49:46,WATCH: CBS includes Hank Aaron in #SuperBowlLIII pre-game show. https://t.co/Rehw7Jw0iG https://t.co/syJyWIFBJR
712,1092193088729239557,4170491,56286,1039696,542,5038,239509,2007-04-11 12:50:15,0,5,2019-02-03 22:48:18,PHOTOS: @Shaq’s #SuperBowl Fun House gets star power https://t.co/mI2ih03b5l https://t.co/ioFt2qIEfn
713,1092191089518407680,4170491,56286,1039696,542,5038,239509,2007-04-11 12:50:15,5,9,2019-02-03 22:40:22,Recognize the face?? @adamlevine and @BeePrinsloo are here! LIVE UPDATES: https://t.co/jeua0p6ZQx https://t.co/ojA2G4R41h
714,1092190996476116992,4170491,56286,1039696,542,5038,239509,2007-04-11 12:50:15,2,8,2019-02-03 22:40:00,“We have to continue to speak out. The #SuperBowl is just a game. This is real life over here.” https://t.co/MPP6DJ9TP2
715,1092188482355777539,4170491,56286,1039696,542,5038,239509,2007-04-11 12:50:15,0,0,2019-02-03 22:30:00,When is the #SuperBowl and how can you watch it? Here’s a guide: https://t.co/wVsITCjRPh
716,1092188152004034561,4170491,56286,1039696,542,5038,239509,2007-04-11 12:50:15,1,5,2019-02-03 22:28:41,PHOTOS: #SuperBowlLIII fun in Atlanta as we countdown to kickoff. https://t.co/xLdn1sYIZV Don't miss LIVE updates:… https://t.co/AWUoMmHqDg
717,1092186910976626688,4170491,56286,1039696,542,5038,239509,2007-04-11 12:50:15,2,5,2019-02-03 22:23:46,We're a little more than an hour from kickoff. Here's what the scene is like @MBStadium. LIVE updates here:… https://t.co/sDjqorDpuF
718,1092184705410183168,4170491,56286,1039696,542,5038,239509,2007-04-11 12:50:15,0,4,2019-02-03 22:15:00,He said he's happy to feel well enough to go to Atlanta for his 53rd consecutive #SuperBowl. But just like the… https://t.co/DhFxqdB1VK
719,1092184636061609990,4170491,56286,1039696,542,5038,239509,2007-04-11 12:50:15,0,1,2019-02-03 22:14:43,Photos: Check out the #SuperBowlLIII scene inside Mercedes-Benz Stadium. https://t.co/TwSt0fwwUS https://t.co/ZUcGj8WLls
720,1092183708885544960,4170491,56286,1039696,542,5038,239509,2007-04-11 12:50:15,5,12,2019-02-03 22:11:02,"Wade Phillips pays tribute to his father with #SuperBowlLIII attire.
https://t.co/vSt3bSvXQG https://t.co/dJ563f9S3P"
721,1092183094801649664,4170491,56286,1039696,542,5038,239509,2007-04-11 12:50:15,0,2,2019-02-03 22:08:36,"Fan who shined laser at Brady banned for life from Arrowhead, could face charges, according to a report https://t.co/eh411WYPkw"
722,1092181423535067142,4170491,56286,1039696,542,5038,239509,2007-04-11 12:50:15,7,12,2019-02-03 22:01:57,"ICE arrests rapper @21savage, says he is actually British and overstayed visa  https://t.co/LkEZjH4CJ3 https://t.co/EYkVVPNihR"
723,1092181029333422087,4170491,56286,1039696,542,5038,239509,2007-04-11 12:50:15,6,15,2019-02-03 22:00:23,"While you await the Big Game, have a few #SuperBowlLIII chuckles on us, compliments of AJC's esteemed cartoonist Mi… https://t.co/02KLSV7UIz"
724,1092179428610854912,4170491,56286,1039696,542,5038,239509,2007-04-11 12:50:15,1,3,2019-02-03 21:54:02,"After Atlanta, these are the future Super Bowl sites https://t.co/WlR8QzTa4Z"
725,1092179309261918208,4170491,56286,1039696,542,5038,239509,2007-04-11 12:50:15,3,19,2019-02-03 21:53:33,The energy at @MBStadium before @SuperBowl is 💯💯💯 Follow along on our Instagram (AJCNews) for an all-access look!… https://t.co/bSRWPkhs9o
726,1092178702128082946,4170491,56286,1039696,542,5038,239509,2007-04-11 12:50:15,4,3,2019-02-03 21:51:08,"Still looking for #SuperBowlLIII tickets? We don't have tickets, but we've got live updates. https://t.co/jeua0p6ZQx https://t.co/Iv0mDCmJe8"
727,1092176970467688448,4170491,56286,1039696,542,5038,239509,2007-04-11 12:50:15,0,4,2019-02-03 21:44:16,It’s shaping up to be a FULL house! The teams are warming up and fans are finding their seats. Live updates:… https://t.co/SwWwbPixnY
728,1092176269284962306,4170491,56286,1039696,542,5038,239509,2007-04-11 12:50:15,5,29,2019-02-03 21:41:28,"Go guys! NFL’s first male cheerleaders to make #SuperBowlLIII debut in Atlanta today.
https://t.co/AMTiEO9sqC https://t.co/NGhwwoEzNy"
729,1092175165692223495,4170491,56286,1039696,542,5038,239509,2007-04-11 12:50:15,0,3,2019-02-03 21:37:05,Tom Brady is ready for his ninth Super Bowl. https://t.co/zV7acXIAcu
730,1092174290596913152,4170491,56286,1039696,542,5038,239509,2007-04-11 12:50:15,0,3,2019-02-03 21:33:37,"If @Google Trends determined #SuperBowl53, these fans would be just fine with that. https://t.co/2Ur7B3iM6v https://t.co/dc84pFrjZZ"
731,1092173696893157376,4170491,56286,1039696,542,5038,239509,2007-04-11 12:50:15,0,4,2019-02-03 21:31:15,Why AJC sports writer Mike Cunningham likes the Rams in  #SuperBowlLIII.  Do you agree or disagree?… https://t.co/HlOtz9BE1S
732,1092171597945942017,4170491,56286,1039696,542,5038,239509,2007-04-11 12:50:15,1,2,2019-02-03 21:22:55,"Pick against these Patriots? AJC sports columnist Mark Bradley says: 'I’m sorry. I just can’t' 
Agree? Disagree?… https://t.co/i5set892W0"
733,1092170876282421248,4170491,56286,1039696,542,5038,239509,2007-04-11 12:50:15,3,10,2019-02-03 21:20:03,"Former Falcons tight end Tony Gonzalez, after being announced as a member of 2019 Pro Football Hall of Fame class,… https://t.co/HBPiWczKsl"
734,1092168438838149121,4170491,56286,1039696,542,5038,239509,2007-04-11 12:50:15,2,2,2019-02-03 21:10:21,"Don't miss a minute! AJC's got you:
LIVE UPDATES: #SuperBowlSunday buzz: https://t.co/GOuSn48nlw https://t.co/rcKyu3iCLZ"
735,1092168287633502209,4170491,56286,1039696,542,5038,239509,2007-04-11 12:50:15,2,5,2019-02-03 21:09:45,It’s almost game time! Follow love updates for #SuperBowlLIII here: https://t.co/jeua0p6ZQx https://t.co/oAx8Wt69mV
736,1092167128353046529,4170491,56286,1039696,542,5038,239509,2007-04-11 12:50:15,2,9,2019-02-03 21:05:09,🤣🤣🤣 https://t.co/r36qbhDALf
737,1092166593537298432,4170491,56286,1039696,542,5038,239509,2007-04-11 12:50:15,0,1,2019-02-03 21:03:02,"Follow along for all the buzz around Super Bowl 2019 entertainment—from social reactions, memes, celebrity sighting… https://t.co/b2kUqg2jph"
738,1092158282641428480,4170491,56286,1039696,542,5038,239509,2007-04-11 12:50:15,1,2,2019-02-03 20:30:00,"Millions of people tune into the Super Bowl, and not just for the ball game 📺 https://t.co/rFGycoHyER"
739,1092158009151815685,4170491,56286,1039696,542,5038,239509,2007-04-11 12:50:15,168,235,2019-02-03 20:28:55,#BREAKING: Rapper 21 Savage arrested by ICE. https://t.co/FrVotFNns3 https://t.co/Ss9EizZ4p0
740,1092155753870360576,4170491,56286,1039696,542,5038,239509,2007-04-11 12:50:15,2,4,2019-02-03 20:19:57,Still on your way downtown? Read up on everything you need to know for #SuperBowl53 https://t.co/OxrDFqFdsn https://t.co/EeOtfsxrtT
741,1092154009463517185,4170491,56286,1039696,542,5038,239509,2007-04-11 12:50:15,5,3,2019-02-03 20:13:01,The Super Bowl will take place at 6:30 tonight at Mercedes-Benz Stadium. The performances by a variety soul singers… https://t.co/3YsXIYx0pn
742,1092153995962052608,4170491,56286,1039696,542,5038,239509,2007-04-11 12:50:15,2,2,2019-02-03 20:12:58,Fans are pouring into @MBStadium for #SBLlll Tune in for LIVE updates: https://t.co/jeua0p6ZQx https://t.co/Kcjp4Lo9GZ
743,1092152078103916544,4170491,56286,1039696,542,5038,239509,2007-04-11 12:50:15,16,53,2019-02-03 20:05:21,If this doesn’t get you hype for the #SuperBowl I don’t know what will. The Atlanta Drum Academy is killing it! https://t.co/Z8OmaqrjSb
744,1092149862018240513,4170491,56286,1039696,542,5038,239509,2007-04-11 12:50:15,0,2,2019-02-03 19:56:32,How you liking this balmy #SuperBowlSunday weather? You'll ❤ Atlanta even more after you check out some of the cold… https://t.co/LmEVpet8Lz
745,1092146956888141834,4170491,56286,1039696,542,5038,239509,2007-04-11 12:50:15,1,4,2019-02-03 19:45:00,"The lineup Jermaine Dupri curated for the final show offered Super Bowl week’s best, most accessible overview of th… https://t.co/zoLhk4m3aw"
746,1092144820632633344,4170491,56286,1039696,542,5038,239509,2007-04-11 12:50:15,3,6,2019-02-03 19:36:30,It’s game day in #atlanta! Follow along for all-day #SuperBowlLlll coverage. https://t.co/90g3pRAW0k https://t.co/caA6Bc1180
747,1092143183906131969,4170491,56286,1039696,542,5038,239509,2007-04-11 12:50:15,2,3,2019-02-03 19:30:00,"As far as downtown traffic is concerned, the #SuperBowl may be the Olympics times two 😱 https://t.co/tkNBOKARCF"
748,1092142933552316416,4170491,56286,1039696,542,5038,239509,2007-04-11 12:50:15,2,3,2019-02-03 19:29:01,Are you ready for these cuties?” Puppy Bowl 2019: How to watch on #SuperBowlSunday. https://t.co/COvAArcBDR https://t.co/3fQkVP8J1j
749,1092141577697484800,4170491,56286,1039696,542,5038,239509,2007-04-11 12:50:15,2,14,2019-02-03 19:23:37,The calm before the #SuperBowl storm. All the feels! https://t.co/0ueCuB8lg5
750,1092139964173819906,4170491,56286,1039696,542,5038,239509,2007-04-11 12:50:15,4,3,2019-02-03 19:17:13,"A 'dangerous sport:' Ahead of Super Bowl, Trump says he wouldn't encourage son to play football.… https://t.co/rXpumUGE3r"
751,1092137297821208576,4170491,56286,1039696,542,5038,239509,2007-04-11 12:50:15,1,5,2019-02-03 19:06:37,"In town, but not going to the Big Game? Don't worry, there are plenty of other things to do today! #SuperBowlSunday… https://t.co/aO7tw4k7m9"
752,1092137102119178240,4170491,56286,1039696,542,5038,239509,2007-04-11 12:50:15,1,2,2019-02-03 19:05:50,"SUPER WEATHER: How about a high of 60, with a few clouds for #SuperBowlSunday. Meanwhile, don't forget to pick up y… https://t.co/Y4H7BvKJEn"
753,1092136890294251520,4170491,56286,1039696,542,5038,239509,2007-04-11 12:50:15,0,1,2019-02-03 19:05:00,Don't miss a moment of Super Bowl 53 🎉 https://t.co/wVsITCjRPh
754,1092136658336657411,4170491,56286,1039696,542,5038,239509,2007-04-11 12:50:15,1,9,2019-02-03 19:04:04,The gates are open and #SuperBowl fans are streaming in! https://t.co/ooyYw2YNBw
755,1092134532701188096,4170491,56286,1039696,542,5038,239509,2007-04-11 12:50:15,1,2,2019-02-03 18:55:38,"NFL plans closed roof for Super Bowl game, open for pregame festivities. https://t.co/ZgdLrYbd7l"
756,1092132279432941568,4170491,56286,1039696,542,5038,239509,2007-04-11 12:50:15,4,5,2019-02-03 18:46:40,T-minus 5 hours and 15 minutes till kickoff and the entry line @MBStadium is already long. #superbowl https://t.co/MrORAC6aIA
757,1092132151196348417,4170491,56286,1039696,542,5038,239509,2007-04-11 12:50:15,1,4,2019-02-03 18:46:10,RUBBING IT IN: Patriots fans line up to take pics in front of a picture of the ring from Super Bowl LI — the one in… https://t.co/7MfBfUnXJg
758,1092131857318232064,4170491,56286,1039696,542,5038,239509,2007-04-11 12:50:15,0,4,2019-02-03 18:45:00,"Hello, downtown Atlanta! It's Super Bowl Sunday 🏈🏆 https://t.co/XABMKtEhM1"
759,1092128469859876864,4170491,56286,1039696,542,5038,239509,2007-04-11 12:50:15,1,2,2019-02-03 18:31:32,PHOTOS: It's GAME DAY! And the fans are out and ready! #SuperBowlSunday https://t.co/QB8Sxnh2Qr https://t.co/FWcoy5E3kg
760,1092127326895333376,4170491,56286,1039696,542,5038,239509,2007-04-11 12:50:15,3,5,2019-02-03 18:27:00,"MARTA, Lyft, Uber, and more for Super Bowl 53: https://t.co/9GHoZAAwen"
761,1092123560527753216,4170491,56286,1039696,542,5038,239509,2007-04-11 12:50:15,2,5,2019-02-03 18:12:02,A look at the NFL Honors red carpet. More of the red carpet looks here: https://t.co/Cv06ZcDzKM https://t.co/cSqdqWHwba
762,1092122109550182403,4170491,56286,1039696,542,5038,239509,2007-04-11 12:50:15,1,9,2019-02-03 18:06:16,The fans are out here and ready to party for the #SuperBowlLlll #SuperBowlSunday #SuperBowl https://t.co/Fq27aB2pV6
763,1092120548258299909,4170491,56286,1039696,542,5038,239509,2007-04-11 12:50:15,0,2,2019-02-03 18:00:03,Everything you need to know about Super Bowl 53 🏈🏆 https://t.co/QgmENmcOQv https://t.co/WW2siq8o46
764,1092118277621510144,4170491,56286,1039696,542,5038,239509,2007-04-11 12:50:15,3,19,2019-02-03 17:51:02,Foo Fighters and Run the Jewels rocked a newly constructed venue in Atlantic Station for the DirecTV Super Saturday… https://t.co/2jjKMQL7l1
765,1092113737736220673,4170491,56286,1039696,542,5038,239509,2007-04-11 12:50:15,0,0,2019-02-03 17:33:00,Have you heard? 🤔 https://t.co/jeua0p6ZQx
766,1092112230181679109,4170491,56286,1039696,542,5038,239509,2007-04-11 12:50:15,0,3,2019-02-03 17:27:00,"Last minute tickets, 🌭🌭, transportation and more! Everything you need to know about Super Bowl 53 https://t.co/yFirrL70J8"
767,1092109716715696129,4170491,56286,1039696,542,5038,239509,2007-04-11 12:50:15,1,4,2019-02-03 17:17:01,"Super Bowl veteran Bruno Mars was joined by halftime-sidestepper Cardi B for a lively, crowd-pleasing show on the e… https://t.co/D4V8fdqW7e"
768,1092105936200699904,4170491,56286,1039696,542,5038,239509,2007-04-11 12:50:15,0,0,2019-02-03 17:02:00,"Here’s your guide to where to eat, drink and play corn hole before kickoff. https://t.co/n7gKyIKTyJ"
769,1092102161226452995,4170491,56286,1039696,542,5038,239509,2007-04-11 12:50:15,2,2,2019-02-03 16:47:00,"If you’re traveling through the Atlanta airport for the #SuperBowl, prepare for the possibility of big crowds durin… https://t.co/E4V7v5Jo0D"
770,1092098265644961792,4170491,56286,1039696,542,5038,239509,2007-04-11 12:50:15,4,13,2019-02-03 16:31:31,Captain America and Captain Marvel are rooting for the Patriots! #SuperBowlSunday #SBLlll https://t.co/s8SOT03iFr
771,1092096625131089920,4170491,56286,1039696,542,5038,239509,2007-04-11 12:50:15,2,10,2019-02-03 16:25:00,Just an option for your #SuperBowl lunch.... and dinner 😋 https://t.co/SfNbbUgBoD
772,1092090340503441408,4170491,56286,1039696,542,5038,239509,2007-04-11 12:50:15,0,1,2019-02-03 16:00:01,Budweiser’s Super Bowl ads are often among the most popular and remembered — from croaking frogs to puppies to Clyd… https://t.co/Sc15qhkbVY
773,1092086570398744577,4170491,56286,1039696,542,5038,239509,2007-04-11 12:50:15,5,2,2019-02-03 15:45:03,A production as mammoth as the Super Bowl deserves its own movie poster...our special full-page -- SUPER BOWL: THE… https://t.co/juUBbCXSKO
774,1092080267379032065,4170491,56286,1039696,542,5038,239509,2007-04-11 12:50:15,1,4,2019-02-03 15:20:00,#Patriots fans: here are a few places to watch Super Bowl 53 in Atlanta https://t.co/QqQkdYwEfH
775,1092075239209660418,4170491,56286,1039696,542,5038,239509,2007-04-11 12:50:15,3,1,2019-02-03 15:00:01,#LARams fans: here are a few places for you to watch the #SuperBowl  https://t.co/TPJIwmGLCb
776,1092072717266927616,4170491,56286,1039696,542,5038,239509,2007-04-11 12:50:15,2,4,2019-02-03 14:50:00,"Parking, road closures and getting to the #SuperBowl.. What you need to know: https://t.co/9GHoZAAwen"
