Index,ID,User_ID,Friends_Count,Followers_Count,Favourites_Count,Listed_Count,Status_Count,Created_at,Retweet_Count,Favourite_Count,Created_at,Text
2224,1092170876282421248,4170491,56286,1039694,542,5038,239510,2007-04-11 12:50:15,3,10,2019-02-03 21:20:03,"Former Falcons tight end Tony Gonzalez, after being announced as a member of 2019 Pro Football Hall of Fame class,… https://t.co/HBPiWczKsl"
2225,1092168438838149121,4170491,56286,1039694,542,5038,239510,2007-04-11 12:50:15,2,2,2019-02-03 21:10:21,"Don't miss a minute! AJC's got you:
LIVE UPDATES: #SuperBowlSunday buzz: https://t.co/GOuSn48nlw https://t.co/rcKyu3iCLZ"
2226,1092168287633502209,4170491,56286,1039694,542,5038,239510,2007-04-11 12:50:15,2,5,2019-02-03 21:09:45,It’s almost game time! Follow love updates for #SuperBowlLIII here: https://t.co/jeua0p6ZQx https://t.co/oAx8Wt69mV
2227,1092167128353046529,4170491,56286,1039694,542,5038,239510,2007-04-11 12:50:15,2,9,2019-02-03 21:05:09,🤣🤣🤣 https://t.co/r36qbhDALf
2228,1092166593537298432,4170491,56286,1039694,542,5038,239510,2007-04-11 12:50:15,0,1,2019-02-03 21:03:02,"Follow along for all the buzz around Super Bowl 2019 entertainment—from social reactions, memes, celebrity sighting… https://t.co/b2kUqg2jph"
2229,1092158282641428480,4170491,56286,1039694,542,5038,239510,2007-04-11 12:50:15,1,2,2019-02-03 20:30:00,"Millions of people tune into the Super Bowl, and not just for the ball game 📺 https://t.co/rFGycoHyER"
2230,1092158009151815685,4170491,56286,1039694,542,5038,239510,2007-04-11 12:50:15,168,235,2019-02-03 20:28:55,#BREAKING: Rapper 21 Savage arrested by ICE. https://t.co/FrVotFNns3 https://t.co/Ss9EizZ4p0
2231,1092155753870360576,4170491,56286,1039694,542,5038,239510,2007-04-11 12:50:15,2,4,2019-02-03 20:19:57,Still on your way downtown? Read up on everything you need to know for #SuperBowl53 https://t.co/OxrDFqFdsn https://t.co/EeOtfsxrtT
2232,1092154009463517185,4170491,56286,1039694,542,5038,239510,2007-04-11 12:50:15,5,3,2019-02-03 20:13:01,The Super Bowl will take place at 6:30 tonight at Mercedes-Benz Stadium. The performances by a variety soul singers… https://t.co/3YsXIYx0pn
2233,1092153995962052608,4170491,56286,1039694,542,5038,239510,2007-04-11 12:50:15,2,2,2019-02-03 20:12:58,Fans are pouring into @MBStadium for #SBLlll Tune in for LIVE updates: https://t.co/jeua0p6ZQx https://t.co/Kcjp4Lo9GZ
2234,1092152078103916544,4170491,56286,1039694,542,5038,239510,2007-04-11 12:50:15,16,53,2019-02-03 20:05:21,If this doesn’t get you hype for the #SuperBowl I don’t know what will. The Atlanta Drum Academy is killing it! https://t.co/Z8OmaqrjSb
2235,1092149862018240513,4170491,56286,1039694,542,5038,239510,2007-04-11 12:50:15,0,2,2019-02-03 19:56:32,How you liking this balmy #SuperBowlSunday weather? You'll ❤ Atlanta even more after you check out some of the cold… https://t.co/LmEVpet8Lz
2236,1092146956888141834,4170491,56286,1039694,542,5038,239510,2007-04-11 12:50:15,1,4,2019-02-03 19:45:00,"The lineup Jermaine Dupri curated for the final show offered Super Bowl week’s best, most accessible overview of th… https://t.co/zoLhk4m3aw"
2237,1092144820632633344,4170491,56286,1039694,542,5038,239510,2007-04-11 12:50:15,3,6,2019-02-03 19:36:30,It’s game day in #atlanta! Follow along for all-day #SuperBowlLlll coverage. https://t.co/90g3pRAW0k https://t.co/caA6Bc1180
2238,1092143183906131969,4170491,56286,1039694,542,5038,239510,2007-04-11 12:50:15,2,3,2019-02-03 19:30:00,"As far as downtown traffic is concerned, the #SuperBowl may be the Olympics times two 😱 https://t.co/tkNBOKARCF"
2239,1092142933552316416,4170491,56286,1039694,542,5038,239510,2007-04-11 12:50:15,2,3,2019-02-03 19:29:01,Are you ready for these cuties?” Puppy Bowl 2019: How to watch on #SuperBowlSunday. https://t.co/COvAArcBDR https://t.co/3fQkVP8J1j
2240,1092141577697484800,4170491,56286,1039694,542,5038,239510,2007-04-11 12:50:15,2,14,2019-02-03 19:23:37,The calm before the #SuperBowl storm. All the feels! https://t.co/0ueCuB8lg5
2241,1092139964173819906,4170491,56286,1039694,542,5038,239510,2007-04-11 12:50:15,4,3,2019-02-03 19:17:13,"A 'dangerous sport:' Ahead of Super Bowl, Trump says he wouldn't encourage son to play football.… https://t.co/rXpumUGE3r"
2242,1092137297821208576,4170491,56286,1039694,542,5038,239510,2007-04-11 12:50:15,1,5,2019-02-03 19:06:37,"In town, but not going to the Big Game? Don't worry, there are plenty of other things to do today! #SuperBowlSunday… https://t.co/aO7tw4k7m9"
2243,1092137102119178240,4170491,56286,1039694,542,5038,239510,2007-04-11 12:50:15,1,2,2019-02-03 19:05:50,"SUPER WEATHER: How about a high of 60, with a few clouds for #SuperBowlSunday. Meanwhile, don't forget to pick up y… https://t.co/Y4H7BvKJEn"
2244,1092136890294251520,4170491,56286,1039694,542,5038,239510,2007-04-11 12:50:15,0,1,2019-02-03 19:05:00,Don't miss a moment of Super Bowl 53 🎉 https://t.co/wVsITCjRPh
2245,1092136658336657411,4170491,56286,1039694,542,5038,239510,2007-04-11 12:50:15,1,9,2019-02-03 19:04:04,The gates are open and #SuperBowl fans are streaming in! https://t.co/ooyYw2YNBw
2246,1092134532701188096,4170491,56286,1039694,542,5038,239510,2007-04-11 12:50:15,1,2,2019-02-03 18:55:38,"NFL plans closed roof for Super Bowl game, open for pregame festivities. https://t.co/ZgdLrYbd7l"
2247,1092132279432941568,4170491,56286,1039694,542,5038,239510,2007-04-11 12:50:15,4,5,2019-02-03 18:46:40,T-minus 5 hours and 15 minutes till kickoff and the entry line @MBStadium is already long. #superbowl https://t.co/MrORAC6aIA
2248,1092132151196348417,4170491,56286,1039694,542,5038,239510,2007-04-11 12:50:15,1,4,2019-02-03 18:46:10,RUBBING IT IN: Patriots fans line up to take pics in front of a picture of the ring from Super Bowl LI — the one in… https://t.co/7MfBfUnXJg
2249,1092131857318232064,4170491,56286,1039694,542,5038,239510,2007-04-11 12:50:15,0,4,2019-02-03 18:45:00,"Hello, downtown Atlanta! It's Super Bowl Sunday 🏈🏆 https://t.co/XABMKtEhM1"
2250,1092128469859876864,4170491,56286,1039694,542,5038,239510,2007-04-11 12:50:15,1,2,2019-02-03 18:31:32,PHOTOS: It's GAME DAY! And the fans are out and ready! #SuperBowlSunday https://t.co/QB8Sxnh2Qr https://t.co/FWcoy5E3kg
2251,1092127326895333376,4170491,56286,1039694,542,5038,239510,2007-04-11 12:50:15,3,5,2019-02-03 18:27:00,"MARTA, Lyft, Uber, and more for Super Bowl 53: https://t.co/9GHoZAAwen"
2252,1092123560527753216,4170491,56286,1039694,542,5038,239510,2007-04-11 12:50:15,2,5,2019-02-03 18:12:02,A look at the NFL Honors red carpet. More of the red carpet looks here: https://t.co/Cv06ZcDzKM https://t.co/cSqdqWHwba
2253,1092122109550182403,4170491,56286,1039694,542,5038,239510,2007-04-11 12:50:15,1,9,2019-02-03 18:06:16,The fans are out here and ready to party for the #SuperBowlLlll #SuperBowlSunday #SuperBowl https://t.co/Fq27aB2pV6
2254,1092120548258299909,4170491,56286,1039694,542,5038,239510,2007-04-11 12:50:15,0,2,2019-02-03 18:00:03,Everything you need to know about Super Bowl 53 🏈🏆 https://t.co/QgmENmcOQv https://t.co/WW2siq8o46
2255,1092118277621510144,4170491,56286,1039694,542,5038,239510,2007-04-11 12:50:15,3,19,2019-02-03 17:51:02,Foo Fighters and Run the Jewels rocked a newly constructed venue in Atlantic Station for the DirecTV Super Saturday… https://t.co/2jjKMQL7l1
2256,1092113737736220673,4170491,56286,1039694,542,5038,239510,2007-04-11 12:50:15,0,0,2019-02-03 17:33:00,Have you heard? 🤔 https://t.co/jeua0p6ZQx
2257,1092112230181679109,4170491,56286,1039694,542,5038,239510,2007-04-11 12:50:15,0,3,2019-02-03 17:27:00,"Last minute tickets, 🌭🌭, transportation and more! Everything you need to know about Super Bowl 53 https://t.co/yFirrL70J8"
2258,1092109716715696129,4170491,56286,1039694,542,5038,239510,2007-04-11 12:50:15,1,4,2019-02-03 17:17:01,"Super Bowl veteran Bruno Mars was joined by halftime-sidestepper Cardi B for a lively, crowd-pleasing show on the e… https://t.co/D4V8fdqW7e"
2259,1092105936200699904,4170491,56286,1039694,542,5038,239510,2007-04-11 12:50:15,0,0,2019-02-03 17:02:00,"Here’s your guide to where to eat, drink and play corn hole before kickoff. https://t.co/n7gKyIKTyJ"
2260,1092102161226452995,4170491,56286,1039694,542,5038,239510,2007-04-11 12:50:15,2,2,2019-02-03 16:47:00,"If you’re traveling through the Atlanta airport for the #SuperBowl, prepare for the possibility of big crowds durin… https://t.co/E4V7v5Jo0D"
2261,1092098265644961792,4170491,56286,1039694,542,5038,239510,2007-04-11 12:50:15,4,13,2019-02-03 16:31:31,Captain America and Captain Marvel are rooting for the Patriots! #SuperBowlSunday #SBLlll https://t.co/s8SOT03iFr
2262,1092096625131089920,4170491,56286,1039694,542,5038,239510,2007-04-11 12:50:15,2,10,2019-02-03 16:25:00,Just an option for your #SuperBowl lunch.... and dinner 😋 https://t.co/SfNbbUgBoD
2263,1092090340503441408,4170491,56286,1039694,542,5038,239510,2007-04-11 12:50:15,0,1,2019-02-03 16:00:01,Budweiser’s Super Bowl ads are often among the most popular and remembered — from croaking frogs to puppies to Clyd… https://t.co/Sc15qhkbVY
2264,1092086570398744577,4170491,56286,1039694,542,5038,239510,2007-04-11 12:50:15,5,2,2019-02-03 15:45:03,A production as mammoth as the Super Bowl deserves its own movie poster...our special full-page -- SUPER BOWL: THE… https://t.co/juUBbCXSKO
2265,1092080267379032065,4170491,56286,1039694,542,5038,239510,2007-04-11 12:50:15,1,4,2019-02-03 15:20:00,#Patriots fans: here are a few places to watch Super Bowl 53 in Atlanta https://t.co/QqQkdYwEfH
2266,1092075239209660418,4170491,56286,1039694,542,5038,239510,2007-04-11 12:50:15,3,1,2019-02-03 15:00:01,#LARams fans: here are a few places for you to watch the #SuperBowl  https://t.co/TPJIwmGLCb
2267,1092072717266927616,4170491,56286,1039694,542,5038,239510,2007-04-11 12:50:15,2,4,2019-02-03 14:50:00,"Parking, road closures and getting to the #SuperBowl.. What you need to know: https://t.co/9GHoZAAwen"
2268,1092069819275505665,4170491,56286,1039694,542,5038,239510,2007-04-11 12:50:15,2,1,2019-02-03 14:38:29,"“Upon entering the apartment, the officer encountered a woman attacking her husband with a knife,” a police departm… https://t.co/e0nfOwkkUU"
2269,1092066425940992004,4170491,56286,1039694,542,5038,239510,2007-04-11 12:50:15,5,6,2019-02-03 14:25:00,Headed to the #SuperBowl? Here's a helpful guide for MARTA newbies: https://t.co/tkNBOKARCF
2270,1092062651398660102,4170491,56286,1039694,542,5038,239510,2007-04-11 12:50:15,2,1,2019-02-03 14:10:00,What time is the #SuperBowl? What channel? How to watch? We've got you covered: https://t.co/wVsITCjRPh
2271,1092057626878324736,4170491,56286,1039694,542,5038,239510,2007-04-11 12:50:15,1,5,2019-02-03 13:50:02,We're just hours away from the Super Bowl 53! 🎉 Who do you think takes home the 🏆? https://t.co/QgmENmcOQv https://t.co/7EAf7oN1qt
2272,1092052275315572736,4170491,56286,1039694,542,5038,239510,2007-04-11 12:50:15,1,3,2019-02-03 13:28:46,Looking for something to do before the #SuperBowl? https://t.co/yNlmnM9vRt
2273,1092050327577284608,4170491,56286,1039694,542,5038,239510,2007-04-11 12:50:15,0,9,2019-02-03 13:21:02,The 2019 NFL Honors ceremony was held at the Fox Theatre in Atlanta on Feb. 2. https://t.co/Mjs4k7qDGN
2274,1092046303377477634,4170491,56286,1039694,542,5038,239510,2007-04-11 12:50:15,4,10,2019-02-03 13:05:02,We're got something BIG in today's paper! Our special full-page -- SUPER BOWL: THE MOVIE -- it's a keeper. Pick you… https://t.co/ky8tRFIpXm
2275,1092038249021886465,4170491,56286,1039694,542,5038,239510,2007-04-11 12:50:15,0,9,2019-02-03 12:33:02,A couple players with Georgia ties were feeling kind of golden on Saturday. https://t.co/FxIIXIDMja
2276,1092033969149886466,4170491,56286,1039694,542,5038,239510,2007-04-11 12:50:15,0,0,2019-02-03 12:16:01,A person shot by Gwinnett County police Saturday was transported to the hospital with gunshot wounds. https://t.co/txQuMY83vN
2277,1092029693258334209,4170491,56286,1039694,542,5038,239510,2007-04-11 12:50:15,7,25,2019-02-03 11:59:02,"Corporate big wigs, celebrities and other VIPs may have to take the MARTA with the rest of us amid what the Atlanta… https://t.co/NrOsjB6JOe"
2278,1092025416104194048,4170491,56286,1039694,542,5038,239510,2007-04-11 12:50:15,2,3,2019-02-03 11:42:02,Five children are dead and two adults injured after a minivan crashed into a wooded area off U.S. Route 301 in Prin… https://t.co/bebyJAhBfe
2279,1092021137700200448,4170491,56286,1039694,542,5038,239510,2007-04-11 12:50:15,0,2,2019-02-03 11:25:02,"Among the thousands of images left behind by America’s biggest sporting event, a few live on as indelible. During t… https://t.co/SfDwrX8OL0"
2280,1092016857345859585,4170491,56286,1039694,542,5038,239510,2007-04-11 12:50:15,0,1,2019-02-03 11:08:02,"Steve Colby's Pogo Pictures, based in Druid Hills, creates another ad that will make a Super Bowl appearance this y… https://t.co/VOxFOovf9I"
2281,1092012579332022272,4170491,56286,1039694,542,5038,239510,2007-04-11 12:50:15,3,10,2019-02-03 10:51:02,"Miami wide receiver Marquez Ezzard declared his intent to return home to join up with Georgia Tech. Ezzard, a Stock… https://t.co/ZJCsk8TXnW"
2282,1092008301959827457,4170491,56286,1039694,542,5038,239510,2007-04-11 12:50:15,0,4,2019-02-03 10:34:02,"Tight end Tony Gonzalez, cornerback Champ Bailey, safety Ed Reed, center Kevin Mawae and cornerback Ty Law were ele… https://t.co/9zpPYfDBS0"
2283,1092004023312568320,4170491,56286,1039694,542,5038,239510,2007-04-11 12:50:15,0,9,2019-02-03 10:17:02,"Instead of a gender-specific toy, McDonald’s restaurants in New Zealand are handing out Roald Dahl books in Happy M… https://t.co/ayTYQjBDaR"
2284,1091999771483611138,4170491,56286,1039694,542,5038,239510,2007-04-11 12:50:15,2,4,2019-02-03 10:00:08,"Bruno Mars and Cardi B played State Farm Arena on Saturday night before the Super Bowl, with Lil Jon as a surprise… https://t.co/Lam4LZ2Qwc"
2285,1091987916111384576,4170491,56286,1039694,542,5038,239510,2007-04-11 12:50:15,4,2,2019-02-03 09:13:02,"One deputy was killed and another hurt late Saturday in a standoff at a Pierce Township, Ohio, apartment complex, a… https://t.co/yeBnK8Tzk0"
2286,1091983893010485248,4170491,56286,1039694,542,5038,239510,2007-04-11 12:50:15,2,13,2019-02-03 08:57:02,Patrick Mahomes' breathtaking breakthrough season earned him the NFL's Most Valuable Player award. https://t.co/bdshgGagC6
2287,1091979614753296384,4170491,56286,1039694,542,5038,239510,2007-04-11 12:50:15,1,4,2019-02-03 08:40:02,"Super Bowl 53: Monica, Brick and DJ Smurf offer a nostalgic glance of ‘old Atlanta’ https://t.co/SWcq5wqEdV"
2288,1091975336009580544,4170491,56286,1039694,542,5038,239510,2007-04-11 12:50:15,0,4,2019-02-03 08:23:02,"Carolina Panthers running back Christian McCaffrey surprised a Mooresville, North Carolina, couple with Super Bowl… https://t.co/wqpUwaJOLj"
2289,1091971056720584704,4170491,56286,1039694,542,5038,239510,2007-04-11 12:50:15,1,9,2019-02-03 08:06:02,Super Bowl 53: Foo Fighters stock Super Saturday Night show with guests https://t.co/ntL7K25ffE
2290,1091966781906976768,4170491,56286,1039694,542,5038,239510,2007-04-11 12:50:15,1,5,2019-02-03 07:49:03,"John Collins matched his career high with 35 points and fell one shy of his career best with 16 rebounds, and the H… https://t.co/xkqTTZCXPf"
2291,1091962498201411584,4170491,56286,1039694,542,5038,239510,2007-04-11 12:50:15,27,50,2019-02-03 07:32:01,"Black History Month: In 1955, bus seat protest by teenager Claudette Colvin preceded Rosa Parks' famous action by m… https://t.co/e4k5kngdPE"
2292,1091958224075534336,4170491,56286,1039694,542,5038,239510,2007-04-11 12:50:15,2,2,2019-02-03 07:15:02,"A 4-year-old accidentally shot his mom in the face using an unsecured gun in Washington state on Saturday evening,… https://t.co/ABGVk0PU0L"
2293,1091954438812647426,4170491,56286,1039694,542,5038,239510,2007-04-11 12:50:15,0,3,2019-02-03 07:00:00,Atlanta rapper @2chainz performed his biggest hits to an energetic crowd at Friday night’s “Honor Your Code” party. https://t.co/ibzjL6PuMn
2294,1091946912398430208,4170491,56286,1039694,542,5038,239510,2007-04-11 12:50:15,0,2,2019-02-03 06:30:05,Events and concerts in Atlanta during Super Bowl 53 https://t.co/YJgTKskmwn
2295,1091943121733201921,4170491,56286,1039694,542,5038,239510,2007-04-11 12:50:15,0,2,2019-02-03 06:15:02,Atlanta ad man has commercial in #SuperBowl https://t.co/09YaL7QXzs https://t.co/xsMdB4qPvz
2296,1091936822735847424,4170491,56286,1039694,542,5038,239510,2007-04-11 12:50:15,2,2,2019-02-03 05:50:00,“There are a lot of things going on politically. It gives you time just to relax and enjoy the game of football.” https://t.co/eZYPUi9jPt
2297,1091931858726776832,4170491,56286,1039694,542,5038,239510,2007-04-11 12:50:15,0,4,2019-02-03 05:30:16,The Super Bowl’s presence in Atlanta suggests road closures and bad traffic. But here we discuss a small open road… https://t.co/k1UtlJvW6Q
2298,1091928017226686464,4170491,56286,1039694,542,5038,239510,2007-04-11 12:50:15,0,3,2019-02-03 05:15:01,"Doritos want to be your fire, the one desire. https://t.co/gwlZglyr1Q"
2299,1091924252830380033,4170491,56286,1039694,542,5038,239510,2007-04-11 12:50:15,2,2,2019-02-03 05:00:03,"‘Super Bold’ brunch celebrates, empowers women on game weekend https://t.co/erQcTZS7JM https://t.co/4M7KPh9J6d"
2300,1091921723795087360,4170491,56286,1039694,542,5038,239510,2007-04-11 12:50:15,1,5,2019-02-03 04:50:00,It's almost time! #SUPERBOWL53 https://t.co/uoyKMd8mei
2301,1091919271637278720,4170491,56286,1039694,542,5038,239510,2007-04-11 12:50:15,1,1,2019-02-03 04:40:15,A range of sports (we see you OBJ) and entertainment celebrities are expected at the #MaximBigGameExperience. Follo… https://t.co/Sve3hz8HBq
2302,1091917463602847744,4170491,56286,1039694,542,5038,239510,2007-04-11 12:50:15,0,0,2019-02-03 04:33:04,"Observations, stats and quotes from Georgia Tech’s 59-49 loss to No. 25 Florida State Saturday in Tallahassee, Fla.… https://t.co/E9KGCn6hPI"
2303,1091913173639315457,4170491,56286,1039694,542,5038,239510,2007-04-11 12:50:15,1,2,2019-02-03 04:16:02,"If Sunday’s Super Bowl needed a tie-breaker that could only solved by popularity in web search, the New England Pat… https://t.co/7hxijBh5fV"
2304,1091912861507571713,4170491,56286,1039694,542,5038,239510,2007-04-11 12:50:15,4,8,2019-02-03 04:14:47,Lots of celebs in the house. The party requires some deep pockets. Tickets start at $750 and an “on stage” table wi… https://t.co/9Vrl8H7LZb
2305,1091912167547457536,4170491,56286,1039694,542,5038,239510,2007-04-11 12:50:15,2,9,2019-02-03 04:12:02,"We’re at the #MaximBigGameExperience with performances from @1future, @iamjamiefoxx and @Diplo. #superbowl… https://t.co/ob1gnqUuGf"
2306,1091909143093481473,4170491,56286,1039694,542,5038,239510,2007-04-11 12:50:15,4,2,2019-02-03 04:00:01,"🎟: How many tickets can actually be sold for the game? 
🍑: How many Georgia natives will be on the field? 
💰: What… https://t.co/Gxz1SNKor2"
2307,1091905373760602112,4170491,56286,1039694,542,5038,239510,2007-04-11 12:50:15,5,20,2019-02-03 03:45:02,It's almost Puppy Bowl time! 🐶❤➡ https://t.co/qQmL5wqNIK https://t.co/xArkFTmfx2
2308,1091902230276521984,4170491,56286,1039694,542,5038,239510,2007-04-11 12:50:15,1,3,2019-02-03 03:32:32,Are you at the #SuperBowl music fest? Rapper @iamcardib takes the stage at State Farm Arena. https://t.co/6I2Mmm7tPr
2309,1091901226546089984,4170491,56286,1039694,542,5038,239510,2007-04-11 12:50:15,43,162,2019-02-03 03:28:33,How @iamcardib plans to celebrate if she wins a Grammy! https://t.co/CcYZfr5igm
2310,1091900594871304192,4170491,56286,1039694,542,5038,239510,2007-04-11 12:50:15,6,3,2019-02-03 03:26:03,People are seeking a woman’s son after she was found stabbed to death inside of her Stone Mountain residence on Sat… https://t.co/z4r75I7PF1
2311,1091896638614966273,4170491,56286,1039694,542,5038,239510,2007-04-11 12:50:15,7,18,2019-02-03 03:10:19,@ashanti looking fabulous at the #BUDLIGHTSBMF https://t.co/6G3QimErwQ
2312,1091896556716990466,4170491,56286,1039694,542,5038,239510,2007-04-11 12:50:15,4,3,2019-02-03 03:10:00,🍺🍷🍾🍸!!! https://t.co/A2fUcGdBDe
2313,1091893673317552128,4170491,56286,1039694,542,5038,239510,2007-04-11 12:50:15,37,363,2019-02-03 02:58:32,So what’s @KillerMike and @therealelp favorite things to do in #atl? Who would have guessed 😂@runjewels https://t.co/uvw4v8z4oa
2314,1091892249737203718,4170491,56286,1039694,542,5038,239510,2007-04-11 12:50:15,6,15,2019-02-03 02:52:53,@iamcardib has arrived to the #BUDLIGHTSBMF https://t.co/ahp9cX7Wm6
2315,1091889017312944128,4170491,56286,1039694,542,5038,239510,2007-04-11 12:50:15,3,5,2019-02-03 02:40:02,A production as mammoth as the Super Bowl deserves its own movie poster. Get it in Sunday's editions of The Atlanta… https://t.co/D1xM39qm9Q
2316,1091886492874625029,4170491,56286,1039694,542,5038,239510,2007-04-11 12:50:15,0,3,2019-02-03 02:30:00,Still no plans for tomorrow? Have no fear! Check out what these great local spots have planned. https://t.co/ojLfesyjP3
2317,1091883425588486144,4170491,56286,1039694,542,5038,239510,2007-04-11 12:50:15,2,4,2019-02-03 02:17:49,Rapper's lawyer responds to allegations against Bow Wow https://t.co/zxwav5dL1T
2318,1091880198969217035,4170491,56286,1039694,542,5038,239510,2007-04-11 12:50:15,1,5,2019-02-03 02:05:00,Get out and get a look at the city before heading into @MBStadium for #SUPERBOWL53. https://t.co/sfS9CX9Z1B
2319,1091878256297603073,4170491,56286,1039694,542,5038,239510,2007-04-11 12:50:15,2,4,2019-02-03 01:57:17,We’re at @directvnow Super Saturday Night to see @foofighters. The concert starts at 10 but there’s already plenty… https://t.co/IEilfvCmIw
2320,1091877690884411392,4170491,56286,1039694,542,5038,239510,2007-04-11 12:50:15,0,1,2019-02-03 01:55:02,The #SuperBowl is just one 👏 day 👏 away https://t.co/P2exfYZfIf https://t.co/PjFBmgLNFA
2321,1091875166110576641,4170491,56286,1039694,542,5038,239510,2007-04-11 12:50:15,3,1,2019-02-03 01:45:00,The 24-year-old Rams QB is set become the first quarterback drafted first overall to reach the Super Bowl in three… https://t.co/q4HfQRHe6q
2322,1091874538672013313,4170491,56286,1039694,542,5038,239510,2007-04-11 12:50:15,8,5,2019-02-03 01:42:30,"For the most part, MARTA kept trains and passengers moving, though Gold Line rail service was suspended for about 5… https://t.co/t7Kkuy7IRD"
2323,1091867728829472768,4170491,56286,1039694,542,5038,239510,2007-04-11 12:50:15,2,4,2019-02-03 01:15:27,"In case you needed a little something extra to get you hyped for the big game, the animals at @GeorgiaAquarium have… https://t.co/qSZBHw10f8"
2324,1091865349111382016,4170491,56286,1039694,542,5038,239510,2007-04-11 12:50:15,18,41,2019-02-03 01:05:59,"Hey #Atlanta, make sure to plan ahead tomorrow on your way to the big game! #SuperBowl53 https://t.co/ep0tLdS96g https://t.co/5g8YX9dRS7"
2325,1091863862381555713,4170491,56286,1039694,542,5038,239510,2007-04-11 12:50:15,0,1,2019-02-03 01:00:05,Find out how the @Migos are eating after hours for #SUPERBOWL53 here: https://t.co/qmL7ZGrySz https://t.co/5YCpMu8nLZ
2326,1091861325419110400,4170491,56286,1039694,542,5038,239510,2007-04-11 12:50:15,1,2,2019-02-03 00:50:00,Two of the top scoring offenses in the NFL will be taking the field at #SUPERBOWL53. https://t.co/lhlnGFxd2I
2327,1091858397916471296,4170491,56286,1039694,542,5038,239510,2007-04-11 12:50:15,5,7,2019-02-03 00:38:22,LATEST: Virginia's U.S. Senators joint statement: Gov. Ralph Northam 'must resign'  https://t.co/PSLahW4m4p https://t.co/F9dwtvVvB3
2328,1091855033270980609,4170491,56286,1039694,542,5038,239510,2007-04-11 12:50:15,1,1,2019-02-03 00:25:00,Ever wondered how much it costs to air an ad during the #SuperBowl? 🤔 https://t.co/X3kispgHL7
2329,1091853400134901760,4170491,56286,1039694,542,5038,239510,2007-04-11 12:50:15,1,4,2019-02-03 00:18:30,"Before you leave town after #SB53, make sure you see everything #Atlanta has to offer! https://t.co/mO6SUAPTtr https://t.co/vbiIhcl1kW"
2330,1091850002845052928,4170491,56286,1039694,542,5038,239510,2007-04-11 12:50:15,1,4,2019-02-03 00:05:00,The Falcons QB won’t be taking the field tomorrow - but he’s taking a stand. https://t.co/5CGD6SBQ0L
2331,1091848766955708418,4170491,56286,1039694,542,5038,239510,2007-04-11 12:50:15,3,5,2019-02-03 00:00:06,Official: #SuperBowl limo ‘shortage’ could give Georgia a ‘black eye’ https://t.co/7o4UaI62SL https://t.co/dQDKQ8bQiL
2332,1091845539568775168,4170491,56286,1039694,542,5038,239510,2007-04-11 12:50:15,0,3,2019-02-02 23:47:16,Offensive Rookie of the Year @saquon predicts a good game but has a feel for who’s going to prevail. #SuperBowl https://t.co/47QtJoMByf
2333,1091843709694562306,4170491,56286,1039694,542,5038,239510,2007-04-11 12:50:15,3,1,2019-02-02 23:40:00,There's a bit of a silver lining to losing #SUPERBOWL53... https://t.co/eSVQmBbU9T
2334,1091842907198373889,4170491,56286,1039694,542,5038,239510,2007-04-11 12:50:15,5,1,2019-02-02 23:36:49,BREAKING: Person reported killed in officer-involved shooting in Gwinnett https://t.co/txQuMY83vN
2335,1091837450480177153,4170491,56286,1039694,542,5038,239510,2007-04-11 12:50:15,1,10,2019-02-02 23:15:08,Hmmmm. What would Ghost order from Waffle House? Read more here: https://t.co/qmL7ZGrySz https://t.co/GmgE2KbUr2
2336,1091835664948170760,4170491,56286,1039694,542,5038,239510,2007-04-11 12:50:15,3,3,2019-02-02 23:08:02,NEW DETAILS: Protesters march on Stone Mountain Village after park is closed https://t.co/6MMYEwhnyu https://t.co/F6tFn0mrlx
