Index,ID,User_ID,Friends_Count,Followers_Count,Favourites_Count,Listed_Count,Status_Count,Created_at,Retweet_Count,Favourite_Count,Created_at,Text
1094,1092890119093202944,12039612,1558,159357,1718,1366,109485,2008-01-09 19:18:34,1,3,2019-02-05 20:58:03,Analysts: Amazon buying FedEx makes sense if it's serious about delivery https://t.co/EnXXrk8G6w https://t.co/JncINswmuK
1095,1092887096644255744,12039612,1558,159357,1718,1366,109485,2008-01-09 19:18:34,0,1,2019-02-05 20:46:03,"Toronto Raptors make Grizzlies trade offer for Mike Conley, Marc Gasol, per report https://t.co/gCo8YNqKkx"
1096,1092882948699746305,12039612,1558,159357,1718,1366,109485,2008-01-09 19:18:34,1,2,2019-02-05 20:29:34,"Toronto Raptors make Grizzlies trade offer for Mike Conley, Marc Gasol, per report https://t.co/7XuO1UXD1m https://t.co/WeqyVNdFSB"
1097,1092881055135223808,12039612,1558,159357,1718,1366,109485,2008-01-09 19:18:34,1,2,2019-02-05 20:22:02,Analysts: Amazon buying FedEx makes sense if it's serious about delivery https://t.co/BSeJbkss3G
1098,1092876783249211393,12039612,1558,159357,1718,1366,109485,2008-01-09 19:18:34,0,3,2019-02-05 20:05:04,The 9:01: Aerosmith's Steven Tyler mum on past as he opens Janie's House in Bartlett https://t.co/DcvqQ6fobP
1099,1092875528053256192,12039612,1558,159357,1718,1366,109485,2008-01-09 19:18:34,0,0,2019-02-05 20:00:05,"Who is Alice Johnson, Trump's guest at State of the Union address? https://t.co/XW7WWaMC4Q https://t.co/yebNcgUrSj"
1100,1092872754716655618,12039612,1558,159357,1718,1366,109485,2008-01-09 19:18:34,1,3,2019-02-05 19:49:03,More than 700 101st Airborne Division soldiers return from Afghanistan https://t.co/jZVs2xzYqi
1101,1092868471598272512,12039612,1558,159357,1718,1366,109485,2008-01-09 19:18:34,0,2,2019-02-05 19:32:02,College football signing day: Why waiting until February can benefit high school recruits https://t.co/yMnPvUdTQS
1102,1092864220281098240,12039612,1558,159357,1718,1366,109485,2008-01-09 19:18:34,2,1,2019-02-05 19:15:09,"Who is Alice Johnson, Trump's guest at State of the Union address? https://t.co/heGDFdupPS"
1103,1092860412742250503,12039612,1558,159357,1718,1366,109485,2008-01-09 19:18:34,0,2,2019-02-05 19:00:01,Shelby County Attorney Marlinee Iverson has received permission from the parties to a 2012 agreement with the Depar… https://t.co/fXpt1j6wmo
1104,1092853120529588228,12039612,1558,159357,1718,1366,109485,2008-01-09 19:18:34,0,0,2019-02-05 18:31:02,Tennessee Board of Regents begins talks about raising student fees for 2019-2020 https://t.co/aax9GaD1wj
1105,1092847332817846278,12039612,1558,159357,1718,1366,109485,2008-01-09 19:18:34,0,0,2019-02-05 18:08:02,New Swanky's Taco Shop location planned for LYFE Kitchen building https://t.co/NNz0N63V5K
1106,1092843308022448129,12039612,1558,159357,1718,1366,109485,2008-01-09 19:18:34,1,2,2019-02-05 17:52:03,Memphis football coach Mike Norvell agrees to extension through 2023 season https://t.co/wmC3WBBInS
1107,1092839054280933376,12039612,1558,159357,1718,1366,109485,2008-01-09 19:18:34,2,0,2019-02-05 17:35:09,"In a new bombshell investigation, 13 people say they suspect James Brown did not die of natural causes. https://t.co/mGqq4HozZ8"
1108,1092835260730097665,12039612,1558,159357,1718,1366,109485,2008-01-09 19:18:34,0,0,2019-02-05 17:20:04,Mapping out the 2019 UT Vols recruiting class https://t.co/iVsDGupHGK
1109,1092831485667594242,12039612,1558,159357,1718,1366,109485,2008-01-09 19:18:34,0,8,2019-02-05 17:05:04,Memphis football coach Mike Norvell agrees to extension through 2023 season https://t.co/E6g3l9IQDZ https://t.co/tQbnl1loYr
1110,1092830978224078848,12039612,1558,159357,1718,1366,109485,2008-01-09 19:18:34,0,0,2019-02-05 17:03:03,Gov. Bill Lee unveils his first major legislative initiative aimed at career training https://t.co/zfk6iHZJLX
1111,1092826822742556673,12039612,1558,159357,1718,1366,109485,2008-01-09 19:18:34,1,5,2019-02-05 16:46:32,Source: Memphis football coach Mike Norvell agrees to extension through 2023 season https://t.co/gHN75cqlRt
1112,1092824436586307584,12039612,1558,159357,1718,1366,109485,2008-01-09 19:18:34,0,0,2019-02-05 16:37:04,Addition of midfielder Adam Najem brings Memphis 901 FC's inaugural roster to 15 https://t.co/WYOf4WCCrx
1113,1092820159713169415,12039612,1558,159357,1718,1366,109485,2008-01-09 19:18:34,3,6,2019-02-05 16:20:04,The 9:01: Aerosmith's Steven Tyler opens Janie's House in Bartlett without owning up to his own past https://t.co/SJGtY2hPzR
1114,1092817017608884229,12039612,1558,159357,1718,1366,109485,2008-01-09 19:18:34,1,4,2019-02-05 16:07:35,The 9:01: Aerosmith's Steven Tyler opens Janie's House in Bartlett without owning up to his own past… https://t.co/3I8Bx4ti9c
1115,1092815877660119041,12039612,1558,159357,1718,1366,109485,2008-01-09 19:18:34,0,1,2019-02-05 16:03:03,The 9:01: Aerosmith's Steven Tyler cuts scarf to open Janie's House in Bartlett https://t.co/HQEyrJi6Ef
1116,1092811703757221889,12039612,1558,159357,1718,1366,109485,2008-01-09 19:18:34,0,2,2019-02-05 15:46:28,The 9:01: Aerosmith's Steven Tyler opens Janie's House in Bartlett without owning up to his own past https://t.co/7MUUtbLK4R
1117,1092810092553142272,12039612,1558,159357,1718,1366,109485,2008-01-09 19:18:34,0,1,2019-02-05 15:40:04,Democratic women to send political message by wearing white to State of the Union https://t.co/EBb3WPL8Rq
1118,1092806065547366406,12039612,1558,159357,1718,1366,109485,2008-01-09 19:18:34,0,0,2019-02-05 15:24:04,County should see more DOJ reports on Juvenile Court after agreement is reached https://t.co/gaSHc5E6OT
1119,1092801799592001537,12039612,1558,159357,1718,1366,109485,2008-01-09 19:18:34,0,2,2019-02-05 15:07:06,County should see more DOJ reports on Juvenile Court after agreement is reached https://t.co/l0ogvzizEf https://t.co/XFZTsJkcnO
1120,1092796265262403586,12039612,1558,159357,1718,1366,109485,2008-01-09 19:18:34,0,8,2019-02-05 14:45:07,Four-star Lester Quinones likes idea of joining James Wiseman; Memphis 'definitely' in mix https://t.co/30UExD3Wob
1121,1092794489884692480,12039612,1558,159357,1718,1366,109485,2008-01-09 19:18:34,1,0,2019-02-05 14:38:04,Two children injured in Lakeland school bus crash https://t.co/OFEEM09Dt1 https://t.co/nHVBA4NFfw
1122,1092791966989987840,12039612,1558,159357,1718,1366,109485,2008-01-09 19:18:34,0,0,2019-02-05 14:28:02,Two children injured in Lakeland school bus crash https://t.co/xq0PRcJ49s
1123,1092790509905633281,12039612,1558,159357,1718,1366,109485,2008-01-09 19:18:34,0,0,2019-02-05 14:22:15,Two children injured in Lakeland school bus crash https://t.co/PEgYyICMPQ
1124,1092783412274962432,12039612,1558,159357,1718,1366,109485,2008-01-09 19:18:34,0,2,2019-02-05 13:54:03,"Lock of George Washington's hair sells at auction for more than $35,000 https://t.co/BPEiiDrjlf"
1125,1092773094941515776,12039612,1558,159357,1718,1366,109485,2008-01-09 19:18:34,0,2,2019-02-05 13:13:03,Let there be life -- kissed by the sun https://t.co/nRnOhCG8TG
1126,1092764664050544645,12039612,1558,159357,1718,1366,109485,2008-01-09 19:18:34,0,4,2019-02-05 12:39:33,How Memphis football's 2019 recruiting class looks heading into national signing day https://t.co/kzHeXeqpVo
1127,1092764287658061824,12039612,1558,159357,1718,1366,109485,2008-01-09 19:18:34,3,3,2019-02-05 12:38:03,"TVA admits potential liability in case of sickened coal ash workers, may hit ratepayers https://t.co/7SUJ9G4YqD"
1128,1092760280029937665,12039612,1558,159357,1718,1366,109485,2008-01-09 19:18:34,0,5,2019-02-05 12:22:07,"Arlington girl gets her service puppy after community raises $10,500 https://t.co/vAF4uzVhe2"
1129,1092743901352546304,12039612,1558,159357,1718,1366,109485,2008-01-09 19:18:34,0,2,2019-02-05 11:17:02,Donald Trump's power dynamic with Nancy Pelosi will be on full display at the State of the Union https://t.co/p6sve67qln
1130,1092739659287986176,12039612,1558,159357,1718,1366,109485,2008-01-09 19:18:34,0,0,2019-02-05 11:00:11,"State of the Union address, Super Bowl victory parade: 5 things to know Tuesday https://t.co/DjHIk7Bdkn"
1131,1092620089889824773,12039612,1558,159357,1718,1366,109485,2008-01-09 19:18:34,1,0,2019-02-05 03:05:03,State of the Union: Two former Tennessee prisoners among those invited as President Trump's guests https://t.co/j13GqRBbSG
1132,1092616059583188992,12039612,1558,159357,1718,1366,109485,2008-01-09 19:18:34,0,0,2019-02-05 02:49:03,Vote for Boys' Athlete of the Week Jan. 28-Feb. 2 https://t.co/64d63bQ1Pc
1133,1092611779799207936,12039612,1558,159357,1718,1366,109485,2008-01-09 19:18:34,3,4,2019-02-05 02:32:02,Lemoyne-Owen College president asked to resign after SGA cites 'failed leadership' https://t.co/z2fm2X4DNL
1134,1092607527613882369,12039612,1558,159357,1718,1366,109485,2008-01-09 19:18:34,0,1,2019-02-05 02:15:08,Vote for Girls' Athlete of the Week Jan. 28-Feb.2 https://t.co/zJ0Lc8wqqZ
1135,1092603225205809153,12039612,1558,159357,1718,1366,109485,2008-01-09 19:18:34,0,1,2019-02-05 01:58:03,How the Memphis Grizzlies almost made a bad Mike Conley trade a decade ago https://t.co/aFd2qYfHk6
1136,1092582342814851073,12039612,1558,159357,1718,1366,109485,2008-01-09 19:18:34,4,17,2019-02-05 00:35:04,It's official: Tennessee welcomes all-girl Boy Scouts of America troop https://t.co/1KeBvt7Nyx
1137,1092578310331219968,12039612,1558,159357,1718,1366,109485,2008-01-09 19:18:34,1,7,2019-02-05 00:19:02,Steven Tyler addresses the crowd in Bartlett outside Janie's House https://t.co/H61I70bKTW
1138,1092574032271155200,12039612,1558,159357,1718,1366,109485,2008-01-09 19:18:34,0,0,2019-02-05 00:02:02,Dixie Pickers to close Collierville store on Town Square https://t.co/n9oGxZTwZD
1139,1092569776797478913,12039612,1558,159357,1718,1366,109485,2008-01-09 19:18:34,2,5,2019-02-04 23:45:08,"Here's how to support Janie's Fund, Steven Tyler's charity for abused girls https://t.co/pxWSa44jtb"
1140,1092565727335366656,12039612,1558,159357,1718,1366,109485,2008-01-09 19:18:34,1,1,2019-02-04 23:29:02,Shelby County Schools appeals postseason bans https://t.co/vKPIup9UOa
1141,1092559939409719296,12039612,1558,159357,1718,1366,109485,2008-01-09 19:18:34,0,2,2019-02-04 23:06:02,Steven Tyler holds 'scarf-cutting' ceremony https://t.co/MC4VpqcDfT
1142,1092555669046206464,12039612,1558,159357,1718,1366,109485,2008-01-09 19:18:34,1,5,2019-02-04 22:49:04,Republican introduces comprehensive medical marijuana proposal in Tennessee https://t.co/puJACUy8kf
1143,1092551384669605889,12039612,1558,159357,1718,1366,109485,2008-01-09 19:18:34,0,2,2019-02-04 22:32:03,NFL 100 commercial: Mike Singletary talks making of popular Super Bowl ad https://t.co/SnmUUZzAYM
1144,1092547136397426694,12039612,1558,159357,1718,1366,109485,2008-01-09 19:18:34,0,0,2019-02-04 22:15:10,Grizzlies' Kyle Anderson to see specialist for shoulder as roster remains in flux https://t.co/ahxbS4fdXE
1145,1092543324009963520,12039612,1558,159357,1718,1366,109485,2008-01-09 19:18:34,0,0,2019-02-04 22:00:01,The injury bug is biting the Grizzlies again. https://t.co/2YaoaeWkoh
1146,1092538304933834753,12039612,1558,159357,1718,1366,109485,2008-01-09 19:18:34,7,16,2019-02-04 21:40:04,Steven Tyler holds 'scarf-cutting' ceremony for house to help abused Memphis-area girls https://t.co/92aLH9gEAU
1147,1092534777746382848,12039612,1558,159357,1718,1366,109485,2008-01-09 19:18:34,11,39,2019-02-04 21:26:03,Steven Tyler holds 'scarf-cutting' ceremony for house to help abused Memphis-area girls https://t.co/8UzWYaSFnj https://t.co/z5rhLakuoq
1148,1092524972432596994,12039612,1558,159357,1718,1366,109485,2008-01-09 19:18:34,0,1,2019-02-04 20:47:06,Desoto County sheriff's deputy resigns after DUI arrest https://t.co/1PAJxZpbaf
1149,1092520705504301057,12039612,1558,159357,1718,1366,109485,2008-01-09 19:18:34,0,1,2019-02-04 20:30:08,"Bernie Sanders asks why Catalyst Pharmaceutical is pricing a once-free drug at $375,000 https://t.co/ALs4n1pZNM"
1150,1092516655446589440,12039612,1558,159357,1718,1366,109485,2008-01-09 19:18:34,2,8,2019-02-04 20:14:03,Darrell Henderson's NFL combine goal: 4.3 seconds in 40-yard dash https://t.co/oWp4PUzxp9
1151,1092512379185885186,12039612,1558,159357,1718,1366,109485,2008-01-09 19:18:34,0,2,2019-02-04 19:57:03,Opinion: Super Bowl MVP Julian Edelman shouldn’t even have been playing in the game https://t.co/CtYACFJ5El
1152,1092508100899360769,12039612,1558,159357,1718,1366,109485,2008-01-09 19:18:34,1,3,2019-02-04 19:40:03,"John Legend and Adam Levine change dirty diapers in Super Bowl Pampers ad, singing song written by Chrissy Teigen https://t.co/vQVjr6IDf7"
1153,1092504075235672064,12039612,1558,159357,1718,1366,109485,2008-01-09 19:18:34,0,0,2019-02-04 19:24:03,"Tiger Basketball Podcast: Rece Davis, Penny Hardaway and unpacking Memphis' rough week https://t.co/xk0vcy2a44"
1154,1092499794013097985,12039612,1558,159357,1718,1366,109485,2008-01-09 19:18:34,9,24,2019-02-04 19:07:03,Memphis football announces spring game tentatively scheduled for April 12 https://t.co/b0BGHlEK3U
1155,1092495519690211329,12039612,1558,159357,1718,1366,109485,2008-01-09 19:18:34,0,1,2019-02-04 18:50:04,Kristian Williams decommits from Minnesota football https://t.co/TyOKR29nod
1156,1092491487009562624,12039612,1558,159357,1718,1366,109485,2008-01-09 19:18:34,1,3,2019-02-04 18:34:02,"Southern Heritage Classic: Gladys Knight, Jeffrey Osborne to play Classic Concert 2019 https://t.co/95ZSP5LlrX"
1157,1092491259170541569,12039612,1558,159357,1718,1366,109485,2008-01-09 19:18:34,0,1,2019-02-04 18:33:08,"Southern Heritage Classic: Gladys Knight, Jeffrey Osborne to play Classic Concert 2019 https://t.co/hA3XtyqQYQ https://t.co/bICwILfAta"
1158,1092487209951858688,12039612,1558,159357,1718,1366,109485,2008-01-09 19:18:34,0,1,2019-02-04 18:17:02,Southern rockers Lynyrd Skynyrd bring farewell tour to Mid-South https://t.co/CThkOiPHXH
1159,1092482953949708288,12039612,1558,159357,1718,1366,109485,2008-01-09 19:18:34,1,0,2019-02-04 18:00:08,"Football, reimagined: Why the AAF, Memphis Express think they'll succeed where others failed https://t.co/kuiYtCtx71"
1160,1092478664359456775,12039612,1558,159357,1718,1366,109485,2008-01-09 19:18:34,0,1,2019-02-04 17:43:05,Noose reportedly found on Shelby County Schools property https://t.co/7YFqAOttpi
1161,1092474374802866176,12039612,1558,159357,1718,1366,109485,2008-01-09 19:18:34,0,3,2019-02-04 17:26:02,"Review: Maroon 5 delivers a flavorless halftime show, avoids being the worst ever https://t.co/tSLGoNf3eZ"
1162,1092469594500009985,12039612,1558,159357,1718,1366,109485,2008-01-09 19:18:34,1,0,2019-02-04 17:07:03,ESPN College Gameday host Rece Davis explains 'jealousy' comments on Penny Hardaway https://t.co/dGw5P4DbnU
1163,1092465321431257088,12039612,1558,159357,1718,1366,109485,2008-01-09 19:18:34,5,2,2019-02-04 16:50:04,"Children are using an unhealthy amount of toothpaste, CDC warns https://t.co/BcflvQ54t5"
1164,1092461546754592773,12039612,1558,159357,1718,1366,109485,2008-01-09 19:18:34,0,0,2019-02-04 16:35:04,ESPN College Gameday host Rece Davis explains 'jealousy' comments on Penny Hardaway https://t.co/HRldOYuD90 https://t.co/zdXZ5EP6GK
1165,1092461053773008897,12039612,1558,159357,1718,1366,109485,2008-01-09 19:18:34,3,2,2019-02-04 16:33:06,ESPN College Gameday host Rece Davis explains 'jealousy' comments on @Memphis_MBB coach Penny Hardaway  https://t.co/2neCEoXgm1
1166,1092458269447258113,12039612,1558,159357,1718,1366,109485,2008-01-09 19:18:34,0,0,2019-02-04 16:22:02,"John Legend and Adam Levine change dirty diapers in Super Bowl Pampers ad, singing song by Chrissy Teigen https://t.co/5Jgo8oqfYS"
1167,1092453998882304000,12039612,1558,159357,1718,1366,109485,2008-01-09 19:18:34,2,0,2019-02-04 16:05:04,Noose reportedly found on Shelby County Schools property https://t.co/SUmOHdMNWa https://t.co/GwOe19PXcx
1168,1092453995770195969,12039612,1558,159357,1718,1366,109485,2008-01-09 19:18:34,1,2,2019-02-04 16:05:04,"The 9:01: Steven Tyler gets a warm welcome in Memphis — Tim Lambesis, not so much https://t.co/ZmQnbR0Ib9"
1169,1092446325411479552,12039612,1558,159357,1718,1366,109485,2008-01-09 19:18:34,1,6,2019-02-04 15:34:35,"The 9:01: Steven Tyler gets a warm welcome in Memphis — Tim Lambesis, not so much https://t.co/WeEcQWb05z https://t.co/NkyfKxRJYW"
1170,1092442229367402496,12039612,1558,159357,1718,1366,109485,2008-01-09 19:18:34,3,2,2019-02-04 15:18:18,NEW: A rope 'tied up to resemble a noose' was found at the Shelby County Schools Teaching and Learning Academy this… https://t.co/qDHkNhsLEs
1171,1092442166083891200,12039612,1558,159357,1718,1366,109485,2008-01-09 19:18:34,1,4,2019-02-04 15:18:03,Patriots kicker Stephen Gostkowski played in Super Bowl a day after grandfather's death https://t.co/l7wn6huh5J
1172,1092437887935807488,12039612,1558,159357,1718,1366,109485,2008-01-09 19:18:34,0,0,2019-02-04 15:01:03,Super Bowl thoughts: 5 worse games than Patriots-Rams; are the Titans transitive champions? https://t.co/OUXBB4OPa7
1173,1092433847143284736,12039612,1558,159357,1718,1366,109485,2008-01-09 19:18:34,3,5,2019-02-04 14:45:00,"Review: Maroon 5 delivers a white-bread halftime show, avoids being the worst ever  https://t.co/cvnB61OP5i"
1174,1092430324150255616,12039612,1558,159357,1718,1366,109485,2008-01-09 19:18:34,1,4,2019-02-04 14:31:00,"The @TheAAF's inaugural season officially begins Saturday, but as far as @AAFMemphis is concerned, the zero hour is… https://t.co/rcasZegE9G"
1175,1092423780734025734,12039612,1558,159357,1718,1366,109485,2008-01-09 19:18:34,3,7,2019-02-04 14:05:00,"Nancy Armour: ""Call attention to racism and discrimination, and your career is effectively over. Test positive for… https://t.co/y1Voc2TSPa"
1176,1092416496553336832,12039612,1558,159357,1718,1366,109485,2008-01-09 19:18:34,2,3,2019-02-04 13:36:03,Gannett rejects takeover offer from MNG/Digital First Media https://t.co/ayeQVI6qfW
1177,1092409199932465153,12039612,1558,159357,1718,1366,109485,2008-01-09 19:18:34,0,0,2019-02-04 13:07:03,"Review: Maroon 5 delivers a vanilla halftime show, avoids being the worst ever https://t.co/Z40Qav4CD7"
1178,1092408582648152065,12039612,1558,159357,1718,1366,109485,2008-01-09 19:18:34,0,3,2019-02-04 13:04:36,"Football, reimagined: Why the AAF, Memphis Express think they'll succeed where others failed https://t.co/h0Nz2B4uKu https://t.co/9aZ5HBEQJ5"
1179,1092404927056543745,12039612,1558,159357,1718,1366,109485,2008-01-09 19:18:34,1,4,2019-02-04 12:50:05,"Review: Maroon 5 delivers a white-bread halftime show, avoids being the worst ever https://t.co/FGYzO1Ht0r"
1180,1092400767758004225,12039612,1558,159357,1718,1366,109485,2008-01-09 19:18:34,0,5,2019-02-04 12:33:33,New FedEx executive says company has 'great opportunity' to draw more women to logistics https://t.co/XhpICbUUSD https://t.co/zKe9EMHG9C
1181,1092400638972039169,12039612,1558,159357,1718,1366,109485,2008-01-09 19:18:34,1,3,2019-02-04 12:33:02,Former Memphis football star Anthony Miller to inspire at Commercial Appeal Sports Awards https://t.co/FvMmUZmHqx
1182,1092396361163726848,12039612,1558,159357,1718,1366,109485,2008-01-09 19:18:34,3,4,2019-02-04 12:16:02,New FedEx executive says company has 'great opportunity' to draw more women to logistics https://t.co/M6fxciIztv
1183,1092393359937654784,12039612,1558,159357,1718,1366,109485,2008-01-09 19:18:34,0,1,2019-02-04 12:04:07,Memphis Grizzlies: Kyle Anderson to see specialist for shoulder as roster remains in flux https://t.co/xa2ucL4Fkc https://t.co/zDhNSGDVZS
1184,1092387553137868800,12039612,1558,159357,1718,1366,109485,2008-01-09 19:18:34,0,1,2019-02-04 11:41:02,Inside the prison unit where Cyntoia Brown will prepare for freedom https://t.co/0Km8GWwRzT
1185,1092377267777482753,12039612,1558,159357,1718,1366,109485,2008-01-09 19:18:34,0,1,2019-02-04 11:00:10,"If you call in sick Monday after the Super Bowl, you aren't alone. 'Super Bowl fever' is a thing https://t.co/S50ArwYGts"
1186,1092281857906016256,12039612,1558,159357,1718,1366,109485,2008-01-09 19:18:34,1,6,2019-02-04 04:41:03,"The NFL put MLK in a Super Bowl video, and Colin Kaepernick fans aren't happy about it https://t.co/N6tw4UG4n1"
1187,1092276320933957632,12039612,1558,159357,1718,1366,109485,2008-01-09 19:18:34,0,4,2019-02-04 04:19:03,"Stephen Gostkowski sets Super Bowl record with sixth appearance, converts two FGs, PAT for Patriots https://t.co/yLso3rEddM"
1188,1092272043922460672,12039612,1558,159357,1718,1366,109485,2008-01-09 19:18:34,0,0,2019-02-04 04:02:03,Patriots top Rams 13-3 to win sixth NFL title in lowest-scoring Super Bowl ever https://t.co/c0vh4qryBQ
1189,1092267779527491584,12039612,1558,159357,1718,1366,109485,2008-01-09 19:18:34,4,14,2019-02-04 03:45:06,Stephen Gostkowski sets Super Bowl record with sixth appearance as Patriots claim title https://t.co/gAavKtR3wB
1190,1092263978431119360,12039612,1558,159357,1718,1366,109485,2008-01-09 19:18:34,11,30,2019-02-04 03:30:00,The Washington Post ad in tonight's Super Bowl is a stark reminder of the importance of journalism. And it matters… https://t.co/FovBsWBVrU
1191,1092256470761160704,12039612,1558,159357,1718,1366,109485,2008-01-09 19:18:34,1,8,2019-02-04 03:00:10,"Stephen Gostkowski sets Super Bowl record with sixth appearance, converts FG and PAT for Patriots https://t.co/a1f9d1sox4"
1192,1092240093853741058,12039612,1558,159357,1718,1366,109485,2008-01-09 19:18:34,0,2,2019-02-04 01:55:05,"Super Bowl LIII live: Score updates, analysis, play-by-play on Patriots vs. Rams https://t.co/NxwAfGYJKM"
1193,1092235803936387072,12039612,1558,159357,1718,1366,109485,2008-01-09 19:18:34,5,19,2019-02-04 01:38:03,Super Bowl 2019: Memphis Express head coach Mike Singletary featured in 'NFL100' commercial https://t.co/XbdAxrG12o
1194,1092226996095066113,12039612,1558,159357,1718,1366,109485,2008-01-09 19:18:34,1,5,2019-02-04 01:03:03,"Stephen Gostkowski sets Super Bowl record, has New England Patriots only points https://t.co/XMB1HP7z6Q"
1195,1092222847672451072,12039612,1558,159357,1718,1366,109485,2008-01-09 19:18:34,0,0,2019-02-04 00:46:34,"Stephen Gostkowski sets Super Bowl record, has New England Patriots only points https://t.co/cffW1RvKlb https://t.co/p2kygCb9K6"
1196,1092222213586108416,12039612,1558,159357,1718,1366,109485,2008-01-09 19:18:34,1,0,2019-02-04 00:44:02,"Stephen Gostkowski sets Super Bowl record, has New England Patriots only points https://t.co/4lqNflyLpx"
1197,1092189246411165696,12039612,1558,159357,1718,1366,109485,2008-01-09 19:18:34,0,3,2019-02-03 22:33:02,We want our Lady Vols-Commodores basketball rivalry back https://t.co/BDa8pRxCNM
1198,1092180439563943936,12039612,1558,159357,1718,1366,109485,2008-01-09 19:18:34,0,3,2019-02-03 21:58:03,"ICE arrests rapper 21 Savage in Atlanta, says he's actually from United Kingdom https://t.co/ILEJpES776"
1199,1092176160191143937,12039612,1558,159357,1718,1366,109485,2008-01-09 19:18:34,1,12,2019-02-03 21:41:02,Memphis football receives commitment from defensive tackle Kajuan Robinson https://t.co/D0hU9GYMUe
1200,1092170501609336832,12039612,1558,159357,1718,1366,109485,2008-01-09 19:18:34,8,24,2019-02-03 21:18:33,Steven Tyler spotted in Germantown ahead of Youth Villages event Monday https://t.co/wJaCOEHpgB https://t.co/GELPY9Fmmp
1201,1092163204698927104,12039612,1558,159357,1718,1366,109485,2008-01-09 19:18:34,0,5,2019-02-03 20:49:34,"Game Recap: Memphis Grizzlies 96, New York Knicks 84 https://t.co/rGa5UqJqaI https://t.co/xnsFxONeCw"
1202,1092162822811893760,12039612,1558,159357,1718,1366,109485,2008-01-09 19:18:34,0,0,2019-02-03 20:48:03,"Game Recap: Memphis Grizzlies 96, New York Knicks 84 https://t.co/0Jr7sXZgnf"
1203,1092158543145390085,12039612,1558,159357,1718,1366,109485,2008-01-09 19:18:34,2,2,2019-02-03 20:31:02,Memphis Grizzlies: Kyle Anderson to see specialist for shoulder as roster remains in flux https://t.co/m0XAmRZMB5
1204,1092145457822924800,12039612,1558,159357,1718,1366,109485,2008-01-09 19:18:34,0,0,2019-02-03 19:39:02,The case against El Chapo is headed to the jury. Here's what to know https://t.co/R4sHjPIW9p
1205,1092115519824711680,12039612,1558,159357,1718,1366,109485,2008-01-09 19:18:34,1,2,2019-02-03 17:40:05,Sunday Sports Brunch: University of Memphis adds two assistant coaches https://t.co/GpYsMaOv4j
1206,1092111486682611712,12039612,1558,159357,1718,1366,109485,2008-01-09 19:18:34,2,0,2019-02-03 17:24:03,Former MPD probationary officer charged with sexual exploitation of a minor in California https://t.co/qZ2PfKLrEl
1207,1092111243010236416,12039612,1558,159357,1718,1366,109485,2008-01-09 19:18:34,2,0,2019-02-03 17:23:05,"Memphis police officer arrested for domestic assault, relieved of duty https://t.co/D3EMunG6Di https://t.co/fqvt4j7EvM"
1208,1092107205531324417,12039612,1558,159357,1718,1366,109485,2008-01-09 19:18:34,16,136,2019-02-03 17:07:02,Steven Tyler spotted in Germantown ahead of Youth Villages event Monday https://t.co/vsGg2borHa
1209,1092102934177943553,12039612,1558,159357,1718,1366,109485,2008-01-09 19:18:34,1,1,2019-02-03 16:50:04,Pressure builds for Virginia Gov. Ralph Northam to resign amid blackface photo controversy https://t.co/9pmaUh3S46
1210,1092094133982908417,12039612,1558,159357,1718,1366,109485,2008-01-09 19:18:34,2,1,2019-02-03 16:15:06,"Memphis police officer arrested for domestic assault, relieved of duty https://t.co/z9xyvlH5k5"
1211,1092061155600814081,12039612,1558,159357,1718,1366,109485,2008-01-09 19:18:34,2,5,2019-02-03 14:04:03,Memphis basketball: Jeremiah Martin's historic performance tainted by end result https://t.co/6vrIKQEf0S
1212,1092058761819115520,12039612,1558,159357,1718,1366,109485,2008-01-09 19:18:34,0,1,2019-02-03 13:54:32,Memphis basketball: Jeremiah Martin's historic performance tainted by end result https://t.co/O0UlznPD9j
