Index,ID,User_ID,Friends_Count,Followers_Count,Favourites_Count,Listed_Count,Status_Count,Created_at,Retweet_Count,Favourite_Count,Created_at,Text
576,1091348702424383489,15679641,709,654005,4331,6575,180868,2008-07-31 19:59:08,1,4,2019-02-01 14:53:01,This is the simple way to avoid getting scammed like Crowley ISD and Galveston County did https://t.co/DWsZgNljP1
577,1091344169078009856,15679641,709,654005,4331,6575,180868,2008-07-31 19:59:08,4,9,2019-02-01 14:35:00,Drought in parts of Texas last year followed by lots of rain in the fall could make pecans more expensive this year https://t.co/BUnKt9BF96
578,1091341147493019648,15679641,709,654005,4331,6575,180868,2008-07-31 19:59:08,3,9,2019-02-01 14:23:00,"Acquiring Kristaps Porzingis is biggest non-draft day deal in Mavs history. Now, it's up to Rick Carlisle to make i… https://t.co/BHSfEEcd2p"
579,1091337372116094976,15679641,709,654005,4331,6575,180868,2008-07-31 19:59:08,4,3,2019-02-01 14:08:00,Which North Texas cities were named among anti-vaccine 'hotspots' in national study? https://t.co/fjrN4uwuVK
580,1091332845803577344,15679641,709,654005,4331,6575,180868,2008-07-31 19:59:08,3,3,2019-02-01 13:50:01,A landmark Uptown property has changed hands. https://t.co/RVdUx34hd9
581,1091323532766789632,15679641,709,654005,4331,6575,180868,2008-07-31 19:59:08,4,5,2019-02-01 13:13:00,Woman found shot in arm outside Red Bird apartment complex https://t.co/35qUjyABNR
582,1091321014192168962,15679641,709,654005,4331,6575,180868,2008-07-31 19:59:08,4,9,2019-02-01 13:03:00,Texas wants court to make tobacco companies repay $125 million in missed payments https://t.co/G33pf0XLrd
583,1091318445881393152,15679641,709,654005,4331,6575,180868,2008-07-31 19:59:08,4,5,2019-02-01 12:52:47,Overturned 18-wheeler ties up traffic on I-30 in Rockwall #DFWTraffic https://t.co/RJgeNF6Ta1
584,1091316233159495680,15679641,709,654005,4331,6575,180868,2008-07-31 19:59:08,17,16,2019-02-01 12:44:00,String of student rapes reported at Baylor University residence hall https://t.co/5E4VCifocj
585,1091312206174699521,15679641,709,654005,4331,6575,180868,2008-07-31 19:59:08,4,2,2019-02-01 12:28:00,"Dallas mother whose 2 sons died minutes apart after shooting, crash loses third son https://t.co/S8wry9Cwn6"
586,1091308687266861056,15679641,709,654005,4331,6575,180868,2008-07-31 19:59:08,8,22,2019-02-01 12:14:01,Texans' property taxes are high. School funding needs an overhaul. What does Greg Abbott plan to do? https://t.co/hd9bwCquXo
587,1091305665350549504,15679641,709,654005,4331,6575,180868,2008-07-31 19:59:08,4,1,2019-02-01 12:02:00,"Dallas man faces charges after enrolling at fake university set up by ICE, feds say https://t.co/1tZJraIxjr"
588,1091296858184523776,15679641,709,654005,4331,6575,180868,2008-07-31 19:59:08,1,3,2019-02-01 11:27:00,Dallas trustee resigning after it is reported that he no longer lives in the district he represents https://t.co/K83M9tx7oN
589,1091291329211101186,15679641,709,654005,4331,6575,180868,2008-07-31 19:59:08,3,5,2019-02-01 11:05:02,"Dallas City Council member reported campaign donations from corporations, which is forbidden https://t.co/rL58qll97i"
590,1091226642620604416,15679641,709,654005,4331,6575,180868,2008-07-31 19:59:08,2,6,2019-02-01 06:48:00,The @HiltonAnatole is over the hill this year! https://t.co/ZtrS198pqa
591,1091217080437956608,15679641,709,654005,4331,6575,180868,2008-07-31 19:59:08,2,5,2019-02-01 06:10:00,More like @AmericanAir(Pods). https://t.co/QxGoHFVS2v
592,1091210536879042560,15679641,709,654005,4331,6575,180868,2008-07-31 19:59:08,23,91,2019-02-01 05:44:00,The never-on-Sunday liquor store ban in Texas could be history. https://t.co/jXIgNjUCFr
593,1091206262115782657,15679641,709,654005,4331,6575,180868,2008-07-31 19:59:08,6,5,2019-02-01 05:27:01,Which North Texas cities were named among anti-vaccine 'hotspots' in national study? https://t.co/tq8UFiSTKH
594,1091202234912854017,15679641,709,654005,4331,6575,180868,2008-07-31 19:59:08,1,6,2019-02-01 05:11:01,"More than Kristaps Porzingis: Meet the other players the Mavericks are receiving, including the Knicks' leading sco… https://t.co/rWAlbGXkp6"
595,1091198960658726913,15679641,709,654005,4331,6575,180868,2008-07-31 19:59:08,5,13,2019-02-01 04:58:00,Is Dallas’ White Rock Lake haunted? #CuriousTexas ghost hunts for an answer. 👻 https://t.co/xIKGpPqq1v
596,1091189649387724800,15679641,709,654005,4331,6575,180868,2008-07-31 19:59:08,2,7,2019-02-01 04:21:00,"Early college football national title odds: Texas has better odds than Oklahoma, Texas A&amp;M; see all local schools'… https://t.co/s1Q01tvwXB"
597,1091185877936758784,15679641,709,654005,4331,6575,180868,2008-07-31 19:59:08,2,2,2019-02-01 04:06:01,Here are 7 ways to celebrate #BlackHistoryMonth in Dallas-Fort Worth https://t.co/L6kwHSKS88
598,1091182352221511680,15679641,709,654005,4331,6575,180868,2008-07-31 19:59:08,1,12,2019-02-01 03:52:00,The adorable gorillas at the @DallasZoo and @FortWorthZoo know who they're rooting for this #SuperBowl Sunday! Do y… https://t.co/KEHaLbrtCu
599,1091178578669121536,15679641,709,654005,4331,6575,180868,2008-07-31 19:59:08,3,6,2019-02-01 03:37:00,"Forney man active in youth sports, accused of sexually assaulting child also faces indecency charges, police say https://t.co/6MB0b2c9nM"
600,1091174300168667136,15679641,709,654005,4331,6575,180868,2008-07-31 19:59:08,0,8,2019-02-01 03:20:00,National reaction to Kristaps Porzingis trade: Knicks 'inept' ... does Dallas have its new Nash-Dirk duo? https://t.co/8yLv6t6W6f
601,1091170274278604800,15679641,709,654005,4331,6575,180868,2008-07-31 19:59:08,22,109,2019-02-01 03:04:01,"Dear Kristaps Porzingis: Welcome to Dallas, you're gonna love it https://t.co/TfoCCfxUEP"
602,1091168257904660481,15679641,709,654005,4331,6575,180868,2008-07-31 19:59:08,4,3,2019-02-01 02:56:00,"Denton inmate was making noose from pants when jail officer saw and stopped suicide attempt, police say https://t.co/6iOA1LukgP"
603,1091163980993908736,15679641,709,654005,4331,6575,180868,2008-07-31 19:59:08,1,2,2019-02-01 02:39:00,Who's behind Kellen Moore's rapid rise with the Cowboys? Hint: It wasn't just Scott Linehan. https://t.co/BfPX4HUPju
604,1091159703466532865,15679641,709,654005,4331,6575,180868,2008-07-31 19:59:08,0,1,2019-02-01 02:22:00,Plan a fun weekend: The top 20-plus things to do in Dallas-Fort Worth https://t.co/xA7wGg3Yo4
605,1091157944199200769,15679641,709,654005,4331,6575,180868,2008-07-31 19:59:08,1,6,2019-02-01 02:15:01,"5 things to know about Mavericks forward Kristaps Porzingis, including how the All-Star compares to a Dallas legend https://t.co/aoAr0a7HgZ"
606,1091156181098381312,15679641,709,654005,4331,6575,180868,2008-07-31 19:59:08,0,2,2019-02-01 02:08:00,"Dallas City Council member reported campaign donations from corporations, which is forbidden https://t.co/bRvDDceEfg"
607,1091153160511647745,15679641,709,654005,4331,6575,180868,2008-07-31 19:59:08,1,2,2019-02-01 01:56:00,.@TuesdayMorning shares climb on stronger holiday quarter https://t.co/3MW6UrXfji
608,1091149384690081792,15679641,709,654005,4331,6575,180868,2008-07-31 19:59:08,5,6,2019-02-01 01:41:00,This is the simple way to avoid getting scammed like Crowley ISD and Galveston County did | Watchdog https://t.co/00PfH7BkBk
609,1091145861567037441,15679641,709,654005,4331,6575,180868,2008-07-31 19:59:08,2,6,2019-02-01 01:27:00,Dallas trustee resigning after it is reported that he doesn't live in the district he represents https://t.co/6geFT1Y3Mb
610,1091142338985033729,15679641,709,654005,4331,6575,180868,2008-07-31 19:59:08,3,1,2019-02-01 01:13:00,Fort Worth kindergarten teacher accused of fondling preteen https://t.co/hMpJHOG97H
611,1091140324410441728,15679641,709,654005,4331,6575,180868,2008-07-31 19:59:08,7,25,2019-02-01 01:05:00,Sources: Dallas Cowboys have no plans to extend Jason Garrett's contract at this time https://t.co/1ck3m2Y9Uj
612,1091138814511407109,15679641,709,654005,4331,6575,180868,2008-07-31 19:59:08,3,1,2019-02-01 00:59:00,"Hurst student facing 9 felony charges after school bombing, shooting threats https://t.co/Nswu0RGl76"
613,1091134036326694912,15679641,709,654005,4331,6575,180868,2008-07-31 19:59:08,2,4,2019-02-01 00:40:01,"The best kid-friendly events: arty fun, Lunar New Year, toys and more https://t.co/Lk14Jq5NvG"
614,1091129504796459008,15679641,709,654005,4331,6575,180868,2008-07-31 19:59:08,1,5,2019-02-01 00:22:00,Dallas trustee resigning after it is reported that he no longer lives in the district he represents https://t.co/VmokqJJCaz
615,1091125731915112448,15679641,709,654005,4331,6575,180868,2008-07-31 19:59:08,3,1,2019-02-01 00:07:01,"Dallas man faces charges after enrolling at fake university set up by @ICEgov, feds say https://t.co/vhQksvJpVP"
616,1091121201127321600,15679641,709,654005,4331,6575,180868,2008-07-31 19:59:08,0,2,2019-01-31 23:49:01,Lawyer for paralyzed butt-lift patient says surgeons knew danger of unlicensed post-op hotel in Dallas https://t.co/32IGADkjrN
617,1091115914756542464,15679641,709,654005,4331,6575,180868,2008-07-31 19:59:08,1,8,2019-01-31 23:28:00,"Yes, do your KonMari cleanse; just don’t dump all that joyless junk on the city | Editorial https://t.co/wEUivmP9gk"
618,1091110631422525440,15679641,709,654005,4331,6575,180868,2008-07-31 19:59:08,1,0,2019-01-31 23:07:01,"Spots to eat, drink and watch the Super Bowl in Dallas-Fort Worth https://t.co/GWvyJB27TY"
619,1091106853902303232,15679641,709,654005,4331,6575,180868,2008-07-31 19:59:08,4,12,2019-01-31 22:52:00,Valley View Center's remaining tenants suddenly booted from dead North Dallas mall — and for what? | @RobertWilonsky https://t.co/8WQq7Z4UJA
620,1091102830402981888,15679641,709,654005,4331,6575,180868,2008-07-31 19:59:08,18,24,2019-01-31 22:36:01,"5 plants to blame for most of North Texas' 78,737 pounds of air pollution, report says https://t.co/A3KcY2zveA"
621,1091098550929371138,15679641,709,654005,4331,6575,180868,2008-07-31 19:59:08,1,6,2019-01-31 22:19:00,Can Sutherland Springs families sue Academy Sports over gun sale? Texas judge will soon decide https://t.co/Gu2TL7wo9b
622,1091094783299330049,15679641,709,654005,4331,6575,180868,2008-07-31 19:59:08,2,3,2019-01-31 22:04:02,.@TheBushCenter picks power couple @BillGates and @melindagates for leadership award https://t.co/aC1JWyq3ON
623,1091093265447874560,15679641,709,654005,4331,6575,180868,2008-07-31 19:59:08,0,5,2019-01-31 21:58:00,3 'related' rapes reported at Baylor residence hall https://t.co/eTzS6HSgoY
624,1091088986729263104,15679641,709,654005,4331,6575,180868,2008-07-31 19:59:08,4,6,2019-01-31 21:41:00,"Dallas mother whose 2 sons died minutes apart after shooting, crash loses third son https://t.co/z4FLdvkWzM"
625,1091084961694838785,15679641,709,654005,4331,6575,180868,2008-07-31 19:59:08,1,3,2019-01-31 21:25:00,Fort Worth man pleads guilty to murdering wife who was thrown into lake with concrete tied to her neck https://t.co/c5wv3VclOL
626,1091081440945672195,15679641,709,654005,4331,6575,180868,2008-07-31 19:59:08,3,3,2019-01-31 21:11:01,More apartments on the way at the $1.5 billion Frisco Station development https://t.co/fCb5ZTV268
627,1091076655098069000,15679641,709,654005,4331,6575,180868,2008-07-31 19:59:08,3,4,2019-01-31 20:52:00,Former student arrested in threats to Fort Worth high school https://t.co/SrDn4TalDP
628,1091073132432187395,15679641,709,654005,4331,6575,180868,2008-07-31 19:59:08,4,6,2019-01-31 20:38:00,#Breaking: @DallasCath Diocese releases list of clergy credibly accused of sexual abuse since 1950 https://t.co/m81axP5pxj
629,1091065082853896195,15679641,709,654005,4331,6575,180868,2008-07-31 19:59:08,1,6,2019-01-31 20:06:01,".@AmericanAir, Apple team up for free in-flight music streaming https://t.co/2BcDnOOXdO"
630,1091060551021674497,15679641,709,654005,4331,6575,180868,2008-07-31 19:59:08,7,11,2019-01-31 19:48:00,"Texas pecans could be more expensive this year thanks to 2018’s drought, heavy rains #txwx https://t.co/CIomFVqB48"
631,1091049478071767041,15679641,709,654005,4331,6575,180868,2008-07-31 19:59:08,3,3,2019-01-31 19:04:00,3 charged with murder in drug-related shooting of 21-year-old Burleson man https://t.co/31gT9GXgqP
632,1091041677844844546,15679641,709,654005,4331,6575,180868,2008-07-31 19:59:08,0,2,2019-01-31 18:33:01,Want or @Google to turn off the lights? Start with a smart bulb | Technology https://t.co/PMlMlJWx8e
633,1091037649639493636,15679641,709,654005,4331,6575,180868,2008-07-31 19:59:08,2,7,2019-01-31 18:17:00,Singer-songwriter @KingPrincess69 brings her queer swagger and lo-fi sound to Dallas' @granadatheater this weekend https://t.co/XMsCQAlSlF
634,1091033632951754759,15679641,709,654005,4331,6575,180868,2008-07-31 19:59:08,4,4,2019-01-31 18:01:03,Man held in sucker-punch assault on woman walking with her kids in Fort Worth https://t.co/Yp1h0PBO3b
635,1091030351806377984,15679641,709,654005,4331,6575,180868,2008-07-31 19:59:08,0,2,2019-01-31 17:48:00,Police investigate body of man found in creek along former McKinney golf course https://t.co/Jt0c8wirVy
636,1091026827844435969,15679641,709,654005,4331,6575,180868,2008-07-31 19:59:08,1,1,2019-01-31 17:34:00,"Political Points: Update on non-citizen voters, political football, Cornyn on GOP's chances in 2020 | Newsletters https://t.co/1KHMVUs7pY"
637,1091023057244835845,15679641,709,654005,4331,6575,180868,2008-07-31 19:59:08,6,2,2019-01-31 17:19:01,Texas lawyer sues Apple over FaceTime bug that he claims allowed eavesdropping on deposition testimony https://t.co/Dpme72op9y
638,1091019293150638080,15679641,709,654005,4331,6575,180868,2008-07-31 19:59:08,2,2,2019-01-31 17:04:04,Texans' property taxes are high. School funding needs an overhaul. What does @GregAbbott_TX plan to do? #txlege… https://t.co/qc5NKnMAMs
639,1091015503835992065,15679641,709,654005,4331,6575,180868,2008-07-31 19:59:08,0,2,2019-01-31 16:49:00,Hydrogen One by @RED_Cinema is a smartphone with the potential to be great ... someday | Tech Review https://t.co/m0hjDlk5mV
640,1091011477904019456,15679641,709,654005,4331,6575,180868,2008-07-31 19:59:08,12,16,2019-01-31 16:33:01,Is @whiterockdallas haunted? Curious Texas ghost hunts for an answer https://t.co/jn6tDZHF10
641,1091007449774067717,15679641,709,654005,4331,6575,180868,2008-07-31 19:59:08,1,2,2019-01-31 16:17:00,Lake Highlands Town Center shopping sells to Maryland-based real estate investor https://t.co/6xknt5krOI
642,1091003427612549120,15679641,709,654005,4331,6575,180868,2008-07-31 19:59:08,2,3,2019-01-31 16:01:01,"A man's flu shot fainting spell leads to a hospital trip — and a $4,700 bill https://t.co/KEsWLMWYDS"
643,1091003277288882176,15679641,709,654005,4331,6575,180868,2008-07-31 19:59:08,2,2,2019-01-31 16:00:25,#DallasCowboys owner Jerry Jones had a positive reaction to DeMarcus Lawrence's tweet | @TheTylerDragon  https://t.co/gV2xW0IhEO
644,1091000150410055685,15679641,709,654005,4331,6575,180868,2008-07-31 19:59:08,1,7,2019-01-31 15:48:00,Stopping human trafficking will require greater communication among agencies and communities | Opinion https://t.co/XD3unEOYMp
645,1090994878216105985,15679641,709,654005,4331,6575,180868,2008-07-31 19:59:08,1,2,2019-01-31 15:27:03,Underappreciated and underpaid: This artist's autobiographical work has universal appeal https://t.co/a4E8WrU5Ov
646,1090990593361219584,15679641,709,654005,4331,6575,180868,2008-07-31 19:59:08,2,3,2019-01-31 15:10:01,Michael Irvin candidly shares his thoughts about the current state of the Dallas Cowboys | @DavidMooreDMN https://t.co/ofECVfjNbC
647,1090986311920558082,15679641,709,654005,4331,6575,180868,2008-07-31 19:59:08,4,26,2019-01-31 14:53:00,"In what may have been his last game at Madison Square Garden, Mavericks' Dirk Nowitzki gives fans performance to re… https://t.co/qeJ83yCQTS"
648,1090981788837658625,15679641,709,654005,4331,6575,180868,2008-07-31 19:59:08,34,16,2019-01-31 14:35:02,Report: @ICEgov force-feeding El Paso detainees on hunger strike through their noses https://t.co/BIELW4aPuC
649,1090978759161843712,15679641,709,654005,4331,6575,180868,2008-07-31 19:59:08,1,4,2019-01-31 14:23:00,"The new spot in Bishop Arts, expected to open in early February, will be located at Davis Street and Beckley Avenue. https://t.co/SoASpoDtec"
650,1090974992043515904,15679641,709,654005,4331,6575,180868,2008-07-31 19:59:08,0,3,2019-01-31 14:08:02,'I'm going to watch him like I watched Beltre': Isiah Kiner-Falefa's more-defined role in 2019 leads to new Rangers… https://t.co/EWs5835PYi
651,1090970434940649472,15679641,709,654005,4331,6575,180868,2008-07-31 19:59:08,4,5,2019-01-31 13:49:55,29-year-old man shot to death trying to stop truck burglary in Garland https://t.co/VQte9kgVKy
652,1090961144804716544,15679641,709,654005,4331,6575,180868,2008-07-31 19:59:08,2,2,2019-01-31 13:13:00,Woman killed when bale of recycled material falls on her at @RepublicService warehouse in east Fort Worth https://t.co/zqBrwoFMm6
653,1090958627358281731,15679641,709,654005,4331,6575,180868,2008-07-31 19:59:08,1,3,2019-01-31 13:03:00,Smart order at the French Room: Tableside service and fascinating wines for $57 https://t.co/xbT58mPTfR
654,1090943282039934977,15679641,709,654005,4331,6575,180868,2008-07-31 19:59:08,2,2,2019-01-31 12:02:01,Blue Apron to cut about 200 jobs at its Arlington fulfillment center https://t.co/o7VwZwkod8
655,1090934469740122112,15679641,709,654005,4331,6575,180868,2008-07-31 19:59:08,1,3,2019-01-31 11:27:00,AT&amp;T's 2019 challenge: Reversing a shrinking TV audience and paying down billions in debt https://t.co/MMY2wVcNwr
656,1090928932172517376,15679641,709,654005,4331,6575,180868,2008-07-31 19:59:08,1,4,2019-01-31 11:05:00,"We know it's not Valentine's Day yet but we just wanted to say those three little words before it's too late...

Fr… https://t.co/j5IOIbn5w3"
657,1090848149638393856,15679641,709,654005,4331,6575,180868,2008-07-31 19:59:08,1,3,2019-01-31 05:44:00,Texas man executed for killing Houston police officer in 1988 https://t.co/lE1EfnZ4xb
658,1090839846254448640,15679641,709,654005,4331,6575,180868,2008-07-31 19:59:08,5,12,2019-01-31 05:11:00,Michael Irvin's advice to Tony Romo about pursuing a coaching career in the future: 'Are you out of your mind?' https://t.co/YumrisHm7H
659,1090831036282474496,15679641,709,654005,4331,6575,180868,2008-07-31 19:59:08,11,38,2019-01-31 04:36:00,"Yoga, martial arts classes part of new kind of PE curriculum for Frisco kids https://t.co/EWlYCJgQkd"
660,1090827263132733440,15679641,709,654005,4331,6575,180868,2008-07-31 19:59:08,4,7,2019-01-31 04:21:00,Giant Japan financial firm headed to Plano's Legacy West https://t.co/ByyeGLd24i
661,1090823489878142977,15679641,709,654005,4331,6575,180868,2008-07-31 19:59:08,2,3,2019-01-31 04:06:01,Report: Former Oklahoma DC Mike Stoops to join Alabama's staff in off-field role  https://t.co/Wa4stxVJje
662,1090819965312221189,15679641,709,654005,4331,6575,180868,2008-07-31 19:59:08,2,3,2019-01-31 03:52:00,Has a Dallas school trustee resigned? Because replacing him is on the board's agenda https://t.co/y8OcKyOVsB
663,1090816188635062273,15679641,709,654005,4331,6575,180868,2008-07-31 19:59:08,1,9,2019-01-31 03:37:00,Lawmakers have a proposal to prevent more Texas moms from dying after childbirth https://t.co/IXdwNrWkvo
664,1090811911166455808,15679641,709,654005,4331,6575,180868,2008-07-31 19:59:08,1,2,2019-01-31 03:20:00,"3 under-the-radar free agents the Cowboys should target, including a perfect complement to Ezekiel Elliott https://t.co/SINxTRlRJO"
665,1090807885226016768,15679641,709,654005,4331,6575,180868,2008-07-31 19:59:08,1,6,2019-01-31 03:04:00,Dallas lawyer’s young children donating thousands to 3 City Council members https://t.co/9QPB2OT6Gc
666,1090805871452581894,15679641,709,654005,4331,6575,180868,2008-07-31 19:59:08,3,5,2019-01-31 02:56:00,Cleric among 13 arrested in Denton County sting targeting online solicitation of minors https://t.co/Sg8bKInOFg
667,1090801594885640192,15679641,709,654005,4331,6575,180868,2008-07-31 19:59:08,0,6,2019-01-31 02:39:00,Mavs rookie Luka Doncic ranked near top of USA Today's list of the 25 best NBA players under 25 https://t.co/KduxMcp9YM
668,1090797314145468416,15679641,709,654005,4331,6575,180868,2008-07-31 19:59:08,1,1,2019-01-31 02:22:00,There's still time to get free Dunkin' coffee in 3 North Texas cities https://t.co/8y4JTXvP79
669,1090793793270566912,15679641,709,654005,4331,6575,180868,2008-07-31 19:59:08,0,3,2019-01-31 02:08:00,"At the French Room in Dallas, a chef elegantly walks on eggshells | @MichaleneB https://t.co/j9WE3sEhBU"
670,1090790771597418502,15679641,709,654005,4331,6575,180868,2008-07-31 19:59:08,10,26,2019-01-31 01:56:00,Texas 'not as red as people think': Cornyn sees 2020 campaign as another referendum on Trump https://t.co/5tNNdX43y6
671,1090786998938492928,15679641,709,654005,4331,6575,180868,2008-07-31 19:59:08,2,5,2019-01-31 01:41:01,Watch: Cowboys DL Tyrone Crawford surprises Frisco Heritage girls soccer player with $10K scholarship https://t.co/p3tGaAuEok
672,1090783472812208128,15679641,709,654005,4331,6575,180868,2008-07-31 19:59:08,1,16,2019-01-31 01:27:00,"'Mrs. Maisel' star Rachel Brosnahan pays tribute to the memory of her aunt, fashion icon Kate Spade https://t.co/ScndCC5Vg1"
673,1090776429502103553,15679641,709,654005,4331,6575,180868,2008-07-31 19:59:08,3,8,2019-01-31 00:59:01,Dallas' landmark Anatole Hotel is celebrating it's 40th birthday this year https://t.co/kkYsrYFwKT
674,1090771650168217600,15679641,709,654005,4331,6575,180868,2008-07-31 19:59:08,2,5,2019-01-31 00:40:01,"Suspect arrested in string of burglaries targeting Mesquite churches, school https://t.co/gg7GvekeGi"
675,1090767116020731904,15679641,709,654005,4331,6575,180868,2008-07-31 19:59:08,5,6,2019-01-31 00:22:00,"Report: Ex-Baylor AD says Art Briles will be 'largely exonerated,' eligible to coach college football in 2019 https://t.co/3qfaEXQ0SY"
676,1090763343256784897,15679641,709,654005,4331,6575,180868,2008-07-31 19:59:08,3,11,2019-01-31 00:07:01,Zoo officials baffled after new shark killed by moray eel in Waco https://t.co/Sp0TimD199
677,1090758812045398018,15679641,709,654005,4331,6575,180868,2008-07-31 19:59:08,1,7,2019-01-30 23:49:00,Fort Worth coffee shop Brewed is heading to a hip neighborhood in Dallas https://t.co/PlpBDICSMK
678,1090748243632447488,15679641,709,654005,4331,6575,180868,2008-07-31 19:59:08,14,21,2019-01-30 23:07:01,"Dallas-Fort Worth led nation in jobs growth in 2018, topping New York and Houston https://t.co/fRuQzXjhnH"
679,1090737419371061250,15679641,709,654005,4331,6575,180868,2008-07-31 19:59:08,7,6,2019-01-30 22:24:00,📺 Our @davetarrantnews joins @NBCDFW in moments to discuss the latest on the Catholic dioceses in TX &amp; a list of 'c… https://t.co/lkJDJFJSAB
680,1090736161595813893,15679641,709,654005,4331,6575,180868,2008-07-31 19:59:08,2,3,2019-01-30 22:19:00,Are you falling behind? Here's how much your peers have put away in their 401(k)s https://t.co/gpDwAcZDhY
681,1090732392199917568,15679641,709,654005,4331,6575,180868,2008-07-31 19:59:08,2,4,2019-01-30 22:04:01,The 11 best sports bars in Dallas https://t.co/oqP2i6mLV1
682,1090730880623104000,15679641,709,654005,4331,6575,180868,2008-07-31 19:59:08,6,2,2019-01-30 21:58:01,Dallas police searching for man in beanie who robbed 2 Pleasant Grove banks in 2 weeks https://t.co/AUUmrdkCNr
683,1090726598981156864,15679641,709,654005,4331,6575,180868,2008-07-31 19:59:08,0,1,2019-01-30 21:41:00,"2 injured, including suspected carjacker, after crash in northeast Dallas https://t.co/IBcLXm8IFv"
684,1090722577868341257,15679641,709,654005,4331,6575,180868,2008-07-31 19:59:08,3,1,2019-01-30 21:25:01,Dallas police hunt 3 identity thieves who went on Target shopping spree https://t.co/O8SvRbSFr6
685,1090719051884740615,15679641,709,654005,4331,6575,180868,2008-07-31 19:59:08,2,9,2019-01-30 21:11:01,"A year after fire, Dallas barbecue joint gets back to serving up brisket with a side of Holy Spirit https://t.co/LD4qk9UeFX"
686,1090714266087407626,15679641,709,654005,4331,6575,180868,2008-07-31 19:59:08,3,6,2019-01-30 20:52:00,3 juveniles in custody after @lyft driver is carjacked at gunpoint in Garland https://t.co/ihbUDQ2bHt
687,1090709988362907649,15679641,709,654005,4331,6575,180868,2008-07-31 19:59:08,4,3,2019-01-30 20:35:00,Police seek help identifying woman whose body was found in east Oak Cliff woods https://t.co/ZpkSyatVIB
688,1090708065815531525,15679641,709,654005,4331,6575,180868,2008-07-31 19:59:08,14,16,2019-01-30 20:27:21,Tens of thousands removed from potential non-citizen voters list after counties find flawed data https://t.co/Ikfw0G6SED
689,1090702690437525504,15679641,709,654005,4331,6575,180868,2008-07-31 19:59:08,4,13,2019-01-30 20:06:00,Top Texas Democrat rules out funding Trump's border wall as key panel starts work to break impasse https://t.co/4oeavkchlm
690,1090698163793596416,15679641,709,654005,4331,6575,180868,2008-07-31 19:59:08,1,8,2019-01-30 19:48:01,"I love zoos, but do we need them? | Opinion https://t.co/eecoKKVqy1"
691,1090692829033254920,15679641,709,654005,4331,6575,180868,2008-07-31 19:59:08,0,0,2019-01-30 19:26:49,"@harmonylead Hi Harmony, sorry for the wait. We work to get to our members as quickly as possible. You should be pr… https://t.co/1VnIxaTHnl"
692,1090690614256168963,15679641,709,654005,4331,6575,180868,2008-07-31 19:59:08,3,7,2019-01-30 19:18:01,"Texas cocaine dealer shot pregnant girlfriend, son with AK-47 while fending off robbers, feds say https://t.co/Kut33ZnzYb"
693,1090671236055777281,15679641,709,654005,4331,6575,180868,2008-07-31 19:59:08,4,4,2019-01-30 18:01:01,"Rockwall police step up patrols after children report being followed home, offered drugs https://t.co/OBPy1xGm8B"
