Index,ID,User_ID,Friends_Count,Followers_Count,Favourites_Count,Listed_Count,Status_Count,Created_at,Retweet_Count,Favourite_Count,Created_at,Text
1,1094745078524985344,15679641,709,654005,4331,6575,180868,2008-07-31 19:59:08,0,3,2019-02-10 23:49:00,Why Dallasites are paying $600 for a beauty treatment with 24-karat gold needles https://t.co/DjbGJiLN2V
2,1094734511001272328,15679641,709,654005,4331,6575,180868,2008-07-31 19:59:08,1,8,2019-02-10 23:07:01,Plano man gets 13 years for promising man $50 for sex with 13-year-old daughter https://t.co/floLcG547i
3,1094726203385303040,15679641,709,654005,4331,6575,180868,2008-07-31 19:59:08,1,2,2019-02-10 22:34:00,A look inside the millions of dollars universities in Texas are spending to find elite recruiting classes |… https://t.co/tA8szdZ3sI
4,1094720165323964418,15679641,709,654005,4331,6575,180868,2008-07-31 19:59:08,1,2,2019-02-10 22:10:00,"A Dallas-area brewpub gets help from @SBAgov, but another #GovernmentShutdown could doom its funding https://t.co/fEkPXmk3Cn"
5,1094710851553103873,15679641,709,654005,4331,6575,180868,2008-07-31 19:59:08,0,1,2019-02-10 21:33:00,Man suspected of opening fire on ex-girlfriend in Fort Worth parking lot https://t.co/EbeS5WtAKu
6,1094705316749553671,15679641,709,654005,4331,6575,180868,2008-07-31 19:59:08,1,5,2019-02-10 21:11:00,How an SMU art history class launched Jonathan Norton's career as a Dallas playwright https://t.co/kB7FoZgHVT
7,1094682165529452545,15679641,709,654005,4331,6575,180868,2008-07-31 19:59:08,2,1,2019-02-10 19:39:01,Dallas' @VerdigrisEnsemb redefines choral music in show inspired by radio and Amelia Earhart mystery | Classical Mu… https://t.co/UohPykvKSu
8,1094677884244054016,15679641,709,654005,4331,6575,180868,2008-07-31 19:59:08,8,4,2019-02-10 19:22:00,Fort Worth mom sentenced to 2 years in jail after boyfriend beats toddler to death https://t.co/a3YyEDmFsE
9,1094670084306620416,15679641,709,654005,4331,6575,180868,2008-07-31 19:59:08,3,15,2019-02-10 18:51:00,"Texas schools are not meeting the needs of the economy, and that has to change | Editorial https://t.co/q4SBzoKcJI"
10,1094665304662294531,15679641,709,654005,4331,6575,180868,2008-07-31 19:59:08,2,9,2019-02-10 18:32:01,"After 35 years at @SouthwestAir, Shari Rood's long-delayed dream of being a flight attendant is finally taking wing https://t.co/4HSwFZZQBq"
11,1094661529767735296,15679641,709,654005,4331,6575,180868,2008-07-31 19:59:08,1,3,2019-02-10 18:17:01,"The #txlege must reform school funding this session, no delays this time | Opinion https://t.co/J25Yz5Qc70"
12,1094657503391039489,15679641,709,654005,4331,6575,180868,2008-07-31 19:59:08,1,9,2019-02-10 18:01:01,Dallas is the perfect city for a prep school that helps low-income kids pay their own tuition | Opinion https://t.co/lq6iCDkSFT
13,1094657379638104064,15679641,709,654005,4331,6575,180868,2008-07-31 19:59:08,0,2,2019-02-10 18:00:31,How Super Bowl history debunks the notion that Dak Prescott needs to run more for Cowboys to succeed | @TimCowlishaw https://t.co/RDrrFb8QmF
14,1094654856579686400,15679641,709,654005,4331,6575,180868,2008-07-31 19:59:08,3,8,2019-02-10 17:50:30,"DWI suspect bites off part of @DENTONPD officer's ear, police say https://t.co/29OjmXAbRA"
15,1094654481000730625,15679641,709,654005,4331,6575,180868,2008-07-31 19:59:08,20,42,2019-02-10 17:49:00,"The heart of a school is its teachers, and teachers should be at the heart of school finance reform | Opinion https://t.co/uElrsa3G3A"
16,1094648693674921984,15679641,709,654005,4331,6575,180868,2008-07-31 19:59:08,4,14,2019-02-10 17:26:00,"Like roses growing in concrete, impoverished kids can blossom with the right education | Opinion https://t.co/yro1OV7QFO"
17,1094643416955318272,15679641,709,654005,4331,6575,180868,2008-07-31 19:59:08,1,6,2019-02-10 17:05:02,The key to education achievement among low-income kids is setting high expectations | Opinion https://t.co/Ma0QWxu09H
18,1094639635374891008,15679641,709,654005,4331,6575,180868,2008-07-31 19:59:08,1,6,2019-02-10 16:50:01,The #txlege must recognize the cost and benefit of high-quality education for all | Opinion https://t.co/LfLhmaYSD6
19,1094634349520142336,15679641,709,654005,4331,6575,180868,2008-07-31 19:59:08,0,3,2019-02-10 16:29:00,Stars' favorable playoff picture can't always mask this lurking issue... | @MDeFranks #GoStars https://t.co/u2AiYxwRA4
20,1094629070065807360,15679641,709,654005,4331,6575,180868,2008-07-31 19:59:08,1,6,2019-02-10 16:08:02,Want to spend Valentine's weekend at Hotel ZaZa? Click the link to enter to win a two night stay. Includes dinner a… https://t.co/NPskInd8CA
21,1094622775963250688,15679641,709,654005,4331,6575,180868,2008-07-31 19:59:08,1,3,2019-02-10 15:43:01,"2 drivers die after single-car crashes in Dallas, police say https://t.co/R0fH2GfmbM"
22,1094618747099377665,15679641,709,654005,4331,6575,180868,2008-07-31 19:59:08,3,3,2019-02-10 15:27:00,"'Almost doomed to migrate': Guatemalan villagers see little hope of escaping poverty, crime, except by crossing the… https://t.co/LRcdv0KSp3"
23,1094618116917731329,15679641,709,654005,4331,6575,180868,2008-07-31 19:59:08,3,3,2019-02-10 15:24:30,Driver dies after west Oak Cliff crash that injured Dallas Fire-Rescue medics https://t.co/58BZd3aEfJ
24,1094612204979175425,15679641,709,654005,4331,6575,180868,2008-07-31 19:59:08,0,4,2019-02-10 15:01:01,Kids are already going wild for the new Peppa Pig playplace in Grapevine https://t.co/wVjovsmSeO
25,1094606916276367360,15679641,709,654005,4331,6575,180868,2008-07-31 19:59:08,0,3,2019-02-10 14:40:00,"Why Mark Cuban's no-tanking vow is the right message for the depleted Mavericks | @townbrad 
#MFFL 
https://t.co/7IHcqlTQar"
26,1094602640363786241,15679641,709,654005,4331,6575,180868,2008-07-31 19:59:08,1,4,2019-02-10 14:23:00,"Texans love @bucees, so @SharonFGrigsby talked to their frenemies. https://t.co/QGRrdvW917"
27,1094597355104595968,15679641,709,654005,4331,6575,180868,2008-07-31 19:59:08,3,11,2019-02-10 14:02:00,ICYMI: John Tesar is the seventh local chef to exit Plano's Legacy Hall https://t.co/PUUd34APqh
28,1094593329877213184,15679641,709,654005,4331,6575,180868,2008-07-31 19:59:08,1,7,2019-02-10 13:46:01,Only have 10 minutes for a meal this week? Try making these meals with this Trader Joe's find… https://t.co/Kc2AlAAQgs
29,1094582760726036481,15679641,709,654005,4331,6575,180868,2008-07-31 19:59:08,2,2,2019-02-10 13:04:01,Who wants to serve on the Dallas school board for two-ish months? https://t.co/BrBaIi2pLZ
30,1094579485075300352,15679641,709,654005,4331,6575,180868,2008-07-31 19:59:08,6,6,2019-02-10 12:51:00,Here's why a Dallas-area teen's ethnic background reduces his chances for a needed bone marrow transplant https://t.co/b9o3jkXXng
31,1094569422151446530,15679641,709,654005,4331,6575,180868,2008-07-31 19:59:08,1,4,2019-02-10 12:11:01,6 #keto-friendly recipes to jump-start your low-carb journey https://t.co/YW43BXImLi
32,1094499962434539521,15679641,709,654005,4331,6575,180868,2008-07-31 19:59:08,1,8,2019-02-10 07:35:00,"Tei-An is unveiling an extraordinary Japanese menu in Dallas, and you're invited 🍜 https://t.co/EmsFdaBWOs"
33,1094480335159611392,15679641,709,654005,4331,6575,180868,2008-07-31 19:59:08,13,54,2019-02-10 06:17:01,These North Texas high school students run a restaurant that rivals any hot lunch spot https://t.co/dBRohoNqpb
34,1094474547561197568,15679641,709,654005,4331,6575,180868,2008-07-31 19:59:08,0,5,2019-02-10 05:54:01,"Jordan Spieth, Phil Mickelson headline 4-way tie for first-place after second round of AT&amp;T Pebble Beach Pro-Am https://t.co/eBC89xwLCs"
35,1094466502378614784,15679641,709,654005,4331,6575,180868,2008-07-31 19:59:08,0,2,2019-02-10 05:22:03,Shakespearean murder and revenge get a twist with Beijing Dance Theater's 'Hamlet' in Dallas https://t.co/DWF1oXphbh
36,1094462466287910913,15679641,709,654005,4331,6575,180868,2008-07-31 19:59:08,0,2,2019-02-10 05:06:00,Big 12 is what we thought it was: Why conference contenders have their work cut out for them leading up to Selectio… https://t.co/QcJNJx94Rc
37,1094455922955563013,15679641,709,654005,4331,6575,180868,2008-07-31 19:59:08,2,5,2019-02-10 04:40:00,Three gadgets to power all your portable technology — and even jump start the car https://t.co/3M3Ogyugo0
38,1094448121432682496,15679641,709,654005,4331,6575,180868,2008-07-31 19:59:08,1,3,2019-02-10 04:09:00,No injuries reported as fire damages apartments in Far North Dallas https://t.co/fHIFJ1q8Jf
39,1094440068490645504,15679641,709,654005,4331,6575,180868,2008-07-31 19:59:08,3,4,2019-02-10 03:37:00,How Super Bowl history debunks the notion that Dak Prescott needs to run more for Cowboys to succeed @TimCowlishaw… https://t.co/wRIiy6oUlF
40,1094431512441827328,15679641,709,654005,4331,6575,180868,2008-07-31 19:59:08,4,21,2019-02-10 03:03:00,"Bentley the steer earns $195,000 for Abilene girl at Fort Worth Stock Show https://t.co/WSLHIBDjQE"
41,1094425218616041473,15679641,709,654005,4331,6575,180868,2008-07-31 19:59:08,1,10,2019-02-10 02:38:00,"Dallas (and the world) loves Luka. An inside look at why Luka loves Dallas, and how the Mavs plan to keep it that w… https://t.co/FRZiZBtCu4"
42,1094421696126353408,15679641,709,654005,4331,6575,180868,2008-07-31 19:59:08,3,6,2019-02-10 02:24:00,"Woman hits city worker while driving drunk with 1-year-old, Dallas police say https://t.co/wB3zdQ26cS"
43,1094417671058264064,15679641,709,654005,4331,6575,180868,2008-07-31 19:59:08,20,34,2019-02-10 02:08:00,Tarrant County clerk unearths original 1930s indictments of Bonnie and Clyde https://t.co/bW2fQCHxK5
44,1094410626967965696,15679641,709,654005,4331,6575,180868,2008-07-31 19:59:08,1,3,2019-02-10 01:40:01,Why Mavericks rookie Luka Doncic says it's easier to score in the NBA than in Europe @LopezSelby31 | #MFFL https://t.co/OAKTUNxh8u
45,1094403832132628480,15679641,709,654005,4331,6575,180868,2008-07-31 19:59:08,0,6,2019-02-10 01:13:01,Want to spend Valentine's weekend at Hotel ZaZa? Click the link to enter to win a two night stay. Includes dinner a… https://t.co/BvfcvOCQNw
46,1094394771655872514,15679641,709,654005,4331,6575,180868,2008-07-31 19:59:08,2,6,2019-02-10 00:37:01,Letters: To build or not to build — is a border wall the answer? | Opinion https://t.co/Zr9JvbGuRK
47,1094390746017423360,15679641,709,654005,4331,6575,180868,2008-07-31 19:59:08,2,2,2019-02-10 00:21:01,"Father of disabled Texas twins arrested after they're found filthy, malnourished https://t.co/y57S8EBGMZ"
48,1094386717254189057,15679641,709,654005,4331,6575,180868,2008-07-31 19:59:08,0,1,2019-02-10 00:05:00,Full Rangers spring training roster: Which players have the chance to crack the roster on opening day? … https://t.co/DjclmHAr5s
49,1094382692140007424,15679641,709,654005,4331,6575,180868,2008-07-31 19:59:08,13,17,2019-02-09 23:49:01,Early returns could indicate taxpayer heartburn as refunds shrink 8.4 percent https://t.co/6yiaVwbEnW
50,1094368346617843712,15679641,709,654005,4331,6575,180868,2008-07-31 19:59:08,1,2,2019-02-09 22:52:00,"Letters: El Paso, Congress, socialism, Texas Legislature, Dallas Mavericks | Opinion https://t.co/QtmlgfhKBZ"
51,1094348464073388032,15679641,709,654005,4331,6575,180868,2008-07-31 19:59:08,19,11,2019-02-09 21:33:00,.@ursulinedallas apologizes for old photos showing students in blackface for 'Senior Slave Day' https://t.co/SQ9jl9AIlr
52,1094332861996589056,15679641,709,654005,4331,6575,180868,2008-07-31 19:59:08,0,1,2019-02-09 20:31:00,"Letters: Three cheers to Dallas City Council, Mariano Rivera, DMN changes | Opinion https://t.co/FW8mGtToMg"
53,1094319774430056448,15679641,709,654005,4331,6575,180868,2008-07-31 19:59:08,0,2,2019-02-09 19:39:00,Update: Police say a 56-year-old suspect has turned himself in. https://t.co/QHBpPkiORS
54,1094315495778672641,15679641,709,654005,4331,6575,180868,2008-07-31 19:59:08,2,5,2019-02-09 19:22:00,"Here are 6 great pizza joints in North Texas, just in time for National Pizza Day 🍕https://t.co/ySYM36xQJ4"
55,1094302916427550721,15679641,709,654005,4331,6575,180868,2008-07-31 19:59:08,1,1,2019-02-09 18:32:01,"@angiecthomas, @Jenna_Blum, @PamJenoff among authors on tour Feb. 10-16 in D-FW | Books https://t.co/7q3H39hGGE"
56,1094295114531381249,15679641,709,654005,4331,6575,180868,2008-07-31 19:59:08,0,1,2019-02-09 18:01:00,"Sadly, the @DallasSymphony is dropping its ReMix concerts, but Alexander Kerr just led a fine one | Arts https://t.co/BgyRDjwf5w"
57,1094292094087237632,15679641,709,654005,4331,6575,180868,2008-07-31 19:59:08,0,3,2019-02-09 17:49:00,"Hot takes on the divisive topics of our time: vaccinations, immigration, music at the dentist | Opinion https://t.co/7o8sEoU6oi"
58,1094286304026783744,15679641,709,654005,4331,6575,180868,2008-07-31 19:59:08,2,3,2019-02-09 17:26:00,"Woman killed, two injured in two-car collision Friday in southeast Dallas https://t.co/SSMUhU07xz"
59,1094281029043605506,15679641,709,654005,4331,6575,180868,2008-07-31 19:59:08,1,1,2019-02-09 17:05:02,Want to spend Valentine's weekend at Hotel ZaZa? Click the link to enter to win a two night stay. Includes dinner a… https://t.co/MihYWkZEPK
60,1094277244510498816,15679641,709,654005,4331,6575,180868,2008-07-31 19:59:08,3,5,2019-02-09 16:50:00,"Big 12 hoops midseason review: Player(s) and coach of the year, a back-tattoo reveal, biggest win, NCAA outlook and… https://t.co/qIvoeAB5jc"
61,1094271962896105472,15679641,709,654005,4331,6575,180868,2008-07-31 19:59:08,2,7,2019-02-09 16:29:01,.@marvinwinans is calling on the power of music to unify America | Opinion https://t.co/Bf8mUBAkXu
62,1094266680644124673,15679641,709,654005,4331,6575,180868,2008-07-31 19:59:08,4,5,2019-02-09 16:08:01,Where do things stand now for DACA and its beneficiaries? https://t.co/7EkK0ZAwDO
63,1094261642915991552,15679641,709,654005,4331,6575,180868,2008-07-31 19:59:08,6,8,2019-02-09 15:48:00,‘It’s almost becoming normal’: 3 students with South Oak Cliff HS ties fatally shot in 3 years https://t.co/j3C7Ua9bHi
64,1094261392792870912,15679641,709,654005,4331,6575,180868,2008-07-31 19:59:08,0,2,2019-02-09 15:47:01,Rangers spring training projects: A chance to test and fine tune a new process | @Evan_P_Grant https://t.co/wEeAq9A9Uu
65,1094256643624394752,15679641,709,654005,4331,6575,180868,2008-07-31 19:59:08,5,7,2019-02-09 15:28:08,"Parking dispute led to shooting that left one dead, another critically wounded in Joppa, police say https://t.co/jaFvVkUaUA"
66,1094249819147825153,15679641,709,654005,4331,6575,180868,2008-07-31 19:59:08,1,8,2019-02-09 15:01:01,"""Someone once said to me, 'Peppa is like Beyonce, to a 4-year-old.' She's a superstar,"" says the global brand manag… https://t.co/BpKpBYGq5O"
67,1094244530134700039,15679641,709,654005,4331,6575,180868,2008-07-31 19:59:08,1,3,2019-02-09 14:40:00,Mavericks give up a 'ridiculous' 80 points in the paint in loss to the Bucks | @townbrad https://t.co/OJhBQg5zLu
68,1094244530096926722,15679641,709,654005,4331,6575,180868,2008-07-31 19:59:08,1,4,2019-02-09 14:40:00,The Dallas Stars' first moms trip is missing the woman who had long lobbied for it. How the team is honoring her me… https://t.co/OWvbsRU5f1
69,1094240252905115654,15679641,709,654005,4331,6575,180868,2008-07-31 19:59:08,4,14,2019-02-09 14:23:00,The former Fuddruckers near Lovers Lane and Greenville Avenue in Dallas will become a Shake Shack. https://t.co/vHsza7Rtqz
70,1094234967222173696,15679641,709,654005,4331,6575,180868,2008-07-31 19:59:08,3,4,2019-02-09 14:02:00,"A Richardson City Council member has apologized after posting what he said was an ""offensive"" remark about newly el… https://t.co/JhBNhdoyRo"
71,1094225659201839106,15679641,709,654005,4331,6575,180868,2008-07-31 19:59:08,3,6,2019-02-09 13:25:01,Police are asking for the public’s help in identifying a burglar who might have entered a Dallas home through the d… https://t.co/HOGTlOAVHd
72,1094220372847808513,15679641,709,654005,4331,6575,180868,2008-07-31 19:59:08,8,23,2019-02-09 13:04:01,Tarrant County clerk unearths original 1930s indictments of Bonnie and Clyde https://t.co/Bdf9Czl5Io
73,1094207034478739456,15679641,709,654005,4331,6575,180868,2008-07-31 19:59:08,1,3,2019-02-09 12:11:01,"""I was trying to survive,"" Ron Hernandez said. https://t.co/RHL4hwz9xr"
74,1094109641657798656,15679641,709,654005,4331,6575,180868,2008-07-31 19:59:08,7,24,2019-02-09 05:44:00,"Dallas Morning News Charities raises $1.13 million for local nonprofits serving the hungry, homeless https://t.co/4eAE4XC33v"
75,1094098063818407937,15679641,709,654005,4331,6575,180868,2008-07-31 19:59:08,4,4,2019-02-09 04:58:00,"Mustang driver 'showing off' killed pedestrian in Far North Dallas, police say https://t.co/dvvaPNGnrb"
76,1094092529987997696,15679641,709,654005,4331,6575,180868,2008-07-31 19:59:08,3,7,2019-02-09 04:36:01,"Diesel thief a wanted man for stealing 1,600 gallons from Grapevine station https://t.co/wJWPhpCk3B"
77,1094084980450430977,15679641,709,654005,4331,6575,180868,2008-07-31 19:59:08,0,3,2019-02-09 04:06:01,"Why Bob Stoops chose the XFL, his advice to Kyler Murray, plus three more takeaways from his press conference |… https://t.co/tvgfRbQc6r"
78,1094077681547776000,15679641,709,654005,4331,6575,180868,2008-07-31 19:59:08,1,9,2019-02-09 03:37:00,"How a Dallas veteran defended himself when a carjacker, burglar showed up to his home https://t.co/76BzzsfHgh"
79,1094073404741898240,15679641,709,654005,4331,6575,180868,2008-07-31 19:59:08,46,60,2019-02-09 03:20:01,Richardson councilman issues apology after calling newly elected U.S. Rep. Ocasio-Cortez a 'bimbo' https://t.co/Uv1HpyGI3v
80,1094073402720165888,15679641,709,654005,4331,6575,180868,2008-07-31 19:59:08,3,8,2019-02-09 03:20:00,"Film room: Grading the Cowboys' past five NFL draft classes, including one that went from a failure to success last… https://t.co/rRnwk6rstK"
81,1094067360691036161,15679641,709,654005,4331,6575,180868,2008-07-31 19:59:08,3,9,2019-02-09 02:56:00,The Dallas Stars' first moms trip is missing the woman who had long lobbied for it. How the team is honoring her me… https://t.co/bPt7AAOGdo
82,1094058803966984192,15679641,709,654005,4331,6575,180868,2008-07-31 19:59:08,1,1,2019-02-09 02:22:00,Here's why Jimbo Fisher compared Texas A&amp;M's 2019 QB signee to NFL legend Brett Favre | @Ben_Baby https://t.co/H78pX2ZGJA
83,1094055284278992896,15679641,709,654005,4331,6575,180868,2008-07-31 19:59:08,19,60,2019-02-09 02:08:00,"Dear @amazon, New York doesn’t want you; Dallas does | Editorial https://t.co/J9tpfoEd8s"
84,1094052265504268288,15679641,709,654005,4331,6575,180868,2008-07-31 19:59:08,0,1,2019-02-09 01:56:01,"Watch: Michael Young, Eric Nadel, and Luis Ortiz make jokes, talk baseball at special event with Rangers fans |… https://t.co/WybyxcwyRc"
85,1094044964571566081,15679641,709,654005,4331,6575,180868,2008-07-31 19:59:08,2,3,2019-02-09 01:27:00,"Letters: Property taxes, Preston Center, @BillGates and @melindagates, @AntDavis23 | Opinion https://t.co/8u9BXPoDET"
86,1094041441029025792,15679641,709,654005,4331,6575,180868,2008-07-31 19:59:08,4,5,2019-02-09 01:13:00,"Thief may have used doggy door to enter Dallas home, snatching laptops and a gun https://t.co/pXs1ZOEm88"
87,1094039427834408966,15679641,709,654005,4331,6575,180868,2008-07-31 19:59:08,7,13,2019-02-09 01:05:00,"Dallas (and the world) loves Luka. An inside look at why Luka loves Dallas, and how the Mavs plan to keep it that w… https://t.co/l8hJfVPG9E"
88,1094037919839465478,15679641,709,654005,4331,6575,180868,2008-07-31 19:59:08,0,2,2019-02-09 00:59:00,Want to spend Valentine's weekend at Hotel ZaZa? Click the link to enter to win a two night stay. Includes dinner a… https://t.co/qrQDjmcDzf
89,1094033140031594499,15679641,709,654005,4331,6575,180868,2008-07-31 19:59:08,1,3,2019-02-09 00:40:01,Kids are already going wild for the new Peppa Pig playplace in Grapevine https://t.co/RANdWzVaze
90,1094028607532515329,15679641,709,654005,4331,6575,180868,2008-07-31 19:59:08,5,5,2019-02-09 00:22:00,"After reported patient safety lapses, DeSoto psych hospital can keep Medicare funding — but there's a catch https://t.co/5copI99Oj8"
91,1094024832449167360,15679641,709,654005,4331,6575,180868,2008-07-31 19:59:08,0,7,2019-02-09 00:07:00,".@shakeshack is opening near Lakewood, the M Streets and the Park Cities  🍔 🍟https://t.co/fgiqcKntjG"
92,1094020303632695297,15679641,709,654005,4331,6575,180868,2008-07-31 19:59:08,2,1,2019-02-08 23:49:00,"Arlington teenager was online recruiter for Pakistani terrorist group, feds say https://t.co/hmDXXAHde8"
93,1094009731117694980,15679641,709,654005,4331,6575,180868,2008-07-31 19:59:08,3,3,2019-02-08 23:07:00,"Plano molester used Snapchat, Instagram to prey on at least 9 boys, Allen police say https://t.co/jPwE0Njkoc"
94,1094001929783517184,15679641,709,654005,4331,6575,180868,2008-07-31 19:59:08,2,2,2019-02-08 22:36:00,TopGolf is moving into esports with its latest partnership – and these games aren't just for pros https://t.co/OBmEtaBj2o
95,1093993879056142336,15679641,709,654005,4331,6575,180868,2008-07-31 19:59:08,0,1,2019-02-08 22:04:00,"Letters: @GovernorVA Ralph Northam, @TXsecofstate David Whitley, teacher salaries, @DallasPD, Preston Center | Opin… https://t.co/nBX7AjJ040"
96,1093988091285655554,15679641,709,654005,4331,6575,180868,2008-07-31 19:59:08,1,4,2019-02-08 21:41:00,"Fort Worth's Panther Hall, hail storms, tollways and more from #CuriousTexas this week | Newsletters https://t.co/XDFXIwoRg9"
97,1093984066725208064,15679641,709,654005,4331,6575,180868,2008-07-31 19:59:08,0,3,2019-02-08 21:25:01,Cookie Monster goes to court: @DallasCountyTx public defenders revamp law library into @sesamestreet-themed room fo… https://t.co/LNArShmlm7
98,1093975759042105350,15679641,709,654005,4331,6575,180868,2008-07-31 19:59:08,0,2,2019-02-08 20:52:00,Former @GDHCC leaders @ninavaca and @JPalomarez resolve lawsuit amid alleged affair https://t.co/EKKsprwa8x
99,1093952102861291526,15679641,709,654005,4331,6575,180868,2008-07-31 19:59:08,5,10,2019-02-08 19:18:00,"After yet another N-word incident, Southlake better speak louder and stand taller for equality |Editorial https://t.co/TZ9XOrUkX5"
100,1093948586650464257,15679641,709,654005,4331,6575,180868,2008-07-31 19:59:08,7,6,2019-02-08 19:04:02,D-FW tops U.S. in homebuilding for third year in a row https://t.co/vRhPPPM1hB
101,1093944050686799876,15679641,709,654005,4331,6575,180868,2008-07-31 19:59:08,2,3,2019-02-08 18:46:00,.@Allen_Police link Plano man to 9 molested boys and fear there may be more victims https://t.co/ODb8DGtI6W
102,1093940777993019392,15679641,709,654005,4331,6575,180868,2008-07-31 19:59:08,1,8,2019-02-08 18:33:00,Photos: @fwssr says goodbye to historic Will Rogers Coliseum https://t.co/TFG1qBxBS3
103,1093940261355470848,15679641,709,654005,4331,6575,180868,2008-07-31 19:59:08,3,8,2019-02-08 18:30:57,".@DallasSymphony promises bold new season with fresh pieces, guest conductors https://t.co/eZjB3vDVGL"
104,1093936755907153920,15679641,709,654005,4331,6575,180868,2008-07-31 19:59:08,3,10,2019-02-08 18:17:01,".@fleetwoodmac played a landslide of greatest hits at Dallas @AACenter concert, sans mention of Lindsey Buckingham https://t.co/7hQ6JxxOzj"
105,1093932728024793089,15679641,709,654005,4331,6575,180868,2008-07-31 19:59:08,3,2,2019-02-08 18:01:01,Update: Authorities have identified the man as Eion Maurice Finley of Dallas. https://t.co/YI0cqChH2k
106,1093925930261712896,15679641,709,654005,4331,6575,180868,2008-07-31 19:59:08,0,10,2019-02-08 17:34:00,How does the @DallasZoo keep its animals warm on chilly winter days? https://t.co/v53PTOdWgV
107,1093922630476984321,15679641,709,654005,4331,6575,180868,2008-07-31 19:59:08,5,6,2019-02-08 17:20:53,📺 Our @davetarrantnews joins @NBCDFW in moments to discuss how ethnic background can influence a bone marrow transp… https://t.co/7BJDTXxy9Q
108,1093918389410717702,15679641,709,654005,4331,6575,180868,2008-07-31 19:59:08,2,5,2019-02-08 17:04:02,"Uptown rape suspect linked by DNA to West Village assault from 2017, @DallasPD says https://t.co/F2HHyuRZIN"
109,1093914608203636738,15679641,709,654005,4331,6575,180868,2008-07-31 19:59:08,3,2,2019-02-08 16:49:01,Growing inventory of older office space is up for grabs in Plano's Legacy project https://t.co/zGZdxW9WrF
110,1093910578496716809,15679641,709,654005,4331,6575,180868,2008-07-31 19:59:08,2,2,2019-02-08 16:33:00,Feds plan to use murder evidence against suspect in slaying of Dallas girl even though he hasn't been charged https://t.co/nFoW3zhnXY
111,1093906553764225024,15679641,709,654005,4331,6575,180868,2008-07-31 19:59:08,0,1,2019-02-08 16:17:00,What happened to Fort Worth’s Panther Hall? #CuriousTexas goes back in time https://t.co/WHskbsyHaQ
112,1093902526288678912,15679641,709,654005,4331,6575,180868,2008-07-31 19:59:08,2,5,2019-02-08 16:01:00,Is the #MeToo movement killing mentorship opportunities for women? | Opinion https://t.co/EFmhjBzAGq
113,1093897621507317760,15679641,709,654005,4331,6575,180868,2008-07-31 19:59:08,6,6,2019-02-08 15:41:31,"With sleet possible tonight, @TxDOT crews are pretreating  Dallas-Fort Worth highways https://t.co/OCyAiiS6B6"
114,1093893968310558720,15679641,709,654005,4331,6575,180868,2008-07-31 19:59:08,14,100,2019-02-08 15:27:00,.@DallasFuel president Geoff Moore sees the future of esports looking a lot like music festivals https://t.co/n8DwyvTyAL
115,1093889699385655296,15679641,709,654005,4331,6575,180868,2008-07-31 19:59:08,0,0,2019-02-08 15:10:02,"Most figured Bob Stoops might coach again, but his new title is a bit perplexing | @KSherringtonDMN https://t.co/X7ieoKFvoR"
