Index,ID,User_ID,Friends_Count,Followers_Count,Favourites_Count,Listed_Count,Status_Count,Created_at,Retweet_Count,Favourite_Count,Created_at,Text
1,1094747241615634435,12039612,1558,159357,1718,1366,109485,2008-01-09 19:18:34,1,1,2019-02-10 23:57:36,Memphis businessman Mike Bowen killed in car crash in Costa Rica https://t.co/1KQoDtrd3v
2,1094746483788677120,12039612,1558,159357,1718,1366,109485,2008-01-09 19:18:34,0,4,2019-02-10 23:54:35,Memphis businessman Mike Bowen killed in car crash in Costa Rica https://t.co/qxwmT9S7XD https://t.co/E5RmxkC077
3,1094739554039447553,12039612,1558,159357,1718,1366,109485,2008-01-09 19:18:34,0,2,2019-02-10 23:27:03,Penny Hardaway discusses the future of Memphis vs. UConn https://t.co/K8Vw0s5gP7
4,1094712627962494976,12039612,1558,159357,1718,1366,109485,2008-01-09 19:18:34,2,22,2019-02-10 21:40:03,"Memphis 78, UConn 71: Tigers silence Huskies behind commanding performance https://t.co/nCBYfYgT9A"
5,1094709609430806528,12039612,1558,159357,1718,1366,109485,2008-01-09 19:18:34,0,0,2019-02-10 21:28:04,Two teenagers injured in Collierville shooting https://t.co/yIQZTFm88T https://t.co/8lwD3JVocG
6,1094708345045434368,12039612,1558,159357,1718,1366,109485,2008-01-09 19:18:34,0,0,2019-02-10 21:23:02,"Tigers vs. Connecticut Basketball February 10, 2019 https://t.co/AN5BXDJyLf"
7,1094691989252001797,12039612,1558,159357,1718,1366,109485,2008-01-09 19:18:34,0,2,2019-02-10 20:18:03,Two teenagers injured in Collierville shooting https://t.co/sNwkMihaZm
8,1094686210256261120,12039612,1558,159357,1718,1366,109485,2008-01-09 19:18:34,0,3,2019-02-10 19:55:05,Live updates: Tigers try to snap skid against UConn https://t.co/3y1Fyi6myf
9,1094682175667163136,12039612,1558,159357,1718,1366,109485,2008-01-09 19:18:34,0,6,2019-02-10 19:39:03,AAF: Memphis Express at Birmingham Iron — live blog https://t.co/MaGkTxkrHE
10,1094679534547304448,12039612,1558,159357,1718,1366,109485,2008-01-09 19:18:34,0,5,2019-02-10 19:28:33,Live updates: Tigers try to snap skid against UConn https://t.co/stY0RYKxJs https://t.co/fmnots69bc
11,1094647695355060229,12039612,1558,159357,1718,1366,109485,2008-01-09 19:18:34,0,0,2019-02-10 17:22:02,"How C.J. Miles fits in with Grizzlies after Toronto Raptors, Marc Gasol trade https://t.co/L7h5Gc2cs3"
12,1094631339058491394,12039612,1558,159357,1718,1366,109485,2008-01-09 19:18:34,1,0,2019-02-10 16:17:03,Sunday Sports Brunch: Lewisburg girls soccer makes MHSAA Class 5A North Half https://t.co/EPM6W2nPs8
13,1094604428345257985,12039612,1558,159357,1718,1366,109485,2008-01-09 19:18:34,0,0,2019-02-10 14:30:07,Leadership Memphis seeks nominees for change makers on its 40th anniversary https://t.co/vzr4sGNGqk
14,1094600382989381633,12039612,1558,159357,1718,1366,109485,2008-01-09 19:18:34,0,0,2019-02-10 14:14:02,"Could Amazon's Bezos wreck AMI, owner of National Enquirer, with blackmail charges? https://t.co/h5ER6n6Fuj"
15,1094596107248779265,12039612,1558,159357,1718,1366,109485,2008-01-09 19:18:34,0,0,2019-02-10 13:57:03,"How C.J. Miles fits in with the Memphis Grizzlies after Toronto Raptors, Marc Gasol trade https://t.co/LVTkAiYENq"
16,1094591830044360704,12039612,1558,159357,1718,1366,109485,2008-01-09 19:18:34,1,7,2019-02-10 13:40:03,Sky judge and the rules of tomorrow: A look at the AAF's notable rule differences https://t.co/CTOfSZIIe0
17,1094590324305932288,12039612,1558,159357,1718,1366,109485,2008-01-09 19:18:34,2,5,2019-02-10 13:34:04,How Memphis football's 2019 recruiting class addressed key needs https://t.co/c2lqoV5SAH https://t.co/iAlIJvle0E
18,1094587802065530880,12039612,1558,159357,1718,1366,109485,2008-01-09 19:18:34,0,1,2019-02-10 13:24:03,How Memphis football's 2019 recruiting class addressed key needs https://t.co/tpPM03x53a
19,1094447882155880448,12039612,1558,159357,1718,1366,109485,2008-01-09 19:18:34,1,1,2019-02-10 04:08:03,"Game Recap: Memphis Grizzlies 99, New Orleans Pelicans 90 https://t.co/OH2L18mSVJ https://t.co/cNBuprRGTZ"
20,1094441588103831552,12039612,1558,159357,1718,1366,109485,2008-01-09 19:18:34,3,0,2019-02-10 03:43:03,"Game Recap: Memphis Grizzlies 99, New Orleans Pelicans 90 https://t.co/cJgKf3o9rM"
21,1094425229273763840,12039612,1558,159357,1718,1366,109485,2008-01-09 19:18:34,8,33,2019-02-10 02:38:02,The Peabody Hotel of Memphis is celebrating its 150 anniversary in 2019 https://t.co/PPVYkz2pvg
22,1094411903567347712,12039612,1558,159357,1718,1366,109485,2008-01-09 19:18:34,0,1,2019-02-10 01:45:05,Memphis Grizzlies: Delon Wright introduces himself https://t.co/KGy50UzfRm
23,1094407614291734528,12039612,1558,159357,1718,1366,109485,2008-01-09 19:18:34,0,2,2019-02-10 01:28:03,New Memphis Grizzlies player CJ Miles introduces himself https://t.co/WG6TgHWYSl
24,1094403335640240129,12039612,1558,159357,1718,1366,109485,2008-01-09 19:18:34,0,5,2019-02-10 01:11:02,Memphis Grizzlies: Jonas Valanciunas explains what he knows about Memphis https://t.co/QsQghC28kE
25,1094380939474595840,12039612,1558,159357,1718,1366,109485,2008-01-09 19:18:34,1,1,2019-02-09 23:42:03,No. 1 UT Vols dine on Gator meat — but the main course is just ahead https://t.co/IlwP9L3meu
26,1094351245408641025,12039612,1558,159357,1718,1366,109485,2008-01-09 19:18:34,0,1,2019-02-09 21:44:03,How new pro football leagues could change the NFL and college game https://t.co/TapXIN1jet
27,1094345453452345344,12039612,1558,159357,1718,1366,109485,2008-01-09 19:18:34,0,0,2019-02-09 21:21:02,Lakeland's mayor threatened to have vice mayor removed from meeting https://t.co/l1II0NOtWw
28,1094325080090382336,12039612,1558,159357,1718,1366,109485,2008-01-09 19:18:34,1,3,2019-02-09 20:00:05,"The exhibit titled ""PHTGRPHS"" featured the work of local photographers Lester Merriweather and Lawrence Matthews th… https://t.co/JaAUItr4bp"
29,1094320043461173252,12039612,1558,159357,1718,1366,109485,2008-01-09 19:18:34,0,2,2019-02-09 19:40:04,"Chandler Parsons to rejoin Memphis Grizzlies, 'still a part of the team' https://t.co/K8VWUCJZ60"
30,1094315269382639616,12039612,1558,159357,1718,1366,109485,2008-01-09 19:18:34,1,1,2019-02-09 19:21:06,Non-profit group works to uplift Orange Mound community through art https://t.co/lKBIgFPxyI https://t.co/SYwzyNujpD
31,1094314247205650432,12039612,1558,159357,1718,1366,109485,2008-01-09 19:18:34,2,4,2019-02-09 19:17:02,What will happen to Germantown Country Club after it closes? It could become a public park. https://t.co/DGcjFzav9M
32,1094309992121937921,12039612,1558,159357,1718,1366,109485,2008-01-09 19:18:34,1,2,2019-02-09 19:00:08,Non-profit group works to uplift Orange Mound community through art https://t.co/kj4mp1Jdp9
33,1094305695506317312,12039612,1558,159357,1718,1366,109485,2008-01-09 19:18:34,0,1,2019-02-09 18:43:03,Non-profit group works to uplift Orange Mound community through art https://t.co/ND6YfFU8cS
34,1094301414074040320,12039612,1558,159357,1718,1366,109485,2008-01-09 19:18:34,1,2,2019-02-09 18:26:02,Non-profit group works to uplift Orange Mound community through art https://t.co/E9ibKRHc1k
35,1094292742149001216,12039612,1558,159357,1718,1366,109485,2008-01-09 19:18:34,3,1,2019-02-09 17:51:35,"Chandler Parsons to rejoin Memphis Grizzlies, report says https://t.co/DeHiKXSKea https://t.co/pxji7V9BgK"
36,1094288328285974530,12039612,1558,159357,1718,1366,109485,2008-01-09 19:18:34,0,0,2019-02-09 17:34:03,"Chandler Parsons to rejoin Memphis Grizzlies, report says https://t.co/eTjgRHaAOp"
37,1094285191223242753,12039612,1558,159357,1718,1366,109485,2008-01-09 19:18:34,2,0,2019-02-09 17:21:35,Lakeland's mayor threatened to have vice-mayor removed from meeting https://t.co/xYEcGu0n9T https://t.co/CQ8kQH6Jux
38,1094268951503220736,12039612,1558,159357,1718,1366,109485,2008-01-09 19:18:34,0,0,2019-02-09 16:17:03,US marshals searching for 73-year-old fugitive from Michigan https://t.co/kMKb9FTboX
39,1094264678119862273,12039612,1558,159357,1718,1366,109485,2008-01-09 19:18:34,0,0,2019-02-09 16:00:04,A discussion about when and how to fund a Lakeland high school devolved into a spat between the mayor and vice mayo… https://t.co/CQMOPO22eR
40,1094261400858431489,12039612,1558,159357,1718,1366,109485,2008-01-09 19:18:34,0,6,2019-02-09 15:47:03,'Keep fighting the bad guys': Girl battling cancer with no cure made honorary police officer https://t.co/WAUjU5l5Dq
41,1094257179144740865,12039612,1558,159357,1718,1366,109485,2008-01-09 19:18:34,0,0,2019-02-09 15:30:16,Lakeland's mayor threatened to have vice-mayor removed from meeting https://t.co/voBAd1LOzG
42,1094246812851023872,12039612,1558,159357,1718,1366,109485,2008-01-09 19:18:34,2,1,2019-02-09 14:49:04,"“If they could account for where all this money was going, then why does our neighborhood look like it does?” she s… https://t.co/Lqc8jGzxCF"
43,1094233219212357633,12039612,1558,159357,1718,1366,109485,2008-01-09 19:18:34,15,36,2019-02-09 13:55:03,Long-awaited Midtown Donuts opens on Union Avenue on Saturday https://t.co/E2pBNbwehZ https://t.co/B5KMT4Crt3
44,1094229945663008768,12039612,1558,159357,1718,1366,109485,2008-01-09 19:18:34,1,6,2019-02-09 13:42:03,Why Memphis basketball could still earn a first-round bye in the AAC Tournament https://t.co/2sUgX3diNw
45,1094225796909039616,12039612,1558,159357,1718,1366,109485,2008-01-09 19:18:34,4,3,2019-02-09 13:25:34,Le Bonheur perfects lifesaving procedure for premature babies with heart defect https://t.co/FdaBNQwjUv https://t.co/AULBkoAipN
46,1094222394267455488,12039612,1558,159357,1718,1366,109485,2008-01-09 19:18:34,13,43,2019-02-09 13:12:03,Memphis Grizzlies fans deserve better than this. They deserve a team with vision. https://t.co/Vg7hFxwdo2
47,1094068425801064453,12039612,1558,159357,1718,1366,109485,2008-01-09 19:18:34,0,1,2019-02-09 03:00:14,Tiger Kareem Brewton Jr. Through the Years https://t.co/2UVij3mZK3
48,1094064357191888896,12039612,1558,159357,1718,1366,109485,2008-01-09 19:18:34,1,2,2019-02-09 02:44:04,Germantown Chicken Salad Chick: Free chicken salad for a year for the first 150 on opening day https://t.co/93gDxJnMlA
49,1094060075042390016,12039612,1558,159357,1718,1366,109485,2008-01-09 19:18:34,14,29,2019-02-09 02:27:03,Lyft offers free rides to Black history museums in Memphis https://t.co/RcnSspJY7h
50,1094056050028732416,12039612,1558,159357,1718,1366,109485,2008-01-09 19:18:34,3,7,2019-02-09 02:11:03,Life-sized Johnny Cash statue to be installed near site of first show with Tennessee Two https://t.co/OruOeyx09u https://t.co/vu5CoLL5Xm
51,1094055801847730176,12039612,1558,159357,1718,1366,109485,2008-01-09 19:18:34,0,7,2019-02-09 02:10:04,Marc Gasol tweets his farewell to Memphis Grizzles after trade to Toronto Raptors https://t.co/GWQ3hwwp1v
52,1094051771436187648,12039612,1558,159357,1718,1366,109485,2008-01-09 19:18:34,0,0,2019-02-09 01:54:03,How Memphis Grizzlies general manager Chris Wallace explained the Marc Gasol trade https://t.co/S38Y28DAbk
53,1094048377912713218,12039612,1558,159357,1718,1366,109485,2008-01-09 19:18:34,1,0,2019-02-09 01:40:34,"Weathersbee: Should LeMoyne-Owen's president resign? Yes, say students fighting mold and rats… https://t.co/o8GBBcbeGu"
54,1094047497121611776,12039612,1558,159357,1718,1366,109485,2008-01-09 19:18:34,2,3,2019-02-09 01:37:04,"Electrolux fired 658 employees, contract workers in year before closure announcement https://t.co/3wux14M95c"
55,1094043220617633793,12039612,1558,159357,1718,1366,109485,2008-01-09 19:18:34,1,0,2019-02-09 01:20:04,"Black Memphians' role in the freedom struggle largely unsung, authors say https://t.co/vH5YLN4nlQ"
56,1094039188977127424,12039612,1558,159357,1718,1366,109485,2008-01-09 19:18:34,1,8,2019-02-09 01:04:03,Long-awaited Midtown Donuts opens on Union Avenue on Saturday https://t.co/eVpwjBFpH3
57,1094034908064944128,12039612,1558,159357,1718,1366,109485,2008-01-09 19:18:34,2,0,2019-02-09 00:47:02,"Electrolux fired 658 employees, contract workers in Memphis the year before closure announcement https://t.co/88PcZ8Uji0"
58,1094033650515992576,12039612,1558,159357,1718,1366,109485,2008-01-09 19:18:34,0,1,2019-02-09 00:42:03,Freeman | America has a hate problem https://t.co/1fnHhtAAis https://t.co/CoXJInBqWG
59,1094030644143894530,12039612,1558,159357,1718,1366,109485,2008-01-09 19:18:34,1,5,2019-02-09 00:30:06,Le Bonheur perfects lifesaving procedure for premature babies with heart defect https://t.co/hHSuxdIdH6
60,1094026362937999360,12039612,1558,159357,1718,1366,109485,2008-01-09 19:18:34,1,1,2019-02-09 00:13:05,A $150 burger? It's just one part of The Peabody Hotel's 150th anniversary celebration https://t.co/MUfmanaoZT https://t.co/cr6EhtaH8u
61,1094024088698437633,12039612,1558,159357,1718,1366,109485,2008-01-09 19:18:34,2,8,2019-02-09 00:04:03,The Peabody Hotel celebrates 150 years in business https://t.co/9n6JWHI4kb
62,1094019808788652033,12039612,1558,159357,1718,1366,109485,2008-01-09 19:18:34,4,8,2019-02-08 23:47:02,Lorenzen Wright murder trial: Judge doubts need for out-of-town jury https://t.co/O8CtlbzEaW
63,1094018425704275969,12039612,1558,159357,1718,1366,109485,2008-01-09 19:18:34,1,4,2019-02-08 23:41:33,"Electrolux fired 658 employees, contract workers in year before closure announcement https://t.co/NuuBwBOjKB"
64,1094015544943149056,12039612,1558,159357,1718,1366,109485,2008-01-09 19:18:34,0,2,2019-02-08 23:30:06,Buffalo assistant Tim Edwards expected to be hired as Memphis' next DL coach https://t.co/k5AH7ljGNV
65,1094011257621893120,12039612,1558,159357,1718,1366,109485,2008-01-09 19:18:34,0,0,2019-02-08 23:13:04,"What we know about Michael Redlick, the former Grizzlies executive killed in Florida https://t.co/CPY0V4hajx https://t.co/49JzZce6h9"
66,1094009246780477441,12039612,1558,159357,1718,1366,109485,2008-01-09 19:18:34,0,1,2019-02-08 23:05:04,"Wooddale boys basketball postseason ban lifted; Melrose, Westwood to remain out of playoffs for 2019, 2020 https://t.co/ctxTyXqlKO"
67,1094004961518776320,12039612,1558,159357,1718,1366,109485,2008-01-09 19:18:34,0,0,2019-02-08 22:48:03,"What we know about Michael Redlick, the former Grizzlies executive killed in Florida https://t.co/icSC9d3Ylc"
68,1094003709338480640,12039612,1558,159357,1718,1366,109485,2008-01-09 19:18:34,2,0,2019-02-08 22:43:04,How Memphis Grizzlies general manager Chris Wallace explained the Marc Gasol trade https://t.co/TMNk4DhFno https://t.co/W2I81phmWK
69,1094000685530664960,12039612,1558,159357,1718,1366,109485,2008-01-09 19:18:34,0,6,2019-02-08 22:31:03,Memphis football: Mike Norvell completes coaching staff for 2019 season https://t.co/j6FDKMHofJ
70,1093996645992280065,12039612,1558,159357,1718,1366,109485,2008-01-09 19:18:34,1,1,2019-02-08 22:15:00,Mississippi officials refused for months to release the investigative report of the shooting of Ismael Lopez by pol… https://t.co/7Ffsi7PWkT
71,1093991633123794944,12039612,1558,159357,1718,1366,109485,2008-01-09 19:18:34,1,1,2019-02-08 21:55:05,"Vanderbilt should appreciate David Williams, go outside to replace him https://t.co/m3TqI0aTdb"
72,1093991106340102144,12039612,1558,159357,1718,1366,109485,2008-01-09 19:18:34,4,16,2019-02-08 21:52:59,Marc Gasol is officially a member of the Toronto Raptors now. But he shared a goodbye message with Memphis Grizzlie… https://t.co/oBxLM1dJGr
73,1093987597242765313,12039612,1558,159357,1718,1366,109485,2008-01-09 19:18:34,0,4,2019-02-08 21:39:03,Tiger Mike Parks Jr. Through the Years https://t.co/IPM0ueutAC
74,1093983318822080512,12039612,1558,159357,1718,1366,109485,2008-01-09 19:18:34,2,1,2019-02-08 21:22:03,Wife of Ex-Grizzlies' executive arrested for his murder https://t.co/OzYloXynAw
75,1093979294597042176,12039612,1558,159357,1718,1366,109485,2008-01-09 19:18:34,0,4,2019-02-08 21:06:03,Elwood's Shells brings New Orleans-style Gulf seafood to midtown Memphis https://t.co/Nm4Z59jpBT
76,1093975274746769409,12039612,1558,159357,1718,1366,109485,2008-01-09 19:18:34,1,2,2019-02-08 20:50:05,AAF: Memphis Express at Birmingham Iron – 5 things to know https://t.co/IL8wiGKHNX
77,1093968218773958659,12039612,1558,159357,1718,1366,109485,2008-01-09 19:18:34,0,0,2019-02-08 20:22:02,"Zac Stacy on Birmingham Iron, what it will take to win https://t.co/WuuMbNB0go"
78,1093963945432494083,12039612,1558,159357,1718,1366,109485,2008-01-09 19:18:34,4,2,2019-02-08 20:05:04,A $150 burger? It's just one part of The Peabody Hotel's 150th anniversary celebration https://t.co/wGHP82lzFp
79,1093959913418698755,12039612,1558,159357,1718,1366,109485,2008-01-09 19:18:34,0,1,2019-02-08 19:49:02,Christian Hackenberg on AAF: 'This whole league has a bunch of talent' https://t.co/sddqiChbCh
80,1093955636663066624,12039612,1558,159357,1718,1366,109485,2008-01-09 19:18:34,0,0,2019-02-08 19:32:03,"Gov. Bill Lee stresses importance of free press, open government in speech to media group https://t.co/3PlmFjvhMs"
81,1093951380203683840,12039612,1558,159357,1718,1366,109485,2008-01-09 19:18:34,0,3,2019-02-08 19:15:08,Memphis basketball makes list for recruits Damion Baugh and R.J. Hampton https://t.co/4aF84wpgc5
82,1093947334432645120,12039612,1558,159357,1718,1366,109485,2008-01-09 19:18:34,0,1,2019-02-08 18:59:03,7 takeaways as new Shelby County Schools leader moves forward with Destination 2025 https://t.co/qZL3yyYXNr
83,1093943057043636224,12039612,1558,159357,1718,1366,109485,2008-01-09 19:18:34,3,6,2019-02-08 18:42:03,Tennessee bills would allow adoption agencies to deny LGBT couples on religious grounds https://t.co/6Xv2JqNCwO
84,1093938789905510401,12039612,1558,159357,1718,1366,109485,2008-01-09 19:18:34,0,0,2019-02-08 18:25:06,Attorney's Discuss the Shooting of Ismael Lopez https://t.co/Gm5tZ3SsW6
85,1093934751357063173,12039612,1558,159357,1718,1366,109485,2008-01-09 19:18:34,0,0,2019-02-08 18:09:03,Andrea Miller's tenure filled with issues at LeMoyne-Owen College https://t.co/Ubh2oqigmX
86,1093930472206467072,12039612,1558,159357,1718,1366,109485,2008-01-09 19:18:34,1,1,2019-02-08 17:52:03,Sherra Wright and Billy Ray Turner in Court https://t.co/4JGOfs68FD
87,1093926199091515392,12039612,1558,159357,1718,1366,109485,2008-01-09 19:18:34,0,0,2019-02-08 17:35:04,"National Enquirer owner responds to Bezos post, says it 'acted lawfully' in its reporting https://t.co/wpbSFmrz3g"
88,1093922166947557377,12039612,1558,159357,1718,1366,109485,2008-01-09 19:18:34,0,0,2019-02-08 17:19:03,'Green Book':&amp;NegativeMediumSpace;&amp;NegativeMediumSpace;&amp;NegativeMediumSpace;&amp;NegativeMediumSpace;&amp;NegativeMediumSpa… https://t.co/2RHRh1hSda
89,1093922163785191424,12039612,1558,159357,1718,1366,109485,2008-01-09 19:18:34,0,0,2019-02-08 17:19:02,TBI releases identity of man killed in officer-involved shooting in northeast Shelby County https://t.co/a8x1Aikd2d
90,1093917887318888448,12039612,1558,159357,1718,1366,109485,2008-01-09 19:18:34,0,0,2019-02-08 17:02:03,Judge doubts need for out-of-town jury in Lorenzen Wright murder trial https://t.co/41pW1WtGRd
91,1093914498203668480,12039612,1558,159357,1718,1366,109485,2008-01-09 19:18:34,2,3,2019-02-08 16:48:34,Judge doubts need for out-of-town jury in Lorenzen Wright murder trial https://t.co/XFjHoL9sRc https://t.co/EVInkVr0Ah
92,1093913860174684160,12039612,1558,159357,1718,1366,109485,2008-01-09 19:18:34,4,3,2019-02-08 16:46:02,Where's my paycheck? Wells Fargo customers say direct deposits not showing up after outage https://t.co/ssxMADZbWJ
93,1093909583733637120,12039612,1558,159357,1718,1366,109485,2008-01-09 19:18:34,27,92,2019-02-08 16:29:03,"Memphis Grizzlies will retire Marc Gasol's No. 33 jersey, owner Robert Pera says https://t.co/cUvBd0IlKn"
94,1093907070292652033,12039612,1558,159357,1718,1366,109485,2008-01-09 19:18:34,0,1,2019-02-08 16:19:04,"The 9:01: How Memphis comes back from losing Gasol, Electrolux https://t.co/QjduTAtLSu https://t.co/Y9Al3Khiln"
95,1093905307716210690,12039612,1558,159357,1718,1366,109485,2008-01-09 19:18:34,0,1,2019-02-08 16:12:03,"The 9:01: How Memphis comes back from losing Gasol, Electrolux https://t.co/V1Nt7QcRFd"
96,1093901029152825344,12039612,1558,159357,1718,1366,109485,2008-01-09 19:18:34,2,3,2019-02-08 15:55:03,"Memphis Grizzlies will retire Marc Gasol's No. 33 uniform, owner Robert Pera says https://t.co/Y3f3vnbRgN"
97,1093900990615638016,12039612,1558,159357,1718,1366,109485,2008-01-09 19:18:34,1,0,2019-02-08 15:54:54,"The 9:01: How Memphis comes back from losing Gasol, Electrolux https://t.co/vMJe7ZSAbk"
98,1093900026277900288,12039612,1558,159357,1718,1366,109485,2008-01-09 19:18:34,11,19,2019-02-08 15:51:04,"Memphis Grizzlies will retire Marc Gasol's No. 33 uniform, owner Robert Pera says https://t.co/McOMhpf5tV https://t.co/joIy95n22J"
99,1093896762694221825,12039612,1558,159357,1718,1366,109485,2008-01-09 19:18:34,3,17,2019-02-08 15:38:06,"Memphis Grizzlies will retire Marc Gasol's No. 33 uniform, owner Robert Pera says https://t.co/eNSE2U0gyM"
100,1093895237272043520,12039612,1558,159357,1718,1366,109485,2008-01-09 19:18:34,0,0,2019-02-08 15:32:02,'Green Book':​​​​​​​ Memphis actor David Kallaway stars in Oscar-nominated movie https://t.co/mLOiXAlJ2b
101,1093890998239985667,12039612,1558,159357,1718,1366,109485,2008-01-09 19:18:34,1,2,2019-02-08 15:15:12,Freeman | America has a hate problem https://t.co/0GdCqu2dJU
102,1093886937004470274,12039612,1558,159357,1718,1366,109485,2008-01-09 19:18:34,0,0,2019-02-08 14:59:03,The wait for the AAF's mobile app has ended. The long wait was Charlie Ebersol's plan https://t.co/8Zsh2HO9nf
103,1093882659456118785,12039612,1558,159357,1718,1366,109485,2008-01-09 19:18:34,0,1,2019-02-08 14:42:04,"Gov. Bill Lee stresses importance of free press, open government in speech to media group https://t.co/Zan6rGQSBK"
104,1093878391047155712,12039612,1558,159357,1718,1366,109485,2008-01-09 19:18:34,0,2,2019-02-08 14:25:06,Elemento Neapolitan Pizza at Memphis' Crosstown Concourse https://t.co/6G0yIuDWtD
105,1093874350644711425,12039612,1558,159357,1718,1366,109485,2008-01-09 19:18:34,3,2,2019-02-08 14:09:03,"Flea-borne typhus outbreak, rats taking over Los Angeles city buildings https://t.co/9GXpaot36D"
106,1093872206558433280,12039612,1558,159357,1718,1366,109485,2008-01-09 19:18:34,1,1,2019-02-08 14:00:31,"Doctors at Choice MD prescribed needless medicinal cream, costing more than $14,000 per prescription, to California… https://t.co/QtIhFmcXH1"
107,1093870071997435904,12039612,1558,159357,1718,1366,109485,2008-01-09 19:18:34,0,3,2019-02-08 13:52:02,Memphis restaurants: Elwood's Shells in Cooper-Young https://t.co/SjZpfsJeDx
108,1093865802082762752,12039612,1558,159357,1718,1366,109485,2008-01-09 19:18:34,1,3,2019-02-08 13:35:04,Memphis restaurants: Elwood's Shells opens in Cooper-Young https://t.co/SJh3VdiIUu
109,1093861766361165824,12039612,1558,159357,1718,1366,109485,2008-01-09 19:18:34,0,0,2019-02-08 13:19:02,Football recruiting: Top Memphis high school prospects for Class of 2020 https://t.co/uNh8ddxOiR
110,1093857493841780736,12039612,1558,159357,1718,1366,109485,2008-01-09 19:18:34,0,0,2019-02-08 13:02:04,3 last-minute Memphis Valentine's Day date ideas — no reservation required https://t.co/2PEIhbaic7
111,1093853227387363329,12039612,1558,159357,1718,1366,109485,2008-01-09 19:18:34,0,1,2019-02-08 12:45:06,"Weathersbee: Should LeMoyne-Owen's president resign? Yes, say students fighting mold and rats https://t.co/PDcWOZYMga"
112,1093849427607998464,12039612,1558,159357,1718,1366,109485,2008-01-09 19:18:34,2,2,2019-02-08 12:30:00,Mike Conley opened up about a day that began with uncertainty and ended with him still a Memphis Grizzlies player a… https://t.co/29wfoX3nOG
113,1093843900958158848,12039612,1558,159357,1718,1366,109485,2008-01-09 19:18:34,0,7,2019-02-08 12:08:03,This cat was found 'frozen and unresponsive' in snow. An animal hospital saved her life https://t.co/OMwRKNZpef
114,1093840757797019648,12039612,1558,159357,1718,1366,109485,2008-01-09 19:18:34,2,4,2019-02-08 11:55:33,Memphis Grizzlies: How the NBA trade deadline went through Mike Conley's eyes https://t.co/lOqkej7O2V https://t.co/43m4ovhdIa
115,1093839624764620800,12039612,1558,159357,1718,1366,109485,2008-01-09 19:18:34,0,0,2019-02-08 11:51:03,Memphis Grizzlies: Mike Conley on trade deadline day https://t.co/DlyjfibfP1
116,1093835344397680641,12039612,1558,159357,1718,1366,109485,2008-01-09 19:18:34,2,3,2019-02-08 11:34:03,Memphis Grizzlies: How the NBA trade deadline went through Mike Conley's eyes https://t.co/xK6vUGCyOp
117,1093831065683283970,12039612,1558,159357,1718,1366,109485,2008-01-09 19:18:34,1,0,2019-02-08 11:17:03,A Tennessee clinic swindled the military out of $65M. This is how it got caught https://t.co/XlWN2YOCnH
118,1093826817444728832,12039612,1558,159357,1718,1366,109485,2008-01-09 19:18:34,0,0,2019-02-08 11:00:10,"Whitaker's testimony, winter weather, a Kristoff St. John tribute: 5 things you need to know Friday https://t.co/V4suPb8uKf"
119,1093750535386222592,12039612,1558,159357,1718,1366,109485,2008-01-09 19:18:34,0,2,2019-02-08 05:57:03,"Grizzlies waiving Omri Casspi trading Shelvin Mack, JaMychal Green, Garrett Temple https://t.co/hoasD9AHTW"
120,1093746507428347904,12039612,1558,159357,1718,1366,109485,2008-01-09 19:18:34,0,1,2019-02-08 05:41:02,"Fined for 'bizarre behavior' including unwanted face licking, Florida official resigns https://t.co/AT7eHpKotI"
121,1093742485111746560,12039612,1558,159357,1718,1366,109485,2008-01-09 19:18:34,0,0,2019-02-08 05:25:03,"Memphis man found shot dead in apartment complex, police say https://t.co/3baMjXwVgE"
122,1093738470189740032,12039612,1558,159357,1718,1366,109485,2008-01-09 19:18:34,0,1,2019-02-08 05:09:06,Penny Hardaway saw the team he wants Memphis to be. They were wearing Cincinnati jerseys. https://t.co/FqBOcmwAAj
123,1093734178506637313,12039612,1558,159357,1718,1366,109485,2008-01-09 19:18:34,0,2,2019-02-08 04:52:03,Penny Hardaway explains what Memphis is missing in big games https://t.co/VuUTO6w2H0
