Index,ID,User_ID,Friends_Count,Followers_Count,Favourites_Count,Listed_Count,Status_Count,Created_at,Retweet_Count,Favourite_Count,Created_at,Text
729,1090083123273101313,12039612,1558,159357,1718,1366,109485,2008-01-09 19:18:34,0,3,2019-01-29 03:04:04,Memphis Grizzlies: Jaren Jackson Jr. returns to game vs. Denver Nuggets after hard fall https://t.co/hpa0FAU1hZ
730,1090078841089998848,12039612,1558,159357,1718,1366,109485,2008-01-09 19:18:34,0,0,2019-01-29 02:47:03,Memphis Grizzlies: Jaren Jackson Jr. leaves game vs. Denver Nuggets with apparent injury https://t.co/svyIgVNRob
731,1090074583607271426,12039612,1558,159357,1718,1366,109485,2008-01-09 19:18:34,1,2,2019-01-29 02:30:07,Tennessee education department seeks more funding from Gov. Bill Lee https://t.co/0kFi7iD5l6
732,1090070536099692545,12039612,1558,159357,1718,1366,109485,2008-01-09 19:18:34,1,9,2019-01-29 02:14:02,Penny Hardaway is right that he's got a target on his back. But was he right to say it? https://t.co/jRIOK1ZrOg
733,1090067150377705472,12039612,1558,159357,1718,1366,109485,2008-01-09 19:18:34,0,0,2019-01-29 02:00:35,Penny Hardaway is right that he's got a target on his back. But was he right to say it? https://t.co/hrYEhWEUw2 https://t.co/tQfdV3SuSm
734,1090066258555482112,12039612,1558,159357,1718,1366,109485,2008-01-09 19:18:34,0,0,2019-01-29 01:57:03,Strickland announces Community Catalyst Fund to spur development https://t.co/11tmfw6TuC
735,1090061985247567872,12039612,1558,159357,1718,1366,109485,2008-01-09 19:18:34,1,1,2019-01-29 01:40:04,Collierville board of mayor and alderman approved housing development aimed at seniors https://t.co/NpU1YtS5KS
736,1090059478827819008,12039612,1558,159357,1718,1366,109485,2008-01-09 19:18:34,0,2,2019-01-29 01:30:06,Strickland announces Community Catalyst Fund to spur development https://t.co/EB6XX8IsSW https://t.co/6cYsN0cY4n
737,1090058193085042690,12039612,1558,159357,1718,1366,109485,2008-01-09 19:18:34,0,1,2019-01-29 01:25:00,You can play a vital role in supporting local journalism that you and your community can trust. https://t.co/W9eULBrHTO
738,1090051906909716481,12039612,1558,159357,1718,1366,109485,2008-01-09 19:18:34,2,7,2019-01-29 01:00:01,"Though nothing is official yet, Gotti is also expected to announce the lineup for his annual summer Birthday Bash c… https://t.co/8zi3sCnReJ"
739,1090045634940465152,12039612,1558,159357,1718,1366,109485,2008-01-09 19:18:34,1,0,2019-01-29 00:35:06,'Completely falsified' — SCS doubles down as Gateway charter school defends itself https://t.co/qF31qUhepb
740,1090041594810720256,12039612,1558,159357,1718,1366,109485,2008-01-09 19:18:34,1,0,2019-01-29 00:19:02,Watch live: Mayor Strickland's 'State of the City' address https://t.co/mNKfplnIBd
741,1090037454449430528,12039612,1558,159357,1718,1366,109485,2008-01-09 19:18:34,1,0,2019-01-29 00:02:35,Watch live: Mayor Strickland's 'State of the City' address https://t.co/iJTZ9atZ5V https://t.co/lToBvxmtZU
742,1090036834284040192,12039612,1558,159357,1718,1366,109485,2008-01-09 19:18:34,0,0,2019-01-29 00:00:07,How the Memphis Grizzlies will handle playing time for Kyle Anderson and Bruno Caboclo https://t.co/l4aNqXU6ON
743,1090032535609008129,12039612,1558,159357,1718,1366,109485,2008-01-09 19:18:34,0,0,2019-01-28 23:43:02,"TBI wraps up investigation into MPD shooting of Martavious Banks, DA is reviewing https://t.co/asEELY5ddk"
744,1090028508062146561,12039612,1558,159357,1718,1366,109485,2008-01-09 19:18:34,1,1,2019-01-28 23:27:02,"Fruit recalled from Walmart, Aldi, Costco over listeria concern in several states https://t.co/jfuevS3REt"
745,1090024243629309961,12039612,1558,159357,1718,1366,109485,2008-01-09 19:18:34,0,0,2019-01-28 23:10:06,Vote for Boys' Athlete of the Week Jan. 21-26 https://t.co/90vtc7wV8h
746,1090020204464226305,12039612,1558,159357,1718,1366,109485,2008-01-09 19:18:34,2,3,2019-01-28 22:54:02,Memphis extends warming center hours ahead of cold weather https://t.co/aTpeYXR7d5
747,1090015926613934081,12039612,1558,159357,1718,1366,109485,2008-01-09 19:18:34,2,0,2019-01-28 22:37:03,MemFix 4: Several interstates to be closed on weekends https://t.co/X5pDTlIGH0
748,1090011654014857220,12039612,1558,159357,1718,1366,109485,2008-01-09 19:18:34,0,0,2019-01-28 22:20:04,Penny Hardaway: 'Jealousy' from other college coaches leads to target on his back https://t.co/lp99NXXHLm
749,1090007643517640704,12039612,1558,159357,1718,1366,109485,2008-01-09 19:18:34,10,39,2019-01-28 22:04:08,Penny Hardaway: 'Jealousy' from other college coaches leads to target on his back https://t.co/CU6Os95vWq https://t.co/fQUqQc6nTN
750,1090006609718317057,12039612,1558,159357,1718,1366,109485,2008-01-09 19:18:34,4,5,2019-01-28 22:00:01,Briarcrest is hosting a doubleheader on Saturday where the Saints will face University Heights (Ky.) and top-ranked… https://t.co/FoK1uScGpJ
751,1090001329852956672,12039612,1558,159357,1718,1366,109485,2008-01-09 19:18:34,0,1,2019-01-28 21:39:02,"In year before lawsuit, Shelby County spent less than 2 percent on minority-owned businesses https://t.co/CCke59v2NM"
752,1089997052489187328,12039612,1558,159357,1718,1366,109485,2008-01-09 19:18:34,0,0,2019-01-28 21:22:03,Vote for Girls' Athlete of the Week Jan. 21-26 https://t.co/31wkicGT5C
753,1089992778422067200,12039612,1558,159357,1718,1366,109485,2008-01-09 19:18:34,2,0,2019-01-28 21:05:04,Memphis area's top five high school basketball games this week https://t.co/Br1QELQN1q
754,1089988747519803392,12039612,1558,159357,1718,1366,109485,2008-01-09 19:18:34,2,4,2019-01-28 20:49:03,"How Grizzlies' Mike Conley, Marc Gasol could be affected by Anthony Davis' trade request https://t.co/SVyx4ronxH"
755,1089984469292011521,12039612,1558,159357,1718,1366,109485,2008-01-09 19:18:34,2,5,2019-01-28 20:32:03,"Penny Hardaway's Memphis basketball team is surging in NET, KenPom rankings after UCF win https://t.co/Dj1vIxaG2d"
756,1089980238665256961,12039612,1558,159357,1718,1366,109485,2008-01-09 19:18:34,1,1,2019-01-28 20:15:14,"Driven by opioid crisis, more children in Tennessee living in foster care; DCS seeks additional funding https://t.co/fkfOMjUziN"
757,1089976416979034112,12039612,1558,159357,1718,1366,109485,2008-01-09 19:18:34,0,2,2019-01-28 20:00:03,"Many of the least-healthy items on fast-food menus contain nearly the entire daily recommended intake of calories,… https://t.co/DE3nKHYrMI"
758,1089969946166259713,12039612,1558,159357,1718,1366,109485,2008-01-09 19:18:34,0,2,2019-01-28 19:34:20,"TBI wraps up investigation into MPD shooting of Martavious Banks, DA is reviewing https://t.co/U5uahUBtR6"
759,1089969645451264000,12039612,1558,159357,1718,1366,109485,2008-01-09 19:18:34,1,0,2019-01-28 19:33:08,"TBI wraps up investigation into MPD shooting of Martavious Banks, DA is reviewing https://t.co/e2kx9bXN7L"
760,1089969369004814336,12039612,1558,159357,1718,1366,109485,2008-01-09 19:18:34,0,3,2019-01-28 19:32:02,Yo Gotti drops 'Put a Date On It' with Lil Baby; set to appear on 'The Tonight Show' Tuesday https://t.co/iPzaPPt28F
761,1089965125220605952,12039612,1558,159357,1718,1366,109485,2008-01-09 19:18:34,0,0,2019-01-28 19:15:11,Abogados law firm shutdown: State board asks people affected to file refund claims https://t.co/KpZVvFk8BW
762,1089961310245343233,12039612,1558,159357,1718,1366,109485,2008-01-09 19:18:34,0,1,2019-01-28 19:00:01,"While some of federal workers’ retail purchases will simply be deferred, others such as restaurant meals won’t be.… https://t.co/9CLtCrudGJ"
763,1089954539812184064,12039612,1558,159357,1718,1366,109485,2008-01-09 19:18:34,1,1,2019-01-28 18:33:07,The Beifuss File: The Nuclear Kid — Memphis youth builds home nuclear fusion reactor https://t.co/Gh1tgBFJt9 https://t.co/HqEgmV2emz
764,1089946458109956096,12039612,1558,159357,1718,1366,109485,2008-01-09 19:18:34,0,1,2019-01-28 18:01:00,"The Tigers are feeling good after a big win over UCF. Now, they go back on the road this week, facing Tulsa and USF… https://t.co/KkgpJBGGbr"
765,1089935648872677379,12039612,1558,159357,1718,1366,109485,2008-01-09 19:18:34,0,0,2019-01-28 17:18:03,The 9:01: How Shelby County Republicans can make a comeback https://t.co/FXLtHD3Hkw
766,1089931630142054400,12039612,1558,159357,1718,1366,109485,2008-01-09 19:18:34,1,2,2019-01-28 17:02:05,"The Weekly Dish: Tsunami Restaurant starts a chefs market with soup, dips and baked goods https://t.co/6M2xHD2bLU https://t.co/9O6LA81qT9"
767,1089931113332649992,12039612,1558,159357,1718,1366,109485,2008-01-09 19:18:34,0,0,2019-01-28 17:00:02,"""Because the officials on the field are humans, like the players and coaches, errors will happen."" https://t.co/0pg3KSKtiX"
768,1089924346649296897,12039612,1558,159357,1718,1366,109485,2008-01-09 19:18:34,0,0,2019-01-28 16:33:08,Two found dead in North Memphis home where there were no signs of forced entry https://t.co/OPUMUVob8b
769,1089920798180233221,12039612,1558,159357,1718,1366,109485,2008-01-09 19:18:34,0,0,2019-01-28 16:19:02,The 9:01: How Shelby County Republicans make a comeback https://t.co/vKsyZb3zWm
770,1089916659794497536,12039612,1558,159357,1718,1366,109485,2008-01-09 19:18:34,0,0,2019-01-28 16:02:36,The 9:01: How Shelby County Republicans make a comeback https://t.co/nbTGZhkxju https://t.co/w5LdhvfAcf
771,1089914907057971200,12039612,1558,159357,1718,1366,109485,2008-01-09 19:18:34,0,0,2019-01-28 15:55:38,"The 9:01: ""It's going to be hard, no doubt about it."" https://t.co/k0KUCzxqFJ"
772,1089893359341240320,12039612,1558,159357,1718,1366,109485,2008-01-09 19:18:34,4,21,2019-01-28 14:30:00,"ICYMI | ""I'll never forget it. I sent it as FedEx priority mail — spent a quick $20 — because I knew that way he wo… https://t.co/7BwBMZWOhy"
773,1089888341011689473,12039612,1558,159357,1718,1366,109485,2008-01-09 19:18:34,0,0,2019-01-28 14:10:04,Two found dead in North Memphis home where there were no signs of forced entry https://t.co/JcMYZ34QUR
774,1089884058677596170,12039612,1558,159357,1718,1366,109485,2008-01-09 19:18:34,1,1,2019-01-28 13:53:03,"Florida man finds World War II grenade, tosses it in the trunk, brings it to a Taco Bell https://t.co/C75LTW9EV8"
775,1089879779564838912,12039612,1558,159357,1718,1366,109485,2008-01-09 19:18:34,1,2,2019-01-28 13:36:03,"The Weekly Dish: Tsunami Restaurant starts a chefs market with soup, dips and baked goods https://t.co/sYyLJBqMGn"
776,1089874483371016192,12039612,1558,159357,1718,1366,109485,2008-01-09 19:18:34,0,1,2019-01-28 13:15:00,"With a digital subscription, you can help our journalists hold those in power accountable. https://t.co/W9eULBrHTO"
777,1089865938437062656,12039612,1558,159357,1718,1366,109485,2008-01-09 19:18:34,2,2,2019-01-28 12:41:03,The Beifuss File: The Nuclear Kid — Memphis youth builds home nuclear fusion reactor https://t.co/KdMWSEG2Ys
778,1089840570363768834,12039612,1558,159357,1718,1366,109485,2008-01-09 19:18:34,0,1,2019-01-28 11:00:14,8 must-know moments from the Screen Actors Guild Awards https://t.co/Hw5vjFt9kn
779,1089750680770961408,12039612,1558,159357,1718,1366,109485,2008-01-09 19:18:34,0,4,2019-01-28 05:03:03,WWE: Seth Rollins wins men's Royal Rumble match https://t.co/Lf76qYjTWo
780,1089738850950365184,12039612,1558,159357,1718,1366,109485,2008-01-09 19:18:34,0,3,2019-01-28 04:16:03,"WWE: Jerry Lawler happy to see Jeff Jarrett, a fellow Tennessee native, at Royal Rumble https://t.co/L7cBlrMCSE"
781,1089717962825785345,12039612,1558,159357,1718,1366,109485,2008-01-09 19:18:34,0,3,2019-01-28 02:53:02,WWE: Becky Lynch wins women's Royal Rumble https://t.co/dGxfN2tW3V
782,1089709407305416705,12039612,1558,159357,1718,1366,109485,2008-01-09 19:18:34,1,3,2019-01-28 02:19:03,"Could California produce soon cost you more? Farms face labor shortages, immigration woes https://t.co/1IZtqHx6VB"
783,1089705129547317248,12039612,1558,159357,1718,1366,109485,2008-01-09 19:18:34,0,0,2019-01-28 02:02:03,WWE: Shane McMahon's Shooting Star Press for the win is the Royal Rumble's first highlight https://t.co/uTM4x8cVqK
784,1089700867878588416,12039612,1558,159357,1718,1366,109485,2008-01-09 19:18:34,1,8,2019-01-28 01:45:07,Penny Hardaway discusses Memphis' win over UCF https://t.co/Oru5NL4wBG
785,1089697063972028418,12039612,1558,159357,1718,1366,109485,2008-01-09 19:18:34,0,4,2019-01-28 01:30:00,You can play a vital role in supporting local journalism that you and your community can trust. https://t.co/W9eULBrHTO
786,1089688272199131137,12039612,1558,159357,1718,1366,109485,2008-01-09 19:18:34,2,12,2019-01-28 00:55:04,"It's not the Tomb of Doom, but Memphis basketball looks like a different team at FedExForum https://t.co/vqsyKsWR9a"
787,1094747241615634435,12039612,1558,159357,1718,1366,109485,2008-01-09 19:18:34,1,1,2019-02-10 23:57:36,Memphis businessman Mike Bowen killed in car crash in Costa Rica https://t.co/1KQoDtrd3v
788,1094746483788677120,12039612,1558,159357,1718,1366,109485,2008-01-09 19:18:34,0,4,2019-02-10 23:54:35,Memphis businessman Mike Bowen killed in car crash in Costa Rica https://t.co/qxwmT9S7XD https://t.co/E5RmxkC077
789,1094739554039447553,12039612,1558,159357,1718,1366,109485,2008-01-09 19:18:34,0,2,2019-02-10 23:27:03,Penny Hardaway discusses the future of Memphis vs. UConn https://t.co/K8Vw0s5gP7
790,1094712627962494976,12039612,1558,159357,1718,1366,109485,2008-01-09 19:18:34,2,22,2019-02-10 21:40:03,"Memphis 78, UConn 71: Tigers silence Huskies behind commanding performance https://t.co/nCBYfYgT9A"
791,1094709609430806528,12039612,1558,159357,1718,1366,109485,2008-01-09 19:18:34,0,0,2019-02-10 21:28:04,Two teenagers injured in Collierville shooting https://t.co/yIQZTFm88T https://t.co/8lwD3JVocG
792,1094708345045434368,12039612,1558,159357,1718,1366,109485,2008-01-09 19:18:34,0,0,2019-02-10 21:23:02,"Tigers vs. Connecticut Basketball February 10, 2019 https://t.co/AN5BXDJyLf"
793,1094691989252001797,12039612,1558,159357,1718,1366,109485,2008-01-09 19:18:34,0,2,2019-02-10 20:18:03,Two teenagers injured in Collierville shooting https://t.co/sNwkMihaZm
794,1094686210256261120,12039612,1558,159357,1718,1366,109485,2008-01-09 19:18:34,0,3,2019-02-10 19:55:05,Live updates: Tigers try to snap skid against UConn https://t.co/3y1Fyi6myf
795,1094682175667163136,12039612,1558,159357,1718,1366,109485,2008-01-09 19:18:34,0,6,2019-02-10 19:39:03,AAF: Memphis Express at Birmingham Iron — live blog https://t.co/MaGkTxkrHE
796,1094679534547304448,12039612,1558,159357,1718,1366,109485,2008-01-09 19:18:34,0,5,2019-02-10 19:28:33,Live updates: Tigers try to snap skid against UConn https://t.co/stY0RYKxJs https://t.co/fmnots69bc
797,1094647695355060229,12039612,1558,159357,1718,1366,109485,2008-01-09 19:18:34,0,0,2019-02-10 17:22:02,"How C.J. Miles fits in with Grizzlies after Toronto Raptors, Marc Gasol trade https://t.co/L7h5Gc2cs3"
798,1094631339058491394,12039612,1558,159357,1718,1366,109485,2008-01-09 19:18:34,1,0,2019-02-10 16:17:03,Sunday Sports Brunch: Lewisburg girls soccer makes MHSAA Class 5A North Half https://t.co/EPM6W2nPs8
799,1094604428345257985,12039612,1558,159357,1718,1366,109485,2008-01-09 19:18:34,0,0,2019-02-10 14:30:07,Leadership Memphis seeks nominees for change makers on its 40th anniversary https://t.co/vzr4sGNGqk
800,1094600382989381633,12039612,1558,159357,1718,1366,109485,2008-01-09 19:18:34,0,0,2019-02-10 14:14:02,"Could Amazon's Bezos wreck AMI, owner of National Enquirer, with blackmail charges? https://t.co/h5ER6n6Fuj"
801,1094596107248779265,12039612,1558,159357,1718,1366,109485,2008-01-09 19:18:34,0,0,2019-02-10 13:57:03,"How C.J. Miles fits in with the Memphis Grizzlies after Toronto Raptors, Marc Gasol trade https://t.co/LVTkAiYENq"
802,1094591830044360704,12039612,1558,159357,1718,1366,109485,2008-01-09 19:18:34,1,7,2019-02-10 13:40:03,Sky judge and the rules of tomorrow: A look at the AAF's notable rule differences https://t.co/CTOfSZIIe0
803,1094590324305932288,12039612,1558,159357,1718,1366,109485,2008-01-09 19:18:34,2,5,2019-02-10 13:34:04,How Memphis football's 2019 recruiting class addressed key needs https://t.co/c2lqoV5SAH https://t.co/iAlIJvle0E
804,1094587802065530880,12039612,1558,159357,1718,1366,109485,2008-01-09 19:18:34,0,1,2019-02-10 13:24:03,How Memphis football's 2019 recruiting class addressed key needs https://t.co/tpPM03x53a
805,1094447882155880448,12039612,1558,159357,1718,1366,109485,2008-01-09 19:18:34,1,1,2019-02-10 04:08:03,"Game Recap: Memphis Grizzlies 99, New Orleans Pelicans 90 https://t.co/OH2L18mSVJ https://t.co/cNBuprRGTZ"
806,1094441588103831552,12039612,1558,159357,1718,1366,109485,2008-01-09 19:18:34,3,0,2019-02-10 03:43:03,"Game Recap: Memphis Grizzlies 99, New Orleans Pelicans 90 https://t.co/cJgKf3o9rM"
807,1094425229273763840,12039612,1558,159357,1718,1366,109485,2008-01-09 19:18:34,8,33,2019-02-10 02:38:02,The Peabody Hotel of Memphis is celebrating its 150 anniversary in 2019 https://t.co/PPVYkz2pvg
808,1094411903567347712,12039612,1558,159357,1718,1366,109485,2008-01-09 19:18:34,0,1,2019-02-10 01:45:05,Memphis Grizzlies: Delon Wright introduces himself https://t.co/KGy50UzfRm
809,1094407614291734528,12039612,1558,159357,1718,1366,109485,2008-01-09 19:18:34,0,2,2019-02-10 01:28:03,New Memphis Grizzlies player CJ Miles introduces himself https://t.co/WG6TgHWYSl
810,1094403335640240129,12039612,1558,159357,1718,1366,109485,2008-01-09 19:18:34,0,5,2019-02-10 01:11:02,Memphis Grizzlies: Jonas Valanciunas explains what he knows about Memphis https://t.co/QsQghC28kE
811,1094380939474595840,12039612,1558,159357,1718,1366,109485,2008-01-09 19:18:34,1,1,2019-02-09 23:42:03,No. 1 UT Vols dine on Gator meat — but the main course is just ahead https://t.co/IlwP9L3meu
812,1094351245408641025,12039612,1558,159357,1718,1366,109485,2008-01-09 19:18:34,0,1,2019-02-09 21:44:03,How new pro football leagues could change the NFL and college game https://t.co/TapXIN1jet
813,1094345453452345344,12039612,1558,159357,1718,1366,109485,2008-01-09 19:18:34,0,0,2019-02-09 21:21:02,Lakeland's mayor threatened to have vice mayor removed from meeting https://t.co/l1II0NOtWw
814,1094325080090382336,12039612,1558,159357,1718,1366,109485,2008-01-09 19:18:34,1,3,2019-02-09 20:00:05,"The exhibit titled ""PHTGRPHS"" featured the work of local photographers Lester Merriweather and Lawrence Matthews th… https://t.co/JaAUItr4bp"
815,1094320043461173252,12039612,1558,159357,1718,1366,109485,2008-01-09 19:18:34,0,2,2019-02-09 19:40:04,"Chandler Parsons to rejoin Memphis Grizzlies, 'still a part of the team' https://t.co/K8VWUCJZ60"
816,1094315269382639616,12039612,1558,159357,1718,1366,109485,2008-01-09 19:18:34,1,1,2019-02-09 19:21:06,Non-profit group works to uplift Orange Mound community through art https://t.co/lKBIgFPxyI https://t.co/SYwzyNujpD
817,1094314247205650432,12039612,1558,159357,1718,1366,109485,2008-01-09 19:18:34,2,4,2019-02-09 19:17:02,What will happen to Germantown Country Club after it closes? It could become a public park. https://t.co/DGcjFzav9M
818,1094309992121937921,12039612,1558,159357,1718,1366,109485,2008-01-09 19:18:34,1,2,2019-02-09 19:00:08,Non-profit group works to uplift Orange Mound community through art https://t.co/kj4mp1Jdp9
819,1094305695506317312,12039612,1558,159357,1718,1366,109485,2008-01-09 19:18:34,0,1,2019-02-09 18:43:03,Non-profit group works to uplift Orange Mound community through art https://t.co/ND6YfFU8cS
820,1094301414074040320,12039612,1558,159357,1718,1366,109485,2008-01-09 19:18:34,1,2,2019-02-09 18:26:02,Non-profit group works to uplift Orange Mound community through art https://t.co/E9ibKRHc1k
821,1094292742149001216,12039612,1558,159357,1718,1366,109485,2008-01-09 19:18:34,3,1,2019-02-09 17:51:35,"Chandler Parsons to rejoin Memphis Grizzlies, report says https://t.co/DeHiKXSKea https://t.co/pxji7V9BgK"
822,1094288328285974530,12039612,1558,159357,1718,1366,109485,2008-01-09 19:18:34,0,0,2019-02-09 17:34:03,"Chandler Parsons to rejoin Memphis Grizzlies, report says https://t.co/eTjgRHaAOp"
823,1094285191223242753,12039612,1558,159357,1718,1366,109485,2008-01-09 19:18:34,2,0,2019-02-09 17:21:35,Lakeland's mayor threatened to have vice-mayor removed from meeting https://t.co/xYEcGu0n9T https://t.co/CQ8kQH6Jux
824,1094268951503220736,12039612,1558,159357,1718,1366,109485,2008-01-09 19:18:34,0,0,2019-02-09 16:17:03,US marshals searching for 73-year-old fugitive from Michigan https://t.co/kMKb9FTboX
825,1094264678119862273,12039612,1558,159357,1718,1366,109485,2008-01-09 19:18:34,0,0,2019-02-09 16:00:04,A discussion about when and how to fund a Lakeland high school devolved into a spat between the mayor and vice mayo… https://t.co/CQMOPO22eR
826,1094261400858431489,12039612,1558,159357,1718,1366,109485,2008-01-09 19:18:34,0,6,2019-02-09 15:47:03,'Keep fighting the bad guys': Girl battling cancer with no cure made honorary police officer https://t.co/WAUjU5l5Dq
827,1094257179144740865,12039612,1558,159357,1718,1366,109485,2008-01-09 19:18:34,0,0,2019-02-09 15:30:16,Lakeland's mayor threatened to have vice-mayor removed from meeting https://t.co/voBAd1LOzG
828,1094246812851023872,12039612,1558,159357,1718,1366,109485,2008-01-09 19:18:34,2,1,2019-02-09 14:49:04,"“If they could account for where all this money was going, then why does our neighborhood look like it does?” she s… https://t.co/Lqc8jGzxCF"
829,1094233219212357633,12039612,1558,159357,1718,1366,109485,2008-01-09 19:18:34,15,36,2019-02-09 13:55:03,Long-awaited Midtown Donuts opens on Union Avenue on Saturday https://t.co/E2pBNbwehZ https://t.co/B5KMT4Crt3
830,1094229945663008768,12039612,1558,159357,1718,1366,109485,2008-01-09 19:18:34,1,6,2019-02-09 13:42:03,Why Memphis basketball could still earn a first-round bye in the AAC Tournament https://t.co/2sUgX3diNw
831,1094225796909039616,12039612,1558,159357,1718,1366,109485,2008-01-09 19:18:34,4,3,2019-02-09 13:25:34,Le Bonheur perfects lifesaving procedure for premature babies with heart defect https://t.co/FdaBNQwjUv https://t.co/AULBkoAipN
832,1094222394267455488,12039612,1558,159357,1718,1366,109485,2008-01-09 19:18:34,13,43,2019-02-09 13:12:03,Memphis Grizzlies fans deserve better than this. They deserve a team with vision. https://t.co/Vg7hFxwdo2
833,1094068425801064453,12039612,1558,159357,1718,1366,109485,2008-01-09 19:18:34,0,1,2019-02-09 03:00:14,Tiger Kareem Brewton Jr. Through the Years https://t.co/2UVij3mZK3
834,1094064357191888896,12039612,1558,159357,1718,1366,109485,2008-01-09 19:18:34,1,2,2019-02-09 02:44:04,Germantown Chicken Salad Chick: Free chicken salad for a year for the first 150 on opening day https://t.co/93gDxJnMlA
835,1094060075042390016,12039612,1558,159357,1718,1366,109485,2008-01-09 19:18:34,14,29,2019-02-09 02:27:03,Lyft offers free rides to Black history museums in Memphis https://t.co/RcnSspJY7h
836,1094056050028732416,12039612,1558,159357,1718,1366,109485,2008-01-09 19:18:34,3,7,2019-02-09 02:11:03,Life-sized Johnny Cash statue to be installed near site of first show with Tennessee Two https://t.co/OruOeyx09u https://t.co/vu5CoLL5Xm
837,1094055801847730176,12039612,1558,159357,1718,1366,109485,2008-01-09 19:18:34,0,7,2019-02-09 02:10:04,Marc Gasol tweets his farewell to Memphis Grizzles after trade to Toronto Raptors https://t.co/GWQ3hwwp1v
838,1094051771436187648,12039612,1558,159357,1718,1366,109485,2008-01-09 19:18:34,0,0,2019-02-09 01:54:03,How Memphis Grizzlies general manager Chris Wallace explained the Marc Gasol trade https://t.co/S38Y28DAbk
839,1094048377912713218,12039612,1558,159357,1718,1366,109485,2008-01-09 19:18:34,1,0,2019-02-09 01:40:34,"Weathersbee: Should LeMoyne-Owen's president resign? Yes, say students fighting mold and rats… https://t.co/o8GBBcbeGu"
840,1094047497121611776,12039612,1558,159357,1718,1366,109485,2008-01-09 19:18:34,2,3,2019-02-09 01:37:04,"Electrolux fired 658 employees, contract workers in year before closure announcement https://t.co/3wux14M95c"
841,1094043220617633793,12039612,1558,159357,1718,1366,109485,2008-01-09 19:18:34,1,0,2019-02-09 01:20:04,"Black Memphians' role in the freedom struggle largely unsung, authors say https://t.co/vH5YLN4nlQ"
842,1094039188977127424,12039612,1558,159357,1718,1366,109485,2008-01-09 19:18:34,1,8,2019-02-09 01:04:03,Long-awaited Midtown Donuts opens on Union Avenue on Saturday https://t.co/eVpwjBFpH3
843,1094034908064944128,12039612,1558,159357,1718,1366,109485,2008-01-09 19:18:34,2,0,2019-02-09 00:47:02,"Electrolux fired 658 employees, contract workers in Memphis the year before closure announcement https://t.co/88PcZ8Uji0"
844,1094033650515992576,12039612,1558,159357,1718,1366,109485,2008-01-09 19:18:34,0,1,2019-02-09 00:42:03,Freeman | America has a hate problem https://t.co/1fnHhtAAis https://t.co/CoXJInBqWG
845,1094030644143894530,12039612,1558,159357,1718,1366,109485,2008-01-09 19:18:34,1,5,2019-02-09 00:30:06,Le Bonheur perfects lifesaving procedure for premature babies with heart defect https://t.co/hHSuxdIdH6
846,1094026362937999360,12039612,1558,159357,1718,1366,109485,2008-01-09 19:18:34,1,1,2019-02-09 00:13:05,A $150 burger? It's just one part of The Peabody Hotel's 150th anniversary celebration https://t.co/MUfmanaoZT https://t.co/cr6EhtaH8u
847,1094024088698437633,12039612,1558,159357,1718,1366,109485,2008-01-09 19:18:34,2,8,2019-02-09 00:04:03,The Peabody Hotel celebrates 150 years in business https://t.co/9n6JWHI4kb
848,1094019808788652033,12039612,1558,159357,1718,1366,109485,2008-01-09 19:18:34,4,8,2019-02-08 23:47:02,Lorenzen Wright murder trial: Judge doubts need for out-of-town jury https://t.co/O8CtlbzEaW
849,1094018425704275969,12039612,1558,159357,1718,1366,109485,2008-01-09 19:18:34,1,4,2019-02-08 23:41:33,"Electrolux fired 658 employees, contract workers in year before closure announcement https://t.co/NuuBwBOjKB"
