Index,ID,User_ID,Friends_Count,Followers_Count,Favourites_Count,Listed_Count,Status_Count,Created_at,Retweet_Count,Favourite_Count,Created_at,Text
369,1092495519690211329,12039612,1558,159357,1718,1366,109485,2008-01-09 19:18:34,0,1,2019-02-04 18:50:04,Kristian Williams decommits from Minnesota football https://t.co/TyOKR29nod
370,1092491487009562624,12039612,1558,159357,1718,1366,109485,2008-01-09 19:18:34,1,3,2019-02-04 18:34:02,"Southern Heritage Classic: Gladys Knight, Jeffrey Osborne to play Classic Concert 2019 https://t.co/95ZSP5LlrX"
371,1092491259170541569,12039612,1558,159357,1718,1366,109485,2008-01-09 19:18:34,0,1,2019-02-04 18:33:08,"Southern Heritage Classic: Gladys Knight, Jeffrey Osborne to play Classic Concert 2019 https://t.co/hA3XtyqQYQ https://t.co/bICwILfAta"
372,1092487209951858688,12039612,1558,159357,1718,1366,109485,2008-01-09 19:18:34,0,1,2019-02-04 18:17:02,Southern rockers Lynyrd Skynyrd bring farewell tour to Mid-South https://t.co/CThkOiPHXH
373,1092482953949708288,12039612,1558,159357,1718,1366,109485,2008-01-09 19:18:34,1,0,2019-02-04 18:00:08,"Football, reimagined: Why the AAF, Memphis Express think they'll succeed where others failed https://t.co/kuiYtCtx71"
374,1092478664359456775,12039612,1558,159357,1718,1366,109485,2008-01-09 19:18:34,0,1,2019-02-04 17:43:05,Noose reportedly found on Shelby County Schools property https://t.co/7YFqAOttpi
375,1092474374802866176,12039612,1558,159357,1718,1366,109485,2008-01-09 19:18:34,0,3,2019-02-04 17:26:02,"Review: Maroon 5 delivers a flavorless halftime show, avoids being the worst ever https://t.co/tSLGoNf3eZ"
376,1092469594500009985,12039612,1558,159357,1718,1366,109485,2008-01-09 19:18:34,1,0,2019-02-04 17:07:03,ESPN College Gameday host Rece Davis explains 'jealousy' comments on Penny Hardaway https://t.co/dGw5P4DbnU
377,1092465321431257088,12039612,1558,159357,1718,1366,109485,2008-01-09 19:18:34,5,2,2019-02-04 16:50:04,"Children are using an unhealthy amount of toothpaste, CDC warns https://t.co/BcflvQ54t5"
378,1092461546754592773,12039612,1558,159357,1718,1366,109485,2008-01-09 19:18:34,0,0,2019-02-04 16:35:04,ESPN College Gameday host Rece Davis explains 'jealousy' comments on Penny Hardaway https://t.co/HRldOYuD90 https://t.co/zdXZ5EP6GK
379,1092461053773008897,12039612,1558,159357,1718,1366,109485,2008-01-09 19:18:34,3,2,2019-02-04 16:33:06,ESPN College Gameday host Rece Davis explains 'jealousy' comments on @Memphis_MBB coach Penny Hardaway  https://t.co/2neCEoXgm1
380,1092458269447258113,12039612,1558,159357,1718,1366,109485,2008-01-09 19:18:34,0,0,2019-02-04 16:22:02,"John Legend and Adam Levine change dirty diapers in Super Bowl Pampers ad, singing song by Chrissy Teigen https://t.co/5Jgo8oqfYS"
381,1092453998882304000,12039612,1558,159357,1718,1366,109485,2008-01-09 19:18:34,2,0,2019-02-04 16:05:04,Noose reportedly found on Shelby County Schools property https://t.co/SUmOHdMNWa https://t.co/GwOe19PXcx
382,1092453995770195969,12039612,1558,159357,1718,1366,109485,2008-01-09 19:18:34,1,2,2019-02-04 16:05:04,"The 9:01: Steven Tyler gets a warm welcome in Memphis — Tim Lambesis, not so much https://t.co/ZmQnbR0Ib9"
383,1092446325411479552,12039612,1558,159357,1718,1366,109485,2008-01-09 19:18:34,1,6,2019-02-04 15:34:35,"The 9:01: Steven Tyler gets a warm welcome in Memphis — Tim Lambesis, not so much https://t.co/WeEcQWb05z https://t.co/NkyfKxRJYW"
384,1092442229367402496,12039612,1558,159357,1718,1366,109485,2008-01-09 19:18:34,3,2,2019-02-04 15:18:18,NEW: A rope 'tied up to resemble a noose' was found at the Shelby County Schools Teaching and Learning Academy this… https://t.co/qDHkNhsLEs
385,1092442166083891200,12039612,1558,159357,1718,1366,109485,2008-01-09 19:18:34,1,4,2019-02-04 15:18:03,Patriots kicker Stephen Gostkowski played in Super Bowl a day after grandfather's death https://t.co/l7wn6huh5J
386,1092437887935807488,12039612,1558,159357,1718,1366,109485,2008-01-09 19:18:34,0,0,2019-02-04 15:01:03,Super Bowl thoughts: 5 worse games than Patriots-Rams; are the Titans transitive champions? https://t.co/OUXBB4OPa7
387,1092433847143284736,12039612,1558,159357,1718,1366,109485,2008-01-09 19:18:34,3,5,2019-02-04 14:45:00,"Review: Maroon 5 delivers a white-bread halftime show, avoids being the worst ever  https://t.co/cvnB61OP5i"
388,1092430324150255616,12039612,1558,159357,1718,1366,109485,2008-01-09 19:18:34,1,4,2019-02-04 14:31:00,"The @TheAAF's inaugural season officially begins Saturday, but as far as @AAFMemphis is concerned, the zero hour is… https://t.co/rcasZegE9G"
389,1092423780734025734,12039612,1558,159357,1718,1366,109485,2008-01-09 19:18:34,3,7,2019-02-04 14:05:00,"Nancy Armour: ""Call attention to racism and discrimination, and your career is effectively over. Test positive for… https://t.co/y1Voc2TSPa"
390,1092416496553336832,12039612,1558,159357,1718,1366,109485,2008-01-09 19:18:34,2,3,2019-02-04 13:36:03,Gannett rejects takeover offer from MNG/Digital First Media https://t.co/ayeQVI6qfW
391,1092409199932465153,12039612,1558,159357,1718,1366,109485,2008-01-09 19:18:34,0,0,2019-02-04 13:07:03,"Review: Maroon 5 delivers a vanilla halftime show, avoids being the worst ever https://t.co/Z40Qav4CD7"
392,1092408582648152065,12039612,1558,159357,1718,1366,109485,2008-01-09 19:18:34,0,3,2019-02-04 13:04:36,"Football, reimagined: Why the AAF, Memphis Express think they'll succeed where others failed https://t.co/h0Nz2B4uKu https://t.co/9aZ5HBEQJ5"
393,1092404927056543745,12039612,1558,159357,1718,1366,109485,2008-01-09 19:18:34,1,4,2019-02-04 12:50:05,"Review: Maroon 5 delivers a white-bread halftime show, avoids being the worst ever https://t.co/FGYzO1Ht0r"
394,1092400767758004225,12039612,1558,159357,1718,1366,109485,2008-01-09 19:18:34,0,5,2019-02-04 12:33:33,New FedEx executive says company has 'great opportunity' to draw more women to logistics https://t.co/XhpICbUUSD https://t.co/zKe9EMHG9C
395,1092400638972039169,12039612,1558,159357,1718,1366,109485,2008-01-09 19:18:34,1,3,2019-02-04 12:33:02,Former Memphis football star Anthony Miller to inspire at Commercial Appeal Sports Awards https://t.co/FvMmUZmHqx
396,1092396361163726848,12039612,1558,159357,1718,1366,109485,2008-01-09 19:18:34,3,4,2019-02-04 12:16:02,New FedEx executive says company has 'great opportunity' to draw more women to logistics https://t.co/M6fxciIztv
397,1092393359937654784,12039612,1558,159357,1718,1366,109485,2008-01-09 19:18:34,0,1,2019-02-04 12:04:07,Memphis Grizzlies: Kyle Anderson to see specialist for shoulder as roster remains in flux https://t.co/xa2ucL4Fkc https://t.co/zDhNSGDVZS
398,1092387553137868800,12039612,1558,159357,1718,1366,109485,2008-01-09 19:18:34,0,1,2019-02-04 11:41:02,Inside the prison unit where Cyntoia Brown will prepare for freedom https://t.co/0Km8GWwRzT
399,1092377267777482753,12039612,1558,159357,1718,1366,109485,2008-01-09 19:18:34,0,1,2019-02-04 11:00:10,"If you call in sick Monday after the Super Bowl, you aren't alone. 'Super Bowl fever' is a thing https://t.co/S50ArwYGts"
400,1092281857906016256,12039612,1558,159357,1718,1366,109485,2008-01-09 19:18:34,1,6,2019-02-04 04:41:03,"The NFL put MLK in a Super Bowl video, and Colin Kaepernick fans aren't happy about it https://t.co/N6tw4UG4n1"
401,1092276320933957632,12039612,1558,159357,1718,1366,109485,2008-01-09 19:18:34,0,4,2019-02-04 04:19:03,"Stephen Gostkowski sets Super Bowl record with sixth appearance, converts two FGs, PAT for Patriots https://t.co/yLso3rEddM"
402,1092272043922460672,12039612,1558,159357,1718,1366,109485,2008-01-09 19:18:34,0,0,2019-02-04 04:02:03,Patriots top Rams 13-3 to win sixth NFL title in lowest-scoring Super Bowl ever https://t.co/c0vh4qryBQ
403,1092267779527491584,12039612,1558,159357,1718,1366,109485,2008-01-09 19:18:34,4,14,2019-02-04 03:45:06,Stephen Gostkowski sets Super Bowl record with sixth appearance as Patriots claim title https://t.co/gAavKtR3wB
404,1092263978431119360,12039612,1558,159357,1718,1366,109485,2008-01-09 19:18:34,11,30,2019-02-04 03:30:00,The Washington Post ad in tonight's Super Bowl is a stark reminder of the importance of journalism. And it matters… https://t.co/FovBsWBVrU
405,1092256470761160704,12039612,1558,159357,1718,1366,109485,2008-01-09 19:18:34,1,8,2019-02-04 03:00:10,"Stephen Gostkowski sets Super Bowl record with sixth appearance, converts FG and PAT for Patriots https://t.co/a1f9d1sox4"
406,1092240093853741058,12039612,1558,159357,1718,1366,109485,2008-01-09 19:18:34,0,2,2019-02-04 01:55:05,"Super Bowl LIII live: Score updates, analysis, play-by-play on Patriots vs. Rams https://t.co/NxwAfGYJKM"
407,1092235803936387072,12039612,1558,159357,1718,1366,109485,2008-01-09 19:18:34,5,19,2019-02-04 01:38:03,Super Bowl 2019: Memphis Express head coach Mike Singletary featured in 'NFL100' commercial https://t.co/XbdAxrG12o
408,1092226996095066113,12039612,1558,159357,1718,1366,109485,2008-01-09 19:18:34,1,5,2019-02-04 01:03:03,"Stephen Gostkowski sets Super Bowl record, has New England Patriots only points https://t.co/XMB1HP7z6Q"
409,1092222847672451072,12039612,1558,159357,1718,1366,109485,2008-01-09 19:18:34,0,0,2019-02-04 00:46:34,"Stephen Gostkowski sets Super Bowl record, has New England Patriots only points https://t.co/cffW1RvKlb https://t.co/p2kygCb9K6"
410,1092222213586108416,12039612,1558,159357,1718,1366,109485,2008-01-09 19:18:34,1,0,2019-02-04 00:44:02,"Stephen Gostkowski sets Super Bowl record, has New England Patriots only points https://t.co/4lqNflyLpx"
411,1092189246411165696,12039612,1558,159357,1718,1366,109485,2008-01-09 19:18:34,0,3,2019-02-03 22:33:02,We want our Lady Vols-Commodores basketball rivalry back https://t.co/BDa8pRxCNM
412,1092180439563943936,12039612,1558,159357,1718,1366,109485,2008-01-09 19:18:34,0,3,2019-02-03 21:58:03,"ICE arrests rapper 21 Savage in Atlanta, says he's actually from United Kingdom https://t.co/ILEJpES776"
413,1092176160191143937,12039612,1558,159357,1718,1366,109485,2008-01-09 19:18:34,1,12,2019-02-03 21:41:02,Memphis football receives commitment from defensive tackle Kajuan Robinson https://t.co/D0hU9GYMUe
414,1092170501609336832,12039612,1558,159357,1718,1366,109485,2008-01-09 19:18:34,8,24,2019-02-03 21:18:33,Steven Tyler spotted in Germantown ahead of Youth Villages event Monday https://t.co/wJaCOEHpgB https://t.co/GELPY9Fmmp
415,1092163204698927104,12039612,1558,159357,1718,1366,109485,2008-01-09 19:18:34,0,5,2019-02-03 20:49:34,"Game Recap: Memphis Grizzlies 96, New York Knicks 84 https://t.co/rGa5UqJqaI https://t.co/xnsFxONeCw"
416,1092162822811893760,12039612,1558,159357,1718,1366,109485,2008-01-09 19:18:34,0,0,2019-02-03 20:48:03,"Game Recap: Memphis Grizzlies 96, New York Knicks 84 https://t.co/0Jr7sXZgnf"
417,1092158543145390085,12039612,1558,159357,1718,1366,109485,2008-01-09 19:18:34,2,2,2019-02-03 20:31:02,Memphis Grizzlies: Kyle Anderson to see specialist for shoulder as roster remains in flux https://t.co/m0XAmRZMB5
418,1092145457822924800,12039612,1558,159357,1718,1366,109485,2008-01-09 19:18:34,0,0,2019-02-03 19:39:02,The case against El Chapo is headed to the jury. Here's what to know https://t.co/R4sHjPIW9p
419,1092115519824711680,12039612,1558,159357,1718,1366,109485,2008-01-09 19:18:34,1,2,2019-02-03 17:40:05,Sunday Sports Brunch: University of Memphis adds two assistant coaches https://t.co/GpYsMaOv4j
420,1092111486682611712,12039612,1558,159357,1718,1366,109485,2008-01-09 19:18:34,2,0,2019-02-03 17:24:03,Former MPD probationary officer charged with sexual exploitation of a minor in California https://t.co/qZ2PfKLrEl
421,1092111243010236416,12039612,1558,159357,1718,1366,109485,2008-01-09 19:18:34,2,0,2019-02-03 17:23:05,"Memphis police officer arrested for domestic assault, relieved of duty https://t.co/D3EMunG6Di https://t.co/fqvt4j7EvM"
422,1092107205531324417,12039612,1558,159357,1718,1366,109485,2008-01-09 19:18:34,16,136,2019-02-03 17:07:02,Steven Tyler spotted in Germantown ahead of Youth Villages event Monday https://t.co/vsGg2borHa
423,1092102934177943553,12039612,1558,159357,1718,1366,109485,2008-01-09 19:18:34,1,1,2019-02-03 16:50:04,Pressure builds for Virginia Gov. Ralph Northam to resign amid blackface photo controversy https://t.co/9pmaUh3S46
424,1092094133982908417,12039612,1558,159357,1718,1366,109485,2008-01-09 19:18:34,2,1,2019-02-03 16:15:06,"Memphis police officer arrested for domestic assault, relieved of duty https://t.co/z9xyvlH5k5"
425,1092061155600814081,12039612,1558,159357,1718,1366,109485,2008-01-09 19:18:34,2,5,2019-02-03 14:04:03,Memphis basketball: Jeremiah Martin's historic performance tainted by end result https://t.co/6vrIKQEf0S
426,1092058761819115520,12039612,1558,159357,1718,1366,109485,2008-01-09 19:18:34,0,1,2019-02-03 13:54:32,Memphis basketball: Jeremiah Martin's historic performance tainted by end result https://t.co/O0UlznPD9j
427,1092056874088841216,12039612,1558,159357,1718,1366,109485,2008-01-09 19:18:34,3,17,2019-02-03 13:47:02,Grizzlies: Why 89 seconds of NBA playing time 'felt like a dream' to one Memphis player https://t.co/GqMajaFkk3
428,1092052613212852225,12039612,1558,159357,1718,1366,109485,2008-01-09 19:18:34,0,2,2019-02-03 13:30:07,"Sex trafficking at Super Bowl LIII in Atlanta: Advocates, players fight against exploitation https://t.co/eCOMlu3KBk"
429,1091914938673758208,12039612,1558,159357,1718,1366,109485,2008-01-09 19:18:34,0,5,2019-02-03 04:23:02,'Mission success': Navy's first woman fighter pilot honored in Tennessee with historic all-female flyover https://t.co/TwxOhkzOQ2
430,1091900336485191680,12039612,1558,159357,1718,1366,109485,2008-01-09 19:18:34,4,13,2019-02-03 03:25:01,"It took until February for Memphis basketball coach Penny Hardaway to finally look like a first-time college coach,… https://t.co/iGssmB1lV4"
431,1091874807988117504,12039612,1558,159357,1718,1366,109485,2008-01-09 19:18:34,0,1,2019-02-03 01:43:34,Strickland says Memphis violent crime is down; MPD union head says it's complicated https://t.co/A4b86CQLOp https://t.co/XxPrHY5D1Z
432,1091867255187488768,12039612,1558,159357,1718,1366,109485,2008-01-09 19:18:34,2,2,2019-02-03 01:13:34,Penny Hardaway finally looked like a first-year college coach this week. It could be good for him.… https://t.co/AIngVcSjd6
433,1091860834714902529,12039612,1558,159357,1718,1366,109485,2008-01-09 19:18:34,4,6,2019-02-03 00:48:03,Memphis' Venezuelan community joins international protests with 200-person rally https://t.co/nRg2dptWjq
434,1091852024084340736,12039612,1558,159357,1718,1366,109485,2008-01-09 19:18:34,1,1,2019-02-03 00:13:02,'Mission success': Navy's first woman jet pilot honored in Tennessee with historic all-female flyover https://t.co/Aylywh6jzI
435,1091834157125304320,12039612,1558,159357,1718,1366,109485,2008-01-09 19:18:34,16,39,2019-02-02 23:02:03,NBA acknowledges officiating error that cost Memphis Grizzlies late in loss vs. Hornets https://t.co/MCXCw2CbEr
436,1091829891111272449,12039612,1558,159357,1718,1366,109485,2008-01-09 19:18:34,1,2,2019-02-02 22:45:05,"From automation to art, TEDxMemphis speakers talk 'ideas for the next century' https://t.co/sOh1hbbGN9"
437,1091822580758208512,12039612,1558,159357,1718,1366,109485,2008-01-09 19:18:34,2,2,2019-02-02 22:16:02,Four Memphis boys basketball programs get two-year postseason ban from TSSAA after brawls https://t.co/b1F4P2cGwh
438,1091818423158534153,12039612,1558,159357,1718,1366,109485,2008-01-09 19:18:34,2,4,2019-02-02 21:59:31,"""If it weren't for Capt. Mariner and her contemporaries, the original six that paved the way for us, we wouldn't ha… https://t.co/UmsO7M7DLc"
439,1091816288970829825,12039612,1558,159357,1718,1366,109485,2008-01-09 19:18:34,1,4,2019-02-02 21:51:02,Penny Hardaway: Losing has to teach Memphis basketball a lesson https://t.co/Gexs5PlDTx
440,1091809243429244931,12039612,1558,159357,1718,1366,109485,2008-01-09 19:18:34,1,6,2019-02-02 21:23:03,Jeremiah Martin scores all his 41 points in one half but Memphis rally vs USF falls short https://t.co/xMzDBsIe8Q
441,1091804964744298497,12039612,1558,159357,1718,1366,109485,2008-01-09 19:18:34,0,3,2019-02-02 21:06:03,Penny Hardaway finally looked like a first-year college coach this week. It could be good for him. https://t.co/0j2nly6uUL
442,1091796170005979136,12039612,1558,159357,1718,1366,109485,2008-01-09 19:18:34,0,0,2019-02-02 20:31:06,Tom Lee Park redesign plans introduced to the public https://t.co/Hq3pjBgilT
443,1091791878574493697,12039612,1558,159357,1718,1366,109485,2008-01-09 19:18:34,1,3,2019-02-02 20:14:03,"South Florida 84, Memphis 78: First-half struggles spoil Jeremiah Martin's career game https://t.co/4xFuslcSif"
444,1091766460224016385,12039612,1558,159357,1718,1366,109485,2008-01-09 19:18:34,1,1,2019-02-02 18:33:02,Memphis Tigers travel to USF for a AAC game https://t.co/UKqRa5O47y
445,1091762181337690112,12039612,1558,159357,1718,1366,109485,2008-01-09 19:18:34,23,79,2019-02-02 18:16:02,"Former Memphis standouts Darrell Henderson, Trevon Tate, Tony Pollard invited to NFL Combine https://t.co/o70PGTCzY3"
446,1091758150754144256,12039612,1558,159357,1718,1366,109485,2008-01-09 19:18:34,4,21,2019-02-02 18:00:01,"Darrell Henderson, Trevon Tate and Tony Pollard have been invited to the NFL Combine, which will be from Feb. 26 to… https://t.co/fcCxRuFci3"
447,1091756650640289792,12039612,1558,159357,1718,1366,109485,2008-01-09 19:18:34,0,0,2019-02-02 17:54:04,History finds another new home for Old Betsy | Waters https://t.co/N8l3t30m9i https://t.co/Dokl1TQ3UJ
448,1091754393219878913,12039612,1558,159357,1718,1366,109485,2008-01-09 19:18:34,0,4,2019-02-02 17:45:05,TEDx Memphis at the Crosstown Arts Theatre https://t.co/iftuIXrVIZ
449,1091749106148470784,12039612,1558,159357,1718,1366,109485,2008-01-09 19:18:34,0,1,2019-02-02 17:24:05,Live Updates: Memphis visits South Florida for road test https://t.co/XCYcaKd9j8 https://t.co/wvupalg6Il
450,1091745575383547904,12039612,1558,159357,1718,1366,109485,2008-01-09 19:18:34,1,0,2019-02-02 17:10:03,Live Updates: Memphis visits South Florida for road test https://t.co/YnKhICuajA
451,1091727948770697217,12039612,1558,159357,1718,1366,109485,2008-01-09 19:18:34,2,2,2019-02-02 16:00:00,Memphis Grizzlies trade rumors picked up entering the weekend. https://t.co/YlDw3qRsNs
452,1091704554310184960,12039612,1558,159357,1718,1366,109485,2008-01-09 19:18:34,0,2,2019-02-02 14:27:03,The Weekly Dish: Happy Chinese New Year! Mosa shares a taste of how to celebrate https://t.co/34xQ6H75uh https://t.co/cd2uioUPDH
453,1091694007212797953,12039612,1558,159357,1718,1366,109485,2008-01-09 19:18:34,0,5,2019-02-02 13:45:08,Groundhog Day 2019: Punxsutawney Phil did not see his shadow https://t.co/2PEHntbK5A
454,1091689704192425985,12039612,1558,159357,1718,1366,109485,2008-01-09 19:18:34,0,1,2019-02-02 13:28:02,"Memphis Grizzlies: Trade rumors involving Mike Conley, Marc Gasol, others pick up https://t.co/yYFAvMWGRc"
455,1091685425851392001,12039612,1558,159357,1718,1366,109485,2008-01-09 19:18:34,0,2,2019-02-02 13:11:02,Strickland says Memphis violent crime is down; MPD union head says it's complicated https://t.co/7PuLRGWJUF
456,1091672090145640448,12039612,1558,159357,1718,1366,109485,2008-01-09 19:18:34,1,2,2019-02-02 12:18:03,'Vibrant' Tom Lee Park redesign is forming. Here's how you can see the plans. https://t.co/lN3YjAQrSD
457,1091556087914999808,12039612,1558,159357,1718,1366,109485,2008-01-09 19:18:34,0,0,2019-02-02 04:37:06,Southwind vs. Ridgewood https://t.co/TsvYSdxT6B
458,1091530908946042880,12039612,1558,159357,1718,1366,109485,2008-01-09 19:18:34,0,0,2019-02-02 02:57:03,"Game Recap: Charlotte Hornets 100, Memphis Grizzlies 92 https://t.co/p1V8aNHnjw"
459,1091526631292833792,12039612,1558,159357,1718,1366,109485,2008-01-09 19:18:34,0,1,2019-02-02 02:40:03,Grizzlies coach J.B. Bickerstaff on new player Julian Washburn's NBA debut https://t.co/q5zjuDlC45
460,1091526259144679424,12039612,1558,159357,1718,1366,109485,2008-01-09 19:18:34,0,0,2019-02-02 02:38:34,"Game Recap: Charlotte Hornets 100, Memphis Grizzlies 92 https://t.co/RHPZg2Ax7t https://t.co/QvAonhgyW9"
461,1091522605507641345,12039612,1558,159357,1718,1366,109485,2008-01-09 19:18:34,0,0,2019-02-02 02:24:03,"FedEx worker found dead at Illinois distribution hub amid subzero temps, authorities say https://t.co/mjD75C4viJ"
462,1091518325560147968,12039612,1558,159357,1718,1366,109485,2008-01-09 19:18:34,0,1,2019-02-02 02:07:02,Judge won't delay civil trial against Connor Schilling in Darrius Stewart shooting https://t.co/Mb3Cc1W5nS
463,1091514050264162304,12039612,1558,159357,1718,1366,109485,2008-01-09 19:18:34,1,0,2019-02-02 01:50:03,3 Memphis police officers identified in Whitehaven officer-involved shooting https://t.co/Qk7FSqYmIh
464,1091511663751131137,12039612,1558,159357,1718,1366,109485,2008-01-09 19:18:34,10,9,2019-02-02 01:40:34,Memphis' Electrolux debacle shows how incentives can leave a poor city ripe for exploitation https://t.co/yQWraxBaFt https://t.co/jc8uFxYhud
465,1091509771189002240,12039612,1558,159357,1718,1366,109485,2008-01-09 19:18:34,1,5,2019-02-02 01:33:03,Memphis' Electrolux debacle shows how incentives can leave a poor city ripe for exploitation https://t.co/7JDtnWv9QX
466,1091505489714790400,12039612,1558,159357,1718,1366,109485,2008-01-09 19:18:34,0,1,2019-02-02 01:16:02,Memphis-area officials scramble to recover tax dollars from Electrolux project https://t.co/jMbLpA3zNn
467,1091501215458963457,12039612,1558,159357,1718,1366,109485,2008-01-09 19:18:34,0,1,2019-02-02 00:59:03,One defendant found guilty of first-degree murder in killing of Susan McDonald https://t.co/PIA0Wb5pFf
468,1091497187047960576,12039612,1558,159357,1718,1366,109485,2008-01-09 19:18:34,0,0,2019-02-02 00:43:03,One defendant found guilty of first-degree murder in killing of Susan McDonald https://t.co/rk5yaWZy4I https://t.co/8VuxdPwsmz
469,1091494669849104389,12039612,1558,159357,1718,1366,109485,2008-01-09 19:18:34,5,9,2019-02-02 00:33:02,Super Bowl: Stephen Gostkowski has 'nothing but love for the city of Memphis' https://t.co/BATKkuybED
470,1091490467278143489,12039612,1558,159357,1718,1366,109485,2008-01-09 19:18:34,0,0,2019-02-02 00:16:20,One guilty of murder in Susan McDonald slaying; second defendant convicted on lesser charge https://t.co/tTuwxE0KFV
471,1091489770079801344,12039612,1558,159357,1718,1366,109485,2008-01-09 19:18:34,1,0,2019-02-02 00:13:34,3 Memphis police officers identified in Whitehaven officer-involved shooting https://t.co/FRNx3lw41J https://t.co/Jg88VHURq0
472,1091482216528470016,12039612,1558,159357,1718,1366,109485,2008-01-09 19:18:34,1,1,2019-02-01 23:43:33,Electrolux closing Memphis facility: 5 things to know https://t.co/eko2WNVNwL https://t.co/guTtfwoKh4
473,1091481081134632961,12039612,1558,159357,1718,1366,109485,2008-01-09 19:18:34,0,1,2019-02-01 23:39:03,Electrolux closing Memphis facility: 5 things to know https://t.co/LORsx7YJB9
474,1091473788301119489,12039612,1558,159357,1718,1366,109485,2008-01-09 19:18:34,0,0,2019-02-01 23:10:04,Evanoff: Why Electrolux pulled the plug https://t.co/c0MNHahG9I
475,1091469505384058880,12039612,1558,159357,1718,1366,109485,2008-01-09 19:18:34,2,4,2019-02-01 22:53:03,Mayor Strickland: Electrolux will pay full tax on property https://t.co/w1F45NbNDn
476,1091465477598179330,12039612,1558,159357,1718,1366,109485,2008-01-09 19:18:34,1,0,2019-02-01 22:37:02,Federal judge considering order on jailing offenders who can't pay https://t.co/VRu3WVrYrZ
477,1091461210866880513,12039612,1558,159357,1718,1366,109485,2008-01-09 19:18:34,1,2,2019-02-01 22:20:05,Memphis venue faces backlash after booking band fronted by man who tried to have his wife killed https://t.co/xJP3FdKu4E
478,1091460453090250754,12039612,1558,159357,1718,1366,109485,2008-01-09 19:18:34,0,0,2019-02-01 22:17:05,Evanoff: Why Electrolux pulled the plug https://t.co/ztSict2zne https://t.co/jrfsCvZets
479,1091441823803940864,12039612,1558,159357,1718,1366,109485,2008-01-09 19:18:34,0,0,2019-02-01 21:03:03,"Just months before its next testing company is supposed to start, Tennessee has yet to receive its first bid https://t.co/fPtt72TbM5"
480,1091437543189635074,12039612,1558,159357,1718,1366,109485,2008-01-09 19:18:34,1,2,2019-02-01 20:46:02,Gov. Bill Lee issues executive order to temporarily halt new regulations https://t.co/QoU3TdGAD6
481,1091433265968361472,12039612,1558,159357,1718,1366,109485,2008-01-09 19:18:34,1,4,2019-02-01 20:29:03,Anthony Miller ready to speak at Commercial Appeal Sports Awards https://t.co/mHpkaPfbdi
482,1091428987526696960,12039612,1558,159357,1718,1366,109485,2008-01-09 19:18:34,0,0,2019-02-01 20:12:03,"No new Super Bowl commercial for FedEx, but here are some of the best from years past https://t.co/mqWo19ojps"
483,1091424713669312513,12039612,1558,159357,1718,1366,109485,2008-01-09 19:18:34,1,0,2019-02-01 19:55:04,Electrolux closing: Assessor finding out how much can be recouped in incentives https://t.co/9n8YYEEvhR
484,1091423581035102208,12039612,1558,159357,1718,1366,109485,2008-01-09 19:18:34,0,0,2019-02-01 19:50:34,Electrolux closing: Assessor finding out how much can be recouped in incentives https://t.co/a5ogkCzINm https://t.co/438vzsvtIW
485,1091420681412243456,12039612,1558,159357,1718,1366,109485,2008-01-09 19:18:34,3,4,2019-02-01 19:39:02,I-240 interchanges to be closed weekends through Feb. 18 https://t.co/xzDPTYrXgC
486,1091416416140414976,12039612,1558,159357,1718,1366,109485,2008-01-09 19:18:34,1,0,2019-02-01 19:22:05,I-240 interchanges to be closed weekends through Feb. 18 https://t.co/1s3C65lsuy https://t.co/xjTFerfNXy
487,1091414489910702082,12039612,1558,159357,1718,1366,109485,2008-01-09 19:18:34,1,2,2019-02-01 19:14:26,Electrolux closing: Assessor finding out how much can be recouped in incentives  https://t.co/01KQFURxYo
